,Unnamed: 0,question_id,user_input,answer,context,gold_context,operation,source,reasoning_type,reference_contexts,source_id_norm,in_kg,retrieved_contexts,latency,model_output
0,0,182f0809,"GM operating margin 2023 vs 2022, GM.","To calculate the operating profit margin, we divide Operating Income by Total Net Sales and Revenue. For 2023, the calculation is as follows:

• 2023 Operating Profit Margin = 9,298 / 171,842 ≈ 0.0541, or about 5.41%.

For 2022, using the same method:

• 2022 Operating Profit Margin = 10,315 / 156,735 ≈ 0.0658, or about 6.58%.

This comparison shows that the operating margin declined from approximately 6.58% in 2022 to about 5.41% in 2023.","['CONSOLIDATED INCOME STATEMENTS\n(In millions, except per share amounts)\n \tYears Ended December 31,\n \t2023\t\t2022\t\t2021\nNet sales and revenue\t\t\t\t\t\nAutomotive\t$\t157,658 \t\t\t$\t143,975 \t\t\t$\t113,590 \t\nGM Financial\t14,184 \t\t\t12,760 \t\t\t13,414 \t\nTotal net sales and revenue (Note 3)\t171,842 \t\t\t156,735 \t\t\t127,004 \t\nCosts and expenses\t\t\t\t\t\nAutomotive and other cost of sales\t141,330 \t\t\t126,892 \t\t\t100,544 \t\nGM Financial interest, operating and other expenses\t11,374 \t\t\t8,862 \t\t\t8,582 \t\nAutomotive and other selling, general and administrative expense\t9,840 \t\t\t10,667 \t\t\t8,554 \t\nTotal costs and expenses\t162,544 \t\t\t146,421 \t\t\t117,680 \t\nOperating income (loss)\t9,298 \t\t\t10,315 \t\t\t9,324 \t\nAutomotive interest expense\t911 \t\t\t987 \t\t\t950 \t\nInterest income and other non-operating income, net (Note 19)\t1,537 \t\t\t1,432 \t\t\t3,041 \t\nEquity income (loss) (Note 8)\t480 \t\t\t837 \t\t\t1,301 \t\nIncome (loss) before income taxes\t10,403 \t\t\t11,597 \t\t\t12,716 \t\nIncome tax expense (benefit) (Note 17)\t563 \t\t\t1,888 \t\t\t2,771 \t\nNet income (loss)\t9,840 \t\t\t9,708 \t\t\t9,945 \t\nNet loss (income) attributable to noncontrolling interests\t287 \t\t\t226 \t\t\t74 \t\nNet income (loss) attributable to stockholders\t$\t10,127 \t\t\t$\t9,934 \t\t\t$\t10,019 \t\nNet income (loss) attributable to common stockholders\t$\t10,022 \t\t\t$\t8,915 \t\t\t$\t9,837 \t\nEarnings per share (Note 21)\t\t\t\t\t\nBasic earnings per common share\t$\t7.35 \t\t\t$\t6.17 \t\t\t$\t6.78 \t\nWeighted-average common shares outstanding – basic\t1,364 \t\t\t1,445 \t\t\t1,451 \t\nDiluted earnings per common share\t$\t7.32 \t\t\t$\t6.13 \t\t\t$\t6.70 \t\nWeighted-average common shares outstanding – diluted\t1,369 \t\t\t1,454 \t\t\t1,468']",,Division,FinDER,Arithmetic,"['CONSOLIDATED INCOME STATEMENTS\n(In millions, except per share amounts)\n \tYears Ended December 31,\n \t2023\t\t2022\t\t2021\nNet sales and revenue\t\t\t\t\t\nAutomotive\t$\t157,658 \t\t\t$\t143,975 \t\t\t$\t113,590 \t\nGM Financial\t14,184 \t\t\t12,760 \t\t\t13,414 \t\nTotal net sales and revenue (Note 3)\t171,842 \t\t\t156,735 \t\t\t127,004 \t\nCosts and expenses\t\t\t\t\t\nAutomotive and other cost of sales\t141,330 \t\t\t126,892 \t\t\t100,544 \t\nGM Financial interest, operating and other expenses\t11,374 \t\t\t8,862 \t\t\t8,582 \t\nAutomotive and other selling, general and administrative expense\t9,840 \t\t\t10,667 \t\t\t8,554 \t\nTotal costs and expenses\t162,544 \t\t\t146,421 \t\t\t117,680 \t\nOperating income (loss)\t9,298 \t\t\t10,315 \t\t\t9,324 \t\nAutomotive interest expense\t911 \t\t\t987 \t\t\t950 \t\nInterest income and other non-operating income, net (Note 19)\t1,537 \t\t\t1,432 \t\t\t3,041 \t\nEquity income (loss) (Note 8)\t480 \t\t\t837 \t\t\t1,301 \t\nIncome (loss) before income taxes\t10,403 \t\t\t11,597 \t\t\t12,716 \t\nIncome tax expense (benefit) (Note 17)\t563 \t\t\t1,888 \t\t\t2,771 \t\nNet income (loss)\t9,840 \t\t\t9,708 \t\t\t9,945 \t\nNet loss (income) attributable to noncontrolling interests\t287 \t\t\t226 \t\t\t74 \t\nNet income (loss) attributable to stockholders\t$\t10,127 \t\t\t$\t9,934 \t\t\t$\t10,019 \t\nNet income (loss) attributable to common stockholders\t$\t10,022 \t\t\t$\t8,915 \t\t\t$\t9,837 \t\nEarnings per share (Note 21)\t\t\t\t\t\nBasic earnings per common share\t$\t7.35 \t\t\t$\t6.17 \t\t\t$\t6.78 \t\nWeighted-average common shares outstanding – basic\t1,364 \t\t\t1,445 \t\t\t1,451 \t\nDiluted earnings per common share\t$\t7.32 \t\t\t$\t6.13 \t\t\t$\t6.70 \t\nWeighted-average common shares outstanding – diluted\t1,369 \t\t\t1,454 \t\t\t1,468']",182f0809,True,"['Engineering\n(Dollar amounts in millions)\t\t \t\tVariance\nYear Ended December 31,\t\t2023\t\t2022\t\t2023 vs. 2022\nSales\t\t$\t2,160 \t\t\t$\t2,762 \t\t\t(22)\t%\nOperating profit\t\t$\t491 \t\t\t$\t555 \t\t\t(12)\t%\nAs a percent of sales\t\t22.7 \t%\t\t20.1 \t%\t\t\n \n2023 vs. 2022\n \t\t% Change\nFactors Contributing to Changes - Sales\t\t\nCurrency\t\t1 \t%\nOther\t\t(23)\t%\n(22)\t%\n \nSales\nEngineering segment sales decreased $602 million, or 22%, in 2023 versus 2022 . The decrease was driven by project timing.\n\nProjects for Russia that were sanctioned, and therefore terminated or suspended, have been lawfully wound down and represented approximately $238 million and $894 million of the Engineering segment sales during 2023 and 2022, respectively.\n\nOperating profit\n\nEngineering segment operating profit decreased $64 million, or 12%, in 2023 versus 2022. The decline from lower sales was partially offset by higher margin on wind down of terminated or suspended projects sanctioned in Russia.', 'Other\n(Dollar amounts in millions)\t\t \tVariance\nYear Ended December 31,\t\t2023\t\t2022\t\t2023 vs. 2022\nSales\t\t$\t1,289 \t\t\t$\t1,805 \t\t\t(29)\t%\nOperating profit\t\t$\t43 \t\t\t$\t(66)\t\t\t165 \t%\nAs a percent of sales\t\t3.3 \t%\t\t(3.7)\t%\t\t\n \n2023 vs. 2022\n \t\t% Change\nFactors Contributing to Changes - Sales\t\t\nVolume/Price\t\t2 \t%\nCurrency\t\t— \t%\nAcquisitions/Divestitures\t\t(31)\t%\n(29)\t%\n \nOther consists of corporate costs and a few smaller businesses including: Linde Advanced Materials Technology and global helium wholesale; which individually do not meet the quantitative thresholds for separate presentation.\n\nSales\n\nSales for Other decreased $516 million, or 29%, in 2023 versus 2022. Divestitures decreased sales by 31% primarily due to sale of GIST business in third quarter of 2022. Volume/Price increased sales by 2% driven primarily by price in the coatings and global helium businesses, partially offset by lower coatings volumes.\n\nOperating profit\n\nOperating profit in Other increased $109 million, or 165%, in 2023 versus 2022 driven primarily by higher pricing in global helium and coatings and lower corporate costs which more than offset the impact of divestitures and lower volumes.', '2023\n\n \n\n \n\n7,011.4\n\n \n\n \n\n \n\n1,106.1\n\n \n\n \n\n \n\n326.8\n\n \n\n \n\n \n\n124.9\n\n \n\n \n\n \n\n8,569.2\n\n \n\n2022\n\n \n\n \n\n6,846.9\n\n \n\n \n\n \n\n1,060.5\n\n \n\n \n\n \n\n332.9\n\n \n\n \n\n \n\n105.3\n\n \n\n \n\n \n\n8,345.6\n\n \n\n2021\n\n \n\n \n\n6,354.5\n\n \n\n \n\n \n\n1,192.9\n\n \n\n \n\n \n\n332.7\n\n \n\n \n\n \n\n116.4\n\n \n\n \n\n \n\n7,996.5\n\n \n\nCapital Expenditures\n\n \n\n \n\n \n\n \n\n \n\n \n\n \n\n \n\n \n\n \n\n \n\n \n\n \n\n \n\n \n\n2023\n\n \n\n \n\n190.0\n\n \n\n \n\n \n\n20.4\n\n \n\n \n\n \n\n13.1\n\n \n\n \n\n \n\n0.0\n\n \n\n \n\n \n\n223.5\n\n \n\n2022\n\n \n\n \n\n159.1\n\n \n\n \n\n \n\n10.0\n\n \n\n \n\n \n\n9.7\n\n \n\n \n\n \n\n0.0\n\n \n\n \n\n \n\n178.8\n\n \n\n2021\n\n \n\n \n\n100.3\n\n \n\n \n\n \n\n8.4\n\n \n\n \n\n \n\n10.1\n\n \n\n \n\n \n\n0.0\n\n \n\n \n\n \n\n118.8\n\n \n\nDepreciation & Amortization\n\n \n\n \n\n \n\n \n\n \n\n \n\n \n\n \n\n \n\n \n\n \n\n \n\n \n\n \n\n \n\n2023\n\n \n\n \n\n182.7\n\n \n\n \n\n \n\n27.7\n\n \n\n \n\n \n\n13.6\n\n \n\n \n\n \n\n1.2\n\n \n\n \n\n \n\n225.2\n\n \n\n2022\n\n \n\n \n\n172.1\n\n \n\n \n\n \n\n30.1\n\n \n\n \n\n \n\n13.8\n\n \n\n \n\n \n\n3.0\n\n \n\n \n\n \n\n219.0\n\n \n\n2021\n\n \n\n \n\n170.0\n\n \n\n \n\n \n\n31.1\n\n \n\n \n\n \n\n15.4\n\n \n\n \n\n \n\n2.6\n\n \n\n \n\n \n\n219.1\n\n \n\n(1)\nCorporate reflects the following:\n(A) The administrative costs of the production planning and logistics functions which are elements of Cost of Sales in the Company’s Consolidated Statements of Income but are allocated to the operating segments in Selling, General and Administrative expenses to determine operating segment income before income taxes.  Such amounts were $60.4, $34.3, and $47.1 for 2023, 2022 and 2021, respectively.  The increase in 2023 compared to 2022 is primarily due to higher incentive compensation costs.', ""Years Ended December 31,\t\t2023 vs. 2022 Change\n2023\t\t2022\t\t2021\t\nInvesting Activities\t\t\t\t\t\t\t\nCapital expenditures\t$\t(10.7)\t\t\t$\t(9.0)\t\t\t$\t(7.4)\t\t\t$\t(1.7)\t\nAcquisitions and liquidations of marketable securities, net\t3.5 \t\t\t(3.9)\t\t\t1.0 \t\t\t7.4 \t\nOther(a)\t(1.5)\t\t\t(4.5)\t\t\t(1.8)\t\t\t3.0 \t\nNet automotive cash provided by (used in) investing activities(b)\t$\t(8.7)\t\t\t$\t(17.5)\t\t\t$\t(8.2)\t\t\t$\t8.8 \t\n \n__________\n(a)Includes $0.7 billion, $0.8 billion and $0.5 billion of GM's investment in Ultium Cells Holdings LLC in the years ended December 31, 2023, 2022 and 2021, $0.5 billion, $2.4 billion and $1.0 billion of GM's investment in Cruise in the years ended December 31, 2023, 2022 and 2021, $0.3 billion of GM's investment in Lithium Americas in the year ended December 31, 2023, $2.1 billion for the purchase of Cruise preferred shares from SoftBank Vision Fund (AIV M2) L.P. (SoftBank) in the year ended December 31, 2022 and $0.9 billion related to the sale of Stellantis common shares, excluding dividends received and tax withholding, in the year ended December 31, 2022.\n(b)The investments in Cruise are eliminated within the consolidated statements of cash flows. The redemption of Cruise preferred shares from SoftBank in 2022 are reclassified to financing activities within the consolidated statements of cash flows."", 'Segment operating income increased $497 million (33.6%), primarily due to higher net pricing, lower impact from the European Commission legal matter, lapping the prior year incremental costs incurred due to the war in Ukraine, lower acquisition integration costs and favorable volume/mix. These favorable items were partially offset by higher raw material costs, higher advertising and consumer promotion costs, unfavorable currency, divestiture-related costs incurred in 2023, higher costs incurred for the Simplify to Grow Program, higher other selling, general and administrative expenses, higher remeasurement loss on net monetary position, higher manufacturing costs and an intangible asset impairment charge incurred in 2023.\n\n2022 compared with 2021', 'GENERAL MOTORS COMPANY AND SUBSIDIARIES\nCONSOLIDATED BALANCE SHEETS\n(In millions, except per share amounts)\nDecember 31, 2023\t\tDecember 31, 2022\nASSETS\t\t\t\nCurrent Assets\t\t\t\nCash and cash equivalents\t$\t18,853 \t\t\t$\t19,153 \t\nMarketable debt securities (Note 4)\t7,613 \t\t\t12,150 \t\nAccounts and notes receivable, net of allowance of $298 and $260\n12,378 \t\t\t13,333 \t\nGM Financial receivables, net of allowance of $906 and $869 (Note 5; Note 11 at VIEs)\n39,076 \t\t\t33,623 \t\nInventories (Note 6)\t16,461 \t\t\t15,366 \t\nOther current assets (Note 4; Note 11 at VIEs)\t7,238 \t\t\t6,825 \t\nTotal current assets\t101,618 \t\t\t100,451 \t\nNon-current Assets\t\t\t\nGM Financial receivables, net of allowance of $1,438 and $1,227 (Note 5; Note 11 at VIEs)\n45,043 \t\t\t40,591 \t\nEquity in net assets of nonconsolidated affiliates (Note 8)\t10,613 \t\t\t10,176 \t\nProperty, net (Note 9)\t50,321 \t\t\t45,248 \t\nGoodwill and intangible assets, net (Note 10)\t4,862 \t\t\t4,945 \t\nEquipment on operating leases, net (Note 7; Note 11 at VIEs)\t30,582 \t\t\t32,701 \t\nDeferred income taxes (Note 17)\t22,339 \t\t\t20,539 \t\nOther assets (Note 4; Note 11 at VIEs)\t7,686 \t\t\t9,386 \t\nTotal non-current assets\t171,446 \t\t\t163,586 \t\nTotal Assets\t$\t273,064 \t\t\t$\t264,037 \t\nLIABILITIES AND EQUITY\t\t\t\nCurrent Liabilities\t\t\t\nAccounts payable (principally trade)\t$\t28,114 \t\t\t$\t27,486 \t\nShort-term debt and current portion of long-term debt (Note 13)\t\t\t\nAutomotive\t428 \t\t\t1,959 \t\nGM Financial (Note 11 at VIEs)\t38,540 \t\t\t36,819 \t\nAccrued liabilities (Note 12)\t27,364 \t\t\t24,910 \t\nTotal current liabilities\t94,445 \t\t\t91,173 \t\nNon-current Liabilities\t\t\t\nLong-term debt (Note 13)\t\t\t\nAutomotive\t15,985 \t\t\t15,885 \t\nGM Financial (Note 11 at VIEs)\t66,788 \t\t\t60,036 \t\nPostretirement benefits other than pensions (Note 15)\t4,345 \t\t\t4,193 \t\nPensions (Note 15)\t6,680 \t\t\t5,698 \t\nOther liabilities (Note 12)\t16,515 \t\t\t14,767 \t\nTotal non-current liabilities\t110,312 \t\t\t100,579 \t\nTotal Liabilities\t204,757 \t\t\t191,752 \t\nCommitments and contingencies (Note 16)\t\t\t\nNoncontrolling interest - Cruise stock incentive awards (Note 20)\t118 \t\t\t357 \t\nEquity (Note 20)\t\t\t\nCommon stock, $0.01 par value\n12 \t\t\t14 \t\nAdditional paid-in capital\t19,130 \t\t\t26,428 \t\nRetained earnings\t55,391 \t\t\t49,251 \t\nAccumulated other comprehensive loss\t(10,247)\t\t\t(7,901)\t\nTotal stockholders’ equity\t64,286 \t\t\t67,792 \t\nNoncontrolling interests\t3,903 \t\t\t4,135 \t\nTotal Equity\t68,189 \t\t\t71,927 \t\nTotal Liabilities and Equity\t$\t273,064 \t\t\t$\t264,037', 'CONSOLIDATED INCOME STATEMENTS\n(In millions, except per share amounts)\n \tYears Ended December 31,\n \t2023\t\t2022\t\t2021\nNet sales and revenue\t\t\t\t\t\nAutomotive\t$\t157,658 \t\t\t$\t143,975 \t\t\t$\t113,590 \t\nGM Financial\t14,184 \t\t\t12,760 \t\t\t13,414 \t\nTotal net sales and revenue (Note 3)\t171,842 \t\t\t156,735 \t\t\t127,004 \t\nCosts and expenses\t\t\t\t\t\nAutomotive and other cost of sales\t141,330 \t\t\t126,892 \t\t\t100,544 \t\nGM Financial interest, operating and other expenses\t11,374 \t\t\t8,862 \t\t\t8,582 \t\nAutomotive and other selling, general and administrative expense\t9,840 \t\t\t10,667 \t\t\t8,554 \t\nTotal costs and expenses\t162,544 \t\t\t146,421 \t\t\t117,680 \t\nOperating income (loss)\t9,298 \t\t\t10,315 \t\t\t9,324 \t\nAutomotive interest expense\t911 \t\t\t987 \t\t\t950 \t\nInterest income and other non-operating income, net (Note 19)\t1,537 \t\t\t1,432 \t\t\t3,041 \t\nEquity income (loss) (Note 8)\t480 \t\t\t837 \t\t\t1,301 \t\nIncome (loss) before income taxes\t10,403 \t\t\t11,597 \t\t\t12,716 \t\nIncome tax expense (benefit) (Note 17)\t563 \t\t\t1,888 \t\t\t2,771 \t\nNet income (loss)\t9,840 \t\t\t9,708 \t\t\t9,945 \t\nNet loss (income) attributable to noncontrolling interests\t287 \t\t\t226 \t\t\t74 \t\nNet income (loss) attributable to stockholders\t$\t10,127 \t\t\t$\t9,934 \t\t\t$\t10,019 \t\nNet income (loss) attributable to common stockholders\t$\t10,022 \t\t\t$\t8,915 \t\t\t$\t9,837 \t\nEarnings per share (Note 21)\t\t\t\t\t\nBasic earnings per common share\t$\t7.35 \t\t\t$\t6.17 \t\t\t$\t6.78 \t\nWeighted-average common shares outstanding – basic\t1,364 \t\t\t1,445 \t\t\t1,451 \t\nDiluted earnings per common share\t$\t7.32 \t\t\t$\t6.13 \t\t\t$\t6.70 \t\nWeighted-average common shares outstanding – diluted\t1,369 \t\t\t1,454 \t\t\t1,468', ""The principal factors that determine consumer vehicle preferences in the markets in which we operate include overall vehicle design, price, quality, available options, safety, reliability, fuel economy or range and functionality. Market leadership in individual countries in which we compete varies widely.\n\nWe present both wholesale and total vehicle sales data to assist in the analysis of our revenue and market share. Wholesale vehicle sales data consists of sales to GM's dealers and distributors, as well as sales to the U.S. government, and excludes vehicles sold by our joint ventures. Wholesale vehicle sales data correlates to our revenue recognized from the sale of vehicles, which is the largest component of Automotive net sales and revenue. In the year ended December 31, 2023, 29.4% of our wholesale vehicle sales volume was generated outside the U.S. The following table summarizes wholesale vehicle sales by automotive segment (vehicles in thousands):\nYears Ended December 31,\n2023\t\t2022\t\t2021\nGMNA\t3,147 \t\t\t83.5 \t%\t\t2,926 \t\t\t81.8 \t%\t\t2,308 \t\t\t80.7 \t%\nGMI\t621 \t\t\t16.5 \t%\t\t653 \t\t\t18.2 \t%\t\t551 \t\t\t19.3 \t%\nTotal\t3,768 \t\t\t100.0 \t%\t\t3,579 \t\t\t100.0 \t%\t\t2,859 \t\t\t100.0 \t%"", 'Segment operating income increased $323 million (18.3%), primarily due to higher net pricing, the impact of our Clif Bar acquisition, higher operating results from the divested developed market gum business, lower costs incurred for the Simplify to Grow Program and lapping prior year inventory step-up charges. These favorable items were partially offset by higher raw material costs, higher advertising and consumer promotion costs, higher acquisition integration costs and contingent consideration adjustments, higher other selling, general and administrative expenses, an intangible asset impairment charge incurred in 2023, divestiture-related costs incurred in 2023, unfavorable volume/mix and unfavorable currency.\n\n2022 compared with 2021', 'Tesla, Inc.\nConsolidated Statements of Operations\n(in millions, except per share data)\nYear Ended December 31,\n2023\t\t2022\t\t2021\nRevenues\t\t\t\t\t\nAutomotive sales\t$\t78,509 \t\t\t$\t67,210 \t\t\t$\t44,125 \t\nAutomotive regulatory credits\t1,790 \t\t\t1,776 \t\t\t1,465 \t\nAutomotive leasing\t2,120 \t\t\t2,476 \t\t\t1,642 \t\nTotal automotive revenues\t82,419 \t\t\t71,462 \t\t\t47,232 \t\nEnergy generation and storage\t6,035 \t\t\t3,909 \t\t\t2,789 \t\nServices and other\t8,319 \t\t\t6,091 \t\t\t3,802 \t\nTotal revenues\t96,773 \t\t\t81,462 \t\t\t53,823 \t\nCost of revenues\t\t\t\t\t\nAutomotive sales\t65,121 \t\t\t49,599 \t\t\t32,415 \t\nAutomotive leasing\t1,268 \t\t\t1,509 \t\t\t978 \t\nTotal automotive cost of revenues\t66,389 \t\t\t51,108 \t\t\t33,393 \t\nEnergy generation and storage\t4,894 \t\t\t3,621 \t\t\t2,918 \t\nServices and other\t7,830 \t\t\t5,880 \t\t\t3,906 \t\nTotal cost of revenues\t79,113 \t\t\t60,609 \t\t\t40,217 \t\nGross profit\t17,660 \t\t\t20,853 \t\t\t13,606 \t\nOperating expenses\t\t\t\t\t\nResearch and development\t3,969 \t\t\t3,075 \t\t\t2,593 \t\nSelling, general and administrative\t4,800 \t\t\t3,946 \t\t\t4,517 \t\nRestructuring and other\t— \t\t\t176 \t\t\t(27)\t\nTotal operating expenses\t8,769 \t\t\t7,197 \t\t\t7,083 \t\nIncome from operations\t8,891 \t\t\t13,656 \t\t\t6,523 \t\nInterest income\t1,066 \t\t\t297 \t\t\t56 \t\nInterest expense\t(156)\t\t\t(191)\t\t\t(371)\t\nOther income (expense), net\t172 \t\t\t(43)\t\t\t135 \t\nIncome before income taxes\t9,973 \t\t\t13,719 \t\t\t6,343 \t\n(Benefit from) provision for income taxes\t(5,001)\t\t\t1,132 \t\t\t699 \t\nNet income\t14,974 \t\t\t12,587 \t\t\t5,644 \t\nNet (loss) income attributable to noncontrolling interests and redeemable noncontrolling interests in subsidiaries\t(23)\t\t\t31 \t\t\t125 \t\nNet income attributable to common stockholders\t$\t14,997 \t\t\t$\t12,556 \t\t\t$\t5,519 \t\n \t\t\t\t\t\nNet income per share of common stock attributable to common stockholders\t\t\t\t\t\nBasic\t$\t4.73 \t\t\t$\t4.02 \t\t\t$\t1.87 \t\nDiluted\t$\t4.30 \t\t\t$\t3.62 \t\t\t$\t1.63 \t\nWeighted average shares used in computing net income per share of common stock\t\t\t\t\t\nBasic\t3,174\t\t3,130\t\t2,959\nDiluted\t3,485\t\t3,475\t\t3,386']",2346.9882919453084,"5.41, 6.58"
1,1,c593f878,"NGC's cyber investments boost investor confidence, enhance valuation, and bolster stability.","The provided information allows us to assess how Northrop Grumman’s investments in cybersecurity can bolster investor confidence and reinforce long-term valuation stability. Specifically, the company’s focus on a multi-layered defense approach, including a dedicated Cybersecurity Operations Center that offers round-the-clock monitoring, continuous threat detection, and rapid incident response, minimizes the risk of cyber breaches. This proactive posture reduces the likelihood of disruptions that might otherwise negatively impact financial performance, cash flows, and overall operational stability.

Additionally, regular third-party assessments further validate the robustness of the company’s cybersecurity measures. These independent reviews help ensure that any vulnerabilities are identified and addressed promptly while reinforcing the credibility of the company’s risk management strategies. The integration of these investments into regular risk oversight through the board, executive risk committees, and specialized groups (like the Audit and Risk Committee) supports transparency and effective governance.

In summary, these cybersecurity investments contribute to investor confidence by mitigating potential risks linked to cyber threats, thereby protecting the company’s financial health and ensuring that valuation remains stable over the long term. While no direct calculations are provided, the qualitative link between enhanced cybersecurity measures and reduced uncertainty around operational and financial risks is evident from the details discussed.","['We recognize the critical importance of maintaining the safety and security of our systems and data and have a holistic process for overseeing and managing cybersecurity and related risks. This process is supported by both management and our Board of Directors.\nThe Chief Information Office, which maintains our cybersecurity function, is led by our Chief Information Officer (CIO), who reports to our CEO. The Chief Information Security Officer (CISO) reports to the CIO and generally is responsible for management of cybersecurity risk and the protection and defense of our networks and systems. The CISO manages a team of cybersecurity professionals with broad experience and expertise, including in cybersecurity threat assessments and detection, mitigation technologies, cybersecurity training, incident response, cyber forensics, insider threats and regulatory compliance.\nOur Board of Directors is responsible for overseeing our enterprise risk management activities in general, and each of our Board committees assists the Board in the role of risk oversight. The full Board receives an update on the Company’s risk management process and the risk trends related to cybersecurity at least annually. The Audit and Risk Committee specifically assists the Board in its oversight of risks related to cybersecurity. To help ensure effective oversight, the Audit and Risk Committee receives reports on information security and cybersecurity from the CISO at least four times a year.\nIn addition, the Company’s Enterprise Risk Management Council (ERMC) considers risks relating to cybersecurity, among other significant risks, and applicable mitigation plans to address such risks. The ERMC is comprised of the Executive Leadership Team, as well as the Chief Accounting Officer, Chief Compliance Officer, Corporate Secretary, Chief Sustainability Officer, Treasurer and Vice President, Internal Audit. The CIO and CISO attend each ERMC meeting. The ERMC meets during the year and receives periodic updates on cybersecurity risks from the CIO and CISO. We have an established process and playbook led by our CISO governing our assessment, response and notifications internally and externally upon the occurrence of a cybersecurity incident. Depending on the nature and severity of an incident, this process provides for escalating notification to our CEO and the Board (including our Lead Independent Director and the Audit and Risk Committee chair).\nOur approach to cybersecurity risk management includes the following key elements:\n•Multi-Layered Defense and Continuous Monitoring – We work to protect our computing environments and products from cybersecurity threats through multi-layered defenses and apply lessons learned from our defense and monitoring efforts to help prevent future attacks. We utilize data analytics to detect anomalies and search for cyber threats. Our Cybersecurity Operations Center provides comprehensive cyber threat detection and response capabilities and maintains a 24x7 monitoring system which complements the technology, processes and threat detection techniques we use to monitor, manage and mitigate cybersecurity threats. From time to time, we engage third party consultants or other advisors to assist in assessing, identifying and/or managing cybersecurity threats. We also periodically use our Internal Audit function to conduct additional reviews and assessments.\n•Insider Threats – We maintain an insider threat program designed to identify, assess, and address potential risks from within our Company. Our program evaluates potential risks consistent with industry practices, customer requirements and applicable law, including privacy and other considerations.\n•Information Sharing and Collaboration – We work with government, customer, industry and/or supplier partners, such as the National Defense Information Sharing and Analysis Center and other government-industry partnerships, to gather and develop best practices and share information to address cyber threats. These relationships enable the rapid sharing of threat and vulnerability mitigation information across the defense industrial base and supply chain.\n•Third Party Risk Assessments – We conduct information security assessments before sharing or allowing the hosting of sensitive data in computing environments managed by third parties, and our standard terms and conditions contain contractual provisions requiring certain security protections.\n•Training and Awareness – We provide awareness training to our employees to help identify, avoid and mitigate cybersecurity threats. Our employees with network access participate annually in required training, including spear phishing and other awareness training. We also periodically host tabletop exercises with management and other employees to practice rapid cyber incident response.\n•Supplier Engagement – We provide training and other resources to our suppliers to support cybersecurity resiliency in our supply chain. We also require our suppliers to comply with our standard information security terms and conditions, in addition to any requirements from our customers, as a condition of doing business with us, and require them to complete information security questionnaires to review and assess any potential cyber-related risks depending on the nature of the services being provided.\nWhile we have experienced cybersecurity incidents in the past, to date none have materially affected the Company or our financial position, results of operations and/or cash flows. We continue to invest in the cybersecurity and resiliency of our networks and to enhance our internal controls and processes, which are designed to help protect our systems and infrastructure, and the information they contain. For more information regarding the risks we face from cybersecurity threats, please see “Risk Factors.”\nFORWARD-LOOKING STATEMENTS AND PROJECTIONS\nThis Annual Report on Form 10-K and the information we are incorporating by reference contain statements that constitute “forward-looking statements” within the meaning of the Private Securities Litigation Reform Act of 1995. Words such as “will,” “expect,” “anticipate,” “intend,” “may,” “could,” “should,” “plan,” “project,” “forecast,” “believe,” “estimate,” “guidance,” “outlook,” “trends,” “goals” and similar expressions generally identify these forward-looking statements. Forward-looking statements include, among other things, statements relating to our future financial condition, results of operations and/or cash flows. Forward-looking statements are based upon assumptions, expectations, plans and projections that we believe to be reasonable when made, but which may change over time. These statements are not guarantees of future performance and inherently involve a wide range of risks and uncertainties that are difficult to predict. Specific risks that could cause actual results to differ materially from those expressed or implied in these forward-looking statements include, but are not limited to, those identified under “Risk Factors” and other important factors disclosed in this report and from time to time in our other SEC filings. These risks and uncertainties are amplified by the global macroeconomic, security and political environments, including inflationary pressures, labor and supply chain challenges, which have caused and will continue to cause significant challenges, instability and uncertainty. They include:\nIndustry and Economic Risks\n•our dependence on the U.S. government for a substantial portion of our business\n•significant delays or reductions in appropriations and/or for our programs, and U.S. government funding and program support more broadly, including as a result of a prolonged continuing resolution and/or government shutdown, and/or related to the global security environment or other global events\n•significant delays or reductions in payments as a result of or related to a breach of the debt ceiling\n•the use of estimates when accounting for our contracts and the effect of contract cost growth and our efforts to recover or offset such costs and/or changes in estimated contract costs and revenues, including as a result of inflationary pressures, labor shortages, supply chain challenges and/or other macroeconomic factors, and risks related to management’s judgments and assumptions in estimating and/or projecting contract revenue and performance which may be inaccurate\n•continued pressures from macroeconomic trends, including on costs, schedules, performance and ability to meet expectations\n•increased competition within our markets and bid protests\nLegal and Regulatory Risks\n•investigations, claims, disputes, enforcement actions, litigation (including criminal, civil and administrative) and/or other legal proceedings\n•the improper conduct of employees, agents, subcontractors, suppliers, business partners or joint ventures in which we participate, including the impact on our reputation and our ability to do business\n•changes in procurement and other laws, SEC, DoD and other rules and regulations, contract terms and practices applicable to our industry, findings by the U.S. government as to our compliance with such requirements, more aggressive enforcement of such requirements and changes in our customers’ business practices globally\n•environmental matters, including climate change, unforeseen environmental costs and government and third party claims\n•unanticipated changes in our tax provisions or exposure to additional tax liabilities\nBusiness and Operational Risks\n•cyber and other security threats or disruptions faced by us, our customers or our suppliers and other partners, and changes in related regulations\n•our ability to attract and retain a qualified, talented and diverse workforce with the necessary security clearances to meet our performance obligations\n•the performance and viability of our subcontractors and suppliers and the availability and pricing of raw materials and components, particularly with inflationary pressures, increased costs, shortages in labor and financial resources, supply chain disruptions, and extended material lead times\n•impacts related to health epidemics and pandemics and similar outbreaks\n•our exposure to additional risks as a result of our international business, including risks related to global security, geopolitical and economic factors, misconduct, suppliers, laws and regulations\n•our ability to innovate, develop new products and technologies, progress and benefit from digital transformation and maintain technologies to meet the needs of our customers\n•natural disasters\n•products and services we provide related to hazardous and high risk operations, including the production and use of such products, which subject us to various environmental, regulatory, financial, reputational and other risks\n•our ability appropriately to exploit and/or protect intellectual property rights\nGeneral and Other Risk Factors\n•the adequacy and availability of, and ability to obtain, insurance coverage, customer indemnifications or other liability protections\n•the future investment performance of plan assets, gains or losses associated with changes in valuation of marketable securities related to our non-qualified benefit plans, changes in actuarial assumptions associated\nwith our pension and other postretirement benefit plans and legislative or other regulatory actions impacting our pension and postretirement benefit obligations\n•changes in business conditions that could impact business investments and/or recorded goodwill or the value of other long-lived assets, and other potential future liabilities\nWe urge you to consider the limitations on, and risks associated with, forward-looking statements and not unduly rely on the accuracy of forward-looking statements. These forward-looking statements speak only as of the date this report is first filed or, in the case of any document incorporated by reference, the date of that document. We undertake no obligation to publicly update or revise any forward-looking statements, whether as a result of new information, future events or otherwise, except as required by applicable law.']",,,FinDER,Non-numerical,"['We recognize the critical importance of maintaining the safety and security of our systems and data and have a holistic process for overseeing and managing cybersecurity and related risks. This process is supported by both management and our Board of Directors.\nThe Chief Information Office, which maintains our cybersecurity function, is led by our Chief Information Officer (CIO), who reports to our CEO. The Chief Information Security Officer (CISO) reports to the CIO and generally is responsible for management of cybersecurity risk and the protection and defense of our networks and systems. The CISO manages a team of cybersecurity professionals with broad experience and expertise, including in cybersecurity threat assessments and detection, mitigation technologies, cybersecurity training, incident response, cyber forensics, insider threats and regulatory compliance.\nOur Board of Directors is responsible for overseeing our enterprise risk management activities in general, and each of our Board committees assists the Board in the role of risk oversight. The full Board receives an update on the Company’s risk management process and the risk trends related to cybersecurity at least annually. The Audit and Risk Committee specifically assists the Board in its oversight of risks related to cybersecurity. To help ensure effective oversight, the Audit and Risk Committee receives reports on information security and cybersecurity from the CISO at least four times a year.\nIn addition, the Company’s Enterprise Risk Management Council (ERMC) considers risks relating to cybersecurity, among other significant risks, and applicable mitigation plans to address such risks. The ERMC is comprised of the Executive Leadership Team, as well as the Chief Accounting Officer, Chief Compliance Officer, Corporate Secretary, Chief Sustainability Officer, Treasurer and Vice President, Internal Audit. The CIO and CISO attend each ERMC meeting. The ERMC meets during the year and receives periodic updates on cybersecurity risks from the CIO and CISO. We have an established process and playbook led by our CISO governing our assessment, response and notifications internally and externally upon the occurrence of a cybersecurity incident. Depending on the nature and severity of an incident, this process provides for escalating notification to our CEO and the Board (including our Lead Independent Director and the Audit and Risk Committee chair).\nOur approach to cybersecurity risk management includes the following key elements:\n•Multi-Layered Defense and Continuous Monitoring – We work to protect our computing environments and products from cybersecurity threats through multi-layered defenses and apply lessons learned from our defense and monitoring efforts to help prevent future attacks. We utilize data analytics to detect anomalies and search for cyber threats. Our Cybersecurity Operations Center provides comprehensive cyber threat detection and response capabilities and maintains a 24x7 monitoring system which complements the technology, processes and threat detection techniques we use to monitor, manage and mitigate cybersecurity threats. From time to time, we engage third party consultants or other advisors to assist in assessing, identifying and/or managing cybersecurity threats. We also periodically use our Internal Audit function to conduct additional reviews and assessments.\n•Insider Threats – We maintain an insider threat program designed to identify, assess, and address potential risks from within our Company. Our program evaluates potential risks consistent with industry practices, customer requirements and applicable law, including privacy and other considerations.\n•Information Sharing and Collaboration – We work with government, customer, industry and/or supplier partners, such as the National Defense Information Sharing and Analysis Center and other government-industry partnerships, to gather and develop best practices and share information to address cyber threats. These relationships enable the rapid sharing of threat and vulnerability mitigation information across the defense industrial base and supply chain.\n•Third Party Risk Assessments – We conduct information security assessments before sharing or allowing the hosting of sensitive data in computing environments managed by third parties, and our standard terms and conditions contain contractual provisions requiring certain security protections.\n•Training and Awareness – We provide awareness training to our employees to help identify, avoid and mitigate cybersecurity threats. Our employees with network access participate annually in required training, including spear phishing and other awareness training. We also periodically host tabletop exercises with management and other employees to practice rapid cyber incident response.\n•Supplier Engagement – We provide training and other resources to our suppliers to support cybersecurity resiliency in our supply chain. We also require our suppliers to comply with our standard information security terms and conditions, in addition to any requirements from our customers, as a condition of doing business with us, and require them to complete information security questionnaires to review and assess any potential cyber-related risks depending on the nature of the services being provided.\nWhile we have experienced cybersecurity incidents in the past, to date none have materially affected the Company or our financial position, results of operations and/or cash flows. We continue to invest in the cybersecurity and resiliency of our networks and to enhance our internal controls and processes, which are designed to help protect our systems and infrastructure, and the information they contain. For more information regarding the risks we face from cybersecurity threats, please see “Risk Factors.”\nFORWARD-LOOKING STATEMENTS AND PROJECTIONS\nThis Annual Report on Form 10-K and the information we are incorporating by reference contain statements that constitute “forward-looking statements” within the meaning of the Private Securities Litigation Reform Act of 1995. Words such as “will,” “expect,” “anticipate,” “intend,” “may,” “could,” “should,” “plan,” “project,” “forecast,” “believe,” “estimate,” “guidance,” “outlook,” “trends,” “goals” and similar expressions generally identify these forward-looking statements. Forward-looking statements include, among other things, statements relating to our future financial condition, results of operations and/or cash flows. Forward-looking statements are based upon assumptions, expectations, plans and projections that we believe to be reasonable when made, but which may change over time. These statements are not guarantees of future performance and inherently involve a wide range of risks and uncertainties that are difficult to predict. Specific risks that could cause actual results to differ materially from those expressed or implied in these forward-looking statements include, but are not limited to, those identified under “Risk Factors” and other important factors disclosed in this report and from time to time in our other SEC filings. These risks and uncertainties are amplified by the global macroeconomic, security and political environments, including inflationary pressures, labor and supply chain challenges, which have caused and will continue to cause significant challenges, instability and uncertainty. They include:\nIndustry and Economic Risks\n•our dependence on the U.S. government for a substantial portion of our business\n•significant delays or reductions in appropriations and/or for our programs, and U.S. government funding and program support more broadly, including as a result of a prolonged continuing resolution and/or government shutdown, and/or related to the global security environment or other global events\n•significant delays or reductions in payments as a result of or related to a breach of the debt ceiling\n•the use of estimates when accounting for our contracts and the effect of contract cost growth and our efforts to recover or offset such costs and/or changes in estimated contract costs and revenues, including as a result of inflationary pressures, labor shortages, supply chain challenges and/or other macroeconomic factors, and risks related to management’s judgments and assumptions in estimating and/or projecting contract revenue and performance which may be inaccurate\n•continued pressures from macroeconomic trends, including on costs, schedules, performance and ability to meet expectations\n•increased competition within our markets and bid protests\nLegal and Regulatory Risks\n•investigations, claims, disputes, enforcement actions, litigation (including criminal, civil and administrative) and/or other legal proceedings\n•the improper conduct of employees, agents, subcontractors, suppliers, business partners or joint ventures in which we participate, including the impact on our reputation and our ability to do business\n•changes in procurement and other laws, SEC, DoD and other rules and regulations, contract terms and practices applicable to our industry, findings by the U.S. government as to our compliance with such requirements, more aggressive enforcement of such requirements and changes in our customers’ business practices globally\n•environmental matters, including climate change, unforeseen environmental costs and government and third party claims\n•unanticipated changes in our tax provisions or exposure to additional tax liabilities\nBusiness and Operational Risks\n•cyber and other security threats or disruptions faced by us, our customers or our suppliers and other partners, and changes in related regulations\n•our ability to attract and retain a qualified, talented and diverse workforce with the necessary security clearances to meet our performance obligations\n•the performance and viability of our subcontractors and suppliers and the availability and pricing of raw materials and components, particularly with inflationary pressures, increased costs, shortages in labor and financial resources, supply chain disruptions, and extended material lead times\n•impacts related to health epidemics and pandemics and similar outbreaks\n•our exposure to additional risks as a result of our international business, including risks related to global security, geopolitical and economic factors, misconduct, suppliers, laws and regulations\n•our ability to innovate, develop new products and technologies, progress and benefit from digital transformation and maintain technologies to meet the needs of our customers\n•natural disasters\n•products and services we provide related to hazardous and high risk operations, including the production and use of such products, which subject us to various environmental, regulatory, financial, reputational and other risks\n•our ability appropriately to exploit and/or protect intellectual property rights\nGeneral and Other Risk Factors\n•the adequacy and availability of, and ability to obtain, insurance coverage, customer indemnifications or other liability protections\n•the future investment performance of plan assets, gains or losses associated with changes in valuation of marketable securities related to our non-qualified benefit plans, changes in actuarial assumptions associated\nwith our pension and other postretirement benefit plans and legislative or other regulatory actions impacting our pension and postretirement benefit obligations\n•changes in business conditions that could impact business investments and/or recorded goodwill or the value of other long-lived assets, and other potential future liabilities\nWe urge you to consider the limitations on, and risks associated with, forward-looking statements and not unduly rely on the accuracy of forward-looking statements. These forward-looking statements speak only as of the date this report is first filed or, in the case of any document incorporated by reference, the date of that document. We undertake no obligation to publicly update or revise any forward-looking statements, whether as a result of new information, future events or otherwise, except as required by applicable law.']",c593f878,True,"['We invest in enhancing our cybersecurity capabilities and strengthening our partnerships with appropriate business partners, service partners, and government and law enforcement agencies to understand the range of cybersecurity risks in the operating environment, enhance defenses, and improve resiliency against cybersecurity threats. Additionally, we are a member of the Financial Services and Information Technology ISACs and both a founding member and board member of the Automotive ISAC. Our membership with these industry cybersecurity groups assists in our efforts to protect the Company against both enterprise and in-vehicle security risks.', 'In response to the rapidly evolving cyber threat environment, the Company continues to invest in data security and system resiliency. See also Item 1A: Risk Factors for an additional discussion regarding risks related to information technology systems.', 'We also periodically retain outside expertise to conduct a maturity assessment of our program against industry standards and participants. Our program is informed by industry standards such as, for example, the National Institute of Standards and Technology’s Framework for Improving Critical Infrastructure Cybersecurity (“NIST CSF”), but this does not imply that we meet all technical standards, specifications or requirements under the NIST CSF or other sources.\n\n \n\nWe have combatted cybersecurity threats in the normal course of business, but prior cybersecurity incidents have not materially affected, and do not appear likely to materially affect, our operations, business strategy, results of operations or financial condition. However, our Enterprise Risk Management program has recognized that we face ongoing risks from cybersecurity threats that, if not successfully prevented or mitigated, could materially affect us, including our operations, business strategy, results of operations or financial condition. For additional information on this risk, see Item 1A, Risk Factors, of this Annual Report on Form 10-K.\n\n \n\nCybersecurity Governance', 'While we have previously experienced technology outages and cybersecurity events that have impacted our systems and service, future events may result in more significant impacts to our operations, reputation or financial results. As a result of these prior events, and given the potential risks that a technology outage or cybersecurity event would result in a materially adverse effect on our results of operations, financial condition, reputation, or business, we have conducted and will continue conducting, internal and third-party assessments of information technology and cybersecurity vulnerabilities, information technology resiliency, and our related processes and procedures, so that we can continue to identify and address key cybersecurity risks.\n\nCYBERSECURITY GOVERNANCE\n\nBoard Oversight', 'We regularly engage external auditors to assess our internal cybersecurity programs and compliance and have been certified to conform to the requirements of ISO/IEC 27001.\n\n \n\nThere are no identified cybersecurity threats that have materially affected or are reasonably likely to materially affect our results of operations, or financial condition as of the date of this Annual Report on Form 10-K.\n\n \n\nSee “Risk Factors” for more information on our cybersecurity risks.\n\n \n\nCybersecurity Governance\n\n \n\nAs an important part of our risk management processes, cybersecurity is a focus area for our Board and management. Our Nominating and Corporate Governance Committee (the “NCG Committee”), which consists of independent members of the Board of Directors, is responsible for the oversight of risks from cybersecurity threats. The NCG Committee receives quarterly updates from the Cybersecurity Steering Committee. These updates include existing and emerging cybersecurity threats, risks, cybersecurity incident management and key information security initiatives. The NCG Committee also provides updates to our cybersecurity risk management and strategy programs to the Board of Directors on a quarterly basis.', 'Although we have invested in the protection of our data and information technology and monitor our systems on an ongoing basis, there can be no assurance that such efforts will prevent material compromises to our information technology systems in the future that could have a material adverse effect on our business. As of the date of this filing, we are not aware of any current cybersecurity threats or incidents that have materially affected or are reasonably likely to materially affect our business, results of operations or financial condition. For further discussion of the risks related to cybersecurity, see the risk factors discussed under “Information Technology and Cybersecurity” in our Risk Factors in Item 1A of this Form 10-K.\n\nGovernance', 'We are not aware of any risks from cybersecurity threats, including as a result of any cybersecurity incidents, which have materially affected or are reasonably likely to materially affect our Company, including our business strategy, results of operations, or financial condition. Refer to “Item 1A. Risk factors” in this annual report on Form 10-K, including “If our information technology networks or data, or those of third parties upon which we rely, are or were disrupted or otherwise compromised, we could experience costly remediation or other expenses, liability under federal and state laws, and litigation and investigations, any of which could result in substantial reputational damage and materially and adversely affect our business, financial condition, results of operations, cash flows, and the market price of our common stock”, for additional discussion about cybersecurity-related risks.\n\nGovernance', 'Our ability to attract and retain customers, efficiently operate our businesses, execute our DRIVE transformation, including Network 2.0, and compete effectively increasingly depend in part upon the sophistication, security, and reliability of our technology network, including our ability to provide features of service that are important to our customers, to protect our confidential business information and the information provided by our customers, and to maintain customer confidence in our ability to protect our systems and to provide services consistent with their expectations.\n\n \n\nCybersecurity Risk Management and Strategy', 'As of the date of this report, we do not believe that risks from any cybersecurity threats, including as a result of any previous cybersecurity incidents, have materially affected or are reasonably likely to affect us, including our business strategy, results of operations or financial condition. That said, as discussed more fully under Item 1A. “Risk Factors—Operational Risks— Increased information technology security threats and more sophisticated computer crime pose a risk to our systems, networks, products and services” of this Form 10-K, these threats pose a risk to the security of our systems and networks and the confidentiality, availability and integrity of our data. Cybersecurity attacks could also include attacks targeting customer data or the security, integrity and/or reliability of the hardware and software installed in our products. It is possible that our information technology systems and networks, or those managed or provided by third parties, could have vulnerabilities, which could go unnoticed for a period of time. While various procedures and controls have been and are being utilized to mitigate such risks, there can be no guarantee that the actions and controls we have implemented and are implementing, or which we cause or have caused third-party service providers to implement, will be sufficient to protect and mitigate associated risks to our systems, information or other property.\n\nCybersecurity Governance', 'In the last three fiscal years to date, we are not aware of any cybersecurity incidents that have materially affected or are reasonably likely to materially affect our business, results of operations, or financial condition. While we have significant security processes and initiatives in place, we may be unable to detect or prevent a breach or disruption in the future. For more information about cybersecurity-related risks, please see Item 1A. “Risk Factors” of this Form 10-K. See “Item 1A. Risk Factors” of our Annual Report on Form 10-K for the year ended May 31, 2021, for information regarding the 2017 NotPetya cyberattack at TNT Express.\n\n \n\nCybersecurity Governance']",740.2390410425141,"By continually investing in data-security upgrades, joining sector ISACs, aligning its program with NIST CSF standards, securing ISO 27001 certification, and subjecting its defenses to regular third-party audits, NGC demonstrates a mature, board-supervised cyber-risk program that has so far averted any material incidents; this visible risk mitigation reassures investors, supports the company’s valuation, and enhances the long-term stability of its operations and financial results."
2,2,cb08b8b0,"SBA Comm., credit evals & DTA quality receivables.","The details provided illustrate that SBA Communications Corporation employs a proactive and disciplined approach to managing credit risk associated with its receivables. The company conducts periodic credit evaluations, which means that it regularly reviews the creditworthiness of its customers. This ongoing evaluation helps in identifying any potential deterioration in credit quality early on, thereby allowing the company to adjust its risk management strategy promptly.

In addition, the establishment of an allowance for doubtful accounts is a key risk mitigation tool. By setting aside reserves based on historical experiences, specific customer issues, and past-due balances, the company acknowledges and prepares for the possibility of uncollectible receivables. This practice not only enhances the reliability of its financial statements by reflecting more conservative estimates of collectible revenue but also provides stakeholders with greater assurance that any credit losses are being managed in a structured manner.

Overall, these practices indicate that SBA Communications Corporation has strong internal controls and a robust framework for credit risk management. The systematic credit evaluations combined with the prudent establishment of allowances for doubtful accounts contribute to the overall quality of the company's receivables and help mitigate potential adverse impacts from defaults or delayed collections.","['Site leasing revenues\n\nRevenue from site leasing is recognized on a straight-line basis over the current term of the related lease agreements, which are generally five years to fifteen years. Receivables recorded related to the straight-lining of site leases are reflected in other assets on the Consolidated Balance Sheets. Rental amounts received in advance are recorded as deferred revenue on the Consolidated Balance Sheets. Revenue from site leasing represents 93% of our total revenue for the year ended December 31, 2023. \n\nSite development revenues\n\nSite development projects in which we perform consulting services include contracts on a fixed price basis that are billed at contractual rates. Revenue is recognized over time based on milestones achieved, which are determined based on costs incurred. Amounts billed in advance (collected or uncollected) are recorded as deferred revenue on our Consolidated Balance Sheets.\n\nRevenue from construction projects is recognized over time, determined by the percentage of cost incurred to date compared to management’s estimated total cost for each contract. This method is used because management considers total cost to be the best available measure of progress on the contracts. These amounts are based on estimates, and the uncertainty inherent in the estimates initially is reduced as work on the contracts nears completion. Refer to Note 5 in our Consolidated Financial Statements included in this annual report for further detail of costs and estimated earnings in excess of billings on uncompleted contracts. Provisions for estimated losses on uncompleted contracts are made in the period in which such losses are determined to be probable.\n\nThe site development segment represents approximately 7% of our total revenues for the year ended December 31, 2023. We account for site development revenue in accordance with ASC 606, Revenue from Contracts with Customers. Payment terms do not result in any significant financing arrangements. Furthermore, these contracts do not typically include variable consideration; therefore, the transaction price that is recognized over time is generally the amount of the total contract.\n\nAccounts receivable\n\nThe accounts receivable balance for the years ended December 31, 2023 and 2022 was $182.7 million and $184.4 million, respectively, of which $32.3 million and $59.6 million related to the site development segment, respectively. We perform periodic credit evaluations of our customers. In addition, we monitor collections and payments from our customers and maintain a provision for estimated credit losses based upon historical experience, specific customer collection issues identified, and past due balances as determined based on contractual terms. Interest is charged on outstanding receivables from customers on a case by case basis in accordance with the terms of the respective contracts or agreements with those customers. Amounts determined to be uncollectible are written off against the allowance for doubtful accounts in the period in which uncollectibility is determined to be probable. Refer to Note 15 in our Consolidated Financial Statements included in this annual report for further detail of the site development segment.']",,,FinDER,Non-numerical,"['Site leasing revenues\n\nRevenue from site leasing is recognized on a straight-line basis over the current term of the related lease agreements, which are generally five years to fifteen years. Receivables recorded related to the straight-lining of site leases are reflected in other assets on the Consolidated Balance Sheets. Rental amounts received in advance are recorded as deferred revenue on the Consolidated Balance Sheets. Revenue from site leasing represents 93% of our total revenue for the year ended December 31, 2023. \n\nSite development revenues\n\nSite development projects in which we perform consulting services include contracts on a fixed price basis that are billed at contractual rates. Revenue is recognized over time based on milestones achieved, which are determined based on costs incurred. Amounts billed in advance (collected or uncollected) are recorded as deferred revenue on our Consolidated Balance Sheets.\n\nRevenue from construction projects is recognized over time, determined by the percentage of cost incurred to date compared to management’s estimated total cost for each contract. This method is used because management considers total cost to be the best available measure of progress on the contracts. These amounts are based on estimates, and the uncertainty inherent in the estimates initially is reduced as work on the contracts nears completion. Refer to Note 5 in our Consolidated Financial Statements included in this annual report for further detail of costs and estimated earnings in excess of billings on uncompleted contracts. Provisions for estimated losses on uncompleted contracts are made in the period in which such losses are determined to be probable.\n\nThe site development segment represents approximately 7% of our total revenues for the year ended December 31, 2023. We account for site development revenue in accordance with ASC 606, Revenue from Contracts with Customers. Payment terms do not result in any significant financing arrangements. Furthermore, these contracts do not typically include variable consideration; therefore, the transaction price that is recognized over time is generally the amount of the total contract.\n\nAccounts receivable\n\nThe accounts receivable balance for the years ended December 31, 2023 and 2022 was $182.7 million and $184.4 million, respectively, of which $32.3 million and $59.6 million related to the site development segment, respectively. We perform periodic credit evaluations of our customers. In addition, we monitor collections and payments from our customers and maintain a provision for estimated credit losses based upon historical experience, specific customer collection issues identified, and past due balances as determined based on contractual terms. Interest is charged on outstanding receivables from customers on a case by case basis in accordance with the terms of the respective contracts or agreements with those customers. Amounts determined to be uncollectible are written off against the allowance for doubtful accounts in the period in which uncollectibility is determined to be probable. Refer to Note 15 in our Consolidated Financial Statements included in this annual report for further detail of the site development segment.']",cb08b8b0,True,"[""DTE Energy has approximately $1.8 billion of available liquidity at December 31, 2023, consisting primarily of cash and cash equivalents and amounts available under unsecured revolving credit agreements.\nDTE Energy believes it will have sufficient operating flexibility, cash resources and funding sources to maintain adequate liquidity and to meet future operating cash and capital expenditure needs. However, virtually all DTE Energy's businesses are capital intensive, or require access to capital, and the inability to access adequate capital could adversely impact earnings and cash flows.\nCredit Ratings\nCredit ratings are intended to provide banks and capital market participants with a framework for comparing the credit quality of securities and are not a recommendation to buy, sell, or hold securities. DTE Energy, DTE Electric, and DTE Gas' credit ratings affect their costs of capital and other terms of financing, as well as their ability to access the credit and commercial paper markets. DTE Energy, DTE Electric, and DTE Gas' management believes that the current credit ratings provide sufficient access to capital markets. However, disruptions in the banking and capital markets not specifically related to DTE Energy, DTE Electric, and DTE Gas may affect their ability to access these funding sources or cause an increase in the return required by investors.\nAs part of the normal course of business, DTE Electric, DTE Gas, and various non-utility subsidiaries of DTE Energy routinely enter into physical or financially settled contracts for the purchase and sale of electricity, natural gas, coal, capacity, storage, and other energy-related products and services. Certain of these contracts contain provisions which allow the counterparties to request that DTE Energy posts cash or letters of credit in the event that the senior unsecured debt rating of DTE Energy is downgraded below investment grade. The amount of such collateral which could be requested fluctuates based upon commodity prices and the provisions and maturities of the underlying transactions and could be substantial. Also, upon a downgrade below investment grade, DTE Energy, DTE Electric, and DTE Gas could have restricted access to the commercial paper market, and if DTE Energy is downgraded below investment grade, the non-utility businesses could be required to restrict operations due to a lack of available liquidity. A downgrade below investment grade could potentially increase the borrowing costs of DTE Energy, DTE Electric, and DTE Gas and their subsidiaries and may limit access to the capital markets. The impact of a downgrade will not affect DTE Energy, DTE Electric, and DTE Gas' ability to comply with existing debt covenants. While DTE Energy, DTE Electric, and DTE Gas currently do not anticipate such a downgrade, they cannot predict the outcome of current or future credit rating agency reviews."", 'Selected measures of liquidity and capital resources\nCertain relevant measures of our liquidity and capital resources follow:  \nDecember 31,\n(MILLIONS OF DOLLARS)\t2023\t\t2022\nCash and cash equivalents\t$\t2,041 \t\t\t$\t3,581 \t\nAccounts receivable, net(a)\n1,304 \t\t\t1,215 \t\nShort-term borrowings\t3 \t\t\t2 \t\nCurrent portion of long-term debt\t— \t\t\t1,350 \t\nLong-term debt\t6,564 \t\t\t6,552 \t\nWorking capital\t4,454 \t\t\t4,339 \t\nRatio of current assets to current liabilities\t3.36:1\t\t2.37:1\n \n(a)    Accounts receivable are usually collected over a period of 45 to 75 days. For the years ended December 31, 2023 and 2022, the number of days that accounts receivables were outstanding have remained within this range. We regularly monitor our accounts receivable for collectability, particularly in markets where economic conditions remain uncertain. We believe that our allowance for doubtful accounts is appropriate. Our assessment is based on such factors as past due aging, historical and expected collection patterns, the financial condition of our customers, the robust nature of our credit and collection practices and the economic environment.\nFor additional information about the sources and uses of our funds, see the Analysis of the Consolidated Balance Sheets and Analysis of the Consolidated Statements of Cash Flows sections of this MD&A.', 'The Company reviews its trade accounts receivable, related to base rents, straight-line rent, expense reimbursements and other revenues for collectability. The Company evaluates the probability of the collection of the lessee’s total accounts receivable, including the corresponding straight-line rent receivable balance on a lease-by-lease basis. The Company’s analysis of its accounts receivable includes (i) customer credit worthiness, (ii) assessment of risk associated with the tenant, and (iii) current economic trends. In addition, tenants in bankruptcy are analyzed and considerations are made in connection with the expected recovery of pre-petition and post-petition bankruptcy claims. If a lessee’s accounts receivable balance is considered uncollectible, the Company will write-off the uncollectible receivable balances associated with the lease and will only recognize lease income on a cash basis. The Company includes provision for doubtful accounts in Revenues from rental properties, net, in accordance with Topic 842. Lease income will then be limited to the lesser of (i) the straight-line rental income or (ii) the lease payments that have been collected from the lessee. In addition to the lease-specific collectability assessment performed under Topic 842, the analysis also recognizes a general reserve under ASC Topic 450 Contingencies, as a reduction to Revenues from rental properties, for its portfolio of operating lease receivables which are not expected to be fully collectible based on the Company’s historical and current collection experience and the potential for settlement of arrears. Although the Company estimates uncollectible receivables and provides for them through charges against revenues from rental properties, actual results may differ from those estimates. If the Company subsequently determines that it is probable it will collect the remaining lessee’s lease payments under the lease term, the Company will then reinstate the straight-line balance.', 'Sales of Financing Receivables\n\nWe offer certain of our customers the option to acquire certain of our cloud and license, hardware and services offerings through separate long-term payment contracts. We generally sell these contracts that we have financed for our customers on a non-recourse basis to financial institutions within 90 days of the contracts’ dates of execution. We record the transfers of amounts due from customers to financial institutions as sales of financing receivables because we are considered to have surrendered control of these financing receivables. During fiscal 2024, 2023 and 2022, $1.4 billion, $2.0 billion and $1.8 billion, respectively, of our financing receivables were sold to financial institutions.', 'Sales are typically made on credit, and we generally do not require collateral. We are exposed to credit losses primarily through sales of products and services. Our expected loss allowance methodology for accounts receivable,notes receivable, and contract assets is developed using historical collection experience, published or estimated credit default rates for entities that represent our customer base, current and future economic and market conditions, and a review of the current status of customers’ trade accounts receivables. We review receivables for U.S. and international customers separately to better reflect different published credit default rates and economic and market conditions. Additionally, specific reserve amounts are established to record the appropriate provision for customers that have a higher probability of default. Our monitoring activities include account reconciliation, dispute resolution, payment confirmation, consideration of customers’ financial condition and macroeconomic conditions. Balances are written off when determined to be uncollectible.', 'The Company performs ongoing credit evaluations of its customers’ financial condition to manage collection risk, in some cases supplemented by collateral. The Company maintains allowances for potential credit losses, and such losses have historically been within management’s expectations. At any given point in time, the total amount outstanding from any one of a number of its customers may be individually significant to the Company’s financial condition. As of June 28, 2024 and June 30, 2023, net accounts receivable were $2.17 billion and $1.60 billion, respectively, and reserves for potential credit losses were not material. As of June 28, 2024, one customer accounted for 15% of the Company’s net accounts receivable and as of June 30, 2023, two customers accounted for 15% and 13% of the Company’s net accounts receivable.\nThe Company also has cash equivalent and investment policies that limit the amount of credit exposure to any one financial institution or investment instrument and requires that investments be made only with financial institutions or in investment instruments evaluated as highly credit-worthy.\n\nSupplier Concentration', 'Payment terms are generally 30 to 60 days from the transfer of control. Payment terms do not contain a significant financing component.\n\nAccounts receivable, net – Accounts receivable, net includes amounts billed and currently due from customers. The amounts due are stated at their net estimated realizable value. Accounts receivable are stated net of an allowance for doubtful accounts and sales allowances of $22.2 and $16.6 at December 31, 2023 and 2022, respectively. We make estimates of expected allowance for doubtful accounts based upon our assessment of various factors, including historical experience, the age of the accounts receivable balances, changes to customer creditworthiness, and other factors that may affect our ability to collect from customers.\n\nUnbilled receivables – Our unbilled receivables include unbilled amounts typically resulting from sales under software milestone billings associated with multi-year term license renewals and software implementations when the input method of revenue recognition is utilized and revenue recognized exceeds the amount billed to the customer, and right to payment is not solely due to the passage of time. Amounts may not exceed their net realizable value.', 'Amounts billed and due from our customers are classified as accounts receivable on the balance sheet and require payment on a short-term basis. Our allowance for doubtful accounts represents our estimate of probable non-payments and credit losses in our existing receivables, as determined based on a review of past due balances and other specific account data.\n\nThe following table sets forth our net sales by the Americas, Europe, Middle East and Africa (EMEA) and Asia/Pacific (APAC) geographic regions:  \n(millions)\tAmericas\tEMEA\tAPAC\tTotal\n2023\t\t\t\t\nNet sales\t$\t4,756.9 \t\t$\t1,212.8 \t\t$\t692.5 \t\t$\t6,662.2 \t\n2022\t\t\t\t\nNet sales\t$\t4,551.7 \t\t$\t1,116.4 \t\t$\t682.4 \t\t$\t6,350.5 \t\n2021\t\t\t\t\nNet sales\t$\t4,396.1 \t\t$\t1,191.3 \t\t$\t730.5 \t\t$\t6,317.9 \t\n \nPerformance Obligations\nOur revenues primarily result from contracts or purchase orders with customers, which generally are both short-term in nature and have a single performance obligation—the delivery of our products to customers. We assess the\n goods and services promised in our customers’ contracts or purchase orders and identify a performance obligation for each promise to transfer a good or service (or bundle of goods or services) that is distinct. To identify the performance obligations, we consider all the goods or services promised, whether explicitly stated or implied based on customary business practices.', 'For transactions where we recognize a significant financing component, judgment is required to determine the discount rate. For EIP sales, the discount rate used to adjust the transaction price primarily reflects current market interest rates and the estimated credit risk of the customer. Customer credit behavior is inherently uncertain. See “Receivables and Allowance for Credit Losses” above, for additional discussion on how we assess credit risk.\n\nFor receivables associated with an end service customer in which the sale of the device was not directly to the end customer (sell-in model or devices sourced directly from OEM), the effect of imputing interest is recognized as a reduction to service revenue over the service contract period. In these transactions, the provision of wireless communications services is the only performance obligation as the device sale was recognized when transferred to the dealer.\n\nContract Balances\n\nGenerally, our devices and service plans are available at standard prices, which are maintained on price lists and published on our website and/or within our retail stores.', ""As of December 31, 2023, our credit ratings were as follows:\nRating Agency\t\tLong-Term Debt Rating\t\tCommercial Paper Rating\t\tOutlook\nMoody's\t\tBaa1\t\tP-2\t\tStable\nS&P\t\tBBB\t\tA-2\t\tStable\n \nThese debt and commercial paper ratings impact the interest we pay on our financing arrangements. A downgrade of one or both of our debt and commercial paper ratings could increase our interest expense and decrease the cash available to fund anticipated obligations. As of December 31, 2023, we were in compliance with all debt covenants and we have no reason to believe that we will be unable to satisfy these covenants.""]",1107.0912920404226,"The company monitors credit risk aggressively: it reviews every customer’s financial condition, tracks aging (target 45-75 collection days), and books both lease-specific (ASC 842) and portfolio (ASC 450) reserves. Historical losses are “not material” (e.g., at 6/28/24 a 2.17 billion receivable balance carried only an immaterial reserve), and overall allowances were 22.2 million on 1.304 billion of receivables at 12/31/23. Management therefore views its receivables—and the related deferred tax assets tied to them—as high-quality and fully recoverable."
3,3,GPN/2009/page_85.pdf,"Q: For GPN, what was the fair value of share awards vested in 2009?
A: 6.2
Q: what was the value in 2007?
A: 1.7
Q: what was the net change in value?
A: A0
Q: what is the net change divided by the 2007 value?",265%,"[""['notes to consolidated financial statements 2014 ( continued ) the following table summarizes the changes in non-vested restricted stock awards for the year ended may 31 , 2009 ( share awards in thousands ) : share awards weighted average grant-date fair value .']\n\tshare awards\tweighted average grant-date fair value\nnon-vested at may 31 2007\t278\t$ 37\ngranted\t400\t38\nvested\t-136 ( 136 )\t30\nforfeited\t-24 ( 24 )\t40\nnon-vested at may 31 2008\t518\t39\ngranted\t430\t43\nvested\t-159 ( 159 )\t39\nforfeited\t-27 ( 27 )\t41\nnon-vested at may 31 2009\t762\t42\n['the weighted average grant-date fair value of share awards granted in the years ended may 31 , 2008 and 2007 was $ 38 and $ 45 , respectively .', 'the total fair value of share awards vested during the years ended may 31 , 2009 , 2008 and 2007 was $ 6.2 million , $ 4.1 million and $ 1.7 million , respectively .', 'we recognized compensation expense for restricted stock of $ 9.0 million , $ 5.7 million , and $ 2.7 million in the years ended may 31 , 2009 , 2008 and 2007 .', 'as of may 31 , 2009 , there was $ 23.5 million of total unrecognized compensation cost related to unvested restricted stock awards that is expected to be recognized over a weighted average period of 2.9 years .', 'employee stock purchase plan we have an employee stock purchase plan under which the sale of 2.4 million shares of our common stock has been authorized .', 'employees may designate up to the lesser of $ 25000 or 20% ( 20 % ) of their annual compensation for the purchase of stock .', 'the price for shares purchased under the plan is 85% ( 85 % ) of the market value on the last day of the quarterly purchase period .', 'as of may 31 , 2009 , 0.8 million shares had been issued under this plan , with 1.6 million shares reserved for future issuance .', 'the weighted average grant-date fair value of each designated share purchased under this plan was $ 6 , $ 6 and $ 8 in the years ended may 31 , 2009 , 2008 and 2007 , respectively .', 'these values represent the fair value of the 15% ( 15 % ) discount .', 'note 12 2014segment information general information during fiscal 2009 , we began assessing our operating performance using a new segment structure .', 'we made this change as a result of our june 30 , 2008 acquisition of 51% ( 51 % ) of hsbc merchant services llp in the united kingdom , in addition to anticipated future international expansion .', 'beginning with the quarter ended august 31 , 2008 , the reportable segments are defined as north america merchant services , international merchant services , and money transfer .', 'the following tables reflect these changes and such reportable segments for fiscal years 2009 , 2008 , and 2007. .']""]","{'text_2': 'the total fair value of share awards vested during the years ended may 31 , 2009 , 2008 and 2007 was $ 6.2 million , $ 4.1 million and $ 1.7 million , respectively .'}","subtract(6.2, 1.7), divide(#0, 1.7)",ConvFinQA,Compositional,"['the total fair value of share awards vested during the years ended may 31 , 2009 , 2008 and 2007 was $ 6.2 million , $ 4.1 million and $ 1.7 million , respectively .']",GPN/2009/page_85.pdf,True,"[""['notes to consolidated financial statements 2014 ( continued ) the following table summarizes the changes in non-vested restricted stock awards for the year ended may 31 , 2009 ( share awards in thousands ) : share awards weighted average grant-date fair value .'] share awards weighted average grant-date fair value non-vested at may 31 2007 278 $ 37 granted 400 38 vested -136 ( 136 ) 30 forfeited -24 ( 24 ) 40 non-vested at may 31 2008 518 39 granted 430 43 vested -159 ( 159 ) 39 forfeited -27 ( 27 ) 41 non-vested at may 31 2009 762 42 ['the weighted average grant-date fair value of share awards granted in the years ended may 31 , 2008 and 2007 was $ 38 and $ 45 , respectively .', 'the total fair value of share awards vested during the years ended may 31 , 2009 , 2008 and 2007 was $ 6.2 million , $ 4.1 million and $ 1.7 million , respectively .', 'we recognized compensation expense for restricted stock of $ 9.0 million , $ 5.7 million , and $ 2.7 million in the years ended may 31 , 2009 , 2008 and 2007 .', 'as of may 31 , 2009 , there was $ 23.5 million of total unrecognized compensation cost related to unvested restricted stock awards that is expected to be recognized over a weighted average period of 2.9 years .', 'employee stock purchase plan we have an employee stock purchase plan under which the sale of 2.4 million shares of our common stock has been authorized .', 'employees may designate up to the lesser of $ 25000 or 20% ( 20 % ) of their annual compensation for the purchase of stock .', 'the price for shares purchased under the plan is 85% ( 85 % ) of the market value on the last day of the quarterly purchase period .', 'as of may 31 , 2009 , 0.8 million shares had been issued under this plan , with 1.6 million shares reserved for future issuance .', 'the weighted average grant-date fair value of each designated share purchased under this plan was $ 6 , $ 6 and $ 8 in the years ended may 31 , 2009 , 2008 and 2007 , respectively .', 'these values represent the fair value of the 15% ( 15 % ) discount .', 'note 12 2014segment information general information during fiscal 2009 , we began assessing our operating performance using a new segment structure .', 'we made this change as a result of our june 30 , 2008 acquisition of 51% ( 51 % ) of hsbc merchant services llp in the united kingdom , in addition to anticipated future international expansion .', 'beginning with the quarter ended august 31 , 2008 , the reportable segments are defined as north america merchant services , international merchant services , and money transfer .', 'the following tables reflect these changes and such reportable segments for fiscal years 2009 , 2008 , and 2007. .']"", ""['the weighted average grant date fair value of options granted during 2012 , 2011 , and 2010 was $ 13 , $ 19 and $ 20 per share , respectively .', 'the total intrinsic value of options exercised during the years ended december 31 , 2012 , 2011 and 2010 , was $ 19.0 million , $ 4.2 million and $ 15.6 million , respectively .', 'in 2012 , the company granted 931340 shares of restricted class a common stock and 4048 shares of restricted stock units .', 'restricted common stock and restricted stock units generally have a vesting period of 2 to 4 years .', 'the fair value related to these grants was $ 54.5 million , which is recognized as compensation expense on an accelerated basis over the vesting period .', 'beginning with restricted stock grants in september 2010 , dividends are accrued on restricted class a common stock and restricted stock units and are paid once the restricted stock vests .', 'in 2012 , the company also granted 138410 performance shares .', 'the fair value related to these grants was $ 7.7 million , which is recognized as compensation expense on an accelerated and straight-lined basis over the vesting period .', 'the vesting of these shares is contingent on meeting stated performance or market conditions .', 'the following table summarizes restricted stock , restricted stock units , and performance shares activity for 2012 : number of shares weighted average grant date fair value outstanding at december 31 , 2011 .', '.', '.', '.', '.', '.', '.', '.', '.', '.', '.', '.', '.', '.', '1432610 $ 57 .'] number of shares weightedaveragegrant datefair value outstanding at december 31 2011 1432610 $ 57 granted 1073798 54 vested -366388 ( 366388 ) 55 cancelled -226493 ( 226493 ) 63 outstanding at december 31 2012 1913527 54 ['outstanding at december 31 , 2012 .', '.', '.', '.', '.', '.', '.', '.', '.', '.', '.', '.', '.', '.', '1913527 54 the total fair value of restricted stock , restricted stock units , and performance shares that vested during the years ended december 31 , 2012 , 2011 and 2010 , was $ 20.9 million , $ 11.6 million and $ 10.3 million , respectively .', 'eligible employees may acquire shares of class a common stock using after-tax payroll deductions made during consecutive offering periods of approximately six months in duration .', 'shares are purchased at the end of each offering period at a price of 90% ( 90 % ) of the closing price of the class a common stock as reported on the nasdaq global select market .', 'compensation expense is recognized on the dates of purchase for the discount from the closing price .', 'in 2012 , 2011 and 2010 , a total of 27768 , 32085 and 21855 shares , respectively , of class a common stock were issued to participating employees .', 'these shares are subject to a six-month holding period .', 'annual expense of $ 0.1 million , $ 0.2 million and $ 0.1 million for the purchase discount was recognized in 2012 , 2011 and 2010 , respectively .', 'non-executive directors receive an annual award of class a common stock with a value equal to $ 75000 .', 'non-executive directors may also elect to receive some or all of the cash portion of their annual stipend , up to $ 25000 , in shares of stock based on the closing price at the date of distribution .', 'as a result , 40260 , 40585 and 37350 shares of class a common stock were issued to non-executive directors during 2012 , 2011 and 2010 , respectively .', 'these shares are not subject to any vesting restrictions .', 'expense of $ 2.2 million , $ 2.1 million and $ 2.4 million related to these stock-based payments was recognized for the years ended december 31 , 2012 , 2011 and 2010 , respectively .', '19 .', 'fair value measurements in general , the company uses quoted prices in active markets for identical assets to determine the fair value of marketable securities and equity investments .', 'level 1 assets generally include u.s .', 'treasury securities , equity securities listed in active markets , and investments in publicly traded mutual funds with quoted market prices .', 'if quoted prices are not available to determine fair value , the company uses other inputs that are directly observable .', 'assets included in level 2 generally consist of asset- backed securities , municipal bonds , u.s .', 'government agency securities and interest rate swap contracts .', 'asset-backed securities , municipal bonds and u.s .', 'government agency securities were measured at fair value based on matrix pricing using prices of similar securities with similar inputs such as maturity dates , interest rates and credit ratings .', 'the company determined the fair value of its interest rate swap contracts using standard valuation models with market-based observable inputs including forward and spot exchange rates and interest rate curves. .']"", ""The following is a reconciliation of the numerators and denominators of the basic and diluted net income per share computations for the periods presented below.\n \tYears Ended October 31,\n \t2024\t\t2023\t\t2022\n \t(in millions)\nNumerator:\t \t\t \t\t \nNet income\t$\t1,289 \t\t\t$\t1,240 \t\t\t$\t1,254 \t\nDenominators:\t \t\t \t\t \nBasic weighted average shares\t290 \t\t\t294 \t\t\t299 \t\nPotential common shares — stock options and other employee stock plans\t1 \t\t\t2 \t\t\t1 \t\nDiluted weighted average shares\t291 \t\t\t296 \t\t\t300 \t\n \n\nThe dilutive effect of share-based awards is reflected in diluted net income per share by application of the treasury stock method, which includes consideration of unamortized share-based compensation expense and the dilutive effect of in-the-money options and non-vested restricted stock units. Under the treasury stock method, the amount the employee must pay for exercising stock options and unamortized share-based compensation expense collectively are assumed proceeds to be used to repurchase hypothetical shares. An increase in the fair market value of the company's common stock can result in a greater dilutive effect from potentially dilutive awards."", ""['american tower corporation and subsidiaries notes to consolidated financial statements 2014 ( continued ) the following table illustrates the effect on net loss and net loss per share if the company had applied the fair value recognition provisions of sfas no .', '123 to stock-based compensation .', 'the estimated fair value of each option is calculated using the black-scholes option-pricing model ( in thousands , except per share amounts ) : .'] 2002 2001 2000 net loss as reported $ -1141879 ( 1141879 ) $ -450094 ( 450094 ) $ -194628 ( 194628 ) less : total stock-based employee compensation expense determined under fair value basedmethod for all awards net of related tax effect -38126 ( 38126 ) -50540 ( 50540 ) -51186 ( 51186 ) pro-forma net loss $ -1180005 ( 1180005 ) $ -500634 ( 500634 ) $ -245814 ( 245814 ) basic and diluted net loss per share 2014as reported $ -5.84 ( 5.84 ) $ -2.35 ( 2.35 ) $ -1.15 ( 1.15 ) basic and diluted net loss per share 2014pro-forma $ -6.04 ( 6.04 ) $ -2.61 ( 2.61 ) $ -1.46 ( 1.46 ) ['fair value of financial instruments 2014as of december 31 , 2002 , the carrying amounts of the company 2019s 5.0% ( 5.0 % ) convertible notes , the 2.25% ( 2.25 % ) convertible notes , the 6.25% ( 6.25 % ) convertible notes and the senior notes were approximately $ 450.0 million , $ 210.9 million , $ 212.7 million and $ 1.0 billion , respectively , and the fair values of such notes were $ 291.4 million , $ 187.2 million , $ 144.4 million and $ 780.0 million , respectively .', 'as of december 31 , 2001 , the carrying amount of the company 2019s 5.0% ( 5.0 % ) convertible notes , the 2.25% ( 2.25 % ) convertible notes , the 6.25% ( 6.25 % ) convertible notes and the senior notes were approximately $ 450.0 million , $ 204.1 million , $ 212.8 million and $ 1.0 billion , respectively , and the fair values of such notes were $ 268.3 million , $ 173.1 million , $ 158.2 million and $ 805.0 million , respectively .', 'fair values were determined based on quoted market prices .', 'the carrying values of all other financial instruments reasonably approximate the related fair values as of december 31 , 2002 and 2001 .', 'retirement plan 2014the company has a 401 ( k ) plan covering substantially all employees who meet certain age and employment requirements .', 'under the plan , the company matches 35% ( 35 % ) of participants 2019 contributions up to a maximum 5% ( 5 % ) of a participant 2019s compensation .', 'the company contributed approximately $ 979000 , $ 1540000 and $ 1593000 to the plan for the years ended december 31 , 2002 , 2001 and 2000 , respectively .', 'recent accounting pronouncements 2014in june 2001 , the fasb issued sfas no .', '143 , 201caccounting for asset retirement obligations . 201d this statement establishes accounting standards for the recognition and measurement of liabilities associated with the retirement of tangible long-lived assets and the related asset retirement costs .', 'the requirements of sfas no .', '143 are effective for the company as of january 1 , 2003 .', 'the company will adopt this statement in the first quarter of 2003 and does not expect the impact of adopting this statement to have a material impact on its consolidated financial position or results of operations .', 'in august 2001 , the fasb issued sfas no .', '144 , 201caccounting for the impairment or disposal of long-lived assets . 201d sfas no .', '144 supersedes sfas no .', '121 , 201caccounting for the impairment of long-lived assets and for long-lived assets to be disposed of , 201d but retains many of its fundamental provisions .', 'sfas no .', '144 also clarifies certain measurement and classification issues from sfas no .', '121 .', 'in addition , sfas no .', '144 supersedes the accounting and reporting provisions for the disposal of a business segment as found in apb no .', '30 , 201creporting the results of operations 2014reporting the effects of disposal of a segment of a business and extraordinary , unusual and infrequently occurring events and transactions 201d .', 'however , sfas no .', '144 retains the requirement in apb no .', '30 to separately report discontinued operations , and broadens the scope of such requirement to include more types of disposal transactions .', 'the scope of sfas no .', '144 excludes goodwill and other intangible assets that are not to be amortized , as the accounting for such items is prescribed by sfas no .', '142 .', 'the company implemented sfas no .', '144 on january 1 , 2002 .', 'accordingly , all relevant impairment assessments and decisions concerning discontinued operations have been made under this standard in 2002. .']"", 'Employee Stock Purchase Plan\nWe provide the following disclosures for the 2004 Purchase Plan as of December 31 (dollars, except shares):\n2023\t\t2022\t\t2021\nWeighted-average purchase price per share\t$\t572.59 \t\t\t$\t568.29 \t\t\t$\t467.59 \t\nWeighted average grant-date fair value per award for shares purchased\t$\t206.83 \t\t\t$\t202.61 \t\t\t$\t138.80 \t\nNumber of shares purchased\t151,875 \t\t\t143,515 \t\t\t166,023 \t\n \nWe use the Black-Scholes option-pricing model to determine the fair value of shares under the 2004 Purchase Plan with the following assumptions during the years ended December 31:\n2023\t\t2022\t\t2021\nRange of dividend yield\t\n1.69% - 1.78%\n1.48 - 1.55%\n1.58 - 1.77%\nRange of risk-free interest rate\t\n4.57% - 5.30%\n0.72 - 3.06%\n0.01 - 0.21%\nRange of expected volatility\t\n26.02% - 34.93%\n25.73 - 37.20%\n25.54 - 41.24%\nWeighted-average expected volatility\t30.48 \t%\t\t30.34 \t%\t\t34.08 \t%\nWeighted average expected life (in years)\t1.06\t\t1.06\t\t1.18\n \nStock-Based Compensation Expense\nThe following table presents, by operating expense, our stock-based compensation expense recognized in our consolidated statement of operations for the years ended December 31 (in thousands):\n2023\t\t2022\t\t2021\nCost of revenues\t$\t49,013 \t\t\t$\t45,028 \t\t\t$\t38,438 \t\nSales and marketing\t84,583 \t\t\t82,794 \t\t\t79,144 \t\nGeneral and administrative\t273,940 \t\t\t276,161 \t\t\t246,192 \t\nTotal\t$\t407,536 \t\t\t$\t403,983 \t\t\t$\t363,774 \t\n \nOur stock-based compensation expense recognized in the consolidated statement of operations was comprised of the following types of equity awards for the years ended December 31 (in thousands):\n2023\t\t2022\t\t2021\nRSUs\t$\t387,011 \t\t\t$\t359,952 \t\t\t$\t330,077 \t\nRSAs\t1,752 \t\t\t9,793 \t\t\t10,067 \t\nEmployee stock purchase plan\t18,773 \t\t\t34,238 \t\t\t23,630 \t\nTotal\t$\t407,536 \t\t\t$\t403,983 \t\t\t$\t363,774 \t\n \nDuring the years ended December 31, 2023, 2022 and 2021, we capitalized $60.3 million, $46.3 million and $27.7 million, respectively, of stock-based compensation expense as construction in progress in property, plant and equipment.\nAs of December 31, 2023, the total stock-based compensation cost related to unvested equity awards not yet recognized, net of estimated forfeitures, totaled $776.3 million which is expected to be recognized over a weighted-average period of 2.28 years.', ""['stockholders 2019 equity derivative instruments activity , net of tax , included in non-owner changes to equity within the consolidated statements of stockholders 2019 equity for the years ended december 31 , 2008 , 2007 and 2006 is as follows: .'] 2008 2007 2006 balance at january 1 $ 2014 $ 16 $ 2 increase ( decrease ) in fair value -9 ( 9 ) -6 ( 6 ) 75 reclassifications to earnings 2 -10 ( 10 ) -61 ( 61 ) balance at december 31 $ -7 ( 7 ) $ 2014 $ 16 ['net investment in foreign operations hedge at december 31 , 2008 and 2007 , the company did not have any hedges of foreign currency exposure of net investments in foreign operations .', 'investments hedge during the first quarter of 2006 , the company entered into a zero-cost collar derivative ( the 201csprint nextel derivative 201d ) to protect itself economically against price fluctuations in its 37.6 million shares of sprint nextel corporation ( 201csprint nextel 201d ) non-voting common stock .', 'during the second quarter of 2006 , as a result of sprint nextel 2019s spin-off of embarq corporation through a dividend to sprint nextel shareholders , the company received approximately 1.9 million shares of embarq corporation .', 'the floor and ceiling prices of the sprint nextel derivative were adjusted accordingly .', 'the sprint nextel derivative was not designated as a hedge under the provisions of sfas no .', '133 , 201caccounting for derivative instruments and hedging activities . 201d accordingly , to reflect the change in fair value of the sprint nextel derivative , the company recorded a net gain of $ 99 million for the year ended december 31 , 2006 , included in other income ( expense ) in the company 2019s consolidated statements of operations .', 'in december 2006 , the sprint nextel derivative was terminated and settled in cash and the 37.6 million shares of sprint nextel were converted to common shares and sold .', 'the company received aggregate cash proceeds of approximately $ 820 million from the settlement of the sprint nextel derivative and the subsequent sale of the 37.6 million sprint nextel shares .', 'the company recognized a loss of $ 126 million in connection with the sale of the remaining shares of sprint nextel common stock .', 'as described above , the company recorded a net gain of $ 99 million in connection with the sprint nextel derivative .', 'fair value of financial instruments the company 2019s financial instruments include cash equivalents , sigma fund investments , short-term investments , accounts receivable , long-term receivables , accounts payable , accrued liabilities , derivatives and other financing commitments .', 'the company 2019s sigma fund , available-for-sale investment portfolios and derivatives are recorded in the company 2019s consolidated balance sheets at fair value .', 'all other financial instruments , with the exception of long-term debt , are carried at cost , which is not materially different than the instruments 2019 fair values .', 'using quoted market prices and market interest rates , the company determined that the fair value of long- term debt at december 31 , 2008 was $ 2.8 billion , compared to a carrying value of $ 4.1 billion .', 'since considerable judgment is required in interpreting market information , the fair value of the long-term debt is not necessarily indicative of the amount which could be realized in a current market exchange .', 'equity price market risk at december 31 , 2008 , the company 2019s available-for-sale equity securities portfolio had an approximate fair market value of $ 128 million , which represented a cost basis of $ 125 million and a net unrealized loss of $ 3 million .', 'these equity securities are held for purposes other than trading .', '%%transmsg*** transmitting job : c49054 pcn : 105000000 ***%%pcmsg|102 |00022|yes|no|02/23/2009 19:17|0|0|page is valid , no graphics -- color : n| .']"", ""['notes to consolidated financial statements 2013 ( continued ) ( amounts in millions , except per share amounts ) assumptions can materially affect the estimate of fair value , and our results of operations could be materially impacted .', 'there were no stock options granted during the years ended december 31 , 2015 and 2014 .', 'the weighted-average grant-date fair value per option during the year ended december 31 , 2013 was $ 4.14 .', 'the fair value of each option grant has been estimated with the following weighted-average assumptions. .'] year ended december 31 2013 expected volatility1 40.2% ( 40.2 % ) expected term ( years ) 2 6.9 risk-free interest rate3 1.3% ( 1.3 % ) expected dividend yield4 2.4% ( 2.4 % ) ['expected volatility 1 .', '.', '.', '.', '.', '.', '.', '.', '.', '.', '.', '.', '.', '.', '.', '.', '.', '.', '.', '.', '.', '.', '.', '.', '.', '.', '.', '40.2% ( 40.2 % ) expected term ( years ) 2 .', '.', '.', '.', '.', '.', '.', '.', '.', '.', '.', '.', '.', '.', '.', '.', '.', '.', '.', '.', '.', '.', '.', '.', '6.9 risk-free interest rate 3 .', '.', '.', '.', '.', '.', '.', '.', '.', '.', '.', '.', '.', '.', '.', '.', '.', '.', '.', '.', '.', '.', '.', '.', '.', '1.3% ( 1.3 % ) expected dividend yield 4 .', '.', '.', '.', '.', '.', '.', '.', '.', '.', '.', '.', '.', '.', '.', '.', '.', '.', '.', '.', '.', '.', '.', '2.4% ( 2.4 % ) 1 the expected volatility used to estimate the fair value of stock options awarded is based on a blend of : ( i ) historical volatility of our common stock for periods equal to the expected term of our stock options and ( ii ) implied volatility of tradable forward put and call options to purchase and sell shares of our common stock .', '2 the estimate of our expected term is based on the average of : ( i ) an assumption that all outstanding options are exercised upon achieving their full vesting date and ( ii ) an assumption that all outstanding options will be exercised at the midpoint between the current date ( i.e. , the date awards have ratably vested through ) and their full contractual term .', 'in determining the estimate , we considered several factors , including the historical option exercise behavior of our employees and the terms and vesting periods of the options .', '3 the risk-free interest rate is determined using the implied yield currently available for zero-coupon u.s .', 'government issuers with a remaining term equal to the expected term of the options .', '4 the expected dividend yield was calculated based on an annualized dividend of $ 0.30 per share in 2013 .', 'stock-based compensation we grant other stock-based compensation awards such as stock-settled awards , cash-settled awards and performance- based awards ( settled in cash or shares ) to certain key employees .', 'the number of shares or units received by an employee for performance-based awards depends on company performance against specific performance targets and could range from 0% ( 0 % ) to 300% ( 300 % ) of the target amount of shares originally granted .', 'incentive awards are subject to certain restrictions and vesting requirements as determined by the compensation committee .', 'the fair value of the shares on the grant date is amortized over the vesting period , which is generally three years .', 'upon completion of the vesting period for cash-settled awards , the grantee is entitled to receive a payment in cash based on the fair market value of the corresponding number of shares of common stock .', 'no monetary consideration is paid by a recipient for any incentive award .', 'the fair value of cash-settled awards is adjusted each quarter based on our share price .', 'the holders of stock-settled awards have absolute ownership interest in the underlying shares of common stock prior to vesting , which includes the right to vote and receive dividends .', 'dividends declared on common stock are accrued during the vesting period and paid when the award vests .', 'the holders of cash-settled and performance-based awards have no ownership interest in the underlying shares of common stock until the awards vest and the shares of common stock are issued. .']"", '2.35\n\n\n$\n\n2.07\n\n\n$\n\n(0.91)\n\nDiluted\n\n\n$\n\n2.31\n\n\n$\n\n2.03\n\n\n$\n\n(0.91)\n\nWeighted average shares outstanding:\n\n\n \n\n  \n\n\n \n\n  \n\n\n \n\n  \n\nBasic\n\n\n \n\n74,195\n\n\n \n\n71,093\n\n\n \n\n66,191\n\nDiluted\n\n\n \n\n75,456\n\n\n \n\n72,534\n\n\n \n\n66,191\n\nNet income (loss)\n\n\n$\n\n174,227\n\n\n$\n\n147,139\n\n\n$\n\n(60,018)\n\nForeign currency translation adjustments\n\n(4,352)\n\n(4,818)\n\n\n \n\n(1,251)\n\nUnrealized gain (loss) on available-for-sale investments\n\n\n \n\n852\n\n\n \n\n(1,044)\n\n(207)\n\nComprehensive income (loss)\n\n\n$\n\n170,727\n\n\n$\n\n141,277\n\n\n$\n\n(61,476)', 'Note 3 – Earnings Per Share\nThe following table shows the computation of basic and diluted earnings per share for 2024, 2023 and 2022 (net income in millions and shares in thousands):\n2024\t\t2023\t\t2022\nNumerator:\t\t\t\t\t\nNet income\t$\t93,736 \t\t\t$\t96,995 \t\t\t$\t99,803 \t\nDenominator:\t\t\t\t\t\nWeighted-average basic shares outstanding\t15,343,783 \t\t\t15,744,231 \t\t\t16,215,963 \t\nEffect of dilutive share-based awards\t64,312 \t\t\t68,316 \t\t\t109,856 \t\nWeighted-average diluted shares\t15,408,095 \t\t\t15,812,547 \t\t\t16,325,819 \t\nBasic earnings per share\t$\t6.11 \t\t\t$\t6.16 \t\t\t$\t6.15 \t\nDiluted earnings per share\t$\t6.08 \t\t\t$\t6.13 \t\t\t$\t6.11 \t\n \nApproximately 24 million restricted stock units (“RSUs”) were excluded from the computation of diluted earnings per share for 2023 because their effect would have been antidilutive.', '$\n\n7,607,337\n\n \n\n \n\n$\n\n6,827,461\n\n \n\nNet earnings per share:\n\n \n\n \n\n \n\n \n\n \n\n \n\n \n\n \n\n \n\nBasic\n\n \n\n$\n\n18.05\n\n \n\n \n\n$\n\n28.88\n\n \n\n \n\n$\n\n23.23\n\n \n\nDiluted\n\n \n\n$\n\n18.00\n\n \n\n \n\n$\n\n28.79\n\n \n\n \n\n$\n\n23.16']",1058.7436669738963,2.65
4,4,AMT/2012/page_123.pdf,what was the cost per tower in American Tower’s colombia movil acquisition?,85607,"[""['american tower corporation and subsidiaries notes to consolidated financial statements the allocation of the purchase price was finalized during the year ended december 31 , 2012 .', 'the following table summarizes the allocation of the aggregate purchase consideration paid and the amounts of assets acquired and liabilities assumed based upon their estimated fair value at the date of acquisition ( in thousands ) : purchase price allocation .']\n\tfinal purchase price allocation\nnon-current assets\t$ 2\nproperty and equipment\t3590\nintangible assets ( 1 )\t1062\nother non-current liabilities\t-91 ( 91 )\nfair value of net assets acquired\t$ 4563\ngoodwill ( 2 )\t89\n['( 1 ) consists of customer-related intangibles of approximately $ 0.4 million and network location intangibles of approximately $ 0.7 million .', 'the customer-related intangibles and network location intangibles are being amortized on a straight-line basis over periods of up to 20 years .', '( 2 ) the company expects that the goodwill recorded will be deductible for tax purposes .', 'the goodwill was allocated to the company 2019s international rental and management segment .', 'colombia 2014colombia movil acquisition 2014on july 17 , 2011 , the company entered into a definitive agreement with colombia movil s.a .', 'e.s.p .', '( 201ccolombia movil 201d ) , whereby atc sitios infraco , s.a.s. , a colombian subsidiary of the company ( 201catc infraco 201d ) , would purchase up to 2126 communications sites from colombia movil for an aggregate purchase price of approximately $ 182.0 million .', 'from december 21 , 2011 through the year ended december 31 , 2012 , atc infraco completed the purchase of 1526 communications sites for an aggregate purchase price of $ 136.2 million ( including contingent consideration of $ 17.3 million ) , subject to post-closing adjustments .', 'through a subsidiary , millicom international cellular s.a .', '( 201cmillicom 201d ) exercised its option to acquire an indirect , substantial non-controlling interest in atc infraco .', 'under the terms of the agreement , the company is required to make additional payments upon the conversion of certain barter agreements with other wireless carriers to cash paying lease agreements .', 'based on the company 2019s current estimates , the value of potential contingent consideration payments required to be made under the amended agreement is expected to be between zero and $ 32.8 million and is estimated to be $ 17.3 million using a probability weighted average of the expected outcomes at december 31 , 2012 .', 'during the year ended december 31 , 2012 , the company recorded a reduction in fair value of $ 1.2 million , which is included in other operating expenses in the consolidated statements of operations. .']""]","{'text_8': '( 201ccolombia movil 201d ) , whereby atc sitios infraco , s.a.s. , a colombian subsidiary of the company ( 201catc infraco 201d ) , would purchase up to 2126 communications sites from colombia movil for an aggregate purchase price of approximately $ 182.0 million .'}","multiply(182.0, const_1000000), divide(#0, 2126)",FinQA,Compositional,"['( 201ccolombia movil 201d ) , whereby atc sitios infraco , s.a.s. , a colombian subsidiary of the company ( 201catc infraco 201d ) , would purchase up to 2126 communications sites from colombia movil for an aggregate purchase price of approximately $ 182.0 million .']",AMT/2012/page_123.pdf,True,"[""['american tower corporation and subsidiaries notes to consolidated financial statements u.s .', 'acquisitions 2014during the year ended december 31 , 2010 , the company acquired 548 towers through multiple acquisitions in the united states for an aggregate purchase price of $ 329.3 million and contingent consideration of approximately $ 4.6 million .', 'the acquisition of these towers is consistent with the company 2019s strategy to expand in selected geographic areas and have been accounted for as business combinations .', 'the following table summarizes the preliminary allocation of the aggregate purchase consideration paid and the amounts of assets acquired and liabilities assumed based on the estimated fair value of the acquired assets and assumed liabilities at the date of acquisition ( in thousands ) : purchase price allocation .'] purchase price allocation non-current assets $ 442 property and equipment 64564 intangible assets ( 1 ) 260898 current liabilities -360 ( 360 ) long-term liabilities -7802 ( 7802 ) fair value of net assets acquired $ 317742 goodwill ( 2 ) 16131 ['( 1 ) consists of customer relationships of approximately $ 205.4 million and network location intangibles of approximately $ 55.5 million .', 'the customer relationships and network location intangibles are being amortized on a straight-line basis over a period of 20 years .', '( 2 ) goodwill is expected to be deductible for income tax purposes .', 'the goodwill was allocated to the domestic rental and management segment .', 'the allocation of the purchase price will be finalized upon completion of analyses of the fair value of the assets acquired and liabilities assumed .', 'south africa acquisition 2014on november 4 , 2010 , the company entered into a definitive agreement with cell c ( pty ) limited to purchase up to approximately 1400 existing towers , and up to 1800 additional towers that either are under construction or will be constructed , for an aggregate purchase price of up to approximately $ 430 million .', 'the company anticipates closing the purchase of up to 1400 existing towers during 2011 , subject to customary closing conditions .', 'other transactions coltel transaction 2014on september 3 , 2010 , the company entered into a definitive agreement to purchase the exclusive use rights for towers in colombia from colombia telecomunicaciones s.a .', 'e.s.p .', '( 201ccoltel 201d ) until 2023 , when ownership of the towers will transfer to the company at no additional cost .', 'pursuant to that agreement , the company completed the purchase of exclusive use rights for 508 towers for an aggregate purchase price of $ 86.8 million during the year ended december 31 , 2010 .', 'the company expects to complete the purchase of the exclusive use rights for an additional 180 towers by the end of 2011 , subject to customary closing conditions .', 'the transaction has been accounted for as a capital lease , with the aggregated purchase price being allocated to property and equipment and non-current assets .', 'joint venture with mtn group 2014on december 6 , 2010 , the company entered into a definitive agreement with mtn group limited ( 201cmtn group 201d ) to establish a joint venture in ghana ( 201ctowerco ghana 201d ) .', 'towerco ghana , which will be managed by the company , will be owned by a holding company of which a wholly owned american tower subsidiary will hold a 51% ( 51 % ) share and a wholly owned mtn group subsidiary ( 201cmtn ghana 201d ) will hold a 49% ( 49 % ) share .', 'the transaction involves the sale of up to 1876 of mtn ghana 2019s existing sites to .']"", ""['american tower corporation and subsidiaries notes to consolidated financial statements the allocation of the purchase price was finalized during the year ended december 31 , 2012 .', 'the following table summarizes the allocation of the aggregate purchase consideration paid and the amounts of assets acquired and liabilities assumed based upon their estimated fair value at the date of acquisition ( in thousands ) : purchase price allocation .'] final purchase price allocation non-current assets $ 2 property and equipment 3590 intangible assets ( 1 ) 1062 other non-current liabilities -91 ( 91 ) fair value of net assets acquired $ 4563 goodwill ( 2 ) 89 ['( 1 ) consists of customer-related intangibles of approximately $ 0.4 million and network location intangibles of approximately $ 0.7 million .', 'the customer-related intangibles and network location intangibles are being amortized on a straight-line basis over periods of up to 20 years .', '( 2 ) the company expects that the goodwill recorded will be deductible for tax purposes .', 'the goodwill was allocated to the company 2019s international rental and management segment .', 'colombia 2014colombia movil acquisition 2014on july 17 , 2011 , the company entered into a definitive agreement with colombia movil s.a .', 'e.s.p .', '( 201ccolombia movil 201d ) , whereby atc sitios infraco , s.a.s. , a colombian subsidiary of the company ( 201catc infraco 201d ) , would purchase up to 2126 communications sites from colombia movil for an aggregate purchase price of approximately $ 182.0 million .', 'from december 21 , 2011 through the year ended december 31 , 2012 , atc infraco completed the purchase of 1526 communications sites for an aggregate purchase price of $ 136.2 million ( including contingent consideration of $ 17.3 million ) , subject to post-closing adjustments .', 'through a subsidiary , millicom international cellular s.a .', '( 201cmillicom 201d ) exercised its option to acquire an indirect , substantial non-controlling interest in atc infraco .', 'under the terms of the agreement , the company is required to make additional payments upon the conversion of certain barter agreements with other wireless carriers to cash paying lease agreements .', 'based on the company 2019s current estimates , the value of potential contingent consideration payments required to be made under the amended agreement is expected to be between zero and $ 32.8 million and is estimated to be $ 17.3 million using a probability weighted average of the expected outcomes at december 31 , 2012 .', 'during the year ended december 31 , 2012 , the company recorded a reduction in fair value of $ 1.2 million , which is included in other operating expenses in the consolidated statements of operations. .']"", 'AMERICAN TOWER CORPORATION AND SUBSIDIARIES\nCONSOLIDATED STATEMENTS OF OPERATIONS\n(in millions, except share and per share data)\n   \n \tYear Ended December 31,\n \t2023\t\t2022\t\t2021\nREVENUES:\t\t\t\t\t\nProperty\t$\t11,001.2 \t\t\t$\t10,470.0 \t\t\t$\t9,109.6 \t\nServices\t143.0 \t\t\t241.1 \t\t\t247.3 \t\nTotal operating revenues\t11,144.2 \t\t\t10,711.1 \t\t\t9,356.9 \t\n OPERATING EXPENSES:\t\t\t\t\t\nCosts of operations (exclusive of items shown separately below):\t\t\t\t\t\n Property\t3,200.5 \t\t\t3,156.4 \t\t\t2,585.3 \t\n Services\t60.1 \t\t\t107.4 \t\t\t96.7 \t\nDepreciation, amortization and accretion\t3,086.5 \t\t\t3,355.1 \t\t\t2,332.6 \t\nSelling, general, administrative and development expense\t992.5 \t\t\t972.3 \t\t\t811.6 \t\nOther operating expenses\t377.7 \t\t\t767.6 \t\t\t398.7 \t\nGoodwill impairment\t402.0 \t\t\t— \t\t\t— \t\nTotal operating expenses\t8,119.3 \t\t\t8,358.8 \t\t\t6,224.9 \t\nOPERATING INCOME\t3,024.9 \t\t\t2,352.3 \t\t\t3,132.0 \t\nOTHER INCOME (EXPENSE):\t\t\t\t\t\nInterest income\t143.4 \t\t\t71.6 \t\t\t40.4 \t\nInterest expense\t(1,398.2)\t\t\t(1,136.5)\t\t\t(870.9)\t\nLoss on retirement of long-term obligations\t(0.3)\t\t\t(0.4)\t\t\t(38.2)\t\nOther (expense) income (including foreign currency (losses) gains of $(330.8), $449.4, and $557.9 respectively)\n(248.5)\t\t\t433.7 \t\t\t566.1 \t\nTotal other expense\t(1,503.6)\t\t\t(631.6)\t\t\t(302.6)\t\nINCOME FROM CONTINUING OPERATIONS BEFORE INCOME TAXES\t1,521.3 \t\t\t1,720.7 \t\t\t2,829.4 \t\nIncome tax provision\t(154.2)\t\t\t(24.0)\t\t\t(261.8)\t\nNET INCOME\t1,367.1 \t\t\t1,696.7 \t\t\t2,567.6 \t\nNet loss attributable to noncontrolling interests\t116.2 \t\t\t69.1 \t\t\t0.1 \t\nNET INCOME ATTRIBUTABLE TO AMERICAN TOWER CORPORATION COMMON STOCKHOLDERS\t$\t1,483.3 \t\t\t$\t1,765.8 \t\t\t$\t2,567.7 \t\nNET INCOME PER COMMON SHARE AMOUNTS:\t\t\t\t\t\nBasic net income attributable to American Tower Corporation common stockholders\t$\t3.18 \t\t\t$\t3.83 \t\t\t$\t5.69 \t\nDiluted net income attributable to American Tower Corporation common stockholders\t$\t3.18 \t\t\t$\t3.82 \t\t\t$\t5.66 \t\nWEIGHTED AVERAGE COMMON SHARES OUTSTANDING (in thousands):\t\t\t\t\t\nBASIC\t466,063 \t\t\t461,519 \t\t\t451,498 \t\nDILUTED\t467,162 \t\t\t462,750 \t\t\t453,294', 'A detail of our cash capital expenditures is as follows:\n\n \n\n \n\n \n\n \n\n \n\n \n\n \n\n \n\n \n\n \n\n \n\n \n\n \n\n \n\n \n\n \n\nFor the year ended\n\n \n\n \n\nDecember 31,\n\n \n\n \n\n2023\n\n \n\n2022\n\n \n\n \n\n \n\n \n\n \n\n \n\n \n\n \n\n \n\n(in thousands) \n\nAcquisitions of towers and related intangible assets (1)(2)\n\n \n\n$\n\n (81,614)\n\n \n\n$\n\n (489,888)\n\nAcquisition of right-of-use assets (2)\n\n \n\n \n\n (5,072)\n\n \n\n \n\n (602,574)\n\nLand buyouts and other assets (3)(4)\n\n \n\n \n\n (43,275)\n\n \n\n \n\n (83,630)\n\nConstruction and related costs\n\n \n\n \n\n (98,128)\n\n \n\n \n\n (103,461)\n\nAugmentation and tower upgrades\n\n \n\n \n\n (82,493)\n\n \n\n \n\n (60,656)\n\nTower maintenance\n\n \n\n \n\n (50,463)\n\n \n\n \n\n (41,568)\n\nGeneral corporate\n\n \n\n \n\n (5,614)\n\n \n\n \n\n (8,758)\n\nOther investing activities (5)\n\n \n\n \n\n (101,587)\n\n \n\n \n\n (3,119)\n\nNet cash used in investing activities\n\n \n\n$\n\n (468,246)\n\n \n\n$\n\n (1,393,654)\n\n \n\n(1)During the year ended December 31, 2022, we closed on 1,445 sites from Airtel Tanzania for $176.1 million. \n\n(2)During the year ended December 31, 2022, we acquired 2,632 sites from GTS in Brazil for $728.2 million, net of working capital adjustments, of which $168.5 million is included in acquisitions of towers and related intangible assets and $559.8 million is included in acquisition of right of use assets. \n\n(3)Excludes $17.6 million and $17.9 million spent to extend ground lease terms for the years ended December 31, 2023 and 2022, respectively.\n\n(4)The year ended December 31, 2022 includes amounts paid related to the acquisition of a data center.', 'AMERICAN TOWER CORPORATION AND SUBSIDIARIES\nCONSOLIDATED BALANCE SHEETS\n(in millions, except share count and per share data)  \nDecember 31, 2023\t\tDecember 31, 2022\nASSETS\t\t\t\t\nCURRENT ASSETS:\t\t\t\t\nCash and cash equivalents\t\t$\t1,973.3 \t\t\t$\t2,028.4 \t\nRestricted cash\t\t120.1 \t\t\t112.3 \t\nAccounts receivable, net\t\t669.7 \t\t\t758.3 \t\nPrepaid and other current assets\t\t946.9 \t\t\t723.3 \t\nTotal current assets\t\t3,710.0 \t\t\t3,622.3 \t\nPROPERTY AND EQUIPMENT, net\t\t19,788.8 \t\t\t19,998.3 \t\nGOODWILL\t\t12,639.0 \t\t\t12,956.7 \t\nOTHER INTANGIBLE ASSETS, net\t\t16,520.7 \t\t\t17,983.3 \t\nDEFERRED TAX ASSET\t\t179.1 \t\t\t129.2 \t\nDEFERRED RENT ASSET\t\t3,521.8 \t\t\t3,039.1 \t\nRIGHT-OF-USE ASSET\t\t8,878.8 \t\t\t8,918.9 \t\nNOTES RECEIVABLE AND OTHER NON-CURRENT ASSETS\t\t789.4 \t\t\t546.7 \t\nTOTAL\t\t$\t66,027.6 \t\t\t$\t67,194.5 \t\nLIABILITIES\t\t\t\t\nCURRENT LIABILITIES:\t\t\t\t\nAccounts payable\t\t$\t258.7 \t\t\t$\t218.6 \t\nAccrued expenses\t\t1,280.6 \t\t\t1,344.2 \t\nDistributions payable\t\t906.2 \t\t\t745.3 \t\nAccrued interest\t\t387.0 \t\t\t261.0 \t\nCurrent portion of operating lease liability\t\t794.6 \t\t\t788.9 \t\nCurrent portion of long-term obligations\t\t3,187.5 \t\t\t4,514.2 \t\nUnearned revenue\t\t434.7 \t\t\t439.7 \t\nTotal current liabilities\t\t7,249.3 \t\t\t8,311.9 \t\nLONG-TERM OBLIGATIONS\t\t35,734.0 \t\t\t34,156.0 \t\nOPERATING LEASE LIABILITY\t\t7,438.7 \t\t\t7,591.9 \t\nASSET RETIREMENT OBLIGATIONS\t\t2,158.2 \t\t\t2,047.4 \t\nDEFERRED TAX LIABILITY\t\t1,361.4 \t\t\t1,492.0 \t\nOTHER NON-CURRENT LIABILITIES\t\t1,220.6 \t\t\t1,186.8 \t\nTotal liabilities\t\t55,162.2 \t\t\t54,786.0 \t\nCOMMITMENTS AND CONTINGENCIES\t\t\t\t\nEQUITY (shares in thousands):\t\t\t\t\nCommon stock: $0.01 par value; 1,000,000 shares authorized; 477,300 and 476,623 shares issued; and 466,296 and 465,619 shares outstanding, respectively\n4.8 \t\t\t4.8 \t\nAdditional paid-in capital\t\t14,872.9 \t\t\t14,689.0 \t\nDistributions in excess of earnings\t\t(3,638.8)\t\t\t(2,101.9)\t\nAccumulated other comprehensive loss\t\t(5,739.5)\t\t\t(5,718.3)\t\nTreasury stock (11,004 shares at cost)\n(1,301.2)\t\t\t(1,301.2)\t\nTotal American Tower Corporation equity\t\t4,198.2 \t\t\t5,572.4 \t\nNoncontrolling interests\t\t6,667.2 \t\t\t6,836.1 \t\nTotal equity\t\t10,865.4 \t\t\t12,408.5 \t\nTOTAL\t\t$\t66,027.6 \t\t\t$\t67,194.5', '(4)The year ended December 31, 2022 includes amounts paid related to the acquisition of a data center.\n\n(5)The year ended December 31, 2023 includes $100.5 million of loan payments made to an unconsolidated joint venture.\n\nSubsequent to December 31, 2023, we purchased or are under contract to purchase 281 communication sites for an aggregate consideration of $87.8 million in cash. We anticipate that these acquisitions will be consummated by the end of the third quarter of 2024.\n\nFor 2024, we expect to incur non-discretionary cash capital expenditures associated with tower maintenance and general corporate expenditures of $51.0 million to $61.0 million and discretionary cash capital expenditures, based on current or potential acquisition obligations, planned new tower construction, forecasted tower augmentations, and forecasted ground lease purchases, of $320.0 million to $340.0 million. We expect to fund these cash capital expenditures from cash on hand, cash flow from operations, and borrowings under the Revolving Credit Facility or new financings. The exact amount of our future cash capital expenditures will depend on a number of factors, including amounts necessary to support our tower portfolio, our new tower build and acquisition programs, and our ground lease purchase program.', ""['( 201cati 201d ) and spectrasite communications , llc ( 201cspectrasite 201d ) .', 'we conduct our international operations through our subsidiary , american tower international , inc. , which in turn conducts operations through its various international operating subsidiaries .', 'our international operations consist primarily of our operations in mexico and brazil , and also include operations in india , which we established in the second half of 2007 .', 'we operate in two business segments : rental and management and network development services .', 'for more information about our business segments , as well as financial information about the geographic areas in which we operate , see item 7 of this annual report under the caption 201cmanagement 2019s discussion and analysis of financial condition and results of operations 201d and note 18 to our consolidated financial statements included in this annual report .', 'products and services rental and management our primary business is our communications site leasing business , which we conduct through our rental and management segment .', 'this segment accounted for approximately 97% ( 97 % ) , 98% ( 98 % ) and 98% ( 98 % ) of our total revenues for the years ended december 31 , 2008 , 2007 and 2006 , respectively .', 'our rental and management segment is comprised of our domestic and international site leasing business , including the operation of wireless communications towers , broadcast communications towers and das networks , as well as rooftop management .', 'wireless communications towers.we are a leading owner and operator of wireless communications towers in the united states , mexico and brazil , based on number of towers and revenue .', 'we also own and operate communications towers in india , where we commenced operations in the second half of 2007 .', 'in addition to owned wireless communications towers , we also manage wireless communications sites for property owners in the united states , mexico and brazil .', 'approximately 92% ( 92 % ) , 91% ( 91 % ) and 91% ( 91 % ) of our rental and management segment revenue was attributable to our wireless communications towers for the years ended december 31 , 2008 , 2007 and 2006 , respectively .', 'as of december 31 , 2008 , our wireless communications tower portfolio included the following : country number of owned sites ( approx ) coverage area united states .', '.', '.', '.', '.', '.', '.', '.', '.', '.', '.', '19400 coverage spans 49 states and the district of columbia ; 90% ( 90 % ) of network provides coverage in the top 100 markets or core areas such as high traffic interstate corridors .', 'mexico .', '.', '.', '.', '.', '.', '.', '.', '.', '.', '.', '.', '.', '.', '.', '.', '2500 coverage primarily concentrated in highly populated areas , including mexico city , monterrey , guadalajara and acapulco .', 'brazil .', '.', '.', '.', '.', '.', '.', '.', '.', '.', '.', '.', '.', '.', '.', '.', '.', '1100 coverage primarily concentrated in major metropolitan areas in central and southern brazil , including sao paulo , rio de janeiro , brasilia and curitiba .', 'india .', '.', '.', '.', '.', '.', '.', '.', '.', '.', '.', '.', '.', '.', '.', '.', '.', '.', '200 initial-phase coverage ( operations established in the second half of 2007 ) .', 'we lease space on our wireless communications towers to customers in a diverse range of wireless industries , including personal communications services , cellular , enhanced specialized mobile radio , wimax .', 'paging and fixed microwave .', 'our major domestic wireless customers include at&t mobility , sprint nextel , verizon wireless ( which completed its merger with alltel in january 2009 ) and t-mobile usa .', 'our major international wireless customers include grupo iusacell ( iusacell celular and unefon in mexico ) , nextel international in mexico and brazil , telefonica ( movistar in mexico and vivo in brazil ) , america movil ( telcel in mexico and claro in brazil ) and telecom italia mobile ( tim ) in brazil .', 'for the year ended december 31 .'] country number of owned sites ( approx ) coverage area united states 19400 coverage spans 49 states and the district of columbia ; 90% ( 90 % ) of network provides coverage in the top 100 markets or core areas such as high traffic interstate corridors . mexico 2500 coverage primarily concentrated in highly populated areas including mexico city monterrey guadalajara and acapulco . brazil 1100 coverage primarily concentrated in major metropolitan areas in central and southern brazil including sao paulo rio de janeiro brasilia and curitiba . india 200 initial-phase coverage ( operations established in the second half of 2007 ) . ['( 201cati 201d ) and spectrasite communications , llc ( 201cspectrasite 201d ) .', 'we conduct our international operations through our subsidiary , american tower international , inc. , which in turn conducts operations through its various international operating subsidiaries .', 'our international operations consist primarily of our operations in mexico and brazil , and also include operations in india , which we established in the second half of 2007 .', 'we operate in two business segments : rental and management and network development services .', 'for more information about our business segments , as well as financial information about the geographic areas in which we operate , see item 7 of this annual report under the caption 201cmanagement 2019s discussion and analysis of financial condition and results of operations 201d and note 18 to our consolidated financial statements included in this annual report .', 'products and services rental and management our primary business is our communications site leasing business , which we conduct through our rental and management segment .', 'this segment accounted for approximately 97% ( 97 % ) , 98% ( 98 % ) and 98% ( 98 % ) of our total revenues for the years ended december 31 , 2008 , 2007 and 2006 , respectively .', 'our rental and management segment is comprised of our domestic and international site leasing business , including the operation of wireless communications towers , broadcast communications towers and das networks , as well as rooftop management .', 'wireless communications towers.we are a leading owner and operator of wireless communications towers in the united states , mexico and brazil , based on number of towers and revenue .', 'we also own and operate communications towers in india , where we commenced operations in the second half of 2007 .', 'in addition to owned wireless communications towers , we also manage wireless communications sites for property owners in the united states , mexico and brazil .', 'approximately 92% ( 92 % ) , 91% ( 91 % ) and 91% ( 91 % ) of our rental and management segment revenue was attributable to our wireless communications towers for the years ended december 31 , 2008 , 2007 and 2006 , respectively .', 'as of december 31 , 2008 , our wireless communications tower portfolio included the following : country number of owned sites ( approx ) coverage area united states .', '.', '.', '.', '.', '.', '.', '.', '.', '.', '.', '19400 coverage spans 49 states and the district of columbia ; 90% ( 90 % ) of network provides coverage in the top 100 markets or core areas such as high traffic interstate corridors .', 'mexico .', '.', '.', '.', '.', '.', '.', '.', '.', '.', '.', '.', '.', '.', '.', '.', '2500 coverage primarily concentrated in highly populated areas , including mexico city , monterrey , guadalajara and acapulco .', 'brazil .', '.', '.', '.', '.', '.', '.', '.', '.', '.', '.', '.', '.', '.', '.', '.', '.', '1100 coverage primarily concentrated in major metropolitan areas in central and southern brazil , including sao paulo , rio de janeiro , brasilia and curitiba .', 'india .', '.', '.', '.', '.', '.', '.', '.', '.', '.', '.', '.', '.', '.', '.', '.', '.', '.', '200 initial-phase coverage ( operations established in the second half of 2007 ) .', 'we lease space on our wireless communications towers to customers in a diverse range of wireless industries , including personal communications services , cellular , enhanced specialized mobile radio , wimax .', 'paging and fixed microwave .', 'our major domestic wireless customers include at&t mobility , sprint nextel , verizon wireless ( which completed its merger with alltel in january 2009 ) and t-mobile usa .', 'our major international wireless customers include grupo iusacell ( iusacell celular and unefon in mexico ) , nextel international in mexico and brazil , telefonica ( movistar in mexico and vivo in brazil ) , america movil ( telcel in mexico and claro in brazil ) and telecom italia mobile ( tim ) in brazil .', 'for the year ended december 31 .']"", '\uf0b7Disciplined Tower Acquisitions. In our tower acquisition program, we pursue towers from third parties that meet or exceed our internal guidelines regarding current and future potential returns. For each acquisition, we prepare various analyses that include projections of several different investment return metrics, review of available capacity, future lease up projections, and a summary of current and future tenant/technology mix.', '\uf0b7Capitalizing on our Scale and Management Experience. We are a large owner, operator and developer of towers, with substantial capital, human, and operating resources. We have been developing towers for wireless service providers in the U.S. since 1989 and owned and operated towers for ourselves since 1997. We believe our size, experience, capabilities, and resources make us a preferred partner for wireless service providers both in the U.S. and internationally. Our management team has extensive experience in site leasing and site development, with some of the longest tenures in the tower and site development industries. We believe that our industry expertise and strong relationships with wireless service providers will permit us to continue to organically grow our site leasing and site development services.\n\nSystematic Tower Portfolio Growth. We intend to continue to grow our tower portfolio, domestically and internationally, through tower acquisitions and the construction of new tower structures. We believe that one of the best uses of our liquidity, including cash from operating activities and borrowings, is to acquire and/or build new towers at prices that we believe will be accretive to our shareholders both in the short and long term and which allow us to maintain our long-term target leverage ratios.', 'Our industry is highly competitive. We compete, both for new business and for the acquisition of assets, with other public tower companies, such as Crown Castle International Corp., SBA Communications Corporation, Telesites S.A.B. de C.V. and Cellnex Telecom, S.A., wireless carrier tower consortia such as Indus Towers Limited and private tower companies, private equity sponsored firms, carrier-affiliated tower companies, independent wireless carriers, tower owners, broadcasters and owners of non-communications sites, including rooftops, utility towers, water towers and other alternative structures. Our data center business also competes with a variety of companies offering similar data center solutions and services, including space, power, interconnection and development services. We believe that location and capacity, grid distribution constraints, network and/or interconnection density, price, quality and speed of service have been, and will continue to be, significant competitive factors affecting owners, operators and managers of communications sites and data center facilities.']",1357.1442499523982,89200
5,5,ETR/2016/page_175.pdf,"Q: what is the implicit interest cost rate reported by Entergy in 2016?
A: 5.13
Q: what is the rate divided by 100?
A: A0
Q: what is the value of lease payments due after 2021?
A: 257812
Q: what is the product of the rate and those payments?",13225.7,"[""['entergy corporation and subsidiaries notes to financial statements liability to $ 60 million , and recorded the $ 2.7 million difference as a credit to interest expense .', 'the $ 60 million remaining liability was eliminated upon payment of the cash portion of the purchase price .', 'as of december 31 , 2016 , entergy louisiana , in connection with the waterford 3 lease obligation , had a future minimum lease payment ( reflecting an interest rate of 8.09% ( 8.09 % ) ) of $ 57.5 million , including $ 2.3 million in interest , due january 2017 that is recorded as long-term debt .', 'in february 2017 the leases were terminated and the leased assets were conveyed to entergy louisiana .', 'grand gulf lease obligations in 1988 , in two separate but substantially identical transactions , system energy sold and leased back undivided ownership interests in grand gulf for the aggregate sum of $ 500 million .', 'the initial term of the leases expired in july 2015 .', 'system energy renewed the leases for fair market value with renewal terms expiring in july 2036 .', 'at the end of the new lease renewal terms , system energy has the option to repurchase the leased interests in grand gulf or renew the leases at fair market value .', 'in the event that system energy does not renew or purchase the interests , system energy would surrender such interests and their associated entitlement of grand gulf 2019s capacity and energy .', 'system energy is required to report the sale-leaseback as a financing transaction in its financial statements .', 'for financial reporting purposes , system energy expenses the interest portion of the lease obligation and the plant depreciation .', 'however , operating revenues include the recovery of the lease payments because the transactions are accounted for as a sale and leaseback for ratemaking purposes .', 'consistent with a recommendation contained in a ferc audit report , system energy initially recorded as a net regulatory asset the difference between the recovery of the lease payments and the amounts expensed for interest and depreciation and continues to record this difference as a regulatory asset or liability on an ongoing basis , resulting in a zero net balance for the regulatory asset at the end of the lease term .', 'the amount was a net regulatory liability of $ 55.6 million and $ 55.6 million as of december 31 , 2016 and 2015 , respectively .', 'as of december 31 , 2016 , system energy , in connection with the grand gulf sale and leaseback transactions , had future minimum lease payments ( reflecting an implicit rate of 5.13% ( 5.13 % ) ) that are recorded as long-term debt , as follows : amount ( in thousands ) .']\n\tamount ( in thousands )\n2017\t$ 17188\n2018\t17188\n2019\t17188\n2020\t17188\n2021\t17188\nyears thereafter\t257812\ntotal\t343752\nless : amount representing interest\t309393\npresent value of net minimum lease payments\t$ 34359\n['.']""]","{'table_6': '\tamount ( in thousands )\n2017\t$ 17188\n2018\t17188\n2019\t17188\n2020\t17188\n2021\t17188\nyears thereafter\t257812\ntotal\t343752\nless : amount representing interest\t309393\npresent value of net minimum lease payments\t$ 34359', 'text_14': 'as of december 31 , 2016 , system energy , in connection with the grand gulf sale and leaseback transactions , had future minimum lease payments ( reflecting an implicit rate of 5.13% ( 5.13 % ) ) that are recorded as long-term debt , as follows : amount ( in thousands ) .'}","divide(5.13, const_100), multiply(#0, 257812)",ConvFinQA,Compositional,"['the years thereafter of amount ( in thousands ) is 257812 ;', 'as of december 31 , 2016 , system energy , in connection with the grand gulf sale and leaseback transactions , had future minimum lease payments ( reflecting an implicit rate of 5.13% ( 5.13 % ) ) that are recorded as long-term debt , as follows : amount ( in thousands ) .']",ETR/2016/page_175.pdf,True,"[""['entergy corporation and subsidiaries notes to financial statements ferc audit report , system energy initially recorded as a net regulatory asset the difference between the recovery of the lease payments and the amounts expensed for interest and depreciation and continues to record this difference as a regulatory asset or liability on an ongoing basis , resulting in a zero net balance for the regulatory asset at the end of the lease term .', 'the amount was a net regulatory asset ( liability ) of ( $ 2.0 ) million and $ 60.6 million as of december 31 , 2011 and 2010 , respectively .', 'as of december 31 , 2011 , system energy had future minimum lease payments ( reflecting an implicit rate of 5.13% ( 5.13 % ) ) , which are recorded as long-term debt as follows : amount ( in thousands ) .'] amount ( in thousands ) 2012 $ 49959 2013 50546 2014 51637 2015 52253 2016 - years thereafter - total 204395 less : amount representing interest 25611 present value of net minimum lease payments $ 178784 ['.']"", ""['entergy corporation and subsidiaries notes to financial statements liability to $ 60 million , and recorded the $ 2.7 million difference as a credit to interest expense .', 'the $ 60 million remaining liability was eliminated upon payment of the cash portion of the purchase price .', 'as of december 31 , 2016 , entergy louisiana , in connection with the waterford 3 lease obligation , had a future minimum lease payment ( reflecting an interest rate of 8.09% ( 8.09 % ) ) of $ 57.5 million , including $ 2.3 million in interest , due january 2017 that is recorded as long-term debt .', 'in february 2017 the leases were terminated and the leased assets were conveyed to entergy louisiana .', 'grand gulf lease obligations in 1988 , in two separate but substantially identical transactions , system energy sold and leased back undivided ownership interests in grand gulf for the aggregate sum of $ 500 million .', 'the initial term of the leases expired in july 2015 .', 'system energy renewed the leases for fair market value with renewal terms expiring in july 2036 .', 'at the end of the new lease renewal terms , system energy has the option to repurchase the leased interests in grand gulf or renew the leases at fair market value .', 'in the event that system energy does not renew or purchase the interests , system energy would surrender such interests and their associated entitlement of grand gulf 2019s capacity and energy .', 'system energy is required to report the sale-leaseback as a financing transaction in its financial statements .', 'for financial reporting purposes , system energy expenses the interest portion of the lease obligation and the plant depreciation .', 'however , operating revenues include the recovery of the lease payments because the transactions are accounted for as a sale and leaseback for ratemaking purposes .', 'consistent with a recommendation contained in a ferc audit report , system energy initially recorded as a net regulatory asset the difference between the recovery of the lease payments and the amounts expensed for interest and depreciation and continues to record this difference as a regulatory asset or liability on an ongoing basis , resulting in a zero net balance for the regulatory asset at the end of the lease term .', 'the amount was a net regulatory liability of $ 55.6 million and $ 55.6 million as of december 31 , 2016 and 2015 , respectively .', 'as of december 31 , 2016 , system energy , in connection with the grand gulf sale and leaseback transactions , had future minimum lease payments ( reflecting an implicit rate of 5.13% ( 5.13 % ) ) that are recorded as long-term debt , as follows : amount ( in thousands ) .'] amount ( in thousands ) 2017 $ 17188 2018 17188 2019 17188 2020 17188 2021 17188 years thereafter 257812 total 343752 less : amount representing interest 309393 present value of net minimum lease payments $ 34359 ['.']"", ""['the city council 2019s advisors and entergy new orleans .', 'in february 2018 the city council approved the settlement , which deferred cost recovery to the 2018 entergy new orleans rate case , but also stated that an adjustment for 2018-2019 ami costs can be filed in the rate case and that , for all subsequent ami costs , the mechanism to be approved in the 2018 rate case will allow for the timely recovery of such costs .', 'sources of capital entergy new orleans 2019s sources to meet its capital requirements include : 2022 internally generated funds ; 2022 cash on hand ; 2022 debt and preferred membership interest issuances ; and 2022 bank financing under new or existing facilities .', 'entergy new orleans may refinance , redeem , or otherwise retire debt prior to maturity , to the extent market conditions and interest rates are favorable .', 'entergy new orleans 2019s receivables from the money pool were as follows as of december 31 for each of the following years. .'] 2017 2016 2015 2014 ( in thousands ) ( in thousands ) ( in thousands ) ( in thousands ) $ 12723 $ 14215 $ 15794 $ 442 ['see note 4 to the financial statements for a description of the money pool .', 'entergy new orleans has a credit facility in the amount of $ 25 million scheduled to expire in november 2018 .', 'the credit facility allows entergy new orleans to issue letters of credit against $ 10 million of the borrowing capacity of the facility .', 'as of december 31 , 2017 , there were no cash borrowings and a $ 0.8 million letter of credit was outstanding under the facility .', 'in addition , entergy new orleans is a party to an uncommitted letter of credit facility as a means to post collateral to support its obligations to miso . a0 as of december 31 , 2017 , a $ 1.4 million letter of credit was outstanding under entergy new orleans 2019s letter of credit a0facility .', 'see note 4 to the financial statements for additional discussion of the credit facilities .', 'entergy new orleans obtained authorization from the ferc through october 2019 for short-term borrowings not to exceed an aggregate amount of $ 150 million at any time outstanding and long-term borrowings and securities issuances .', 'see note 4 to the financial statements for further discussion of entergy new orleans 2019s short-term borrowing limits .', 'the long-term securities issuances of entergy new orleans are limited to amounts authorized not only by the ferc , but also by the city council , and the current city council authorization extends through june 2018 .', 'entergy new orleans , llc and subsidiaries management 2019s financial discussion and analysis state and local rate regulation the rates that entergy new orleans charges for electricity and natural gas significantly influence its financial position , results of operations , and liquidity .', 'entergy new orleans is regulated and the rates charged to its customers are determined in regulatory proceedings .', 'a governmental agency , the city council , is primarily responsible for approval of the rates charged to customers .', 'retail rates see 201calgiers asset transfer 201d below for discussion of the algiers asset transfer .', 'as a provision of the settlement agreement approved by the city council in may 2015 providing for the algiers asset transfer , it was agreed that , with limited exceptions , no action may be taken with respect to entergy new orleans 2019s base rates until rates are implemented .']"", ""['is expected to begin by late-2018 , after the necessary information technology infrastructure is in place .', 'entergy louisiana proposed to recover the cost of ami through the implementation of a customer charge , net of certain benefits , phased in over the period 2019 through 2022 .', 'the parties reached an uncontested stipulation permitting implementation of entergy louisiana 2019s proposed ami system , with modifications to the proposed customer charge .', 'in july 2017 the lpsc approved the stipulation .', 'entergy louisiana expects to recover the undepreciated balance of its existing meters through a regulatory asset at current depreciation rates .', 'sources of capital entergy louisiana 2019s sources to meet its capital requirements include : 2022 internally generated funds ; 2022 cash on hand ; 2022 debt or preferred membership interest issuances ; and 2022 bank financing under new or existing facilities .', 'entergy louisiana may refinance , redeem , or otherwise retire debt prior to maturity , to the extent market conditions and interest rates are favorable .', 'all debt and common and preferred membership interest issuances by entergy louisiana require prior regulatory approval .', 'preferred membership interest and debt issuances are also subject to issuance tests set forth in its bond indentures and other agreements .', 'entergy louisiana has sufficient capacity under these tests to meet its foreseeable capital needs .', 'entergy louisiana 2019s receivables from the money pool were as follows as of december 31 for each of the following years. .'] 2017 2016 2015 2014 ( in thousands ) ( in thousands ) ( in thousands ) ( in thousands ) $ 11173 $ 22503 $ 6154 $ 2815 ['see note 4 to the financial statements for a description of the money pool .', 'entergy louisiana has a credit facility in the amount of $ 350 million scheduled to expire in august 2022 .', 'the credit facility allows entergy louisiana to issue letters of credit against $ 15 million of the borrowing capacity of the facility .', 'as of december 31 , 2017 , there were no cash borrowings and a $ 9.1 million letter of credit outstanding under the credit facility .', 'in addition , entergy louisiana is a party to an uncommitted letter of credit facility as a means to post collateral to support its obligations to miso . a0 as of december 31 , 2017 , a $ 29.7 million letter of credit was outstanding under entergy louisiana 2019s uncommitted letter of credit a0facility .', 'see note 4 to the financial statements for additional discussion of the credit facilities .', 'the entergy louisiana nuclear fuel company variable interest entities have two separate credit facilities , one in the amount of $ 105 million and one in the amount of $ 85 million , both scheduled to expire in may 2019 .', 'as of december 31 , 2017 , $ 65.7 million of loans were outstanding under the credit facility for the entergy louisiana river bend nuclear fuel company variable interest entity .', 'as of december 31 , 2017 , $ 43.5 million in letters of credit to support a like amount of commercial paper issued and $ 36.4 million in loans were outstanding under the entergy louisiana waterford nuclear fuel company variable interest entity credit facility .', 'see note 4 to the financial statements for additional discussion of the nuclear fuel company variable interest entity credit facilities .', 'entergy louisiana , llc and subsidiaries management 2019s financial discussion and analysis .']"", ""['entergy new orleans , inc .', 'and subsidiaries management 2019s financial discussion and analysis entergy new orleans 2019s receivables from the money pool were as follows as of december 31 for each of the following years. .'] 2016 2015 2014 2013 ( in thousands ) ( in thousands ) ( in thousands ) ( in thousands ) $ 14215 $ 15794 $ 442 $ 4737 ['see note 4 to the financial statements for a description of the money pool .', 'entergy new orleans has a credit facility in the amount of $ 25 million scheduled to expire in november 2018 .', 'the credit facility allows entergy new orleans to issue letters of credit against $ 10 million of the borrowing capacity of the facility .', 'as of december 31 , 2016 , there were no cash borrowings and a $ 0.8 million letter of credit was outstanding under the facility .', 'in addition , entergy new orleans is a party to an uncommitted letter of credit facility as a means to post collateral to support its obligations under miso .', 'as of december 31 , 2016 , a $ 6.2 million letter of credit was outstanding under entergy new orleans 2019s letter of credit facility .', 'see note 4 to the financial statements for additional discussion of the credit facilities .', 'entergy new orleans obtained authorization from the ferc through october 2017 for short-term borrowings not to exceed an aggregate amount of $ 100 million at any time outstanding .', 'see note 4 to the financial statements for further discussion of entergy new orleans 2019s short-term borrowing limits .', 'the long-term securities issuances of entergy new orleans are limited to amounts authorized by the city council , and the current authorization extends through june 2018 .', 'state and local rate regulation the rates that entergy new orleans charges for electricity and natural gas significantly influence its financial position , results of operations , and liquidity .', 'entergy new orleans is regulated and the rates charged to its customers are determined in regulatory proceedings .', 'a governmental agency , the city council , is primarily responsible for approval of the rates charged to customers .', 'retail rates see 201calgiers asset transfer 201d below for discussion of the transfer from entergy louisiana to entergy new orleans of certain assets that serve algiers customers .', 'in march 2013 , entergy louisiana filed a rate case for the algiers area , which is in new orleans and is regulated by the city council .', 'entergy louisiana requested a rate increase of $ 13 million over three years , including a 10.4% ( 10.4 % ) return on common equity and a formula rate plan mechanism identical to its lpsc request .', 'in january 2014 the city council advisors filed direct testimony recommending a rate increase of $ 5.56 million over three years , including an 8.13% ( 8.13 % ) return on common equity .', 'in june 2014 the city council unanimously approved a settlement that includes the following : 2022 a $ 9.3 million base rate revenue increase to be phased in on a levelized basis over four years ; 2022 recovery of an additional $ 853 thousand annually through a miso recovery rider ; and 2022 the adoption of a four-year formula rate plan requiring the filing of annual evaluation reports in may of each year , commencing may 2015 , with resulting rates being implemented in october of each year .', 'the formula rate plan includes a midpoint target authorized return on common equity of 9.95% ( 9.95 % ) with a +/- 40 basis point bandwidth .', 'the rate increase was effective with bills rendered on and after the first billing cycle of july 2014 .', 'additional compliance filings were made with the city council in october 2014 for approval of the form of certain rate riders , including among others , a ninemile 6 non-fuel cost recovery interim rider , allowing for contemporaneous recovery of capacity .']"", 'Entergy’s revenues from its non-utility operations include the sale of electric power and capacity to wholesale customers, day-ahead sales of energy in a market administered by an ISO, operation and management services fees, and amortization of a below-market PPA. In 2022 and 2021, the majority of revenues were from the Palisades nuclear power plant located in Michigan, which was shut down in May 2022 and subsequently sold in June 2022. Almost all of the Palisades nuclear plant output was sold under a 15-year PPA with Consumers Energy, which was executed as part of the acquisition of the plant in 2007 and expired in April 2022. Prices under the original PPA ranged from $43.50/MWh in 2007 to $61.50/MWh in 2022, and the average price under the PPA was $51/MWh. Entergy executed an additional PPA to cover the period from the expiration of the original PPA through final shutdown in May 2022 at a price of $24.14/MWh. Entergy issued monthly invoices to Consumers Energy for electric sales based on the actual output of electricity and related services provided during the previous month at the contract price.  The PPA was at below-market prices at the time of the acquisition and Entergy amortized a liability to revenue over the life of the agreement.  The amount amortized each period was based upon the present value, calculated at the date of acquisition, of each year’s difference between revenue under the agreement and revenue based on estimated market prices.  Amounts amortized to revenue were $5 million in 2022 and $12 million in 2021. See Note 14 to the financial statements for discussion of the sale of the Palisades plant.\n Practical Expedients and Exceptions', ""['american tower corporation and subsidiaries notes to consolidated financial statements 2014 ( continued ) 7 .', 'derivative financial instruments under the terms of the credit facility , the company is required to enter into interest rate protection agreements on at least 50% ( 50 % ) of its variable rate debt .', 'under these agreements , the company is exposed to credit risk to the extent that a counterparty fails to meet the terms of a contract .', 'such exposure is limited to the current value of the contract at the time the counterparty fails to perform .', 'the company believes its contracts as of december 31 , 2004 are with credit worthy institutions .', 'as of december 31 , 2004 , the company had two interest rate caps outstanding with an aggregate notional amount of $ 350.0 million ( each at an interest rate of 6.0% ( 6.0 % ) ) that expire in 2006 .', 'as of december 31 , 2003 , the company had three interest rate caps outstanding with an aggregate notional amount of $ 500.0 million ( each at a rate of 5.0% ( 5.0 % ) ) that expired in 2004 .', 'as of december 31 , 2004 and 2003 , there was no fair value associated with any of these interest rate caps .', 'during the year ended december 31 , 2003 , the company recorded an unrealized loss of approximately $ 0.3 million ( net of a tax benefit of approximately $ 0.2 million ) in other comprehensive loss for the change in fair value of cash flow hedges and reclassified $ 5.9 million ( net of a tax benefit of approximately $ 3.2 million ) into results of operations .', 'during the year ended december 31 , 2002 , the company recorded an unrealized loss of approximately $ 9.1 million ( net of a tax benefit of approximately $ 4.9 million ) in other comprehensive loss for the change in fair value of cash flow hedges and reclassified $ 19.5 million ( net of a tax benefit of approximately $ 10.5 million ) into results of operations .', 'hedge ineffectiveness resulted in a gain of approximately $ 1.0 million for the year ended december 31 , 2002 , which is recorded in other expense in the accompanying consolidated statement of operations .', 'the company records the changes in fair value of its derivative instruments that are not accounted for as hedges in other expense .', 'the company did not reclassify any derivative losses into its statement of operations for the year ended december 31 , 2004 and does not anticipate reclassifying any derivative losses into its statement of operations within the next twelve months , as there are no amounts included in other comprehensive loss as of december 31 , 2004 .', '8 .', 'commitments and contingencies lease obligations 2014the company leases certain land , office and tower space under operating leases that expire over various terms .', 'many of the leases contain renewal options with specified increases in lease payments upon exercise of the renewal option .', 'escalation clauses present in operating leases , excluding those tied to cpi or other inflation-based indices , are straight-lined over the term of the lease .', '( see note 1. ) future minimum rental payments under non-cancelable operating leases include payments for certain renewal periods at the company 2019s option because failure to renew could result in a loss of the applicable tower site and related revenues from tenant leases , thereby making it reasonably assured that the company will renew the lease .', 'such payments in effect at december 31 , 2004 are as follows ( in thousands ) : year ending december 31 .'] 2005 $ 106116 2006 106319 2007 106095 2008 106191 2009 106214 thereafter 1570111 total $ 2101046 ['aggregate rent expense ( including the effect of straight-line rent expense ) under operating leases for the years ended december 31 , 2004 , 2003 and 2002 approximated $ 118741000 , $ 113956000 , and $ 109644000 , respectively. .']"", 'Some of our real estate agreements include rental payments adjusted periodically for inflation. Our lease agreements do not contain any material residual value guarantees or material restrictive covenants. The table below presents rent expense associated with facility and vehicle operating leases for the past three years (in thousands):\nLease Cost\t\tClassification\t\t2023\t\t2022\t\t2021\nOperating lease cost (1)\nSelling and administrative expenses\t\t$\t92,939 \t\t\t$\t81,750 \t\t\t$\t71,255 \t\nVariable lease cost\t\tSelling and administrative expenses\t\t$\t24,535 \t\t\t$\t22,326 \t\t\t$\t18,755 \t\n \n(1)Includes short-term lease cost, which is not material.\n\nBased on our lease portfolio as of December 31, 2023, the table below sets forth the approximate future lease payments related to operating leases with initial terms of one year or more (in thousands):\n\n2024\t\t$\t89,568 \t\n2025\t\t80,068 \t\n2026\t\t67,182 \t\n2027\t\t50,500 \t\n2028\t\t28,020 \t\nThereafter\t\t33,092 \t\nTotal lease payments\t\t348,430 \t\nLess: interest\t\t37,266 \t\nPresent value of lease liabilities\t\t$\t311,164 \t\n \n\nTo calculate the present value of our lease liabilities, we determined our incremental borrowing rate based on the effective interest rate on our Credit Facility adjusted for a collateral feature similar to that of our leased properties, as we are unable to derive implicit rates from our existing leases.', 'We have certain properties that are subject to ground leases, which are accounted for as operating leases.\nAt December 31, 2023, minimum future rental payments for the next five years and thereafter are as follows (in millions):\nOperating Leases\t\tFinance\n Leases\t\tTotal\n2024\t\t$\t39.4 \t\t\t$\t5.3 \t\t\t$\t44.7 \t\n2025\t\t38.8 \t\t\t3.6 \t\t\t42.4 \t\n2026\t\t38.0 \t\t\t9.2 \t\t\t47.2 \t\n2027\t\t35.5 \t\t\t1.5 \t\t\t37.0 \t\n2028\t\t31.9 \t\t\t1.5 \t\t\t33.4 \t\nThereafter\t\t497.5 \t\t\t48.9 \t\t\t546.4 \t\nTotal\t\t$\t681.1 \t\t\t$\t70.0 \t\t\t$\t751.1 \t\nPresent value adjustment for remaining lease payments (1)\n(255.9)\t\t\t(25.7)\t\t\t\nTotal lease liability\t\t$\t425.2 \t\t\t$\t44.3 \t\t\t\n \n(1) The discount rates are specific for individual leases primarily based on the lease term. The range of discount rates used to calculate the present value of the operating lease payments is 0.94% to 6.42% and for finance lease payments is 1.14% to 6.21%. The weighted average discount rate was derived from estimated incremental borrowing rates based on our credit quality, as we did not have any borrowings at the balance sheet date with comparable terms to our lease agreements. At December 31, 2023, the weighted average discount rate for operating leases is 3.66% and the weighted average remaining lease term is 23.1 years. At December 31, 2023, the weighted average discount rate for finance leases is 3.47% and the weighted average remaining lease term is 22.6 years.', ""['2010 .', 'on november 1 , 2010 , we redeemed all $ 400 million of our outstanding 6.65% ( 6.65 % ) notes due january 15 , 2011 .', 'the redemption resulted in a $ 5 million early extinguishment charge .', 'receivables securitization facility 2013 at december 31 , 2010 , we have recorded $ 100 million as secured debt under our receivables securitization facility .', '( see further discussion of our receivables securitization facility in note 10. ) 15 .', 'variable interest entities we have entered into various lease transactions in which the structure of the leases contain variable interest entities ( vies ) .', 'these vies were created solely for the purpose of doing lease transactions ( principally involving railroad equipment and facilities ) and have no other activities , assets or liabilities outside of the lease transactions .', 'within these lease arrangements , we have the right to purchase some or all of the assets at fixed prices .', 'depending on market conditions , fixed-price purchase options available in the leases could potentially provide benefits to us ; however , these benefits are not expected to be significant .', 'we maintain and operate the assets based on contractual obligations within the lease arrangements , which set specific guidelines consistent within the railroad industry .', 'as such , we have no control over activities that could materially impact the fair value of the leased assets .', 'we do not hold the power to direct the activities of the vies and , therefore , do not control the ongoing activities that have a significant impact on the economic performance of the vies .', 'additionally , we do not have the obligation to absorb losses of the vies or the right to receive benefits of the vies that could potentially be significant to the we are not considered to be the primary beneficiary and do not consolidate these vies because our actions and decisions do not have the most significant effect on the vie 2019s performance and our fixed-price purchase price options are not considered to be potentially significant to the vie 2019s .', 'the future minimum lease payments associated with the vie leases totaled $ 4.2 billion as of december 31 , 2010 .', '16 .', 'leases we lease certain locomotives , freight cars , and other property .', 'the consolidated statement of financial position as of december 31 , 2010 and 2009 included $ 2520 million , net of $ 901 million of accumulated depreciation , and $ 2754 million , net of $ 927 million of accumulated depreciation , respectively , for properties held under capital leases .', 'a charge to income resulting from the depreciation for assets held under capital leases is included within depreciation expense in our consolidated statements of income .', 'future minimum lease payments for operating and capital leases with initial or remaining non-cancelable lease terms in excess of one year as of december 31 , 2010 , were as follows : millions operating leases capital leases .'] millions operatingleases capitalleases 2011 $ 613 $ 311 2012 526 251 2013 461 253 2014 382 261 2015 340 262 later years 2599 1355 total minimum lease payments $ 4921 $ 2693 amount representing interest n/a -784 ( 784 ) present value of minimum lease payments n/a $ 1909 ['the majority of capital lease payments relate to locomotives .', 'rent expense for operating leases with terms exceeding one month was $ 624 million in 2010 , $ 686 million in 2009 , and $ 747 million in 2008 .', 'when cash rental payments are not made on a straight-line basis , we recognize variable rental expense on a straight-line basis over the lease term .', 'contingent rentals and sub-rentals are not significant. .']""]",1315.7177499961108,13225.7556
6,6,89747a6d,R&D expense as a % of net product revs for VRTX in 2023.,"To calculate the percentage of 2023 product revenues allocated to Research and Development (R&D) expenses, we use the formula:

Percentage = (R&D Expenses / Product Revenues, net) × 100

From the provided data for 2023:
- R&D Expenses = $3,162.9 million
- Product Revenues, net = $9,869.2 million

Calculation:

Percentage = (3,162.9 / 9,869.2) × 100 ≈ 32.06%

Therefore, approximately 32.06% of the product revenues in 2023 were allocated to R&D expenses.","['VERTEX PHARMACEUTICALS INCORPORATED\nConsolidated Statements of Income\n(in millions, except per share amounts)\nYear Ended December 31,\n2023\t\t2022\t\t2021\nRevenues:\t\t\t\t\t\nProduct revenues, net\t$\t9,869.2 \t\t\t$\t8,930.7 \t\t\t$\t7,573.4 \t\nOther revenues\n— \t\t\t— \t\t\t1.0 \t\nTotal revenues\t9,869.2 \t\t\t8,930.7 \t\t\t7,574.4 \t\nCosts and expenses:\t\t\t\t\t\nCost of sales\t1,262.2 \t\t\t1,080.3 \t\t\t904.2 \t\nResearch and development expenses\t3,162.9 \t\t\t2,540.3 \t\t\t1,937.8 \t\nAcquired in-process research and development expenses\t527.1 \t\t\t115.5 \t\t\t1,113.3 \t\nSelling, general and administrative expenses\t1,136.6 \t\t\t944.7 \t\t\t840.1 \t\nChange in fair value of contingent consideration\t(51.6)\t\t\t(57.5)\t\t\t(3.1)\t\nTotal costs and expenses\n6,037.2 \t\t\t4,623.3 \t\t\t4,792.3 \t\nIncome from operations\t3,832.0 \t\t\t4,307.4 \t\t\t2,782.1 \t\nInterest income\t614.7 \t\t\t144.6 \t\t\t4.9 \t\nInterest expense\t(44.1)\t\t\t(54.8)\t\t\t(61.5)\t\nOther (expense) income, net\t(22.8)\t\t\t(164.8)\t\t\t4.9 \t\nIncome before provision for income taxes\t4,379.8 \t\t\t4,232.4 \t\t\t2,730.4 \t\nProvision for income taxes\t760.2 \t\t\t910.4 \t\t\t388.3 \t\nNet income\n$\t3,619.6 \t\t\t$\t3,322.0 \t\t\t$\t2,342.1 \t\nNet income per common share:\t\t\t\t\t\nBasic\n$\t14.05 \t\t\t$\t12.97 \t\t\t$\t9.09 \t\nDiluted\n$\t13.89 \t\t\t$\t12.82 \t\t\t$\t9.01 \t\nShares used in per share calculations:\t\t\t\t\t\nBasic\n257.7 \t\t\t256.1 \t\t\t257.7 \t\nDiluted\n260.5 \t\t\t259.1 \t\t\t259.9']",,Division,FinDER,Arithmetic,"['VERTEX PHARMACEUTICALS INCORPORATED\nConsolidated Statements of Income\n(in millions, except per share amounts)\nYear Ended December 31,\n2023\t\t2022\t\t2021\nRevenues:\t\t\t\t\t\nProduct revenues, net\t$\t9,869.2 \t\t\t$\t8,930.7 \t\t\t$\t7,573.4 \t\nOther revenues\n— \t\t\t— \t\t\t1.0 \t\nTotal revenues\t9,869.2 \t\t\t8,930.7 \t\t\t7,574.4 \t\nCosts and expenses:\t\t\t\t\t\nCost of sales\t1,262.2 \t\t\t1,080.3 \t\t\t904.2 \t\nResearch and development expenses\t3,162.9 \t\t\t2,540.3 \t\t\t1,937.8 \t\nAcquired in-process research and development expenses\t527.1 \t\t\t115.5 \t\t\t1,113.3 \t\nSelling, general and administrative expenses\t1,136.6 \t\t\t944.7 \t\t\t840.1 \t\nChange in fair value of contingent consideration\t(51.6)\t\t\t(57.5)\t\t\t(3.1)\t\nTotal costs and expenses\n6,037.2 \t\t\t4,623.3 \t\t\t4,792.3 \t\nIncome from operations\t3,832.0 \t\t\t4,307.4 \t\t\t2,782.1 \t\nInterest income\t614.7 \t\t\t144.6 \t\t\t4.9 \t\nInterest expense\t(44.1)\t\t\t(54.8)\t\t\t(61.5)\t\nOther (expense) income, net\t(22.8)\t\t\t(164.8)\t\t\t4.9 \t\nIncome before provision for income taxes\t4,379.8 \t\t\t4,232.4 \t\t\t2,730.4 \t\nProvision for income taxes\t760.2 \t\t\t910.4 \t\t\t388.3 \t\nNet income\n$\t3,619.6 \t\t\t$\t3,322.0 \t\t\t$\t2,342.1 \t\nNet income per common share:\t\t\t\t\t\nBasic\n$\t14.05 \t\t\t$\t12.97 \t\t\t$\t9.09 \t\nDiluted\n$\t13.89 \t\t\t$\t12.82 \t\t\t$\t9.01 \t\nShares used in per share calculations:\t\t\t\t\t\nBasic\n257.7 \t\t\t256.1 \t\t\t257.7 \t\nDiluted\n260.5 \t\t\t259.1 \t\t\t259.9']",89747a6d,True,"['Investing Activities\nWe had $119.4 million of net cash used in investing activities in 2023, compared with $191.1 million in 2022.\nCapital Spending—Capital expenditures were $75.6 million and $122.9 million in 2023 and 2022, respectively, and primarily related to the purchase of equipment to increase our manufacturing capacity. We expect capital expenditures for 2024 to increase compared with 2023 given the timing of spending on machinery, equipment and tooling for our new Malaysia manufacturing facility and to support continuous improvement efforts in our other manufacturing locations. To a lesser extent, we expect capital expenditures to increase due to investments in our information technology infrastructure. We expect to fund our capital expenditures using existing cash.\nInvestments in Developed Software—Investments in developed software were $8.5 million and $12.9 million in 2023 and 2022, respectively, and primarily related to investments in projects to support our cloud-based capabilities.\nAcquisitions—In 2023, we paid Bigfoot Biomedical, Inc. $25.1 million, including transaction costs, to acquire patent assets related to pump-based AID technologies. In 2022, we paid $26.0 million to acquire substantially all the assets related to the manufacture and production of shape-memory alloy wire assemblies that are used in the production of Pods from Dynalloy, Inc. and $21.5 million to acquire developed technology and patents from Automated Glucose Control LLC. The remaining $3.0 million purchase price for the Dynalloy acquisition was paid during 2023.\nInvestments—In 2023 and 2022, we made strategic investments in private companies in the amount of $7.2 million and $7.8 million, respectively.', ""Global net advertising, merchandising, sampling, promotion and product development expenses of $3,657 million, $3,711 million and $3,877 million in fiscal 2024, 2023 and 2022, respectively, are recorded in Selling, general and administrative expenses in the accompanying consolidated statements of earnings and are expensed as incurred. The cost of certain promotional products, including samples and testers, are classified within Cost of sales in the accompanying consolidated statements of earnings. \nResearch and Development\nResearch and development costs of $360 million, $344 million and $307 million in fiscal 2024, 2023 and 2022, respectively, are recorded in Selling, general and administrative expenses in the accompanying consolidated statements of earnings and are expensed as incurred.\nShipping and Handling\nShipping and handling expenses of $792 million, $838 million and $860 million in fiscal 2024, 2023 and 2022, respectively, are recorded in Selling, general and administrative expenses in the accompanying consolidated statements of earnings and include distribution center costs, promotional shipping costs, third-party logistics costs and outbound freight.\nRoyalty Fees - License Arrangements\nThe Company’s license agreements provide the Company with worldwide rights to manufacture, market and sell beauty and beauty-related products (or particular categories thereof) using the licensors’ trademarks. The Company's current license arrangements have an initial term of approximately 3 years to 10 years, and are renewable subject to the Company’s compliance with the license agreement provisions. As of June 30, 2024, the remaining terms considering available renewal periods range from 2 years to approximately 26 years. Under each license, the Company is required to pay royalties to the licensor, at least annually, based on net sales to third parties.\nCertain license agreements may require minimum royalty payments, incremental royalties based on net sales levels and minimum spending on advertising and promotional activities. Royalty expenses are accrued in the period in which net sales are recognized while advertising and promotional expenses are accrued at the time these costs are incurred."", ""['table of contents research and development expense ( 201cr&d 201d ) r&d expense increased 34% ( 34 % ) or $ 449 million to $ 1.8 billion in 2010 compared to 2009 .', 'this increase was due primarily to an increase in headcount and related expenses in the current year to support expanded r&d activities .', 'also contributing to this increase in r&d expense in 2010 was the capitalization in 2009 of software development costs of $ 71 million related to mac os x snow leopard .', 'although total r&d expense increased 34% ( 34 % ) during 2010 , it declined as a percentage of net sales given the 52% ( 52 % ) year-over-year increase in net sales in 2010 .', 'the company continues to believe that focused investments in r&d are critical to its future growth and competitive position in the marketplace and are directly related to timely development of new and enhanced products that are central to the company 2019s core business strategy .', 'as such , the company expects to make further investments in r&d to remain competitive .', 'r&d expense increased 20% ( 20 % ) or $ 224 million to $ 1.3 billion in 2009 compared to 2008 .', 'this increase was due primarily to an increase in headcount in 2009 to support expanded r&d activities and higher stock-based compensation expenses .', 'additionally , $ 71 million of software development costs were capitalized related to mac os x snow leopard and excluded from r&d expense during 2009 , compared to $ 11 million of software development costs capitalized during 2008 .', 'although total r&d expense increased 20% ( 20 % ) during 2009 , it remained relatively flat as a percentage of net sales given the 14% ( 14 % ) increase in revenue in 2009 .', 'selling , general and administrative expense ( 201csg&a 201d ) sg&a expense increased $ 1.4 billion or 33% ( 33 % ) to $ 5.5 billion in 2010 compared to 2009 .', 'this increase was due primarily to the company 2019s continued expansion of its retail segment , higher spending on marketing and advertising programs , increased stock-based compensation expenses and variable costs associated with the overall growth of the company 2019s net sales .', 'sg&a expenses increased $ 388 million or 10% ( 10 % ) to $ 4.1 billion in 2009 compared to 2008 .', 'this increase was due primarily to the company 2019s continued expansion of its retail segment in both domestic and international markets , higher stock-based compensation expense and higher spending on marketing and advertising .', 'other income and expense other income and expense for the three years ended september 25 , 2010 , are as follows ( in millions ) : total other income and expense decreased $ 171 million or 52% ( 52 % ) to $ 155 million during 2010 compared to $ 326 million and $ 620 million in 2009 and 2008 , respectively .', 'the overall decrease in other income and expense is attributable to the significant declines in interest rates on a year- over-year basis , partially offset by the company 2019s higher cash , cash equivalents and marketable securities balances .', 'the weighted average interest rate earned by the company on its cash , cash equivalents and marketable securities was 0.75% ( 0.75 % ) , 1.43% ( 1.43 % ) and 3.44% ( 3.44 % ) during 2010 , 2009 and 2008 , respectively .', 'additionally the company incurred higher premium expenses on its foreign exchange option contracts , which further reduced the total other income and expense .', 'during 2010 , 2009 and 2008 , the company had no debt outstanding and accordingly did not incur any related interest expense .', 'provision for income taxes the company 2019s effective tax rates were 24% ( 24 % ) , 32% ( 32 % ) and 32% ( 32 % ) for 2010 , 2009 and 2008 , respectively .', 'the company 2019s effective rates for these periods differ from the statutory federal income tax rate of 35% ( 35 % ) due .'] 2010 2009 2008 interest income $ 311 $ 407 $ 653 other income ( expense ) net -156 ( 156 ) -81 ( 81 ) -33 ( 33 ) total other income and expense $ 155 $ 326 $ 620 ['.']"", 'RTX CORPORATION\nCONSOLIDATED STATEMENT OF OPERATIONS \n(dollars in millions, except per share amounts; shares in millions)\t\t2023\t\t2022\t\t2021\nNet sales:\t\t\t\t\t\t\nProducts sales\t\t$\t49,571 \t\t\t$\t50,773 \t\t\t$\t49,270 \t\nServices sales\t\t19,349 \t\t\t16,301 \t\t\t15,118 \t\nTotal net sales\t\t68,920 \t\t\t67,074 \t\t\t64,388 \t\nCosts and expenses:\t\t\t\t\t\t\nCost of sales - products\t\t43,425 \t\t\t41,927 \t\t\t41,095 \t\nCost of sales - services\t\t13,406 \t\t\t11,479 \t\t\t10,802 \t\nResearch and development\t\t2,805 \t\t\t2,711 \t\t\t2,732 \t\nSelling, general and administrative\t\t5,809 \t\t\t5,573 \t\t\t5,046 \t\nTotal costs and expenses\t\t65,445 \t\t\t61,690 \t\t\t59,675 \t\nOther income, net\t\t86 \t\t\t120 \t\t\t423 \t\nOperating profit\t\t3,561 \t\t\t5,504 \t\t\t5,136 \t\nNon-operating expense (income), net:\t\t\t\t\t\t\nNon-service pension income\t\t(1,780)\t\t\t(1,889)\t\t\t(1,944)\t\nDebt extinguishment costs\t\t— \t\t\t— \t\t\t649 \t\nInterest expense, net\t\t1,505 \t\t\t1,276 \t\t\t1,322 \t\nTotal non-operating expense (income), net\t\t(275)\t\t\t(613)\t\t\t27 \t\nIncome from continuing operations before income taxes\t\t3,836 \t\t\t6,117 \t\t\t5,109 \t\nIncome tax expense\t\t456 \t\t\t790 \t\t\t964 \t\nNet income from continuing operations\t\t3,380 \t\t\t5,327 \t\t\t4,145 \t\nLess: Noncontrolling interest in subsidiaries’ earnings from continuing operations\t\t185 \t\t\t111 \t\t\t248 \t\nNet income from continuing operations attributable to common shareowners\t\t3,195 \t\t\t5,216 \t\t\t3,897 \t\nLoss from discontinued operations attributable to common shareowners\t\t— \t\t\t(19)\t\t\t(33)\t\nNet income attributable to common shareowners\t\t$\t3,195 \t\t\t$\t5,197 \t\t\t$\t3,864 \t\nEarnings (loss) per share attributable to common shareowners - basic\t\t\t\t\t\t\nIncome from continuing operations attributable to common shareowners\t\t$\t2.24 \t\t\t$\t3.54 \t\t\t$\t2.60 \t\nLoss from discontinued operations\t\t— \t\t\t(0.02)\t\t\t(0.03)\t\nNet income attributable to common shareowners\t\t$\t2.24 \t\t\t$\t3.52 \t\t\t$\t2.57 \t\nEarnings (loss) per share attributable to common shareowners - diluted\t\t\t\t\t\t\nIncome from continuing operations attributable to common shareowners\t\t$\t2.23 \t\t\t$\t3.51 \t\t\t$\t2.58 \t\nLoss from discontinued operations\t\t— \t\t\t(0.01)\t\t\t(0.02)\t\nNet income attributable to common shareowners\t\t$\t2.23 \t\t\t$\t3.50 \t\t\t$\t2.56 \t\nWeighted average number of shares outstanding:\t\t\t\t\t\t\nBasic shares\t\t1,426.0 \t\t\t1,475.5 \t\t\t1,501.6 \t\nDiluted shares\t\t1,435.4 \t\t\t1,485.9 \t\t\t1,508.5', 'Capital expenditures were $136.2 million or 2.1% of net sales in 2023, compared with $139.0 million or 2.3% of net sales in 2022. In 2023, approximately 64% of capital expenditures were for improvements to existing equipment or additional equipment to increase productivity and expand capacity. Capital expenditures in 2024 are expected to be approximately 2% of net sales, with a continued emphasis on spending to improve productivity.', 'Other\n(Dollar amounts in millions)\t\t \tVariance\nYear Ended December 31,\t\t2023\t\t2022\t\t2023 vs. 2022\nSales\t\t$\t1,289 \t\t\t$\t1,805 \t\t\t(29)\t%\nOperating profit\t\t$\t43 \t\t\t$\t(66)\t\t\t165 \t%\nAs a percent of sales\t\t3.3 \t%\t\t(3.7)\t%\t\t\n \n2023 vs. 2022\n \t\t% Change\nFactors Contributing to Changes - Sales\t\t\nVolume/Price\t\t2 \t%\nCurrency\t\t— \t%\nAcquisitions/Divestitures\t\t(31)\t%\n(29)\t%\n \nOther consists of corporate costs and a few smaller businesses including: Linde Advanced Materials Technology and global helium wholesale; which individually do not meet the quantitative thresholds for separate presentation.\n\nSales\n\nSales for Other decreased $516 million, or 29%, in 2023 versus 2022. Divestitures decreased sales by 31% primarily due to sale of GIST business in third quarter of 2022. Volume/Price increased sales by 2% driven primarily by price in the coatings and global helium businesses, partially offset by lower coatings volumes.\n\nOperating profit\n\nOperating profit in Other increased $109 million, or 165%, in 2023 versus 2022 driven primarily by higher pricing in global helium and coatings and lower corporate costs which more than offset the impact of divestitures and lower volumes.', 'Historically, our capital expenditures have averaged roughly 1.0% of net sales. Capital expenditures were 1.1% of net sales in 2023 and 0.7% of net sales in 2022 and 2021. In 2022 and 2021, our capital expenditures as a percentage of net sales were lower than our historical average due to our significant sales growth in those years. Based on management’s current plans, we project capital expenditures for 2024 will average 1% to 1.5% of net sales.', 'Engineering\n(Dollar amounts in millions)\t\t \t\tVariance\nYear Ended December 31,\t\t2023\t\t2022\t\t2023 vs. 2022\nSales\t\t$\t2,160 \t\t\t$\t2,762 \t\t\t(22)\t%\nOperating profit\t\t$\t491 \t\t\t$\t555 \t\t\t(12)\t%\nAs a percent of sales\t\t22.7 \t%\t\t20.1 \t%\t\t\n \n2023 vs. 2022\n \t\t% Change\nFactors Contributing to Changes - Sales\t\t\nCurrency\t\t1 \t%\nOther\t\t(23)\t%\n(22)\t%\n \nSales\nEngineering segment sales decreased $602 million, or 22%, in 2023 versus 2022 . The decrease was driven by project timing.\n\nProjects for Russia that were sanctioned, and therefore terminated or suspended, have been lawfully wound down and represented approximately $238 million and $894 million of the Engineering segment sales during 2023 and 2022, respectively.\n\nOperating profit\n\nEngineering segment operating profit decreased $64 million, or 12%, in 2023 versus 2022. The decline from lower sales was partially offset by higher margin on wind down of terminated or suspended projects sanctioned in Russia.', 'Net cash used in investing activities was $2.3 billion in 2023, compared to $2.5 billion in 2022. The change was primarily due to a decrease in acquisition spend, including acquired IPR&D, and capital expenditures, partially offset by higher net purchases of marketable debt and equity securities.', 'Total Revenue\nYear Ended October 31,\t\t$ Change    \t\t% Change    \t\t$ Change\t\t% Change\n2024\t\t2023\t\t2022\t\t2024 vs. 2023\t\t2023 vs. 2022\n(dollars in millions)\t\t\t\t\nDesign Automation\t$\t4,221.1 \t\t\t$\t3,775.3 \t\t\t$\t3,300.2 \t\t\t$\t445.8 \t\t\t12 \t%\t\t$\t475.1 \t\t\t14 \t%\nDesign IP\t1,906.3 \t\t\t1,542.7 \t\t\t1,315.5 \t\t\t363.6 \t\t\t24 \t%\t\t227.2 \t\t\t17 \t%\nTotal\t$\t6,127.4 \t\t\t$\t5,318.0 \t\t\t$\t4,615.7 \t\t\t$\t809.4 \t\t\t15 \t%\t\t$\t702.3 \t\t\t15 \t%']",1017.3880830407144,I don’t know
7,7,366d49d1,% of part-time workforce and flexibility in labor costs for SPG.,"Based on the reference, out of approximately 3,000 employees, about 500 are part-time. This results in roughly 16.67% of the workforce being part-time. This proportion could imply that Simon Property Group maintains a flexible labor structure, potentially allowing it to better manage labor costs in response to demand fluctuations or seasonal variations.","['At December 31, 2023, we and our affiliates at SPG employed approximately 3,000 persons at various properties and offices throughout the United States, of which approximately 500 were part-time. Approximately 1,000 of these employees were located at our corporate headquarters in Indianapolis, Indiana.']",,Division,FinDER,Arithmetic,"['At December 31, 2023, we and our affiliates at SPG employed approximately 3,000 persons at various properties and offices throughout the United States, of which approximately 500 were part-time. Approximately 1,000 of these employees were located at our corporate headquarters in Indianapolis, Indiana.']",366d49d1,True,"['Workforce Composition. As of December 31, 2023, we had 7,364 full-time and 47 part-time active employees (i.e., not interns, not on leave or disability). Of our total workforce, 34% were subject to collective bargaining agreements with various labor unions. These collective bargaining agreements were renegotiated in 2021 and 2023 and expire in 2026 and 2027, respectively.', 'As of September 30, 2024, we had approximately 16,600 full-time, part-time and temporary employees. Approximately 17% of our full-time and part-time employees are represented by labor unions. Collective bargaining agreements between us and these labor unions expire at various dates up to January 2029.', 'As of December 31, 2023, we employed approximately 33,400 persons globally. Our employee base is predominantly full-time and approximately 67% were employed outside of the U.S. in more than 80 countries. We also had approximately 4,600 contractors which we used to supplement our employee base in order to meet specific needs. Our voluntary workforce turnover (rolling 12-month attrition) was approximately 5% as of December 31, 2023. The total cost of our workforce for the year ended December 31, 2023 was $6.0 billion, which primarily consists of compensation, benefits and other personnel- and contractor-related costs.', 'As of December 31, 2023, the Company employed approximately 18,650 full-time and 1,855 part-time employees worldwide. Collective bargaining agreements covered approximately 6,295 employees, or approximately 31% of the Company’s employees worldwide. During 2024, agreements are expected to be negotiated for certain employees at five facilities, four of which are outside of the United States, comprising approximately 72% of total employees under collective bargaining agreements. We believe our efforts in managing our workforce have been effective, as evidenced by a strong culture and a good relationship between the Company and our employees.', 'The Company employed approximately 233,000 people as of September 28, 2024, of which approximately 171,000 were employed in the U.S. and approximately 62,000 were employed outside the U.S. Our global workforce comprises approximately 76% full time and 16% part time employees, with another 8% being seasonal employees. A significant number of employees in various parts of our businesses, including employees of our theme parks, and writers, directors, actors and production personnel for our productions are covered by collective bargaining agreements. In addition, some of our employees outside the U.S. are represented by works councils, trade unions or other employee associations.', 'As of December 30, 2023, the Company had approximately 50,500 employees in 59 countries. Approximately 36% of total employees were employed in the U.S. In addition, the Company had approximately 7,300 temporary contractors globally, primarily in operations. The workforce is comprised of approximately 69% hourly-paid employees, principally in manufacturing and distribution centers, and 31% salaried employees. There were approximately 1,000 U.S. employees covered by collective bargaining agreements dispersed among 8 different local labor unions, and a majority of European employees are represented by Works Councils. Three U.S. collective bargaining agreements are scheduled for renegotiation in the next 12 months. The Company strives to maintain a positive relationship with all its employees, as well as the unions and Works Councils representing them, where applicable.', 'As of December 31, 2023, we had approximately 186,000 full-time and part-time employees calculated on a full-time equivalent basis. Approximately 30% of our employees were located in over 30 countries outside the United States, with larger workforce concentrations in the United Kingdom, Western Europe, East Asia and South Asia. We also use freelance and temporary employees in the normal course of our business. A small overall portion of our full-time U.S. employees are unionized, although many of Content & Experiences’ freelance and temporary writers, directors, actors, technical and production personnel, as well as some on-air and creative talent employees, are covered by industry-wide collective bargaining agreements or work councils. Outside the United States, employees in certain countries, particularly in Europe, are represented by an employee representative organization, such as a union, works council or employee association.', 'Number of Employees by Type and Gender\nMale\t%\t\tFemale\t%\t\tTotal\t%\nFull-time\t30,497 \t\t76 \t%\t\t9,716 \t\t24 \t%\t\t40,213 \t\t100 \t%\nPart-time\t603 \t\t38 \t%\t\t986 \t\t62 \t%\t\t1,589 \t\t100 \t%\nTotal\t31,100 \t\t74 \t%\t\t10,702 \t\t26 \t%\t\t41,802 \t\t100 \t%\n \n\nPercentage of Employees by Level and Gender\nPercentage\n2023\t\t2022\nMale\t\tFemale\t\tTotal\t\tMale\t\tFemale\t\tTotal\nExecutive Council\t67 \t%\t\t33 \t%\t\t100 \t%\t\t71 \t%\t\t29 \t%\t\t100 \t%\nSenior Leadership\t69 \t%\t\t31 \t%\t\t100 \t%\t\t72 \t%\t\t28 \t%\t\t100 \t%\nSalaried Colleagues\t61 \t%\t\t39 \t%\t\t100 \t%\t\t62 \t%\t\t38 \t%\t\t100 \t%', 'Workforce\n\nAs of December 31, 2023, we had the following number of employees, including those represented under union agreements:\nTotal Employees\t\tUnion Employees\nWE\t\t2,533 \t\t\t1,955 \t\nWPS\t\t1,154 \t\t\t832 \t\nWG\t\t378 \t\t\t260 \t\nPGL\t\t1,221 \t\t\t830 \t\nNSG\t\t154 \t\t\t119 \t\nMERC\t\t197 \t\t\t41 \t\nMGU\t\t141 \t\t\t91 \t\nWBS\t\t1,222 \t\t\t— \t\nTotal employees\t\t7,000 \t\t\t4,128 \t\n \n\nWe have a local union presence that spans Wisconsin, Illinois, Minnesota, and Michigan. We believe we have very good overall relations with our workforce.\n\nIn order to attract and retain talent, we provide competitive wages and benefits to our employees based on their performance, role, location, and market data. Our compensation package also includes a 401(k) savings plan with an employer match, an annual incentive plan based on meeting company goals, healthcare and insurance benefits, vacation and paid time off days, as well as other benefits.', 'Our success in the global marketplace depends on our ability to attract and retain a talented and skilled workforce. We aspire to accelerate business results by fostering a diverse and inclusive workplace, where members of our global workforce are supported to perform at their full potential, contribute to our success, and have opportunities for professional development and career advancement.\nWorkforce\nAs of September 30, 2024, we had more than 46,000 employees globally, of which approximately 42,000 were full-time employees and approximately 36% were U.S.-based employees.\nAs of September 30, 2024, approximately 28% of our global employees were covered by collective bargaining agreements, nearly all of whom were employees located outside of the United States.']",826.0538750328124,"≈4 % part-time; with about 96 % of staff full-time and most covered by fixed salary/benefit packages, SPG’s labour costs are largely fixed, giving only modest flexibility (mainly through the small part-time pool and use of outside contractors)."
8,8,9c01e59c,Competitor mix impact on pricing & positioning for NRG Energy (NRG).,"The provided data gives insight into the diverse competitive landscape that NRG Energy faces, and from that, we can infer several impacts on its competitive positioning and pricing strategy. Specifically:

1. Fragmented Market Dynamics: With competitors ranging from regulated utilities to independent power producers and various electric retailers outside of Texas, NRG Energy operates in a market that is highly fragmented. This variation means that different regions will have different levels of competition, regulatory oversight, and customer expectations. In deregulated markets, such as Texas, customers can easily switch providers based on pricing and value propositions. Outside of Texas, where incumbents like regulated utilities and a mix of independent providers are more dominant, NRG may have less flexibility to aggressively undercut prices, as incumbents might have regulatory advantages or established customer bases.

2. Competitive Pricing Pressure: In competitive markets where customers have many choices—including those offered by independent power producers and other retailers—NRG is compelled to adopt a pricing strategy that is both competitive and reflective of local market conditions. The need to appeal to both price-sensitive and value-driven customers forces NRG to carefully balance its pricing, ensuring it remains attractive in a market with several alternative options. In regions with regulated utilities, the rates can sometimes be more stable due to regulatory frameworks, which may limit pricing flexibility and require NRG to find other ways (e.g., service differentiation) to compete.

3. Differentiation Strategy: The data suggests that even though competition is broad and varied, many competitors do not provide comprehensive solutions or differentiated services. For NRG Energy, this competitive mix creates both a challenge and an opportunity. While the presence of regulated utilities and independent power producers means a strong baseline of competition, it also offers NRG an opportunity to differentiate itself—potentially through integrated service offerings, innovative pricing models, or tailored energy solutions that provide added value beyond basic electricity supply.

4. Regulatory and Market Specificities: The competitive landscape changes drastically from one region to another. In markets where regulatory utilities dominate, pricing might be less about aggressive cost-cutting and more about aligning with regulated rate structures, whereas in more liberal deregulated environments, competitive pricing and frequent promotions may be expected. This forces NRG to adopt a localized pricing strategy that accounts for the strengths and competitive tactics of local incumbents and emerging independent providers.

In summary, the mix of competitors impacts NRG Energy's competitive positioning by pushing it to not only compete on price in highly competitive, deregulated environments but also to differentiate its offerings in regions where it competes against established, regulated players. This dual challenge influences its overall pricing strategy, leading the company to strategically tailor its approaches by market, balancing competitive pricing with value-driven service innovation to maintain its position.","['While there has been consolidation in the competitive retail energy space over the past few years, there is still considerable competition for customers at NRG. In Texas, there is healthy competition in deregulated areas and customers can choose providers based on the most appealing offers. Outside of Texas, electricity retailers compete with the incumbent utilities, in addition to other retail electric providers, which can inhibit competition depending on the market rules of the state. There is a high degree of fragmentation, with both large and small competitors offering a range of value propositions, including value, rewards, and sustainability-based offerings.\nWholesale generation is highly fragmented and diverse in terms of industry structure by region. As such, there is wide variation in terms of the capabilities, resources, nature and identities of the Company’s competitors depending on the market. Competitors include regulated utilities, municipalities, cooperatives, other independent power producers, and power marketers or trading companies, including those owned by financial institutions.\nThe smart home market is an expanding global opportunity and is in the early stages of broad consumer adoption. It is highly competitive and fragmented. Major competitors range from large-cap technology companies seeking to expand their core market opportunity who predominantly offer do-it-yourself (""DIY"") devices that put a large burden on homeowners to self-install and support many devices, to security-based providers, as well as industrial and telecommunications companies that offer connected home experiences. Vivint Smart Home provides the full smart home experience, with an end-to-end solution that includes a wide range of unique capabilities and use cases. Currently, the vast majority of competitors do not offer comprehensive smart home solutions and accompanying services.']",,,FinDER,Non-numerical,"['While there has been consolidation in the competitive retail energy space over the past few years, there is still considerable competition for customers at NRG. In Texas, there is healthy competition in deregulated areas and customers can choose providers based on the most appealing offers. Outside of Texas, electricity retailers compete with the incumbent utilities, in addition to other retail electric providers, which can inhibit competition depending on the market rules of the state. There is a high degree of fragmentation, with both large and small competitors offering a range of value propositions, including value, rewards, and sustainability-based offerings.\nWholesale generation is highly fragmented and diverse in terms of industry structure by region. As such, there is wide variation in terms of the capabilities, resources, nature and identities of the Company’s competitors depending on the market. Competitors include regulated utilities, municipalities, cooperatives, other independent power producers, and power marketers or trading companies, including those owned by financial institutions.\nThe smart home market is an expanding global opportunity and is in the early stages of broad consumer adoption. It is highly competitive and fragmented. Major competitors range from large-cap technology companies seeking to expand their core market opportunity who predominantly offer do-it-yourself (""DIY"") devices that put a large burden on homeowners to self-install and support many devices, to security-based providers, as well as industrial and telecommunications companies that offer connected home experiences. Vivint Smart Home provides the full smart home experience, with an end-to-end solution that includes a wide range of unique capabilities and use cases. Currently, the vast majority of competitors do not offer comprehensive smart home solutions and accompanying services.']",9c01e59c,True,"['The oil and gas industry is highly competitive, and we experience strong competition where we operate. We primarily compete with integrated, independent and other energy companies for the sale and transportation of our oil and natural gas\n production to pipelines, marketing companies and end users. Many of these competitors have greater financial, technical and personnel resources than we have. The effect of these competitive factors cannot be predicted.\nPrice, contract terms, availability of rigs and related equipment and quality of service, including infrastructure availability and distribution efficiencies affect competition. We believe that our concentrated acreage positions and our access to both third-party and Company-owned gathering and pipeline infrastructure in our core operating areas, along with our expected activity level and the related services and equipment that we have secured for the upcoming years, enhance our competitive position.', 'We are one of the world’s largest diversified energy services companies. Our services and products are sold in highly competitive markets throughout the world. Competitive factors impacting sales of our services and products include: price; service delivery; health, safety, and environmental standards and practices; service quality; global talent retention; understanding the geological characteristics of the reservoir; product quality; warranty; and technical proficiency.', 'Competition in the markets in which we operate is impacted by electricity and fuel prices, congestion along the power grid, subsidies provided by state and federal governments for new and existing generation facilities, including renewables generation and battery ESS, new market entrants, construction of new generation assets, technological advances in power generation, the actions of environmental and other regulatory authorities, and other factors. We primarily compete with other electricity generators and retailers based on our ability to generate electric supply, market and sell electricity at competitive prices and to efficiently utilize transportation from third-party pipelines and transmission from electric utilities to deliver electricity to end-users. Competitors in the generation and retail power markets in which we participate include numerous regulated utilities, industrial companies, non-utility generators, competitive subsidiaries of regulated utilities, independent power producers, REPs and other energy marketers. See Item 1A. Risk Factors for additional information concerning the risks faced with respect to the markets in which we operate.', 'Strong competition exists in all sectors of the oil and gas industry. We compete with major integrated and independent oil and gas companies for the acquisition of oil and gas leases and properties. We also compete for the equipment, services and personnel required to explore, develop and operate properties, such as drilling rigs and oilfield services. The rising costs and scarcity caused by this competitive pressure will generally increase during periods of higher commodity prices and can be further exacerbated by higher inflation rates and supply chain disruptions in the broader economy. For example, we experienced higher operating costs throughout 2023 due to steep cost inflation, and these inflationary pressures could continue in 2024. Competition is also prevalent in the marketing of oil, gas and NGLs. Certain of our competitors have resources substantially greater than ours and may have established superior strategic long-term positions and relationships. As a consequence, we may be at a competitive disadvantage in bidding for assets or services and accessing capital and downstream markets. In addition, many of our larger competitors may have a competitive advantage when responding to factors that affect demand for oil and gas production, such as changing worldwide price and production levels, the cost and availability of alternative energy sources and the application of government regulations.', 'We compete for natural gas, NGL, Refined Products and crude oil volumes with other midstream companies, major integrated oil companies and independent exploration and production companies that have gathering and processing assets, fractionators, pipelines, terminals and storage facilities. The factors that typically affect our ability to compete for natural gas, NGL, Refined Products and crude oil volumes are:\n\n•quality of services provided;\n•producer drilling activity;\n•proceeds remitted and/or fees charged under our contracts;\n•proximity of our assets to natural gas, NGL, Refined Products and crude oil supply areas and markets;\n•proximity of our assets to alternative energy production;\n•location of our assets relative to those of our competitors;\n•efficiency and reliability of our operations;\n•receipt and delivery capabilities for natural gas, NGLs, Refined Products and crude oil that exist in each pipeline system, plant, fractionator, terminal and storage location;\n•the petrochemical industry’s level of capacity utilization and feedstock requirements;\n•current and forward natural gas, NGLs, Refined Products and crude oil prices; and\n•cost of and access to capital.', 'Significant entrance barriers to build new pipelines exist, including increased federal and state regulations and elevated public opposition against new pipeline builds, and these factors will continue to impact potential competition for the foreseeable future. However, we believe our past success in working with regulators and the public, the position of our existing infrastructure, established strategic long-term contracts, and the fact that our pipelines have numerous receipt and delivery points along our systems provide us a competitive advantage, especially along the eastern seaboard and northwestern United States.\nEnergy Management and Marketing Services\nOur Gas & NGL Marketing Services segment competes with national and regional full-service energy providers, producers, and pipeline marketing affiliates or other marketing companies that aggregate commodities with transportation and storage capacity.\nFor additional information regarding competition for our services or otherwise affecting our business, please refer to Part 1, Item 1A. “Risk Factors” - “The financial condition of our natural gas transportation and midstream businesses is dependent on the continued availability of natural gas supplies in the supply basins that we access and demand for those supplies in the markets we serve,” “Our industry is highly competitive and increased competitive pressure could adversely affect our business and operating results,” and “We may not be able to replace, extend, or add additional customer contracts or contracted volumes on favorable terms, or at all, which could affect our financial condition, the amount of cash available to pay dividends, and our ability to grow.”', 'Although our regulated distribution operations are not currently in significant direct competition with any other distributors of natural gas to residential and commercial customers within our service areas, we do compete with other natural gas suppliers and suppliers of alternative fuels for sales to industrial customers. We compete in all aspects of our business with alternative energy sources, including, in particular, electricity. Electric utilities offer electricity as a rival energy source and compete for the space heating, water heating, and cooking markets. Promotional incentives, improved equipment efficiencies, and promotional rates all contribute to the acceptability of electrical equipment. The principal means to compete against alternative fuels is lower prices, and natural gas historically has maintained its price advantage in the residential, commercial, and industrial markets.\nOur pipeline and storage operations have historically faced competition from other existing intrastate pipelines seeking to provide or arrange transportation, storage, and other services for customers. In the last few years, several new pipelines have been completed, which has increased the level of competition in this segment of our business.', 'Many of our competitors have substantial positions nationally or in the markets in which we operate. Some also have greater scale, financial and operational resources, investment capacity, and brand recognition. Our competitors may be subject to different and, in some cases, less stringent legislative, regulatory, and supervisory regimes than ours. A range of competitors differ from us in their strategic and tactical priorities and, for example, may be willing to suffer meaningful financial losses in the pursuit of disruptive innovation and client growth or to accept more aggressive business, compliance, and other risks in the pursuit of higher returns and market valuations. Competition affects every aspect of our business, including product and service offerings and features, rates, pricing and fees, credit limits, and client service. Successfully competing in our markets also depends on our ability to innovate, to invest in technology and infrastructure, to execute transactions reliably and efficiently, to maintain and enhance our reputation, and to attract, retain, and motivate talented employees, all while effectively managing risks and expenses. We expect that competition will only intensify in the future.', 'Competition exists in various aspects of Consumers’ gas utility business. Competition comes from GCC and transportation programs; system bypass opportunities for new and existing customers; and from alternative fuels and energy sources, such as propane, oil, and electricity.\n\nNorthStar Clean Energy competes with other independent power producers. The needs of this market are driven by electric demand and the generation available.', 'The power production markets in which we operate are characterized by numerous strong and capable competitors, many of whom may have extensive and diversified developmental or operating experience (including both domestic and international) and financial resources similar to, or greater than, ours. Further, in recent years, the power production industry has been characterized by strong and increasing competition with respect to both obtaining power sales agreements and acquiring existing power generation assets. In certain markets, these factors have caused reductions in prices contained in new power sales agreements and, in many cases, have caused higher acquisition prices for existing assets through competitive bidding practices. The evolution of competitive electricity markets and the development of highly efficient gas-fired power plants and renewables such as wind and solar have also caused, and could continue to cause, price pressure in certain power markets where we sell or intend to sell power. In addition, the introduction of low-cost disruptive technologies or the entry of non-traditional competitors into our sector and markets could adversely affect our ability to compete, which could have a material adverse effect on our businesses, operating results and financial condition.']",930.519957910292,"NRG’s rivals range from regulated utilities and large independent power producers in power markets to integrated oil-and-gas majors, midstream pipeline operators and energy marketers; this diverse, well-capitalized mix exerts constant downward pressure on wholesale and retail power prices and raises input-cost volatility. To stay competitive, NRG positions itself on lowest-delivered-cost electricity—leveraging its broad generation fleet, ownership and access to pipeline/transmission infrastructure, and long-term offtake contracts—so it can match or undercut competitor pricing while preserving margin and market share."
9,9,C/2008/page_100.pdf,"For Citigroup, what was the percentage discount given in the reset of convertible preferred stock issued in the private offering ?",17%,"[""['capital resources and liquidity capital resources overview capital is generally generated via earnings from operating businesses .', 'this is augmented through issuance of common stock , convertible preferred stock , preferred stock , subordinated debt , and equity issued through awards under employee benefit plans .', 'capital is used primarily to support assets in the company 2019s businesses and to absorb unexpected market , credit or operational losses .', 'the company 2019s uses of capital , particularly to pay dividends and repurchase common stock , became severely restricted during the latter half of 2008 .', 'see 201cthe company , 201d 201cmanagement 2019s discussion and analysis 2013 events in 2008 , 201d 201ctarp and other regulatory programs , 201d 201crisk factors 201d and 201ccommon equity 201d on pages 2 , 9 , 44 , 47 and 95 , respectively .', 'citigroup 2019s capital management framework is designed to ensure that citigroup and its principal subsidiaries maintain sufficient capital consistent with the company 2019s risk profile , all applicable regulatory standards and guidelines , and external rating agency considerations .', 'the capital management process is centrally overseen by senior management and is reviewed at the consolidated , legal entity , and country level .', 'senior management oversees the capital management process of citigroup and its principal subsidiaries mainly through citigroup 2019s finance and asset and liability committee ( finalco ) .', 'the committee is composed of the senior-most management of citigroup for the purpose of engaging management in decision-making and related discussions on capital and liquidity items .', 'among other things , the committee 2019s responsibilities include : determining the financial structure of citigroup and its principal subsidiaries ; ensuring that citigroup and its regulated entities are adequately capitalized ; determining appropriate asset levels and return hurdles for citigroup and individual businesses ; reviewing the funding and capital markets plan for citigroup ; and monitoring interest-rate risk , corporate and bank liquidity , the impact of currency translation on non-u.s .', 'earnings and capital .', 'the finalco has established capital targets for citigroup and for significant subsidiaries .', 'at december 31 , 2008 , these targets exceeded the regulatory standards .', 'common and preferred stock issuances as discussed under 201cevents in 2008 201d on page 9 , during 2008 , the company issued $ 45 billion in preferred stock and warrants under tarp , $ 12.5 billion of convertible preferred stock in a private offering , $ 11.7 billion of non-convertible preferred stock in public offerings , $ 3.2 billion of convertible preferred stock in public offerings , and $ 4.9 billion of common stock in public offerings .', 'on january 23 , 2009 , pursuant to our prior agreement with the purchasers of the $ 12.5 billion convertible preferred stock issued in the private offering , the conversion price was reset from $ 31.62 per share to $ 26.35 per share .', 'the reset will result in citigroup 2019s issuing approximately 79 million additional common shares if converted .', 'there will be no impact to net income , total stockholders 2019 equity or capital ratios due to the reset .', 'however , the reset will result in a reclassification from retained earnings to additional paid-in capital of $ 1.2 billion to reflect the benefit of the reset to the preferred stockholders .', 'capital ratios citigroup is subject to risk-based capital ratio guidelines issued by the federal reserve board ( frb ) .', 'capital adequacy is measured via two risk- based ratios , tier 1 and total capital ( tier 1 + tier 2 capital ) .', 'tier 1 capital is considered core capital while total capital also includes other items such as subordinated debt and loan loss reserves .', 'both measures of capital are stated as a percentage of risk-weighted assets .', 'risk-weighted assets are measured primarily on their perceived credit risk and include certain off-balance-sheet exposures , such as unfunded loan commitments and letters of credit , and the notional amounts of derivative and foreign- exchange contracts .', 'citigroup is also subject to the leverage ratio requirement , a non-risk-based asset ratio , which is defined as tier 1 capital as a percentage of adjusted average assets .', 'to be 201cwell capitalized 201d under federal bank regulatory agency definitions , a bank holding company must have a tier 1 capital ratio of at least 6% ( 6 % ) , a total capital ratio of at least 10% ( 10 % ) , and a leverage ratio of at least 3% ( 3 % ) , and not be subject to an frb directive to maintain higher capital levels .', 'as noted in the following table , citigroup maintained a 201cwell capitalized 201d position during both 2008 and 2007 .', 'citigroup regulatory capital ratios at year end 2008 2007 .']\nat year end\t2008\t2007\ntier 1 capital\t11.92% ( 11.92 % )\t7.12% ( 7.12 % )\ntotal capital ( tier 1 and tier 2 )\t15.70\t10.70\nleverage ( 1 )\t6.08\t4.03\n['leverage ( 1 ) 6.08 4.03 ( 1 ) tier 1 capital divided by adjusted average assets .', 'events occurring during 2008 , including the transactions with the u.s .', 'government , affected citigroup 2019s capital ratios , and any additional u.s .', 'government financial involvement with the company could further impact the company 2019s capital ratios .', 'in addition , future operations will affect capital levels , and changes that the fasb has proposed regarding off-balance-sheet assets , consolidation and sale treatment could also have an impact on capital ratios .', 'see also note 23 to the consolidated financial statements on page 175 , including 201cfunding liquidity facilities and subordinate interests . 201d .']""]","{'text_14': 'on january 23 , 2009 , pursuant to our prior agreement with the purchasers of the $ 12.5 billion convertible preferred stock issued in the private offering , the conversion price was reset from $ 31.62 per share to $ 26.35 per share .'}","subtract(31.62, 26.35), divide(#0, 31.62)",FinQA,Compositional,"['on january 23 , 2009 , pursuant to our prior agreement with the purchasers of the $ 12.5 billion convertible preferred stock issued in the private offering , the conversion price was reset from $ 31.62 per share to $ 26.35 per share .']",C/2008/page_100.pdf,True,"['On November 3, 2023, we issued $1.60 billion aggregate principal amount of convertible senior notes, which bear interest at an annual rate of 3.00% and mature on November 15, 2028, unless earlier repurchased, redeemed or converted (the “2028 Convertible Notes”). We received net proceeds of approximately $1.56 billion after issuance costs. Contemporaneously with the issuance of the 2028 Convertible Notes, we entered into individually negotiated transactions with certain holders of our existing 1.50% convertible senior notes due February 1, 2024 (the “2024 Convertible Notes”) to repurchase approximately $508 million aggregate principal amount of such notes at an immaterial discount using net proceeds from the offering of the 2028 Convertible Notes. In connection with the issuance of the 2028 Convertible Notes, we also used approximately $155 million of the net proceeds from the offering to pay the cost of entering into capped call contracts with a cap price of approximately $70.26 to hedge the potential dilution impact of the conversion feature. On February 1, 2024, we used a portion of the remaining net proceeds from the offering of the 2028 Convertible Notes to settle the remaining 2024 Convertible Notes in accordance with their original terms for an aggregate cash principal payment of $592 million plus interest.', 'The Company may redeem all or any portion of the 2021 Notes, at the Company’s option, subject to partial redemption limitations, on or after June 20, 2025, if the last reported sale price of the Company’s common stock has been at least 130% of the conversion price then in effect for at least 20 trading days (whether or not consecutive), including the trading day immediately preceding the date on which the Company provides notice of redemption, during any 30 consecutive trading day period ending on, and including, the trading day immediately preceding the date on which the Company provides notice of redemption at a redemption price equal to 100% of the principal amount of the 2021 Notes to be redeemed, plus accrued and unpaid interest to, but excluding, the redemption date.\nIf a fundamental change occurs prior to the maturity date, holders may require the Company to repurchase all or a portion of their 2021 Notes for cash at a price equal to 100% of the principal amount of the 2021 Notes to be repurchased. Holders of 2021 Notes who convert their 2021 Notes in connection with a notice of a redemption or a make-whole fundamental change may be entitled to a premium in the form of an increase in the conversion rate of the 2021 Notes. As of December 31, 2023, none of the conditions permitting the holders of the 2021 Notes to early convert have been met.\n2020 Convertible Debt\nIn August 2020, the Company issued $650.0 million aggregate principal amount of the 2020 Notes in a private placement to qualified institutional buyers pursuant to Rule 144A under the Securities Act. The net proceeds from the sale of the 2020 Notes were approximately $639.5 million after deducting the offering expenses and before the purchase of the 2020 Capped Call Transactions and the partial repurchase of the 2018 Notes, each as described below. The Company used $74.7 million of the net proceeds from the 2020 Notes to enter into privately negotiated capped call instruments (“2020 Capped Call Transactions”) with certain financial institutions.\nIf a fundamental change occurs prior to the maturity date, holders may require the Company to repurchase all or a portion of their 2020 Notes for cash at a price equal to 100% of the principal amount of the 2020 Notes to be repurchased. Holders of 2020 Notes who convert their 2020 Notes in connection with a notice of a redemption or a make-whole fundamental change may be entitled to a premium in the form of an increase in the conversion rate of the 2020 Notes. As of December 31, 2023, none of the conditions permitting the holders of the 2020 Notes to early convert have been met.\n2019 Convertible Debt\nIn September 2019, the Company issued $650.0 million aggregate principal amount of the 2019 Notes in a private placement to qualified institutional buyers pursuant to the Securities Act. The net proceeds from the sale of the 2019 Notes were $639.5 million after deducting the initial purchasers’ discount and offering expenses. The Company used $76.2 million of the net proceeds from the 2019 Notes offering to enter into separate capped call instruments (“2019 Capped Call Transactions”) with the initial purchasers and/or their respective affiliates.', 'If a fundamental change occurs prior to the maturity date, holders may require the Company to repurchase all or a portion of their 2019 Notes for cash at a price equal to 100% of the principal amount of the 2019 Notes to be repurchased. Holders of 2019 Notes who convert their 2019 Notes in connection with a notice of a redemption or a make-whole fundamental change may be entitled to a premium in the form of an increase in the conversion rate of the 2019 Notes.\n2018 Convertible Debt\nIn March 2018, the Company issued $345.0 million aggregate principal amount of the 2018 Notes, in a private placement to qualified institutional buyers pursuant to the Securities Act. The net proceeds from the sale of the 2018 Notes were $335.0 million after deducting the initial purchasers’ discount and offering expenses. The Company used $34.2 million of the net', ""Edison International may, at its option, redeem its preferred stock in whole or in part during certain periods of time prior to each of the dividend reset dates at a price equal to $1,000 per share plus any accumulated and unpaid dividends. Edison International may also, at its option, redeem the preferred stocks in whole but not in part at a price equal to $1,020 per share plus any accumulated and unpaid dividends within a certain period of time following any change in the criteria rating agencies use that would have adverse effects on the equity credit attributed by rating agencies to the preferred stocks.\n\nThe preferred stocks rank senior to Edison International's common stock with respect to dividends rights and distribution rights upon liquidation. The preferred stocks are not subject to any mandatory sinking fund, retirement fund, purchase fund or other similar provisions. Holders of the shares of the preferred stocks do not have the right to require Edison International to repurchase or redeem shares of the preferred stocks."", ""If the Company undergoes a fundamental change at any time prior to the maturity date, holders of the Notes will have the right, at their option, to require the Company to repurchase for cash all or any portion of their Notes at a repurchase price equal to 100% of the principal amount of the Notes to be repurchased, plus accrued and unpaid interest up to, but excluding, the fundamental change repurchase date.\n\nThe conversion rights of the Notes are as follows:\n\nNotes\t\tConversion Date\t\t\nConversion Rate (1)\nConversion Price per Share (1)\n2029 Notes\t\tOctober 15, 2028\t\t7.9170\t\t$\t126.31 \t\n2027 Notes\t\tMay 1, 2027\t\t8.6073\t\t$\t116.18 \t\n2025 Notes\t\tJanuary 1, 2025\t\t10.5150\t\t$\t95.10 \t\n \n\n(1) The conversion rate for the Notes is established as a number of shares of the Company's commons stock per $1,000 principal amount of the Notes, that is equivalent to the conversion price per share, subject to adjustments in certain events. Upon the occurrence of certain corporate events the Company will increase the conversion rate for a holder that elects to convert its Notes.\n\nComponents and Fair Value of the Notes\n\nThe Notes consisted of the following components as of December 31, 2023 and 2022 (in thousands):"", 'In June 2021, the Company issued $1.0 billion aggregate principal amount of the 2021 Notes in a private placement to qualified institutional buyers pursuant to Rule 144A under the Securities Act of 1933, as amended (the “Securities Act”). The net proceeds from the sale of the 2021 Notes were approximately $986.7 million after deducting the initial purchasers’ discount and offering expenses and before the 2021 Capped Call Transactions, as described below, and the repurchase of stock, as described in “Note 15—Stockholders’ (Deficit) Equity.” The Company used $85.0 million of the net proceeds from the 2021 Notes to enter into privately negotiated capped call instruments (“2021 Capped Call Transactions”) with certain financial institutions.', 'Prior to the adoption of the new guidance for accounting for convertible instruments on January 1, 2022, the Company also amortized as interest expense the value of debt discounts of the 2027 Notes and the 2025 Notes.', 'As of December 31, 2023, Edison International has 1,159,317 shares of 5.375% Fixed-Rate Reset Cumulative Perpetual Preferred Stock, Series A (""Series A Preferred Stock"") and 532,454 shares of 5.00% Fixed-Rate Reset Cumulative Perpetual Preferred Stock, Series B (""Series B Preferred Stock"") outstanding, each with a liquidation value of $1,000 per share. The dividends are payable on a semi-annual basis and will be reset every five years beginning on March 15, 2026 and March 15, 2027, for Series A Preferred Stock and Series B Preferred Stock, respectively, to equal the then-current five-year U.S. Treasury rate plus a spread.', 'In November 2023, Edison International, through a tender offer, repurchased 61,497 shares of its Series A Preferred Stock and 84,223 shares of its Series B Preferred Stock for an average price of $925 and $904 per share, respectively, including accrued and unpaid dividends. The aggregate amount paid was $57 million for Series A Preferred Stock and $76 million for Series B Preferred Stock. In December 2023, Edison International repurchased 29,186 shares of its Series A Preferred Stock and 133,323 shares of its Series B Preferred Stock on the open market for an average price of $971 and $955 per share, respectively, including accrued and unpaid dividends. The aggregate amount paid was $28 million for Series A Preferred Stock and $127 million for Series B Preferred Stock. Edison International recognized a total net gain of $16 million from the tender offer and open market repurchases, reflected in ""Preferred stock dividend requirements of Edison International"" on the condensed statements of income.', 'Other\n\n\nWe were a party to a claim against a vendor which resulted in a verdict of approximately $159 million in favor of the Company in October 2022, for which the vendor filed a notice of appeal in February 2023. In December 2023, the Company and the vendor agreed to settle the claim and entered into a new comprehensive services arrangement with preferred rates. The favorable financial impact of these preferred rates will be recognized during the term of the 10-year arrangement as the services are provided.']",3066.660040989518,20%
10,10,800ca373,AEP's EPS FY23 recon check: basic EPS vs net inc.,"For FY2023, American Electric Power Company reports net income attributable to AEP common shareholders of $2,208.1 million, with a weighted average of 518,903,682 basic shares outstanding and a basic earnings per share (EPS) of $4.26. Conceptually, if you multiply the EPS by the number of shares, you should obtain the net income figure. As a simple check:

 EPS × Shares = $4.26 × 518,903,682 ≈ $2,208.1 million

This multiplication confirms that the EPS figure is consistent with the total net income reported. Such an addition-based (or aggregation-based) check supports the accuracy of the EPS calculation because it demonstrates that, on a per-share basis, the net income has been correctly allocated across the number of outstanding shares. If the multiplication did not reconcile with the reported earnings, it would suggest a miscalculation or inconsistency in either the EPS or the share count, thereby raising questions about the reliability of the reported performance.","['AMERICAN ELECTRIC POWER COMPANY, INC. AND SUBSIDIARY COMPANIES\nCONSOLIDATED STATEMENTS OF INCOME\nFor the Years Ended December 31, 2023, 2022 and 2021\n (in millions, except per-share and share amounts)\nYears Ended December 31,\n2023\t\t2022\t\t2021\nREVENUES\t\t\t\t\t\t\nVertically Integrated Utilities\t\t$\t11,303.7 \t\t\t$\t11,292.8 \t\t\t$\t9,852.2 \t\nTransmission and Distribution Utilities\t\t5,677.2 \t\t\t5,489.6 \t\t\t4,464.1 \t\nGeneration & Marketing\t\t1,543.3 \t\t\t2,448.9 \t\t\t2,108.3 \t\nOther Revenues\t\t458.1 \t\t\t408.2 \t\t\t367.4 \t\nTOTAL REVENUES\t\t18,982.3 \t\t\t19,639.5 \t\t\t16,792.0 \t\nEXPENSES\t\t\t\t\t\t\nPurchased Electricity, Fuel and Other Consumables Used for Electric Generation\t\t6,578.3 \t\t\t7,097.9 \t\t\t5,466.3 \t\nOther Operation\t\t2,810.5 \t\t\t2,878.1 \t\t\t2,547.7 \t\nMaintenance\t\t1,276.3 \t\t\t1,249.4 \t\t\t1,121.8 \t\nLoss on the Expected Sale of the Kentucky Operations\t\t— \t\t\t363.3 \t\t\t— \t\nAsset Impairments and Other Related Charges\t\t85.6 \t\t\t48.8 \t\t\t11.6 \t\nEstablishment of 2017-2019 Virginia Triennial Review Regulatory Asset\t\t— \t\t\t(37.0)\t\t\t— \t\nGain on the Sale of Mineral Rights\t\t— \t\t\t(116.3)\t\t\t— \t\nLoss on the Sale of the Competitive Contracted Renewables Portfolio\t\t92.7 \t\t\t— \t\t\t— \t\nDepreciation and Amortization\t\t3,090.4 \t\t\t3,202.8 \t\t\t2,825.7 \t\nTaxes Other Than Income Taxes\t\t1,492.3 \t\t\t1,469.8 \t\t\t1,407.6 \t\nTOTAL EXPENSES\t\t15,426.1 \t\t\t16,156.8 \t\t\t13,380.7 \t\nOPERATING INCOME\t\t3,556.2 \t\t\t3,482.7 \t\t\t3,411.3 \t\nOther Income (Expense):\t\t\t\t\t\t\nOther Income\t\t63.4 \t\t\t11.6 \t\t\t41.4 \t\nAllowance for Equity Funds Used During Construction\t\t174.9 \t\t\t133.7 \t\t\t139.7 \t\nNon-Service Cost Components of Net Periodic Benefit Cost\t\t221.1 \t\t\t188.5 \t\t\t118.6 \t\nInterest Expense\t\t(1,806.9)\t\t\t(1,396.1)\t\t\t(1,199.1)\t\nINCOME BEFORE INCOME TAX EXPENSE AND EQUITY EARNINGS (LOSS)\t\t2,208.7 \t\t\t2,420.4 \t\t\t2,511.9 \t\nIncome Tax Expense\t\t54.6 \t\t\t5.4 \t\t\t115.5 \t\nEquity Earnings (Loss) of Unconsolidated Subsidiaries\t\t58.5 \t\t\t(109.4)\t\t\t91.7 \t\nNET INCOME\t\t2,212.6 \t\t\t2,305.6 \t\t\t2,488.1 \t\nNet Income (Loss) Attributable to Noncontrolling Interests\t\t4.5 \t\t\t(1.6)\t\t\t— \t\nEARNINGS ATTRIBUTABLE TO AEP COMMON SHAREHOLDERS\t\t$\t2,208.1 \t\t\t$\t2,307.2 \t\t\t$\t2,488.1 \t\nWEIGHTED AVERAGE NUMBER OF BASIC AEP COMMON SHARES OUTSTANDING\n518,903,682 \t\t\t511,841,946 \t\t\t500,522,177 \t\nTOTAL BASIC EARNINGS PER SHARE ATTRIBUTABLE TO AEP COMMON SHAREHOLDERS\n$\t4.26 \t\t\t$\t4.51 \t\t\t$\t4.97 \t\nWEIGHTED AVERAGE NUMBER OF DILUTED AEP COMMON SHARES OUTSTANDING\t\t520,206,258 \t\t\t513,484,609 \t\t\t501,784,032 \t\nTOTAL DILUTED EARNINGS PER SHARE ATTRIBUTABLE TO AEP COMMON SHAREHOLDERS\n$\t4.24 \t\t\t$\t4.49 \t\t\t$\t4.96']",,Addition,FinDER,Arithmetic,"['AMERICAN ELECTRIC POWER COMPANY, INC. AND SUBSIDIARY COMPANIES\nCONSOLIDATED STATEMENTS OF INCOME\nFor the Years Ended December 31, 2023, 2022 and 2021\n (in millions, except per-share and share amounts)\nYears Ended December 31,\n2023\t\t2022\t\t2021\nREVENUES\t\t\t\t\t\t\nVertically Integrated Utilities\t\t$\t11,303.7 \t\t\t$\t11,292.8 \t\t\t$\t9,852.2 \t\nTransmission and Distribution Utilities\t\t5,677.2 \t\t\t5,489.6 \t\t\t4,464.1 \t\nGeneration & Marketing\t\t1,543.3 \t\t\t2,448.9 \t\t\t2,108.3 \t\nOther Revenues\t\t458.1 \t\t\t408.2 \t\t\t367.4 \t\nTOTAL REVENUES\t\t18,982.3 \t\t\t19,639.5 \t\t\t16,792.0 \t\nEXPENSES\t\t\t\t\t\t\nPurchased Electricity, Fuel and Other Consumables Used for Electric Generation\t\t6,578.3 \t\t\t7,097.9 \t\t\t5,466.3 \t\nOther Operation\t\t2,810.5 \t\t\t2,878.1 \t\t\t2,547.7 \t\nMaintenance\t\t1,276.3 \t\t\t1,249.4 \t\t\t1,121.8 \t\nLoss on the Expected Sale of the Kentucky Operations\t\t— \t\t\t363.3 \t\t\t— \t\nAsset Impairments and Other Related Charges\t\t85.6 \t\t\t48.8 \t\t\t11.6 \t\nEstablishment of 2017-2019 Virginia Triennial Review Regulatory Asset\t\t— \t\t\t(37.0)\t\t\t— \t\nGain on the Sale of Mineral Rights\t\t— \t\t\t(116.3)\t\t\t— \t\nLoss on the Sale of the Competitive Contracted Renewables Portfolio\t\t92.7 \t\t\t— \t\t\t— \t\nDepreciation and Amortization\t\t3,090.4 \t\t\t3,202.8 \t\t\t2,825.7 \t\nTaxes Other Than Income Taxes\t\t1,492.3 \t\t\t1,469.8 \t\t\t1,407.6 \t\nTOTAL EXPENSES\t\t15,426.1 \t\t\t16,156.8 \t\t\t13,380.7 \t\nOPERATING INCOME\t\t3,556.2 \t\t\t3,482.7 \t\t\t3,411.3 \t\nOther Income (Expense):\t\t\t\t\t\t\nOther Income\t\t63.4 \t\t\t11.6 \t\t\t41.4 \t\nAllowance for Equity Funds Used During Construction\t\t174.9 \t\t\t133.7 \t\t\t139.7 \t\nNon-Service Cost Components of Net Periodic Benefit Cost\t\t221.1 \t\t\t188.5 \t\t\t118.6 \t\nInterest Expense\t\t(1,806.9)\t\t\t(1,396.1)\t\t\t(1,199.1)\t\nINCOME BEFORE INCOME TAX EXPENSE AND EQUITY EARNINGS (LOSS)\t\t2,208.7 \t\t\t2,420.4 \t\t\t2,511.9 \t\nIncome Tax Expense\t\t54.6 \t\t\t5.4 \t\t\t115.5 \t\nEquity Earnings (Loss) of Unconsolidated Subsidiaries\t\t58.5 \t\t\t(109.4)\t\t\t91.7 \t\nNET INCOME\t\t2,212.6 \t\t\t2,305.6 \t\t\t2,488.1 \t\nNet Income (Loss) Attributable to Noncontrolling Interests\t\t4.5 \t\t\t(1.6)\t\t\t— \t\nEARNINGS ATTRIBUTABLE TO AEP COMMON SHAREHOLDERS\t\t$\t2,208.1 \t\t\t$\t2,307.2 \t\t\t$\t2,488.1 \t\nWEIGHTED AVERAGE NUMBER OF BASIC AEP COMMON SHARES OUTSTANDING\n518,903,682 \t\t\t511,841,946 \t\t\t500,522,177 \t\nTOTAL BASIC EARNINGS PER SHARE ATTRIBUTABLE TO AEP COMMON SHAREHOLDERS\n$\t4.26 \t\t\t$\t4.51 \t\t\t$\t4.97 \t\nWEIGHTED AVERAGE NUMBER OF DILUTED AEP COMMON SHARES OUTSTANDING\t\t520,206,258 \t\t\t513,484,609 \t\t\t501,784,032 \t\nTOTAL DILUTED EARNINGS PER SHARE ATTRIBUTABLE TO AEP COMMON SHAREHOLDERS\n$\t4.24 \t\t\t$\t4.49 \t\t\t$\t4.96']",800ca373,True,"['The computation of basic earnings (loss) per share (EPS) is based on the weighted-average number of our common shares outstanding. The computation of diluted EPS is based on the weighted-average number of our common shares outstanding and potential dilutive common shares outstanding during the period as determined by using the treasury stock method.\n\nBasic and diluted EPS for the years ended December 31, 2023, 2022 and 2021 were calculated as follows (in millions, except per share data):\nYears Ended December 31,\n2023\t\t2022\t\t2021\nNumerator:\nNet (loss) income\n$\t(4,714)\t\t\t$\t8,362 \t\t\t$\t12,202 \t\nDenominator:\nBasic weighted-average common shares outstanding\t382 \t\t\t394 \t\t\t403 \t\nEffect of dilutive securities\t— \t\t\t22 \t\t\t28 \t\nDiluted weighted-average common shares outstanding\t382 \t\t\t416 \t\t\t431 \t\nBasic EPS\t$\t(12.33)\t\t\t$\t21.26 \t\t\t$\t30.31 \t\nDiluted EPS\t$\t(12.33)\t\t\t$\t20.12 \t\t\t$\t28.29', 'The table below details the computation of basic and diluted earnings per share (""EPS""):\nFiscal Year Ended 30 September\t2024\t\t2023\t\t2022\nNumerator\t\t\t\t\t\nNet income from continuing operations\t$3,842.1 \t\t\t$2,292.8 \t\t\t$2,243.5 \t\nNet (loss) income from discontinued operations\t(13.9)\t\t\t7.4 \t\t\t12.6 \t\nNet Income attributable to Air Products\t$3,828.2 \t\t\t$2,300.2 \t\t\t$2,256.1 \t\nDenominator (in millions)\nWeighted average common shares — Basic\t222.5 \t\t\t222.3 \t\t\t222.0 \t\nEffect of dilutive securities\t\t\t\t\t\nEmployee stock option and other award plans\t0.3 \t\t\t0.4 \t\t\t0.5 \t\nWeighted average common shares — Diluted\t222.8 \t\t\t222.7 \t\t\t222.5 \t\nPer Share Data(A) (U.S. Dollars per share)\nBasic EPS from continuing operations\t$17.27 \t\t\t$10.31 \t\t\t$10.11 \t\nBasic EPS from discontinued operations\t(0.06)\t\t\t0.03 \t\t\t0.06 \t\nBasic EPS attributable to Air Products\t$17.21 \t\t\t$10.35 \t\t\t$10.16 \t\nDiluted EPS from continuing operations\t$17.24 \t\t\t$10.30 \t\t\t$10.08 \t\nDiluted EPS from discontinued operations\t(0.06)\t\t\t0.03 \t\t\t0.06 \t\nDiluted EPS attributable to Air Products\t$17.18 \t\t\t$10.33 \t\t\t$10.14 \t\n \n(A)EPS is calculated independently for each component and may not sum to total EPS due to rounding.\nDiluted EPS attributable to Air Products reflects the potential dilution that could occur if stock options or other share-based awards were exercised or converted into common stock. The dilutive effect is computed using the treasury stock method, which assumes all share-based awards are exercised, and the hypothetical proceeds from exercise are used by the Company to purchase common stock at the average market price during the period. To the extent they would have been dilutive, the incremental shares, or the difference between shares assumed to be issued versus purchased, are included in the denominator of the diluted EPS calculation. Antidilutive outstanding share-based awards were not material in fiscal years 2024, 2023 and 2022.', 'Basic earnings per share (EPS) is based upon “Net Income (Loss) Attributable to Chevron Corporation” (“earnings”) and includes the effects of deferrals of salary and other compensation awards that are invested in Chevron stock units by certain officers and employees of the company. Diluted EPS includes the effects of these items as well as the dilutive effects of outstanding stock options awarded under the company’s stock option programs (refer to Note 22 Stock Options and Other Share-Based Compensation). The table below sets forth the computation of basic and diluted EPS:\n\tYear ended December 31\n2023\t\t\t2022\t\t2021\nBasic EPS Calculation\t\t\t\t\t\t\nEarnings available to common stockholders - Basic*\n$\t21,369 \t\t\t\t$\t35,465 \t\t\t$\t15,625 \t\nWeighted-average number of common shares outstanding\t1,873 \t\t\t\t1,931 \t\t\t1,916 \t\nAdd: Deferred awards held as stock units\n— \t\t\t\t— \t\t\t— \t\nTotal weighted-average number of common shares outstanding\t1,873 \t\t\t\t1,931 \t\t\t1,916 \t\nEarnings per share of common stock - Basic\t$\t11.41 \t\t\t\t$\t18.36 \t\t\t$\t8.15 \t\nDiluted EPS Calculation\t\t\t\t\t\t\nEarnings available to common stockholders - Diluted*\n$\t21,369 \t\t\t\t$\t35,465 \t\t\t$\t15,625 \t\nWeighted-average number of common shares outstanding\t1,873 \t\t\t\t1,931 \t\t\t1,916 \t\nAdd: Deferred awards held as stock units\n— \t\t\t\t— \t\t\t— \t\nAdd: Dilutive effect of employee stock-based awards\n7 \t\t\t\t9 \t\t\t4 \t\nTotal weighted-average number of common shares outstanding\t1,880 \t\t\t\t1,940 \t\t\t1,920 \t\nEarnings per share of common stock - Diluted\t$\t11.36 \t\t\t\t$\t18.28 \t\t\t$\t8.14 \t\n* There was no effect of dividend equivalents paid on stock units or dilutive impact of employee stock-based awards on earnings.', 'The numerators and denominators of the basic and diluted EPS computations for our common stock are calculated as follows (in millions, except per share amounts):\n \tYear Ended December 31,\n \t2023\t\t2022\t\t2021\n \tClass\nA\t\tClass\nB\t\tClass\nA\t\tClass\nB\t\tClass\nA\t\t\nClass\nB \nBasic EPS:\t \t\t \t\t \t\t \t\t \t\t \nNumerator\t \t\t \t\t \t\t \t\t \t\t \nNet income\t$\t33,722 \t\t\t$\t5,376 \t\t\t$\t19,729 \t\t\t$\t3,471 \t\t\t$\t33,328 \t\t\t$\t6,042 \t\nDenominator\t \t\t \t\t \t\t \t\t \t\t \nShares used in computation of basic earnings per share\t2,220 \t\t\t354 \t\t\t2,285 \t\t\t402 \t\t\t2,383 \t\t\t432 \t\nBasic EPS\t$\t15.19 \t\t\t$\t15.19 \t\t\t$\t8.63 \t\t\t$\t8.63 \t\t\t$\t13.99 \t\t\t$\t13.99 \t\nDiluted EPS:\t \t\t \t\t\t\t \t\t\t\t \nNumerator\t \t\t \t\t \t\t \t\t \t\t \nNet income\t$\t33,722 \t\t\t$\t5,376 \t\t\t$\t19,729 \t\t\t$\t3,471 \t\t\t$\t33,328 \t\t\t$\t6,042 \t\nReallocation of net income as a result of conversion of Class B to Class A common stock\t5,376 \t\t\t— \t\t\t3,471 \t\t\t— \t\t\t6,042 \t\t\t— \t\nReallocation of net income to Class B common stock\t— \t\t\t(112)\t\t\t— \t\t\t(19)\t\t\t— \t\t\t(93)\t\nNet income for diluted EPS\t$\t39,098 \t\t\t$\t5,264 \t\t\t$\t23,200 \t\t\t$\t3,452 \t\t\t$\t39,370 \t\t\t$\t5,949 \t\nDenominator\t \t\t \t\t \t\t \t\t \t\t \nShares used in computation of basic earnings per share\t2,220 \t\t\t354 \t\t\t2,285 \t\t\t402 \t\t\t2,383 \t\t\t432 \t\nConversion of Class B to Class A common stock\t354 \t\t\t— \t\t\t402 \t\t\t— \t\t\t432 \t\t\t— \t\nWeighted-average effect of dilutive RSUs\t55 \t\t\t— \t\t\t15 \t\t\t— \t\t\t44 \t\t\t— \t\nShares used in computation of diluted earnings per share\t2,629 \t\t\t354 \t\t\t2,702 \t\t\t402 \t\t\t2,859 \t\t\t432 \t\nDiluted EPS\t$\t14.87 \t\t\t$\t14.87 \t\t\t$\t8.59 \t\t\t$\t8.59 \t\t\t$\t13.77 \t\t\t$\t13.77', '$\n\n7,607,337\n\n \n\n \n\n$\n\n6,827,461\n\n \n\nNet earnings per share:\n\n \n\n \n\n \n\n \n\n \n\n \n\n \n\n \n\n \n\nBasic\n\n \n\n$\n\n18.05\n\n \n\n \n\n$\n\n28.88\n\n \n\n \n\n$\n\n23.23\n\n \n\nDiluted\n\n \n\n$\n\n18.00\n\n \n\n \n\n$\n\n28.79\n\n \n\n \n\n$\n\n23.16', 'Earnings Per Common Share (“EPS”)\n\n \t\t2023\t\t2022\t\t2021\nNet Income\t\t$\t1,597 \t\t\t$\t1,325 \t\t\t$\t1,575 \t\nWeighted-average common shares outstanding (for basic calculation)\t\t281 \t\t\t286 \t\t\t297 \t\nEffect of dilutive share-based employee compensation\t\t4 \t\t\t4 \t\t\t5 \t\nWeighted-average common and dilutive potential common shares outstanding (for diluted calculation)\t\t285 \t\t\t290 \t\t\t302 \t\nBasic EPS\t\t$\t5.68 \t\t\t$\t4.63 \t\t\t$\t5.30 \t\nDiluted EPS\t\t$\t5.59 \t\t\t$\t4.57 \t\t\t$\t5.21 \t\nUnexercised employee SARs, RSUs, PSUs and stock options (in millions) excluded from the diluted EPS computation(a)\n1.7 \t\t\t1.9 \t\t\t1.1 \t\n \n(a)    These unexercised employee SARs, RSUs, performance share units (""PSUs"") and stock options were not included in the computation of diluted EPS because to do so would have been antidilutive for the periods presented.', 'The following tables provide earnings per share calculations for the years ended December 31, 2023, 2022 and 2021:\nNet Income for Earnings Per Share Calculations - Basic & Diluted\nIn millions\n2023\t2022\t2021\nIncome from continuing operations, net of tax\t$\t533 \t\t$\t1,061 \t\t$\t1,207 \t\nNet income from continuing operations attributable to noncontrolling interests\t39 \t\t53 \t\t30 \t\nIncome from continuing operations attributable to common stockholders\t$\t494 \t\t$\t1,008 \t\t$\t1,177 \t\n(Loss) income from discontinued operations, net of tax\t(71)\t\t4,856 \t\t5,308 \t\nNet (loss) income from discontinued operations attributable to noncontrolling interests\t— \t\t(4)\t\t18 \t\n(Loss) income from discontinued operations attributable to common stockholders\t(71)\t\t4,860 \t\t5,290 \t\nNet income available to common stockholders\t$\t423 \t\t$\t5,868 \t\t$\t6,467 \t\n \nEarnings Per Share Calculations - Basic\nDollars per share\n2023\t2022\t2021\nEarnings from continuing operations attributable to common stockholders\t$\t1.10 \t\t$\t2.02 \t\t$\t2.17 \t\n(Loss) earnings from discontinued operations, net of tax\t(0.16)\t\t9.75 \t\t9.75 \t\nEarnings available to common stockholders 1\n$\t0.94 \t\t$\t11.77 \t\t$\t11.92 \t\n \nEarnings Per Share Calculations - Diluted\nDollars per share\n2023\t2022\t2021\nEarnings from continuing operations attributable to common stockholders\t$\t1.09 \t\t$\t2.02 \t\t$\t2.16 \t\n(Loss) earnings from discontinued operations, net of tax\t(0.16)\t\t9.73 \t\t9.72 \t\nEarnings available to common stockholders 1\n$\t0.94 \t\t$\t11.75 \t\t$\t11.89 \t\n \nShare Count Information\nShares in Millions\n2023\t2022\t2021\nWeighted-average common shares - basic\t449.9 \t\t498.5 \t\t542.7 \t\nPlus dilutive effect of equity compensation plans\t1.3 \t\t0.9 \t\t1.5 \t\nWeighted-average common shares - diluted\t451.2 \t\t499.4 \t\t544.2 \t\nStock options, restricted stock units, and performance-based restricted stock units excluded from EPS calculations 2\n2.6 \t\t4.1 \t\t2.8 \t\n \n1. Earnings per share amounts are computed independently for income from continuing operations, income from discontinued operations and net income attributable to common stockholders. As a result, the per share amounts from continuing operations and discontinued operations may not equal the total per share amounts for net income attributable to common stockholders.\n2. These outstanding options to purchase shares of common stock, restricted stock units and performance based restricted stock units were excluded from the calculation of diluted earnings per share because the effect of including them would have been antidilutive.', ""Earnings Overview\nThe following table summarizes Evergy's net income and diluted earnings per common share (EPS).\n2023\t\tChange\t\t2022\n(millions, except per share amounts)\nNet income attributable to Evergy, Inc.\t$\t731.3 \t\t\t$\t(21.4)\t\t\t$\t752.7 \t\nEarnings per common share, diluted\t3.17 \t\t\t(0.10)\t\t\t3.27 \t\n \nNet income attributable to Evergy, Inc. decreased in 2023, compared to 2022, primarily due to higher depreciation and interest expense in 2023, recording a $96.5 million deferral of revenues in 2023 for future refund of amounts previously collected from customers related to corporate-owned life insurance (COLI) rate credits and lower retail sales driven by unfavorable weather; partially offset by lower operating and maintenance expenses, new Evergy Metro and Evergy Missouri West retail rates effective in January 2023, the refund obligation of amounts collected from customers for the return on investment of Sibley Station recorded in 2022, lower income tax expense, the 2022 ordered refund to customers of certain transmission revenues and an increase due to Evergy Metro's Earnings Review and Sharing Plan (ERSP).\nDiluted EPS decreased in 2023, compared to 2022, primarily due to the decrease in net income attributable to Evergy, Inc. discussed above.\nFor additional information regarding the change in net income, refer to the Evergy Results of Operations section within this MD&A."", 'AMERICAN ELECTRIC POWER COMPANY, INC. AND SUBSIDIARY COMPANIES\nCONSOLIDATED STATEMENTS OF INCOME\nFor the Years Ended December 31, 2023, 2022 and 2021\n (in millions, except per-share and share amounts)\nYears Ended December 31,\n2023\t\t2022\t\t2021\nREVENUES\t\t\t\t\t\t\nVertically Integrated Utilities\t\t$\t11,303.7 \t\t\t$\t11,292.8 \t\t\t$\t9,852.2 \t\nTransmission and Distribution Utilities\t\t5,677.2 \t\t\t5,489.6 \t\t\t4,464.1 \t\nGeneration & Marketing\t\t1,543.3 \t\t\t2,448.9 \t\t\t2,108.3 \t\nOther Revenues\t\t458.1 \t\t\t408.2 \t\t\t367.4 \t\nTOTAL REVENUES\t\t18,982.3 \t\t\t19,639.5 \t\t\t16,792.0 \t\nEXPENSES\t\t\t\t\t\t\nPurchased Electricity, Fuel and Other Consumables Used for Electric Generation\t\t6,578.3 \t\t\t7,097.9 \t\t\t5,466.3 \t\nOther Operation\t\t2,810.5 \t\t\t2,878.1 \t\t\t2,547.7 \t\nMaintenance\t\t1,276.3 \t\t\t1,249.4 \t\t\t1,121.8 \t\nLoss on the Expected Sale of the Kentucky Operations\t\t— \t\t\t363.3 \t\t\t— \t\nAsset Impairments and Other Related Charges\t\t85.6 \t\t\t48.8 \t\t\t11.6 \t\nEstablishment of 2017-2019 Virginia Triennial Review Regulatory Asset\t\t— \t\t\t(37.0)\t\t\t— \t\nGain on the Sale of Mineral Rights\t\t— \t\t\t(116.3)\t\t\t— \t\nLoss on the Sale of the Competitive Contracted Renewables Portfolio\t\t92.7 \t\t\t— \t\t\t— \t\nDepreciation and Amortization\t\t3,090.4 \t\t\t3,202.8 \t\t\t2,825.7 \t\nTaxes Other Than Income Taxes\t\t1,492.3 \t\t\t1,469.8 \t\t\t1,407.6 \t\nTOTAL EXPENSES\t\t15,426.1 \t\t\t16,156.8 \t\t\t13,380.7 \t\nOPERATING INCOME\t\t3,556.2 \t\t\t3,482.7 \t\t\t3,411.3 \t\nOther Income (Expense):\t\t\t\t\t\t\nOther Income\t\t63.4 \t\t\t11.6 \t\t\t41.4 \t\nAllowance for Equity Funds Used During Construction\t\t174.9 \t\t\t133.7 \t\t\t139.7 \t\nNon-Service Cost Components of Net Periodic Benefit Cost\t\t221.1 \t\t\t188.5 \t\t\t118.6 \t\nInterest Expense\t\t(1,806.9)\t\t\t(1,396.1)\t\t\t(1,199.1)\t\nINCOME BEFORE INCOME TAX EXPENSE AND EQUITY EARNINGS (LOSS)\t\t2,208.7 \t\t\t2,420.4 \t\t\t2,511.9 \t\nIncome Tax Expense\t\t54.6 \t\t\t5.4 \t\t\t115.5 \t\nEquity Earnings (Loss) of Unconsolidated Subsidiaries\t\t58.5 \t\t\t(109.4)\t\t\t91.7 \t\nNET INCOME\t\t2,212.6 \t\t\t2,305.6 \t\t\t2,488.1 \t\nNet Income (Loss) Attributable to Noncontrolling Interests\t\t4.5 \t\t\t(1.6)\t\t\t— \t\nEARNINGS ATTRIBUTABLE TO AEP COMMON SHAREHOLDERS\t\t$\t2,208.1 \t\t\t$\t2,307.2 \t\t\t$\t2,488.1 \t\nWEIGHTED AVERAGE NUMBER OF BASIC AEP COMMON SHARES OUTSTANDING\n518,903,682 \t\t\t511,841,946 \t\t\t500,522,177 \t\nTOTAL BASIC EARNINGS PER SHARE ATTRIBUTABLE TO AEP COMMON SHAREHOLDERS\n$\t4.26 \t\t\t$\t4.51 \t\t\t$\t4.97 \t\nWEIGHTED AVERAGE NUMBER OF DILUTED AEP COMMON SHARES OUTSTANDING\t\t520,206,258 \t\t\t513,484,609 \t\t\t501,784,032 \t\nTOTAL DILUTED EARNINGS PER SHARE ATTRIBUTABLE TO AEP COMMON SHAREHOLDERS\n$\t4.24 \t\t\t$\t4.49 \t\t\t$\t4.96', 'NET INCOME\tYear Ended June 30,\t\t\n%\nChange\n \t2024\t\t2023\t\nNet income\t$\t381,816 \t\t\t$\t366,646 \t\t\t4.1%\nDiluted earnings per share\t$\t5.23 \t\t\t$\t5.02 \t\t\t4.2%\n \nNet income grew 4.1% to $381,816, or $5.23 per diluted share, in fiscal 2024 from $366,646, or $5.02 per diluted share, in fiscal 2023. The diluted earnings per share increase fiscal year over fiscal year was 4.2%. This increase was primarily due to growth in our lines of revenue and a reduction in the number of weighted average shares outstanding partially offset by higher operating expenses in fiscal 2024 compared to fiscal 2023 .']",1009.574249968864,"FY 23 net loss of 4,714 million divided by 382 million basic shares = −12.34 per share, which rounds to the reported basic EPS of −12.33."
11,11,3c29b579,"Howmet Aerospace CBA expiry & UAW coverage at Whitehall, MI; ticker at end.","The agreement at the Whitehall, Michigan location covers approximately 1,400 employees out of the 3,400 unionized U.S. employees, which is about 41.2% of the U.S. union workforce. This collective bargaining agreement is set to expire on April 1, 2028.","['Total worldwide employment at the end of 2023 was approximately 23,200 employees in 23 countries.\nApproximately 3,400 employees, or 25% of the U.S. workforce, are represented by labor unions in the United States. Within the United States, there are eight collective bargaining agreements with varying expiration dates between Howmet and various labor unions. Of these eight, the largest workforce covered under a collective bargaining agreement is between Howmet and the United Autoworkers (“UAW”) at our Whitehall, Michigan location. This covers approximately 1,400 employees; the current agreement, which was ratified in 2023, expires on April 1, 2028. The second largest workforce covered under a collective bargaining agreement is between Howmet and the UAW at our Cleveland, Ohio location. This covers approximately 750 employees; the current agreement expires on April 28, 2024. The Cleveland location began negotiations with the UAW in February 2024. On a regional basis, collective bargaining agreements with varying expiration dates cover employees in Europe, North America, South America, and Asia. The Company believes that it has positive relationships with its employees and any respective labor union representatives.']",,Division,FinDER,Arithmetic,"['Total worldwide employment at the end of 2023 was approximately 23,200 employees in 23 countries.\nApproximately 3,400 employees, or 25% of the U.S. workforce, are represented by labor unions in the United States. Within the United States, there are eight collective bargaining agreements with varying expiration dates between Howmet and various labor unions. Of these eight, the largest workforce covered under a collective bargaining agreement is between Howmet and the United Autoworkers (“UAW”) at our Whitehall, Michigan location. This covers approximately 1,400 employees; the current agreement, which was ratified in 2023, expires on April 1, 2028. The second largest workforce covered under a collective bargaining agreement is between Howmet and the UAW at our Cleveland, Ohio location. This covers approximately 750 employees; the current agreement expires on April 28, 2024. The Cleveland location began negotiations with the UAW in February 2024. On a regional basis, collective bargaining agreements with varying expiration dates cover employees in Europe, North America, South America, and Asia. The Company believes that it has positive relationships with its employees and any respective labor union representatives.']",3c29b579,True,"['Total worldwide employment at the end of 2023 was approximately 23,200 employees in 23 countries.\nApproximately 3,400 employees, or 25% of the U.S. workforce, are represented by labor unions in the United States. Within the United States, there are eight collective bargaining agreements with varying expiration dates between Howmet and various labor unions. Of these eight, the largest workforce covered under a collective bargaining agreement is between Howmet and the United Autoworkers (“UAW”) at our Whitehall, Michigan location. This covers approximately 1,400 employees; the current agreement, which was ratified in 2023, expires on April 1, 2028. The second largest workforce covered under a collective bargaining agreement is between Howmet and the UAW at our Cleveland, Ohio location. This covers approximately 750 employees; the current agreement expires on April 28, 2024. The Cleveland location began negotiations with the UAW in February 2024. On a regional basis, collective bargaining agreements with varying expiration dates cover employees in Europe, North America, South America, and Asia. The Company believes that it has positive relationships with its employees and any respective labor union representatives.', ""Purchase & Other Obligations. Howmet has entered into commitments for raw materials, energy and other obligations, which total $244 in 2024, $32 in 2025, $11 in 2026, and none in 2027, 2028 and thereafter.\nOperating Leases. See Note P for the operating lease future minimum contractual obligations.\nGuarantees. As of December 31, 2023, Howmet had outstanding bank guarantees related to tax matters, outstanding debt, workers’ compensation, environmental obligations, and customs duties, among others. The total amount committed under these guarantees, which expire at various dates between 2024 and 2040, was $24 as of December 31, 2023.\nPursuant to the Separation and Distribution Agreement, dated as of October 31, 2016, between Howmet and Alcoa Corporation, Howmet was required to provide certain guarantees for Alcoa Corporation, which had a fair value of $6 as of both December 31, 2023 and 2022, and were included in Other noncurrent liabilities and deferred credits in the Consolidated Balance Sheet. The remaining guarantee, for which the Company and Arconic Corporation are secondarily liable in the event of a payment default by Alcoa Corporation, relates to a long-term energy supply agreement that expires in 2047 at an Alcoa Corporation facility. The Company currently views the risk of an Alcoa Corporation payment default on its obligations under the contract to be remote. The Company and Arconic Corporation are required to provide a guarantee up to an estimated present value amount of approximately $1,131 and $1,040 as of December 31, 2023 and 2022, respectively, in the event of an Alcoa Corporation default. In December 2021, December 2022, and December 2023, a surety bond with a limit of $80 relating to this guarantee was obtained by Alcoa Corporation to protect Howmet's obligation. This surety bond will be renewed on an annual basis by Alcoa Corporation.\nLetters of Credit. The Company has outstanding letters of credit, primarily related to workers’ compensation, environmental obligations, and insurance obligations, among others. The total amount committed under these letters of credit, which automatically renew or expire at various dates, mostly in 2024, was $114 as of December 31, 2023.\nPursuant to the Separation and Distribution Agreements between the Company and Arconic Corporation and between the Company and Alcoa Corporation, the Company is required to retain letters of credit of $52 (which are included in the $114 in the above paragraph) that had previously been provided related to the Company, Arconic Corporation, and Alcoa Corporation workers’ compensation claims that occurred prior to the respective separation transactions of April 1, 2020 and November 1, 2016. Arconic Corporation and Alcoa Corporation workers’ compensation and letters of credit fees paid by the Company are proportionally billed to, and are reimbursed by, Arconic Corporation and Alcoa Corporation, respectively. Also, the Company was required to provide letters of credit for certain Arconic Corporation environmental obligations and, as a result, the Company has $17 of outstanding letters of credit relating to such liabilities (which are also included in the $114 in the above paragraph). Arconic Corporation has issued surety bonds to cover these environmental obligations. Arconic Corporation is being billed for these letter of credit fees paid by the Company and will reimburse the Company for any payments made under these letters of credit.\nSurety Bonds. The Company has outstanding surety bonds primarily related to tax matters, contract performance, workers’ compensation, environmental-related matters, energy contracts, and customs duties. The total amount committed under these annual surety bonds, which automatically renew or expire at various dates, primarily in 2024 and 2025, was $43 as of December 31, 2023.\nPursuant to the Separation and Distribution Agreements between the Company and Arconic Corporation and between the Company and Alcoa Corporation, the Company is required to provide surety bonds of $21 (which are included in the $43 in the above paragraph) that had previously been provided related to the Company, Arconic Corporation, and Alcoa Corporation workers’ compensation claims that occurred prior to the respective separation transactions of April 1, 2020 and November 1, 2016. Arconic Corporation and Alcoa Corporation workers’ compensation claims and surety bond fees paid by the Company are proportionately billed to, and are reimbursed by, Arconic Corporation and Alcoa Corporation."", 'Howmet Aerospace Inc. and subsidiaries\nConsolidated Balance Sheet\n(in millions)\n  \nDecember 31,\t2023\t\t2022\nAssets\t\t\t\nCurrent assets:\t\t\t\nCash and cash equivalents\t$\t610 \t\t\t$\t791 \t\nReceivables from customers, less allowances of $— in 2023 and $1 in 2022 (L)\n675 \t\t\t506 \t\nOther receivables (L)\n17 \t\t\t31 \t\nInventories (M)\n1,765 \t\t\t1,609 \t\nPrepaid expenses and other current assets\t249 \t\t\t206 \t\nTotal current assets\t3,316 \t\t\t3,143 \t\nProperties, plants, and equipment, net (N)\n2,328 \t\t\t2,332 \t\nGoodwill (A and O)\n4,035 \t\t\t4,013 \t\nDeferred income taxes (H)\n46 \t\t\t54 \t\nIntangibles, net (O)\n505 \t\t\t521 \t\nOther noncurrent assets (A and P)\n198 \t\t\t192 \t\nTotal assets\t$\t10,428 \t\t\t$\t10,255 \t\nLiabilities\t\t\t\nCurrent liabilities:\t\t\t\nAccounts payable, trade\t$\t982 \t\t\t$\t962 \t\nAccrued compensation and retirement costs\t263 \t\t\t195 \t\nTaxes, including income taxes\t68 \t\t\t48 \t\nAccrued interest payable\t65 \t\t\t75 \t\nOther current liabilities (A and P)\n200 \t\t\t202 \t\nLong-term debt due within one year (Q and R)\n206 \t\t\t— \t\nTotal current liabilities\t1,784 \t\t\t1,482 \t\nLong-term debt, less amount due within one year (Q and R)\n3,500 \t\t\t4,162 \t\nAccrued pension benefits (G)\n664 \t\t\t633 \t\nAccrued other postretirement benefits (G)\n92 \t\t\t109 \t\nOther noncurrent liabilities and deferred credits (A and P)\n351 \t\t\t268 \t\nTotal liabilities\t6,391 \t\t\t6,654 \t\nContingencies and commitments (U)\nEquity\t\t\t\nHowmet Aerospace Inc. shareholders’ equity:\t\t\t\nPreferred stock (I)\n55 \t\t\t55 \t\nCommon stock (I)\n410 \t\t\t412 \t\nAdditional capital (I)\n3,682 \t\t\t3,947 \t\nRetained earnings (A)\n1,720 \t\t\t1,028 \t\nAccumulated other comprehensive loss (A and K)\n(1,830)\t\t\t(1,841)\t\nTotal equity\t4,037 \t\t\t3,601 \t\nTotal liabilities and equity\t$\t10,428 \t\t\t$\t10,255', 'Howmet Aerospace Inc. and subsidiaries\nStatement of Consolidated Operations\n(in millions, except per-share amounts) \nFor the year ended December 31,\t2023\t\t2022\t\t2021\nSales (C)\n$\t6,640 \t\t\t$\t5,663 \t\t\t$\t4,972 \t\nCost of goods sold (exclusive of expenses below)\t4,773 \t\t\t4,103 \t\t\t3,596 \t\nSelling, general administrative, and other expenses\t333 \t\t\t288 \t\t\t251 \t\nResearch and development expenses\t36 \t\t\t32 \t\t\t17 \t\nProvision for depreciation and amortization\t272 \t\t\t265 \t\t\t270 \t\nRestructuring and other charges (D)\n23 \t\t\t56 \t\t\t90 \t\nOperating income\t1,203 \t\t\t919 \t\t\t748 \t\nLoss on debt redemption (Q)\n2 \t\t\t2 \t\t\t146 \t\nInterest expense, net (E)\n218 \t\t\t229 \t\t\t259 \t\nOther expense, net (F)\n8 \t\t\t82 \t\t\t19 \t\nIncome before income taxes\t975 \t\t\t606 \t\t\t324 \t\nProvision for income taxes (H)\n210 \t\t\t137 \t\t\t66 \t\nNet income\t$\t765 \t\t\t$\t469 \t\t\t$\t258 \t\nAmounts Attributable to Howmet Aerospace Inc. Common Shareholders (J):\nNet income\t$\t763 \t\t\t$\t467 \t\t\t$\t256 \t\nEarnings per share:\t\t\t\t\t\nBasic\t$\t1.85 \t\t\t$\t1.12 \t\t\t$\t0.60 \t\nDiluted\t$\t1.83 \t\t\t$\t1.11 \t\t\t$\t0.59 \t\nAverage Shares Outstanding (I):\nBasic\t412 \t\t\t416 \t\t\t430 \t\nDiluted\t416 \t\t\t421 \t\t\t435', 'At December 30, 2023, we employed approximately 35,000 employees worldwide, with approximately 80% located in the U.S. and the remainder located outside of the U.S. Approximately 7,400, or 27%, of our U.S. employees, most of whom work for our Bell and Textron Aviation segments, are represented by unions under collective bargaining agreements, and certain of our non-U.S. employees are represented by organized works councils. From time to time our collective bargaining agreements expire. Historically, we have been successful in negotiating renewals to expiring agreements without any material disruption of operating activities, and management considers employee relations to be good.', 'Years Ended December 31,\n2023\t\t2022\t\t2021\nCapital expenditures\t\t\t\t\t\nAerospace\t$\t310 \t\t\t$\t246 \t\t\t$\t284 \t\nHoneywell Building Technologies\t79 \t\t\t74 \t\t\t62 \t\nPerformance Materials and Technologies\t462 \t\t\t318 \t\t\t265 \t\nSafety and Productivity Solutions\t106 \t\t\t50 \t\t\t190 \t\nCorporate and All Other\t82 \t\t\t78 \t\t\t94 \t\nTotal capital expenditures\t$\t1,039 \t\t\t$\t766 \t\t\t$\t895', 'At December 31, 2023, the Company had approximately 8,800 employees. Approximately 4% of its employees are covered by various collective bargaining agreements in the U.S. which will expire at various times between now and June 2028. There are no collective bargaining agreements in the U.S. that will expire within one year. Management believes that the Company has a positive relationship with its employees. The Company historically has been able to renegotiate its collective bargaining agreements satisfactorily, with its last work stoppage occurring in March 1993.', 'As of December 31, 2023, we had approximately 14,900 employees, including 4,300 salaried and 10,600 hourly employees. Approximately 63% of our hourly employees worked pursuant to collective bargaining agreements. The majority of our unionized employees are represented by the United Steel Workers (USW), the Printing Packaging Production Workers Union (PPPWU), the Association of Western Pulp and Paper Workers (AWPPW), the International Association of Machinists (IAM), and the International Brotherhood of Teamsters (IBT). We are currently in negotiations to renew or extend union contracts that have recently expired or are expiring in the near future. During 2023, we experienced no work stoppages, and we believe we have satisfactory labor relations with our employees.', 'At December 31, 2023, we employed approximately 87,000 (54%) hourly employees and approximately 76,000 (46%) salaried employees. At December 31, 2023, approximately 46,000 (46%) of our U.S. employees were represented by unions, a majority of which were represented by the International Union, United Automobile, Aerospace and Agricultural Implement Workers of America (UAW). The following table summarizes worldwide employment (in thousands):', 'As of December 31, 2023, we had a highly skilled workforce made up of approximately 122,000 employees, including approximately 65,000 engineers, scientists and information technology professionals. As of December 31, 2023, approximately 93% of our workforce was located in the U.S. and approximately 19% of our employees were covered by collective bargaining agreements with various unions. A number of our existing collective bargaining agreements expire in any given year. Historically, we have been successful in renegotiating expiring agreements without any material disruption of operating activities, and management considers employee and union relations to be good. This has continued to be the case in 2023.']",1057.0054589770734,"Covers about 1,400 UAW-represented employees and expires on April 1 2028.  Ticker: HWM"
12,12,5dbcd4b2,Feb 23 signature date for Wynn governance board continuity.,"The uniform signature date of February 23, 2024, indicates that all key signatories—ranging from the CEO to board directors—executed the document on the same day. This is significant in corporate governance as it confirms that on that date, the board and top management collectively endorsed the document, thereby establishing a single point in time when the decisions, policies, or updates reflected in the document became effective. Such synchronization helps ensure operational continuity by:

• Reinforcing the integrity and timing of the board's decisions—since all signatures confirm the board’s unified approval, it minimizes ambiguity about when the actions were officially adopted.

• Supporting transparency and accountability—stakeholders can clearly trace when the document was executed, which is a key aspect of sound governance.

• Indicating coordinated execution of corporate actions—this can be critical during periods of transition or strategic initiatives, ensuring that all directors and executive officers are aligned on the same timeline for the implementation of policies and decisions.

Ultimately, the single dated signature underscores the board’s unified commitment and reduces the risk of disputes regarding the timing or effectiveness of the board’s resolutions, thereby bolstering both internal governance standards and external investor confidence.","['Signature\t\tTitle\t\tDate\n/s/ Craig S. Billings\t\tDirector, Chief Executive Officer (Principal Executive Officer) at Wynn \t\tFebruary 23, 2024\nCraig S. Billings\t\t\t\t\n/s/ Julie Cameron-Doe\t\tChief Financial Officer (Principal Financial and Accounting Officer)\t\tFebruary 23, 2024\nJulie Cameron-Doe\t\t\t\t\n/s/ Philip G. Satre\t\tNon-Executive Chair of the Board and Director\t\tFebruary 23, 2024\nPhilip G. Satre\t\t\t\t\n/s/ Betsy S. Atkins\t\tDirector\t\tFebruary 23, 2024\nBetsy S. Atkins\t\t\t\t\n/s/ Richard J. Byrne\t\tDirector\t\tFebruary 23, 2024\nRichard J. Byrne\t\t\t\t\n/s/ Paul Liu\t\tDirector\t\tFebruary 23, 2024\nPaul Liu\t\t\t\t\n/s/ Patricia Mulroy\t\tDirector\t\tFebruary 23, 2024\nPatricia Mulroy\t\t\t\t\n/s/ Margaret J. Myers\t\tDirector\t\tFebruary 23, 2024\nMargaret J. Myers\t\t\t\t\n/s/ Darnell Strom\t\tDirector\t\tFebruary 23, 2024\nDarnell Strom\t\t\t\t\n/s/ Winifred Webb\t\tDirector\t\tFebruary 23, 2024\nWinifred Webb']",,,FinDER,Non-numerical,"['Signature\t\tTitle\t\tDate\n/s/ Craig S. Billings\t\tDirector, Chief Executive Officer (Principal Executive Officer) at Wynn \t\tFebruary 23, 2024\nCraig S. Billings\t\t\t\t\n/s/ Julie Cameron-Doe\t\tChief Financial Officer (Principal Financial and Accounting Officer)\t\tFebruary 23, 2024\nJulie Cameron-Doe\t\t\t\t\n/s/ Philip G. Satre\t\tNon-Executive Chair of the Board and Director\t\tFebruary 23, 2024\nPhilip G. Satre\t\t\t\t\n/s/ Betsy S. Atkins\t\tDirector\t\tFebruary 23, 2024\nBetsy S. Atkins\t\t\t\t\n/s/ Richard J. Byrne\t\tDirector\t\tFebruary 23, 2024\nRichard J. Byrne\t\t\t\t\n/s/ Paul Liu\t\tDirector\t\tFebruary 23, 2024\nPaul Liu\t\t\t\t\n/s/ Patricia Mulroy\t\tDirector\t\tFebruary 23, 2024\nPatricia Mulroy\t\t\t\t\n/s/ Margaret J. Myers\t\tDirector\t\tFebruary 23, 2024\nMargaret J. Myers\t\t\t\t\n/s/ Darnell Strom\t\tDirector\t\tFebruary 23, 2024\nDarnell Strom\t\t\t\t\n/s/ Winifred Webb\t\tDirector\t\tFebruary 23, 2024\nWinifred Webb']",5dbcd4b2,True,"['Signature\n\n  \n\nTitle(s)\n\n \n\nDate\n\n \n\n \n\n \n\n \n\n \n\n/s/ CHRISTOPHER R. CONCANNON\n\n \n\nChristopher R. Concannon\n\n  \n\nDirector, Chief Executive Officer and Interim Chief Financial Officer (principal executive officer and interim principal financial officer)\n\n \n\nFebruary 22, 2024\n\n \n\n \n\n \n\n/s/ MICHAEL R. CIANCIULLI\n\n \n\nMichael R. Cianciulli\n\n  \n\nHead of External Reporting (interim principal accounting officer)\n\n \n\nFebruary 22, 2024\n\n \n\n \n\n \n\n/s/ RICHARD M. MCVEY\n\n \n\nRichard M. McVey\n\n  \n\nExecutive Chairman of the Board of Directors\n\n \n\nFebruary 22, 2024\n\n \n\n \n\n \n\n/s/ NANCY ALTOBELLO\n\n  \n\nDirector\n\n \n\nFebruary 22, 2024\n\nNancy Altobello\n\n  \n\n \n\n \n\n \n\n \n\n \n\n \n\n/s/ STEVEN L. BEGLEITER\n\n  \n\nDirector\n\n \n\nFebruary 22, 2024\n\nSteven L. Begleiter\n\n  \n\n \n\n \n\n \n\n \n\n \n\n \n\n/s/ STEPHEN P. CASPER\n\n  \n\nDirector\n\n \n\nFebruary 22, 2024\n\nStephen P. Casper\n\n  \n\n \n\n \n\n \n\n \n\n \n\n \n\n/s/ JANE CHWICK\n\n  \n\nDirector\n\n \n\nFebruary 22, 2024\n\nJane Chwick\n\n  \n\n \n\n \n\n \n\n \n\n \n\n \n\n/s/ WILLIAM CRUGER\n\n  \n\nDirector\n\n \n\nFebruary 22, 2024\n\nWilliam Cruger\n\n  \n\n \n\n \n\n \n\n \n\n \n\n \n\n/s/ KOURTNEY GIBSON\n\n  \n\nDirector\n\n \n\nFebruary 22, 2024\n\nKourtney Gibson\n\n  \n\n \n\n \n\n \n\n \n\n \n\n \n\n/s/ CARLOS M. HERNANDEZ\n\n  \n\nDirector\n\n \n\nFebruary 22, 2024\n\nCarlos M. Hernandez\n\n  \n\n \n\n \n\n \n\n \n\n \n\n \n\n \n\n \n\n/s/ RICHARD G. KETCHUM\n\n \n\nDirector\n\n \n\nFebruary 22, 2024\n\nRichard G. Ketchum\n\n \n\n \n\n \n\n \n\n \n\n \n\n \n\n \n\n \n\n/s/ EMILY PORTNEY\n\n \n\nDirector\n\n \n\nFebruary 22, 2024\n\nEmily Portney\n\n \n\n \n\n \n\n \n\n \n\n \n\n \n\n \n\n \n\n/s/ RICHARD PRAGER\n\n \n\nDirector', 'Signature\n\n \n\nTitle\n\n \n\nDate\n\n \n\n \n\n \n\n \n\n/S/ PAUL J. TUFANO\n\n \n\nPaul J. Tufano\n\nChair of the Board\n\nFebruary 22, 2024\n\n \n\n \n\n \n\n/S/ GREGORY SMITH\n\n \n\nGregory Smith\n\nChief Executive Officer (Principal Executive Officer) and Director\n\nFebruary 22, 2024\n\n \n\n \n\n \n\n/S/ SANJAY MEHTA\n\n \n\nSanjay Mehta\n\nVice President, Chief Financial Officer and Treasurer (Principal Financial and Accounting Officer)\n\nFebruary 22, 2024\n\n \n\n \n\n \n\n/S/ TIMOTHY E. GUERTIN\n\n \n\nTimothy E. Guertin\n\nDirector\n\nFebruary 22, 2024\n\n \n\n \n\n \n\n/S/ PETER HERWECK\n\n \n\nPeter Herweck\n\nDirector\n\nFebruary 22, 2024\n\n \n\n \n\n \n\n/S/ MERCEDES JOHNSON\n\n \n\nMercedes Johnson\n\nDirector\n\nFebruary 22, 2024\n\n \n\n \n\n \n\n/S/ ERNEST E. MADDOCK\n\n \n\nErnest E. Maddock\n\nDirector\n\nFebruary 22, 2024\n\n \n\n \n\n \n\n/S/ MARILYN MATZ\n\n \n\nMarilyn Matz\n\nDirector\n\nFebruary 22, 2024\n\n \n\n \n\n \n\n/S/ FOUAD TAMER\n\n \n\nFouad Tamer\n\nDirector\n\nFebruary 22, 2024\n\n \n\n \n\n \n\n \n\n/S/ BRIDGET VAN KRALINGEN\n\n \n\nBridget van Kralingen\n\nDirector\n\nFebruary 22, 2024', 'Signature\n\nTitle\n\nDate\n\n/s/ Laurence D. Fink\n\nChairman, Chief Executive Officer and Director \n\nFebruary 23, 2024\n\nLaurence D. Fink\n\n(Principal Executive Officer)\n\n \n\n/s/ Martin S. Small\n\nSenior Managing Director and Chief Financial Officer \n\nFebruary 23, 2024\n\nMartin S. Small\n\n(Principal Financial Officer)\n\n \n\n/s/ Marc D. Comerchero\n\nManaging Director and Chief Accounting Officer \n\nFebruary 23, 2024\n\nMarc D. Comerchero\n\n(Principal Accounting Officer)\n\n \n\n/s/ Bader M. Alsaad\n\nDirector\n\nFebruary 23, 2024\n\nBader M. Alsaad\n\n \n\n \n\n/s/ Pamela Daley\n\nDirector\n\nFebruary 23, 2024\n\nPamela Daley\n\n \n\n \n\n/s/ William E. Ford\n\nDirector\n\nFebruary 23, 2024\n\nWilliam E. Ford\n\n \n\n \n\n/s/ Fabrizio Freda\n\n \n\nDirector\n\nFebruary 23, 2024\n\nFabrizio Freda\n\n \n\n \n\n/s/ Murry S. Gerber\n\nDirector\n\nFebruary 23, 2024\n\nMurry S. Gerber\n\n \n\n \n\n/s/ Margaret L. Johnson\n\nDirector\n\nFebruary 23, 2024\n\nMargaret L. Johnson\n\n \n\n \n\n/s/ Robert S. Kapito\n\nDirector\n\nFebruary 23, 2024\n\nRobert S. Kapito\n\n \n\n \n\n/s/ Cheryl D. Mills\n\nDirector\n\nFebruary 23, 2024\n\nCheryl D. Mills\n\n \n\n \n\n/s/ Amin H. Nasser\n\nDirector\n\nFebruary 23, 2024\n\nAmin H. Nasser\n\n \n\n \n\n/s/ Gordon M. Nixon\n\nDirector\n\nFebruary 23, 2024\n\nGordon M. Nixon\n\n \n\n \n\n/s/ Kristin Peck\n\nDirector\n\nFebruary 23, 2024\n\nKristin Peck\n\n \n\n \n\n/s/ Charles H. Robbins\n\nDirector\n\nFebruary 23, 2024\n\nCharles H. Robbins\n\n \n\n \n\n/s/ Marco Antonio Slim Domit\n\nDirector\n\nFebruary 23, 2024\n\nMarco Antonio Slim Domit\n\n \n\n \n\n/s/ Hans E. Vestberg\n\nDirector\n\nFebruary 23, 2024\n\nHans E. Vestberg', 'Signature\t\tTitle\t \tDate\n/s/  M. Troy Woods*\t  \tChairman of the Board\t \tFebruary 14, 2024\nM. Troy Woods\n/s/ Connie D. McDaniel*\t  \tLead Independent Director\t \tFebruary 14, 2024\nConnie D. McDaniel\t\n/s/  F. Thaddeus Arroyo*\t  \tDirector\t \tFebruary 14, 2024\nF. Thaddeus Arroyo\t\n/s/ Robert H.B. Baldwin, Jr.*\t  \tDirector\t\tFebruary 14, 2024\nRobert H.B. Baldwin, Jr.\n/s/ John G. Bruno*\t\tDirector\t\tFebruary 14, 2024\nJohn G. Bruno\t\n/s/  Joia M. Johnson*\t  \tDirector\t \tFebruary 14, 2024\nJoia M. Johnson\n/s/  Ruth Ann Marshall*\t  \tDirector\t \tFebruary 14, 2024\nRuth Ann Marshall\n/s/  Kirsten Kliphouse*\t  \tDirector\t\tFebruary 14, 2024\nKirsten Kliphouse\n/s/ Joseph Osnoss*\t\tDirector\t\tFebruary 14, 2024\nJoseph Osnoss\t\n/s/ William B. Plummer*\t\tDirector\t\tFebruary 14, 2024\nWilliam B. Plummer\n/s/ John T. Turner*\t\tDirector\t\tFebruary 14, 2024\nJohn T. Turner\n/s/ Cameron M. Bready\t  \tDirector\t \tFebruary 14, 2024\nCameron M. Bready', 'Signature\n\n \n\nTitle\n\n \n\nDate\n\n \n\n \n\n \n\n \n\n \n\n/s/ Hamid R. Moghadam\n\n \n\nChairman of the Board and Chief Executive Officer\n\n \n\nFebruary 13, 2024\n\nHamid R. Moghadam\n\n \n\n \n\n \n\n \n\n \n\n \n\n \n\n/s/ Timothy D. Arndt\n\n \n\nChief Financial Officer\n\n \n\nFebruary 13, 2024\n\nTimothy D. Arndt\n\n \n\n \n\n \n\n \n\n \n\n \n\n \n\n/s/ Lori A. Palazzolo\n\n \n\nManaging Director and Chief Accounting Officer\n\n \n\nFebruary 13, 2024\n\nLori A. Palazzolo\n\n \n\n \n\n \n\n \n\n \n\n \n\n \n\n/s/ Cristina G. Bita\n\n \n\nDirector\n\n \n\nFebruary 13, 2024\n\nCristina G. Bita\n\n \n\n \n\n \n\n \n\n \n\n \n\n \n\n/s/ James B. Connor\n\n \n\nDirector\n\n \n\nFebruary 13, 2024\n\nJames B. Connor\n\n \n\n \n\n \n\n \n\n \n\n \n\n \n\n \n\n \n\n/s/ George L. Fotiades\n\n \n\nDirector\n\n \n\nFebruary 13, 2024\n\nGeorge L. Fotiades\n\n \n\n \n\n \n\n \n\n \n\n \n\n \n\n/s/ Lydia H. Kennard\n\n \n\nDirector\n\n \n\nFebruary 13, 2024\n\nLydia H. Kennard\n\n \n\n \n\n \n\n \n\n \n\n \n\n \n\n \n\n \n\n/s/ Irving F. Lyons III\n\n \n\nDirector\n\n \n\nFebruary 13, 2024\n\nIrving F. Lyons III\n\n \n\n \n\n \n\n \n\n \n\n \n\n \n\n/s/ Avid Modjtabai\n\n \n\nDirector\n\n \n\nFebruary 13, 2024\n\nAvid Modjtabai\n\n \n\n \n\n \n\n \n\n \n\n \n\n \n\n \n\n \n\n/s/ David P. O’Connor\n\n \n\nDirector\n\n \n\nFebruary 13, 2024\n\nDavid P. O’Connor\n\n \n\n \n\n \n\n \n\n \n\n \n\n \n\n \n\n \n\n/s/ Olivier Piani\n\n \n\nDirector\n\n \n\nFebruary 13, 2024\n\nOlivier Piani\n\n \n\n \n\n \n\n \n\n \n\n \n\n \n\n \n\n \n\n/s/ Jeffrey L. Skelton\n\n \n\nDirector\n\n \n\nFebruary 13, 2024\n\nJeffrey L. Skelton\n\n \n\n \n\n \n\n \n\n \n\n \n\n \n\n \n\n \n\n/s/ Carl B. Webb\n\n \n\nDirector\n\n \n\nFebruary 13, 2024\n\nCarl B. Webb', 'Signature\n\n \n\nDate\n\n \n\nTitle\n\n \n\n \n\n \n\n \n\n \n\n/s/    BRIAN NICCOL\n\n \n\nFebruary 7, 2024\n\n \n\nChief Executive Officer and Chairman of the Board of Directors\n\n     (principal executive officer)\n\nBrian Niccol\n\n \n\n \n\n \n\n \n\n/s/    JOHN R. HARTUNG\n\n \n\nFebruary 7, 2024\n\n \n\nChief Financial and Administrative Officer\n\n     (principal financial and accounting officer)\n\nJohn R. Hartung\n\n \n\n \n\n \n\n \n\n/s/    ALBERT BALDOCCHI\n\n \n\nFebruary 7, 2024\n\n \n\nDirector\n\nAlbert S. Baldocchi\n\n \n\n \n\n \n\n \n\n/s/    MATTHEW CAREY\n\n \n\nFebruary 7, 2024\n\n \n\nDirector\n\nMatthew Carey\n\n \n\n \n\n \n\n \n\n/s/    GREGG ENGLES\n\n \n\nFebruary 7, 2024\n\n \n\nDirector\n\nGregg Engles\n\n \n\n \n\n \n\n \n\n/s/    PATRICIA FILI-KRUSHEL\n\n \n\nFebruary 7, 2024\n\n \n\nDirector\n\nPatricia Fili-Krushel\n\n \n\n \n\n \n\n \n\n \n\n \n\n \n\n \n\n \n\n/s/    LAURA FUENTES\n\n \n\nFebruary 7, 2024\n\n \n\nDirector\n\nLaura Fuentes\n\n \n\n \n\n \n\n \n\n/s/    MAURICIO GUTIERREZ\n\n \n\nFebruary 7, 2024\n\n \n\nDirector\n\nMauricio Gutierrez\n\n \n\n \n\n \n\n \n\n/s/    ROBIN HICKENLOOPER\n\n \n\nFebruary 7, 2024\n\n \n\nDirector\n\nRobin Hickenlooper\n\n \n\n \n\n \n\n \n\n/s/    SCOTT MAW\n\n \n\nFebruary 7, 2024\n\n \n\nDirector\n\nScott Maw\n\n \n\n \n\n \n\n \n\n/s/    MARY WINSTON\n\n \n\nFebruary 7, 2024\n\n \n\nDirector\n\nMary Winston', 'Name and Signature\n\n \n\nPosition\n\n \n\nDate\n\n \n\n \n\n \n\n \n\n \n\n \n\n/s/ DAVID S. CONGDON\n\n \n\nExecutive Chairman of the Board of Directors\n\n \n\nFebruary 26, 2024\n\nDavid S. Congdon\n\n \n\n \n\n \n\n \n\n \n\n \n\n \n\n/s/ SHERRY A. AAHOLM\n\n \n\nDirector\n\n \n\nFebruary 26, 2024\n\nSherry A. Aaholm\n\n \n\n \n\n \n\n \n\n \n\n \n\n \n\n/s/ JOHN R. CONGDON, JR.\n\n \n\nDirector\n\n \n\nFebruary 26, 2024\n\nJohn R. Congdon, Jr.\n\n \n\n \n\n \n\n \n\n \n\n \n\n \n\n \n\n/s/ ANDREW S. DAVIS\n\n \n\nDirector\n\n \n\nFebruary 26, 2024\n\nAndrew S. Davis\n\n \n\n \n\n \n\n \n\n \n\n \n\n \n\n \n\n \n\n/s/ BRADLEY R. GABOSCH\n\n \n\nDirector\n\n \n\nFebruary 26, 2024\n\nBradley R. Gabosch\n\n \n\n \n\n \n\n \n\n \n\n \n\n \n\n \n\n/s/ GREG C. GANTT\n\n \n\nDirector\n\n \n\nFebruary 26, 2024\n\nGreg C. Gantt\n\n \n\n \n\n \n\n \n\n \n\n \n\n \n\n \n\n/s/ JOHN D. KASARDA\n\n \n\nDirector\n\n \n\nFebruary 26, 2024\n\nJohn D. Kasarda\n\n \n\n \n\n \n\n \n\n \n\n \n\n \n\n/s/ WENDY T. STALLINGS\n\n \n\nDirector\n\n \n\nFebruary 26, 2024\n\nWendy T. Stallings\n\n \n\n \n\n \n\n \n\n \n\n \n\n \n\n \n\n \n\n/s/ THOMAS A. STITH, III\n\n \n\nDirector\n\n \n\nFebruary 26, 2024\n\nThomas A. Stith, III\n\n \n\n \n\n \n\n \n\n \n\n \n\n \n\n \n\n \n\n/s/ LEO H. SUGGS\n\n \n\nDirector\n\n \n\nFebruary 26, 2024\n\nLeo H. Suggs\n\n \n\n \n\n \n\n \n\n \n\n \n\n \n\n/s/ KEVIN M. FREEMAN\n\n \n\nPresident and Chief Executive Officer\n\n \n\nFebruary 26, 2024\n\nKevin M. Freeman\n\n \n\n(Principal Executive Officer)\n\n \n\n \n\n \n\n \n\n \n\n/s/ ADAM N. SATTERFIELD\n\n \n\nExecutive Vice President and Chief Financial Officer\n\n \n\nFebruary 26, 2024\n\nAdam N. Satterfield\n\n \n\n(Principal Financial Officer)\n\n \n\n \n\n \n\n \n\n \n\n/s/ KIMBERLY S. MAREADY\n\n \n\nVice President – Accounting and Finance', 'Signatures\t\t\nTitle \nDate\n/S/    MICHAEL J. KNEELAND \nChairman\t\tJanuary 24, 2024\nMichael J. Kneeland\n/S/     JOSÉ B. ALVAREZ \nDirector\t\tJanuary 24, 2024\nJosé B. Alvarez\n/S/ MARC A. BRUNO\nDirector\t\tJanuary 24, 2024\nMarc A. Bruno\n/S/ LARRY D. DE SHON\nDirector\t\tJanuary 24, 2024\nLarry D. De Shon\n/S/    BOBBY J. GRIFFIN\nLead Independent Director\t\tJanuary 24, 2024\nBobby J. Griffin\n/S/ KIM HARRIS JONES\nDirector\t\tJanuary 24, 2024\nKim Harris Jones\n/S/ TERRI L. KELLY\nDirector\t\tJanuary 24, 2024\nTerri L. Kelly\t\t\t\t\n/S/ FRANCISCO J. LOPEZ-BALBOA\nDirector\t\tJanuary 24, 2024\nFrancisco J. Lopez-Balboa\t\t\t\t\n/S/    GRACIA MARTORE \nDirector\t\tJanuary 24, 2024\nGracia Martore\n/S/    SHIV SINGH\nDirector\t\tJanuary 24, 2024\nShiv Singh\n/S/    MATTHEW J. FLANNERY\nDirector and Chief Executive Officer (Principal Executive Officer)\t\tJanuary 24, 2024\nMatthew J. Flannery\n/S/    WILLIAM E. GRACE\nChief Financial Officer (Principal Financial Officer)\t\tJanuary 24, 2024\nWilliam E. Grace\n/S/    ANDREW B. LIMOGES\nVice President, Controller (Principal Accounting Officer)\t\tJanuary 24, 2024\nAndrew B. Limoges', 'Date:\tFebruary 22, 2024\tBy\t/s/ James M. Cracchiolo\nJames M. Cracchiolo\nChairman and Chief Executive Officer\n(Principal Executive Officer and Director)\n \nDate:\tFebruary 22, 2024\tBy\t/s/ Walter S. Berman\nWalter S. Berman\nExecutive Vice President and Chief Financial Officer\n(Principal Financial Officer)\n \nDate:\tFebruary 22, 2024\tBy\t/s/ Dawn M. Brockman\nDawn M. Brockman\nSenior Vice President and Controller\n(Principal Accounting Officer)\n \nDate:\tFebruary 22, 2024\tBy\t/s/ Dianne Neal Blixt*\nDianne Neal Blixt\nDirector\n \nDate:\tFebruary 22, 2024\tBy\t/s/ Amy DiGeso*\nAmy DiGeso\nDirector\n \nDate:\tFebruary 22, 2024\tBy\t/s/ Armando Pimentel, Jr.*\nArmando Pimentel, Jr.\nDirector\n \nDate:\tFebruary 22, 2024\tBy\t/s/ Robert F. Sharpe, Jr.*\nRobert F. Sharpe, Jr.\nDirector\n \nDate:\tFebruary 22, 2024\tBy\t/s/ Brian T. Shea*\nBrian T. Shea\nDirector\n \nDate:\tFebruary 22, 2024\tBy\t/s/ W. Edward Walter III*\nW. Edward Walter III\nDirector\nDate:\tFebruary 22, 2024\tBy\t/s/ Christopher J. Williams*\nChristopher J. Williams\nDirector\n \n*By\t/s/ Walter S. Berman\nWalter S. Berman\nExecutive Vice President and Chief Financial Officer', 'Signature\tCapacity\tDate\n/s/ Gregory R. Adelson\nGregory R. Adelson\nChief Executive Officer and President\n(Principal Executive Officer)\nAugust 26, 2024\n \t \t \n /s/ Mimi L. Carsley\nMimi L. Carsley\nChief Financial Officer and Treasurer\n(Principal Financial Officer)\tAugust 26, 2024\n \t \t \n/s/ Renee A. Swearingen\nRenee A. Swearingen\nSenior Vice President and Chief Accounting Officer\n(Principal Accounting Officer)\tAugust 26, 2024\n/s/ David B. Foss\nDavid B. Foss\nExecutive Board Chair\nAugust 26, 2024\n/s/ Matthew C. Flanigan\nMatthew C. Flanigan\nVice Chair and Lead Director\tAugust 26, 2024\n \t \t \n/s/ Thomas H. Wilson, Jr\nThomas H. Wilson, Jr\nDirector\tAugust 26, 2024\n \t \n/s/ Jacqueline R. Fiegel\nJacqueline R. Fiegel\nDirector\tAugust 26, 2024\n \t \t \n/s/ Thomas A. Wimsett\nThomas A. Wimsett\nDirector\tAugust 26, 2024\n/s/ Shruti S. Miyashiro\nShruti S. Miyashiro\nDirector\tAugust 26, 2024\n/s/ Wesley A. Brown\nWesley A. Brown\nDirector\tAugust 26, 2024\n/s/ Curtis A. Campbell\nCurtis A. Campbell\nDirector\tAugust 26, 2024\n/s/ Tammy S. LoCascio\nTammy S. LoCascio\nDirector\tAugust 26, 2024\n/s/ Lisa M. Nelson\nLisa M. Nelson\nDirector\tAugust 26, 2024']",818.2960419217125,"Wynn Resorts’ directors and principal officers executed the Form 10-K signature page on February 23, 2024, evidencing board continuity."
13,13,1672b3e6,"Marsh & McLennan's cybersecurity risk mitigation framework outlines the fin. impacts associated with its strategies, specifically for ticker.","Marsh & McLennan Companies’ cybersecurity risk management framework is designed to reduce the financial impact of cyber incidents and support long-term financial health through a multi-layered approach. First, the framework includes rigorous third-party vendor assessments and contractual protections that ensure external service providers adhere to high cybersecurity standards. This minimizes the risk that vendors introduce vulnerabilities that could lead to costly breaches. The contractual provisions often include risk transfer mechanisms such as liability clauses, which help contain potential losses if a breach is linked to a vendor’s system.

In addition, the company employs technical controls (like multifactor authentication and secured network access via VPNs or private channels) and a well-documented incident response plan. This preparedness reduces the likelihood that an incident escalates into a significant disruption, thereby avoiding direct costs related to remediation, regulatory fines, and reputational damage. The ongoing monitoring and periodic third-party penetration testing further ensure that vulnerabilities are identified and addressed early.

Furthermore, the integration of multiple departments (risk management, legal, compliance, IT, etc.) in managing cybersecurity risks allows the company to allocate resources efficiently, prioritize risk mitigation, and maintain robust oversight. This continuous monitoring, combined with regular updates to the Board and Audit Committee, ensures that any emerging cyber threats are quickly identified and mitigated before they can materially affect the company’s strategic or operational performance.

In summary, by proactively mitigating cybersecurity risks through comprehensive vendor assessments, contractual safeguards, and embedded technical controls, Marsh & McLennan Companies minimizes the chances of a costly cyber incident. This not only protects the company from immediate financial losses but also supports long-term financial stability by maintaining market confidence and preventing potential disruptions to its business operations.","['As a professional services firm that processes confidential and sensitive information, such as personal information, cybersecurity risk management is an integral part of our enterprise risk management strategy at Marsh & McLennan. Our cybersecurity risk management program has been designed based on industry standards, such as the National Institute of Standards and Technology Cybersecurity Framework and ISO/IEC:27001, and provides a framework for assessing cybersecurity risk and identifying and managing cybersecurity threats and incidents, including threats and incidents associated with our use of services, applications and products provided by third-party vendors and service providers.\nOur cybersecurity risk management program is coordinated by cross-functional teams, including risk management, legal and compliance, business resiliency management and information security. These teams develop, implement and maintain our compliance policies, programs and training, business resiliency, disaster recovery and information security frameworks, solutions and procedures. They also work closely with our business, internal audit, finance and IT staff to identify, assess and mitigate risks, including those associated with our use of third-party vendors and service providers, and to monitor and take steps designed to prevent security incidents in our technology environment.\nOur cybersecurity risk management framework includes (1) procedures designed to assess the data privacy and cybersecurity practices of third-party vendors and service providers (including risk assessments and contractual protections), (2) technical IT controls designed to manage risks associated with cybersecurity incidents (such as multifactor authentication and requirements for VPN or private channel access to our systems), and (3) formal policies and procedures designed to address cybersecurity incidents. Our formal policies and procedures designed to address cybersecurity incidents include steps for verifying and assessing the severity of a cybersecurity incident, identifying the source of a cybersecurity incident (including whether it is associated with a third-party service provider) and implementing cybersecurity countermeasures and mitigation strategies. Additionally, we have procedures for informing senior management and our Board of Directors of potentially material cybersecurity incidents. We also periodically engage third-party security consultants to assess our cybersecurity program and to perform penetration testing on our security environment and controls. In addition, cybersecurity training is provided to all newly hired colleagues and then at least annually for all colleagues. We also conduct regular ongoing cybersecurity awareness campaigns and phishing tests and provide training in response to such tests as appropriate.\nOur Board of Directors has overall oversight responsibility for the Company’s risk management and receives updates from management throughout the year on cybersecurity matters and other material risks facing the Company. Additionally, the Audit Committee regularly reviews the Company’s policies and practices with respect to risk assessment and risk management, including cybersecurity risks, and reports to the full Board of Directors on a regular basis. The Audit Committee is responsible for overseeing the Company’s enterprise risk management policies and processes, including discussing with management the Company’s major risk exposures and the steps that have been taken to monitor and control such exposures, including those arising from cybersecurity risks.\nManagement is responsible for identifying, assessing and managing material cybersecurity risks on an ongoing basis. Management’s efforts include establishing processes designed to ensure that potential cybersecurity risks are monitored, putting in place mitigation and remedial measures and implementing and maintaining cybersecurity programs. Our cybersecurity programs are under the direction of our Chief Information Security Officer (CISO), who reports to our Chief Information Officer (CIO). Our CIO has significant expertise and over a decade of experience working in technology. Our CISO has over twenty years of experience working in cybersecurity and maintains a Certified Information Systems Security Professional certification. Our CISO and CIO receive reports from our cybersecurity team and monitor the prevention, detection, mitigation, and remediation of cybersecurity incidents. Our cybersecurity team is comprised of experienced information systems security professionals and information security managers with many years of experience and various security certifications.\nManagement, including the CIO and CISO, regularly reviews with the Board of Directors and the Audit Committee the Company’s cybersecurity programs, material cybersecurity risks and mitigation strategies and provides updates on notable developments in the cybersecurity threat landscape. Additionally, management follows a risk-based escalation process to notify the Audit Committee outside of the cycle of regular updates when an emerging risk or material issue is identified, such as a potentially significant cybersecurity threat or incident.\nIn 2023, we did not identify any cybersecurity threats or incidents that have materially affected or are reasonably likely to materially affect the Company, including with respect to our business strategy, results of operations, or financial condition. However, despite our efforts, we cannot eliminate all risks from cybersecurity threats or incidents, or provide assurances that we have not experienced an undetected cybersecurity threat or incident. For more information about these risks, please see “Risk Factors – Cybersecurity, Data Protection and Technology Risks” in this annual report on Form 10-K.']",,,FinDER,Non-numerical,"['As a professional services firm that processes confidential and sensitive information, such as personal information, cybersecurity risk management is an integral part of our enterprise risk management strategy at Marsh & McLennan. Our cybersecurity risk management program has been designed based on industry standards, such as the National Institute of Standards and Technology Cybersecurity Framework and ISO/IEC:27001, and provides a framework for assessing cybersecurity risk and identifying and managing cybersecurity threats and incidents, including threats and incidents associated with our use of services, applications and products provided by third-party vendors and service providers.\nOur cybersecurity risk management program is coordinated by cross-functional teams, including risk management, legal and compliance, business resiliency management and information security. These teams develop, implement and maintain our compliance policies, programs and training, business resiliency, disaster recovery and information security frameworks, solutions and procedures. They also work closely with our business, internal audit, finance and IT staff to identify, assess and mitigate risks, including those associated with our use of third-party vendors and service providers, and to monitor and take steps designed to prevent security incidents in our technology environment.\nOur cybersecurity risk management framework includes (1) procedures designed to assess the data privacy and cybersecurity practices of third-party vendors and service providers (including risk assessments and contractual protections), (2) technical IT controls designed to manage risks associated with cybersecurity incidents (such as multifactor authentication and requirements for VPN or private channel access to our systems), and (3) formal policies and procedures designed to address cybersecurity incidents. Our formal policies and procedures designed to address cybersecurity incidents include steps for verifying and assessing the severity of a cybersecurity incident, identifying the source of a cybersecurity incident (including whether it is associated with a third-party service provider) and implementing cybersecurity countermeasures and mitigation strategies. Additionally, we have procedures for informing senior management and our Board of Directors of potentially material cybersecurity incidents. We also periodically engage third-party security consultants to assess our cybersecurity program and to perform penetration testing on our security environment and controls. In addition, cybersecurity training is provided to all newly hired colleagues and then at least annually for all colleagues. We also conduct regular ongoing cybersecurity awareness campaigns and phishing tests and provide training in response to such tests as appropriate.\nOur Board of Directors has overall oversight responsibility for the Company’s risk management and receives updates from management throughout the year on cybersecurity matters and other material risks facing the Company. Additionally, the Audit Committee regularly reviews the Company’s policies and practices with respect to risk assessment and risk management, including cybersecurity risks, and reports to the full Board of Directors on a regular basis. The Audit Committee is responsible for overseeing the Company’s enterprise risk management policies and processes, including discussing with management the Company’s major risk exposures and the steps that have been taken to monitor and control such exposures, including those arising from cybersecurity risks.\nManagement is responsible for identifying, assessing and managing material cybersecurity risks on an ongoing basis. Management’s efforts include establishing processes designed to ensure that potential cybersecurity risks are monitored, putting in place mitigation and remedial measures and implementing and maintaining cybersecurity programs. Our cybersecurity programs are under the direction of our Chief Information Security Officer (CISO), who reports to our Chief Information Officer (CIO). Our CIO has significant expertise and over a decade of experience working in technology. Our CISO has over twenty years of experience working in cybersecurity and maintains a Certified Information Systems Security Professional certification. Our CISO and CIO receive reports from our cybersecurity team and monitor the prevention, detection, mitigation, and remediation of cybersecurity incidents. Our cybersecurity team is comprised of experienced information systems security professionals and information security managers with many years of experience and various security certifications.\nManagement, including the CIO and CISO, regularly reviews with the Board of Directors and the Audit Committee the Company’s cybersecurity programs, material cybersecurity risks and mitigation strategies and provides updates on notable developments in the cybersecurity threat landscape. Additionally, management follows a risk-based escalation process to notify the Audit Committee outside of the cycle of regular updates when an emerging risk or material issue is identified, such as a potentially significant cybersecurity threat or incident.\nIn 2023, we did not identify any cybersecurity threats or incidents that have materially affected or are reasonably likely to materially affect the Company, including with respect to our business strategy, results of operations, or financial condition. However, despite our efforts, we cannot eliminate all risks from cybersecurity threats or incidents, or provide assurances that we have not experienced an undetected cybersecurity threat or incident. For more information about these risks, please see “Risk Factors – Cybersecurity, Data Protection and Technology Risks” in this annual report on Form 10-K.']",1672b3e6,True,"['Risk Management and Strategy\n\n \n\nThe Company is subject to cybersecurity threats that could have a material adverse impact on our results of operations, financial condition, and liquidity. See also our discussion in the Risk Factors in Item 1A of this report. As a component of our Company-wide enterprise risk management framework, we implemented a cybersecurity program whose objective is to assess, identify, and manage risks from cybersecurity threats that may result in adverse effects on the confidentiality, integrity, and availability of the electronic information systems that we own. We regularly perform internal security assessments, engage third-party consultants to conduct external security assessments, and participate in, conduct, and/or administer exercises, drills, and recovery tests as part of this program. We also maintain training programs and policies and procedures designed to safeguard employee handling and use of data, internet usage, controlled access measures, and physical protections. We consult with industry groups, monitor threat intelligence reports, and communicate with various government agencies in an effort to stay up-to-date on changes in the cybersecurity threat landscape. This program, in addition to addressing our own information systems, is also designed to oversee, identify, and reduce the potential impact of a security incident at a third-party service provider or that otherwise impacts third-party technology and systems we use.', 'Risk Management and Strategy\nThe Company has processes in place to identify, assess and monitor material risks from cybersecurity threats, which are part of the Company’s overall enterprise risk management process and have been embedded in the Company’s operating procedures, internal controls and information systems.\n\nDow\'s comprehensive cybersecurity and information security framework includes risk assessment and mitigation through a threat intelligence-driven approach, application controls, and enhanced security with ransomware defense. The framework leverages International Organization for Standardizations 27001/27002 standards for general information technology controls, International Society of Automation/International Electrotechnical Commission standards for industrial automation, the National Institute of Standards and Technology Cyber Security Framework (""NIST CSF"") for measuring overall readiness to respond to cyber threats, and Sarbanes-Oxley for assessment of internal controls.\n\nDow contracts with external firms to assess Dow’s cybersecurity controls relative to its peers using the NIST CSF. Dow also has a third-party risk management program that assesses risks from vendors and suppliers. In addition, the Company maintains business continuity and disaster recovery plans as well as a cybersecurity insurance policy.', 'Risk Management and Strategy\n\nThe Company utilizes information systems to support a variety of business processes and activities in its decentralized operations. These systems may be subject to cyber-based attacks or breaches. For additional information related to the risks associated with cybersecurity threats, refer to the Business and Operational Risks section of Item 1A. Risk Factors.\n\nCybersecurity risk management is part of the Company\'s global enterprise risk management program. In order to manage the risks associated with cybersecurity threats, the Company has implemented a robust risk-based cybersecurity program consisting of processes, technologies, and controls to assess, identify and manage material risks from cybersecurity threats.\n\nA key part of the Company’s cybersecurity program is the ITW Cybersecurity Framework, which is based on the National Institute of Standards and Technology’s Cybersecurity Framework (""CSF"") and is designed to protect the Company’s data through rapid identification of and effective response to cybersecurity incidents. The Company’s framework includes detailed processes and controls related to backup and recovery, response planning, awareness, vulnerability management and endpoint protection as well as cybersecurity requirements for third-party service providers. The framework is regularly reviewed, assessed, and updated based on input from third party specialists, threat intelligence firms and CSF standard updates.', 'Cybersecurity Risk Management and Strategy:\n\nWe recognize the importance of assessing, identifying, and managing material risks associated with cybersecurity threats, as such term is defined in Item 106(a) of Regulation S-K. These risks include, among other things, internal operational risks; system security risks; data protection; risks to proprietary business information; intellectual property theft; fraud; extortion; harm to employees, partners, or customers; violation of privacy or security laws and other litigation and legal risk; and reputational risks. We have implemented several cybersecurity processes, technologies, and controls to aid in our efforts to identify, assess, and manage such material risks.', 'The Company’s management and Board recognize the importance of strong oversight of cybersecurity risk, information security and technology in maintaining the trust and confidence of our customers, partners, employees and stockholders. The Company maintains cybersecurity measures aligned with the National Institute of Standards and Technology Cybersecurity Framework (Framework) which organizes cybersecurity risks into five categories: identify, protect, detect, respond and recover. Our processes for assessing, identifying and managing material risks from cybersecurity threats is incorporated into our Enterprise Risk Management (ERM) program and evaluated against such Framework. Our information security and ERM teams coordinate to regularly review and assess these risks using a wide range of tools and services.', 'Cybersecurity Risk Management and Strategy', 'Cybersecurity Risk Management and Strategy', 'Risk Management and Strategy\nThe Company takes a risk-based approach to cybersecurity and has implemented cybersecurity policies throughout its operations that are designed to address cybersecurity threats and incidents.', 'Cybersecurity Risk Management', 'Risk Management and Strategy\n\nIn an effort to reduce the likelihood and severity of cyber intrusions, the Companies have a comprehensive cybersecurity program designed to protect and preserve the confidentiality, integrity and availability of data and systems. Consideration of cybersecurity risks is a key component of the Companies’ overall risk management and integrated into processes such as evaluation of potential new vendors or suppliers. The Companies are subject to mandatory cybersecurity regulatory requirements, interface regularly with a wide range of external organizations and participate in classified briefings to maintain an awareness of current cybersecurity threats and vulnerabilities.']",658.9324999367818,MMC
14,14,IPG/2014/page_37.pdf,"Q: For IPG, what was the total amount of long-term debt in the years of 2013 and 2014, combined?
A: A0
Q: and what was the total amount of debt in that same period?",81.09,"[""['management 2019s discussion and analysis of financial condition and results of operations 2013 ( continued ) ( amounts in millions , except per share amounts ) net cash used in investing activities during 2013 primarily related to payments for capital expenditures and acquisitions .', 'capital expenditures of $ 173.0 related primarily to computer hardware and software and leasehold improvements .', 'we made payments of $ 61.5 related to acquisitions completed during 2013 , net of cash acquired .', 'financing activities net cash used in financing activities during 2014 primarily related to the purchase of long-term debt , the repurchase of our common stock and payment of dividends .', 'during 2014 , we redeemed all $ 350.0 in aggregate principal amount of the 6.25% ( 6.25 % ) notes , repurchased 14.9 shares of our common stock for an aggregate cost of $ 275.1 , including fees , and made dividend payments of $ 159.0 on our common stock .', 'this was offset by the issuance of $ 500.0 in aggregate principal amount of our 4.20% ( 4.20 % ) notes .', 'net cash used in financing activities during 2013 primarily related to the purchase of long-term debt , the repurchase of our common stock and payment of dividends .', 'we redeemed all $ 600.0 in aggregate principal amount of our 10.00% ( 10.00 % ) notes .', 'in addition , we repurchased 31.8 shares of our common stock for an aggregate cost of $ 481.8 , including fees , and made dividend payments of $ 126.0 on our common stock .', 'foreign exchange rate changes the effect of foreign exchange rate changes on cash and cash equivalents included in the consolidated statements of cash flows resulted in a decrease of $ 101.0 in 2014 .', 'the decrease was primarily a result of the u.s .', 'dollar being stronger than several foreign currencies , including the canadian dollar , brazilian real , australian dollar and the euro as of december 31 , 2014 compared to december 31 , 2013 .', 'the effect of foreign exchange rate changes on cash and cash equivalents included in the consolidated statements of cash flows resulted in a decrease of $ 94.1 in 2013 .', 'the decrease was primarily a result of the u.s .', 'dollar being stronger than several foreign currencies , including the australian dollar , brazilian real , canadian dollar , japanese yen , and south african rand as of december 31 , 2013 compared to december 31 , 2012. .']\nbalance sheet data\tdecember 31 , 2014\tdecember 31 , 2013\ncash cash equivalents and marketable securities\t$ 1667.2\t$ 1642.1\nshort-term borrowings\t$ 107.2\t$ 179.1\ncurrent portion of long-term debt\t2.1\t353.6\nlong-term debt\t1623.5\t1129.8\ntotal debt\t$ 1732.8\t$ 1662.5\n['liquidity outlook we expect our cash flow from operations , cash and cash equivalents to be sufficient to meet our anticipated operating requirements at a minimum for the next twelve months .', 'we also have a committed corporate credit facility as well as uncommitted facilities available to support our operating needs .', 'we continue to maintain a disciplined approach to managing liquidity , with flexibility over significant uses of cash , including our capital expenditures , cash used for new acquisitions , our common stock repurchase program and our common stock dividends .', 'from time to time , we evaluate market conditions and financing alternatives for opportunities to raise additional funds or otherwise improve our liquidity profile , enhance our financial flexibility and manage market risk .', 'our ability to access the capital markets depends on a number of factors , which include those specific to us , such as our credit rating , and those related to the financial markets , such as the amount or terms of available credit .', 'there can be no guarantee that we would be able to access new sources of liquidity on commercially reasonable terms , or at all. .']""]","{'table_4': 'balance sheet data\tdecember 31 , 2014\tdecember 31 , 2013\ncash cash equivalents and marketable securities\t$ 1667.2\t$ 1642.1\nshort-term borrowings\t$ 107.2\t$ 179.1\ncurrent portion of long-term debt\t2.1\t353.6\nlong-term debt\t1623.5\t1129.8\ntotal debt\t$ 1732.8\t$ 1662.5', 'text_14': 'dollar being stronger than several foreign currencies , including the australian dollar , brazilian real , canadian dollar , japanese yen , and south african rand as of december 31 , 2013 compared to december 31 , 2012. .'}","add(1623.5, 1129.8), add(1732.8, 1662.5), divide(#0, #1), multiply(#2, const_100)",ConvFinQA,Compositional,"['balance sheet data the long-term debt of december 31 , 2014 is 1623.5 ; the long-term debt of december 31 , 2013 is 1129.8 ;', 'balance sheet data the total debt of december 31 , 2014 is $ 1732.8 ; the total debt of december 31 , 2013 is $ 1662.5 ;', 'dollar being stronger than several foreign currencies , including the australian dollar , brazilian real , canadian dollar , japanese yen , and south african rand as of december 31 , 2013 compared to december 31 , 2012. .']",IPG/2014/page_37.pdf,True,"['Long-term debt, including current portion, consisted of the following as of December 31:\n\n(dollars in millions)\t\t2023\t\t2022\n0.000% notes due 2023 (€500 million principal value)\n$\t— \t\t\t$\t531 \t\n2.056% notes due 2025\n1,300 \t\t\t1,300 \t\n0.37% notes due 2026 ( ¥21.5 billion principal value)\n150 \t\t\t163 \t\n0.318% notes due 2026 (€600 million principal value)\n658 \t\t\t638 \t\n2.293% notes due 2027\n500 \t\t\t500 \t\n5.25% notes due 2028\n750 \t\t\t— \t\n2.565% notes due 2030\n1,500 \t\t\t1,500 \t\n0.934% notes due 2031 (€500 million principal value)\n548 \t\t\t531 \t\n3.112% notes due 2040\n750 \t\t\t750 \t\n3.362% notes due 2050\n750 \t\t\t750 \t\nOther (including finance leases)\t\t4 \t\t\t8 \t\nTotal principal long-term debt\t\t6,910 \t\t\t6,671 \t\nOther (discounts and debt issuance costs)\t\t(44)\t\t\t(42)\t\nTotal long-term debt\t\t6,866 \t\t\t6,629 \t\nLess: current portion\t\t— \t\t\t531 \t\nLong-term debt, net of current portion\t\t$\t6,866 \t\t\t$\t6,098', 'Long-term debt consisted of the following:\n                           \nDecember 30,December 31,20232022Private placement facilities$1,074$699U.S. trade accounts receivable securitization210330Term loan741-Various collateralized and uncollateralized loans payable with interest,in varying installments through 2030 at interest ratesfrom0.00% to9.42% at December 30, 2023 andfrom0.00% to3.50% at December 31, 2022547Finance lease obligations810Total2,0871,046Less current maturities(\n150\n)(\n6\n)Total long-term debt$1,937$1,040\nAs of December 30, 2023, the aggregate amounts of long-term debt, including finance lease obligations and net ofdeferred debt issuance costs of $1 million, maturing in each of the next five years and thereafter are as follows:\n        \n2024 $1502025 2312026 7212027 1042028 179Thereafter 702Total $2,087', 'Long-term debt consisted of the following:\n\n(In millions)\t\t2023\t\t2022\n2.242% Notes due 2025\n1,200 \t\t\t1,200 \t\n4.375% Notes due 2025\n830 \t\t\t— \t\n5.800% Notes due 2025\n1,000 \t\t\t— \t\n2.493% Notes due 2027\n900 \t\t\t900 \t\n4.125% Notes due 2028\n830 \t\t\t— \t\n2.722% Notes due 2030\n2,000 \t\t\t2,000 \t\n2.700% Notes due 2031\n750 \t\t\t750 \t\n4.500% Notes due 2032\n941 \t\t\t— \t\n5.900% Notes due 2034\n1,000 \t\t\t— \t\n3.377% Notes due 2040\n1,500 \t\t\t1,500 \t\n3.577% Notes due 2050\n2,000 \t\t\t2,000 \t\n6.200% Notes due 2054\n1,000 \t\t\t— \t\nTotal long-term notes\t\t13,951 \t\t\t8,350 \t\nJapanese Term Loan Facility\t\t379 \t\t\t404 \t\nOther debt (including project financing obligations and finance leases)\t\t74 \t\t\t149 \t\nDiscounts and debt issuance costs\t\t(111)\t\t\t(61)\t\nTotal debt\t\t14,293 \t\t\t8,842 \t\nLess: current portion of long-term debt\t\t51 \t\t\t140 \t\nLong-term debt, net of current portion\t\t$\t14,242 \t\t\t$\t8,702', 'Long-term debt included on our consolidated balance sheets consisted of (in millions):\n \tDecember 31,\n \t2023\t\t2022\nSecured\t\t\t\n2013 Term Loan Facility, variable interest rate of 8.60%, installments through February 2028 (a)\n$\t990 \t\t\t$\t1,752 \t\n2014 Term Loan Facility, variable interest rate of 7.32%, installments through January 2027 (a)\n1,183 \t\t\t1,196 \t\n2023 Term Loan Facility, variable interest rate of 8.87%, installments beginning in December 2024 through June 2029 (a)\n1,100 \t\t\t— \t\n11.75% senior secured notes, interest only payments until due in July 2025 (b)\n— \t\t\t2,500 \t\n10.75% senior secured IP notes, interest only payments until due in February 2026 (b)\n1,000 \t\t\t1,000 \t\n10.75% senior secured LGA/DCA notes, interest only payments until due in February 2026 (b)\n200 \t\t\t200 \t\n7.25% senior secured notes, interest only payments until due in February 2028 (b)\n750 \t\t\t— \t\n8.50% senior secured notes, interest only payments until due in May 2029 (b)\n1,000 \t\t\t— \t\n5.50% senior secured notes, installments through April 2026 (c)\n2,917 \t\t\t3,500 \t\n5.75% senior secured notes, installments beginning in July 2026 until due in April 2029 (c)\n3,000 \t\t\t3,000 \t\nAAdvantage Term Loan Facility, variable interest rate of 10.43%, installments through April 2028 (c)\n3,150 \t\t\t3,500 \t\nEnhanced equipment trust certificates (EETCs), fixed interest rates ranging from 2.88% to 5.90%, averaging 3.60%, maturing from 2024 to 2034\n7,657 \t\t\t9,175 \t\nEquipment loans and other notes payable, fixed and variable interest rates ranging from 2.55% to 8.90%, averaging 6.98%, maturing from 2024 to 2035 (d)\n3,612 \t\t\t3,170 \t\nSpecial facility revenue bonds, fixed interest rates ranging from 2.25% to 5.38%, maturing from 2026 to 2036\n967 \t\t\t1,050 \t\n27,526 \t\t\t30,043 \t\nUnsecured\t\t\t\nPSP1 Promissory Note, interest only payments until due in April 2030 (e)\n1,757 \t\t\t1,757 \t\nPSP2 Promissory Note, interest only payments until due in January 2031 (e)\n1,030 \t\t\t1,030 \t\nPSP3 Promissory Note, interest only payments until due in April 2031 (e)\n959 \t\t\t959 \t\n6.50% convertible senior notes, interest only payments until due in July 2025 (f)\n1,000 \t\t\t1,000 \t\n3.75% senior notes, interest only payments until due in March 2025 (g)\n487 \t\t\t500 \t\n5,233 \t\t\t5,246 \t\nTotal long-term debt\t32,759 \t\t\t35,289 \t\nLess: Total unamortized debt discount, premium and issuance costs\t363 \t\t\t386 \t\nLess: Current maturities\t3,501 \t\t\t3,059 \t\nLong-term debt, net of current maturities\t$\t28,895 \t\t\t$\t31,844 \t\n \nAs of December 31, 2023, the maximum availability under our revolving credit and other facilities is as follows (in millions):\n2013 Revolving Facility\t$\t736 \t\n2014 Revolving Facility\t1,631 \t\nApril 2016 Revolving Facility\t446 \t\nOther short-term facility\t49 \t\nTotal\t$\t2,862', 'Long-term debt consisted of the following (in thousands):  \nDecember 31,\n2023\t\t2022\nMacau Related:\t\t\t\nWM Cayman II Revolver, due 2025(1)\n$\t1,497,610 \t\t\t$\t1,500,473 \t\nWML 4 7/8% Senior Notes, due 2024\t600,000 \t\t\t600,000 \t\nWML 5 1/2% Senior Notes, due 2026\t1,000,000 \t\t\t1,000,000 \t\nWML 5 1/2% Senior Notes, due 2027\t750,000 \t\t\t750,000 \t\nWML 5 5/8% Senior Notes, due 2028\t1,350,000 \t\t\t1,350,000 \t\nWML 5 1/8% Senior Notes, due 2029\t1,000,000 \t\t\t1,000,000 \t\nWML 4 1/2% Convertible Bonds, due 2029(2)\n600,000 \t\t\t— \t\nU.S. and Corporate Related:\t\t\t\nWRF Credit Facilities(3):\n   WRF Term Loan, due 2024\t73,683 \t\t\t837,500 \t\n   WRF Term Loan, due 2027\t730,692 \t\t\t— \t\nWLV 4 1/4% Senior Notes, due 2023\t— \t\t\t500,000 \t\nWLV 5 1/2% Senior Notes, due 2025\t1,380,001 \t\t\t1,780,000 \t\nWLV 5 1/4% Senior Notes, due 2027\t880,000 \t\t\t880,000 \t\nWRF 7 3/4% Senior Notes, due 2025\t— \t\t\t600,000 \t\nWRF 5 1/8% Senior Notes, due 2029\t750,000 \t\t\t750,000 \t\nWRF 7 1/8% Senior Notes, due 2031\t600,000 \t\t\t— \t\nRetail Term Loan, due 2025(4)\n615,000 \t\t\t615,000 \t\n11,826,986 \t\t\t12,162,973 \t\nWML Convertible Bond Conversion Option Derivative\t73,744 \t\t\t— \t\nLess: Unamortized debt issuance costs and original issue discounts and premium, net\t(162,393)\t\t\t(46,114)\t\n11,738,337 \t\t\t12,116,859 \t\nLess: Current portion of long-term debt\t(709,593)\t\t\t(547,543)\t\nTotal long-term debt, net of current portion\t$\t11,028,744 \t\t\t$\t11,569,316', 'December 31,\n2023\t\t2022\n(dollars in millions)\nLong-term Debt, including amounts due within one year\t\t$\t40,143.2 \t\t\t58.8 \t%\t\t$\t36,801.0 \t\t\t56.6 \t%\nShort-term Debt\t\t2,830.2 \t\t\t4.2 \t\t\t4,112.2 \t\t\t6.3 \t\nTotal Debt\t\t42,973.4 \t\t\t63.0 \t\t\t40,913.2 \t\t\t62.9 \t\nAEP Common Equity\t\t25,246.7 \t\t\t37.0 \t\t\t23,893.4 \t\t\t36.7 \t\nNoncontrolling Interests\t\t39.2 \t\t\t— \t\t\t229.0 \t\t\t0.4 \t\nTotal Debt and Equity Capitalization\t\t$\t68,259.3 \t\t\t100.0 \t%\t\t$\t65,035.6 \t\t\t100.0 \t%', 'As of December 31, 2023, outstanding long-term debt was payable as follows:\nAEP\t\tAEP Texas\t\tAEPTCo\t\tAPCo\t\tI&M\t\tOPCo\t\tPSO\t\tSWEPCo\n(in millions)\n2024\t\t$\t2,490.5 \t\t\t$\t96.0 \t\t\t$\t95.0 \t\t\t$\t538.8 \t\t\t$\t83.7 \t\t\t$\t— \t\t\t$\t0.6 \t\t\t$\t— \t\n2025\t\t3,308.5 \t\t\t524.5 \t\t\t90.0 \t\t\t673.3 \t\t\t241.2 \t\t\t— \t\t\t250.6 \t\t\t— \t\n2026\t\t1,780.5 \t\t\t75.0 \t\t\t425.0 \t\t\t30.9 \t\t\t26.3 \t\t\t— \t\t\t50.6 \t\t\t900.0 \t\n2027\t\t2,215.9 \t\t\t25.6 \t\t\t— \t\t\t355.6 \t\t\t4.1 \t\t\t— \t\t\t0.3 \t\t\t— \t\n2028\t\t2,326.6 \t\t\t526.2 \t\t\t60.0 \t\t\t31.8 \t\t\t350.8 \t\t\t— \t\t\t— \t\t\t575.0 \t\nAfter 2028\t\t28,349.7 \t\t\t4,690.2 \t\t\t4,806.0 \t\t\t4,000.0 \t\t\t2,825.4 \t\t\t3,400.0 \t\t\t2,100.0 \t\t\t2,200.0 \t\nPrincipal Amount\t\t40,471.7 \t\t\t5,937.5 \t\t\t5,476.0 \t\t\t5,630.4 \t\t\t3,531.5 \t\t\t3,400.0 \t\t\t2,402.1 \t\t\t3,675.0 \t\nUnamortized Discount, Net and Debt Issuance Costs\n(328.5)\t\t\t(47.7)\t\t\t(61.6)\t\t\t(42.1)\t\t\t(32.1)\t\t\t(33.2)\t\t\t(17.5)\t\t\t(28.1)\t\nTotal Long-term Debt Outstanding\n$\t40,143.2 \t\t\t$\t5,889.8 \t\t\t$\t5,414.4 \t\t\t$\t5,588.3 \t\t\t$\t3,499.4 \t\t\t$\t3,366.8 \t\t\t$\t2,384.6 \t\t\t$\t3,646.9 \t\n \n\nLong-term Debt Subsequent Events\n\nIn January and February 2024, I&M retired $8 million and $8 million, respectively, of Notes Payable related to DCC Fuel.\n\nIn January and February 2024, Transource Energy issued $16 million and $2 million, respectively, of variable rate Other Long-term Debt due in 2025.\n\nIn February 2024, AEP Texas retired $12 million of Securitization Bonds.\n\nIn February 2024, APCo retired $13 million of Securitization Bonds.', 'The Company had short-term and long-term debt outstanding as follows:\nDecember 31,\n(in millions)\t2023\t\t2022\nShort-term debt\t\t\t\nShort-term borrowings\t$\t70 \t\t\t$\t58 \t\nLong-term debt\t\t\t\n3.375% Senior notes due 03/15/25 ($384 million par value)\n384 \t\t\t499 \t\n5.000% Senior notes due 10/01/25 ($453 million par value)1\n477 \t\t\t840 \t\n2.650% Senior notes due 07/01/27 ($1,100 million par value)\n1,093 \t\t\t1,092 \t\n7.125% Senior notes due 02/15/29 ($121 million par value)\n120 \t\t\t120 \t\n1.000% Senior notes due 05/19/31 (€1,000 million par value)\n1,088 \t\t\t1,051 \t\n4.375% Senior notes due 03/15/45 ($500 million par value)\n495 \t\t\t495 \t\nTerm loan facilities, finance leases and other\t53 \t\t\t45 \t\nTotal long-term debt\t3,710 \t\t\t4,142 \t\nLess: current portion\t3 \t\t\t2 \t\nLong-term debt, net of current portion\t$\t3,707 \t\t\t$\t4,140', 'Long-term and short-term debt outstanding was as follows:\nDecember 31,\nInterest Rates (1)\t\t\t\t2023\t\t2022\nRange\tMaturity\tFace\nValue\t\tUnamortized\nDiscount and Issuance Costs\t\tCarrying\nValue\t\tFace\nValue\t\tUnamortized\nDiscount and Issuance Costs\t\tCarrying\nValue\n(In millions)\nSenior notes\n0.50 \t%\t\t-\t\t6.50%\t\t2024\t-\t2054\t\t$\t14,622 \t\t\t$\t(106)\t\t\t$\t14,516 \t\t\t$\t13,671 \t\t\t$\t(83)\t\t\t$\t13,588 \t\nSurplus notes\n7.63 \t%\t\t-\t\t7.88%\t\t2024\t-\t2025\t\t507 \t\t\t— \t\t\t507 \t\t\t507 \t\t\t(1)\t\t\t506 \t\nOther notes\n2.03 \t%\t\t-\t\t8.43%\t\t2024\t-\t2028\t\t495 \t\t\t(2)\t\t\t493 \t\t\t500 \t\t\t(3)\t\t\t497 \t\nFinancing lease obligations\t\t\t\t\t\t\t\t\t\t\t32 \t\t\t— \t\t\t32 \t\t\t56 \t\t\t— \t\t\t56 \t\nTotal long-term debt\n15,656 \t\t\t(108)\t\t\t15,548 \t\t\t14,734 \t\t\t(87)\t\t\t14,647 \t\nTotal short-term debt\n119 \t\t\t— \t\t\t119 \t\t\t175 \t\t\t— \t\t\t175 \t\nTotal\n$\t15,775 \t\t\t$\t(108)\t\t\t$\t15,667 \t\t\t$\t14,909 \t\t\t$\t(87)\t\t\t$\t14,822 \t\n \n__________________\n(1)Range of interest rates are for the year ended December 31, 2023.\nThe aggregate maturities of long-term debt at December 31, 2023 for the next five years and thereafter are $1.8 billion in 2024, $1.3 billion in 2025, $180 million in 2026, $52 million in 2027, $348 million in 2028 and $11.9 billion thereafter.', 'Long-term Debt']",1007.3030829662456,I don’t know
15,15,RE/2014/page_125.pdf,"what is the total amount of notes issued by kilimanjaro in 2014 , in thousands?",950000,"[""['9 .', 'junior subordinated debt securities payable in accordance with the provisions of the junior subordinated debt securities which were issued on march 29 , 2004 , holdings elected to redeem the $ 329897 thousand of 6.2% ( 6.2 % ) junior subordinated debt securities outstanding on may 24 , 2013 .', 'as a result of the early redemption , the company incurred pre-tax expense of $ 7282 thousand related to the immediate amortization of the remaining capitalized issuance costs on the trust preferred securities .', 'interest expense incurred in connection with these junior subordinated debt securities is as follows for the periods indicated: .']\n( dollars in thousands )\tyears ended december 31 , 2014\tyears ended december 31 , 2013\tyears ended december 31 , 2012\ninterest expense incurred\t$ -\t$ 8181\t$ 20454\n['holdings considered the mechanisms and obligations relating to the trust preferred securities , taken together , constituted a full and unconditional guarantee by holdings of capital trust ii 2019s payment obligations with respect to their trust preferred securities .', '10 .', 'reinsurance and trust agreements certain subsidiaries of group have established trust agreements , which effectively use the company 2019s investments as collateral , as security for assumed losses payable to certain non-affiliated ceding companies .', 'at december 31 , 2014 , the total amount on deposit in trust accounts was $ 322285 thousand .', 'on april 24 , 2014 , the company entered into two collateralized reinsurance agreements with kilimanjaro re limited ( 201ckilimanjaro 201d ) , a bermuda based special purpose reinsurer , to provide the company with catastrophe reinsurance coverage .', 'these agreements are multi-year reinsurance contracts which cover specified named storm and earthquake events .', 'the first agreement provides up to $ 250000 thousand of reinsurance coverage from named storms in specified states of the southeastern united states .', 'the second agreement provides up to $ 200000 thousand of reinsurance coverage from named storms in specified states of the southeast , mid-atlantic and northeast regions of the united states and puerto rico as well as reinsurance coverage from earthquakes in specified states of the southeast , mid-atlantic , northeast and west regions of the united states , puerto rico and british columbia .', 'on november 18 , 2014 , the company entered into a collateralized reinsurance agreement with kilimanjaro re to provide the company with catastrophe reinsurance coverage .', 'this agreement is a multi-year reinsurance contract which covers specified earthquake events .', 'the agreement provides up to $ 500000 thousand of reinsurance coverage from earthquakes in the united states , puerto rico and canada .', 'kilimanjaro has financed the various property catastrophe reinsurance coverage by issuing catastrophe bonds to unrelated , external investors .', 'on april 24 , 2014 , kilimanjaro issued $ 450000 thousand of variable rate notes ( 201cseries 2014-1 notes 201d ) .', 'on november 18 , 2014 , kilimanjaro issued $ 500000 thousand of variable rate notes ( 201cseries 2014-2 notes 201d ) .', 'the proceeds from the issuance of the series 2014-1 notes and the series 2014-2 notes are held in reinsurance trust throughout the duration of the applicable reinsurance agreements and invested solely in us government money market funds with a rating of at least 201caaam 201d by standard & poor 2019s. .']""]","{'text_16': 'on april 24 , 2014 , kilimanjaro issued $ 450000 thousand of variable rate notes ( 201cseries 2014-1 notes 201d ) .', 'text_17': 'on november 18 , 2014 , kilimanjaro issued $ 500000 thousand of variable rate notes ( 201cseries 2014-2 notes 201d ) .'}","add(450000, 500000)",FinQA,Arithmetic,"['on april 24 , 2014 , kilimanjaro issued $ 450000 thousand of variable rate notes ( 201cseries 2014-1 notes 201d ) .', 'on november 18 , 2014 , kilimanjaro issued $ 500000 thousand of variable rate notes ( 201cseries 2014-2 notes 201d ) .']",RE/2014/page_125.pdf,True,"[""['9 .', 'junior subordinated debt securities payable in accordance with the provisions of the junior subordinated debt securities which were issued on march 29 , 2004 , holdings elected to redeem the $ 329897 thousand of 6.2% ( 6.2 % ) junior subordinated debt securities outstanding on may 24 , 2013 .', 'as a result of the early redemption , the company incurred pre-tax expense of $ 7282 thousand related to the immediate amortization of the remaining capitalized issuance costs on the trust preferred securities .', 'interest expense incurred in connection with these junior subordinated debt securities is as follows for the periods indicated: .'] ( dollars in thousands ) years ended december 31 , 2014 years ended december 31 , 2013 years ended december 31 , 2012 interest expense incurred $ - $ 8181 $ 20454 ['holdings considered the mechanisms and obligations relating to the trust preferred securities , taken together , constituted a full and unconditional guarantee by holdings of capital trust ii 2019s payment obligations with respect to their trust preferred securities .', '10 .', 'reinsurance and trust agreements certain subsidiaries of group have established trust agreements , which effectively use the company 2019s investments as collateral , as security for assumed losses payable to certain non-affiliated ceding companies .', 'at december 31 , 2014 , the total amount on deposit in trust accounts was $ 322285 thousand .', 'on april 24 , 2014 , the company entered into two collateralized reinsurance agreements with kilimanjaro re limited ( 201ckilimanjaro 201d ) , a bermuda based special purpose reinsurer , to provide the company with catastrophe reinsurance coverage .', 'these agreements are multi-year reinsurance contracts which cover specified named storm and earthquake events .', 'the first agreement provides up to $ 250000 thousand of reinsurance coverage from named storms in specified states of the southeastern united states .', 'the second agreement provides up to $ 200000 thousand of reinsurance coverage from named storms in specified states of the southeast , mid-atlantic and northeast regions of the united states and puerto rico as well as reinsurance coverage from earthquakes in specified states of the southeast , mid-atlantic , northeast and west regions of the united states , puerto rico and british columbia .', 'on november 18 , 2014 , the company entered into a collateralized reinsurance agreement with kilimanjaro re to provide the company with catastrophe reinsurance coverage .', 'this agreement is a multi-year reinsurance contract which covers specified earthquake events .', 'the agreement provides up to $ 500000 thousand of reinsurance coverage from earthquakes in the united states , puerto rico and canada .', 'kilimanjaro has financed the various property catastrophe reinsurance coverage by issuing catastrophe bonds to unrelated , external investors .', 'on april 24 , 2014 , kilimanjaro issued $ 450000 thousand of variable rate notes ( 201cseries 2014-1 notes 201d ) .', 'on november 18 , 2014 , kilimanjaro issued $ 500000 thousand of variable rate notes ( 201cseries 2014-2 notes 201d ) .', 'the proceeds from the issuance of the series 2014-1 notes and the series 2014-2 notes are held in reinsurance trust throughout the duration of the applicable reinsurance agreements and invested solely in us government money market funds with a rating of at least 201caaam 201d by standard & poor 2019s. .']"", 'On November 16, 2012, we issued $900.0 million of senior notes. We issued a $300.0 million series of notes that bore interest at 1.85% and were to mature in 2017. These notes were repaid following our November 2016 debt issuance. We issued a $300.0 million series of notes that bore interest at 3.125% and matured in 2023 and a $300.0 million series of notes that bear interest at 4.35% and will mature in 2043. Interest on the notes is payable semi-annually on May 15 and November 15 each year, beginning on May 15, 2013. The proceeds were used to fund our acquisition of Cuprum.\n\nOn September 5, 2012, we issued a $300.0 million series of senior notes that bear interest at 4.625% and will mature in 2042. Interest on the notes is payable semi-annually on March 15 and September 15 each year, beginning on March 15, 2013. The proceeds were used for the repayment of the $400.0 million aggregate principal amount of notes due in 2014 and to partially fund our acquisition of Cuprum.', '$\n\n4,022.7\n\n\n$\n\n(25.7)\n\n\n$\n\n3,997.0\n\nNet discount, premium and issuance costs associated with issuing these notes are amortized to expense over the respective terms using the interest method.\n\nOn March 8, 2023, we issued $700.0 million of senior notes. We issued a $400.0 million series of notes that bear interest at 5.375% and will mature in 2033 and a $300.0 million series of notes that bear interest at 5.5% and will mature in 2053. Interest on the notes is payable semi-annually on March 15 and September 15 each year, beginning on September 15, 2023. The proceeds from these notes were used to redeem our floating rate notes payable due in 2055 and to repay at maturity our 3.125% notes payable due in 2023. We incurred a one-time cost to extinguish this debt before the scheduled maturity date, which was recorded in operating expenses on the consolidated statements of operations.On June 12, 2020, we issued $500.0 million of senior notes at a discount. On August 3, 2020, we issued an additional $100.0 million of senior notes at a premium. These notes bear interest at 2.125% and will mature in 2030. Interest on the notes is payable semi-annually on June 15 and December 15 each year, beginning on December 15, 2020. The proceeds from these notes were used for general corporate purposes.', 'On October 21, 2015, we completed the 2015 Recapitalization in which certain of our subsidiaries issued notes pursuant to an asset-backed securitization. The notes consisted of $500.0 million of Series 2015-1 3.484% Fixed Rate Senior Secured Notes, Class A-2-I (the “2015 Five-Year Notes”), $800.0 million Series 2015-1 4.474% Fixed Rate Senior Secured Notes, Class A-2-II (the “2015 Ten-Year Notes” and collectively with the 2015 Five-Year Notes, the “2015 Notes”). Gross proceeds from the issuance of the 2015 Notes were $1.3 billion. The 2015 Five-Year Notes were repaid in connection with the 2018 Recapitalization. Additional information related to the 2015 Recapitalization is included in Note 3 to our consolidated financial statements. \n\n \n\n2021, 2019, 2018, 2017 and 2015 Notes\n\n \n\nThe 2021 Notes, 2019 Notes, 2018 Notes, 2017 Notes and the 2015 Notes are collectively referred to as the “Notes.” \n\n \n\nThe Notes have original scheduled principal payments of $51.5 million in 2024, $1.17 billion in 2025, $39.3 million in 2026, $1.31 billion in 2027, $811.5 million in 2028, $625.9 million in 2029, $10.0 million in 2030 and $905.0 million in 2031. However, in accordance with our debt agreements, the payment of principal on the outstanding senior notes may be suspended if our leverage ratio is less than or equal to 5.0x total debt, as defined, to adjusted EBITDA, as defined, and no catch-up provisions are applicable.', 'The following table summarizes the outstanding debt (in thousands): \nMarch 30, 2024\t\tApril 1, 2023\n1.750% senior notes due 2024\t$\t439,738 \t\t\t$\t500,000 \t\n4.375% senior notes due 2029\t850,000 \t\t\t850,000 \t\n3.375% senior notes due 2031\t700,000 \t\t\t700,000 \t\nFinance leases and other\t— \t\t\t1,666 \t\nUnamortized premium, discount and issuance costs, net\t(1,726)\t\t\t(3,283)\t\nTotal debt\t1,988,012 \t\t\t2,048,383 \t\nLess current portion of debt\t(438,740)\t\t\t(310)\t\nTotal long-term debt\t$\t1,549,272 \t\t\t$\t2,048,073', 'On October 16 and December 5, 2006, we issued $500.0 million and $100.0 million, respectively, of senior notes. The notes bear interest at a rate of 6.05% per year. Interest on the notes is payable semi-annually on April 15 and October 15 each year and began on April 15, 2007. The notes will mature on October 15, 2036. A portion of the proceeds were used to fund the 2006 acquisition of WM Advisors, Inc., with the remaining proceeds being used for general corporate purposes. A tender offer in the fourth quarter of 2016 resulted in redemption of $94.4 million of the senior notes. We incurred a one-time cost to extinguish this debt before the scheduled maturity date.\n\nThe non-recourse mortgages and notes payable are primarily financings for real estate developments. As of December 31, 2023, the development had an outstanding principal balance of $3.0 million with an interest rate of 4.0%. As of December 31, 2022, outstanding principal balances ranged from $3.0 million to $15.9 million per development with interest rates ranging from 3.5% to 4.8%. Outstanding debt is secured by the underlying real estate properties, which were reported as real estate on our consolidated statements of financial position with a carrying value of $321.7 million and $317.6 million as of December 31, 2023 and 2022, respectively. As of December 31, 2023, future annual maturities of long-term debt were as follows (in millions):\n\nYear ending December 31:\n\n    \n\n\n    \n\n  \n\n2024\n\n\n$\n\n0.1\n\n\n2025\n\n399.3', 'In June 2021, the Company issued $1.0 billion aggregate principal amount of the 2021 Notes in a private placement to qualified institutional buyers pursuant to Rule 144A under the Securities Act of 1933, as amended (the “Securities Act”). The net proceeds from the sale of the 2021 Notes were approximately $986.7 million after deducting the initial purchasers’ discount and offering expenses and before the 2021 Capped Call Transactions, as described below, and the repurchase of stock, as described in “Note 15—Stockholders’ (Deficit) Equity.” The Company used $85.0 million of the net proceeds from the 2021 Notes to enter into privately negotiated capped call instruments (“2021 Capped Call Transactions”) with certain financial institutions.', 'Scheduled maturities of long-term debt are as follows for the periods ending December 31: \n(in millions)\t \n2024\t$\t130.1 \t\n2025\t45.7 \t\n2026\t28.8 \t\n2027\t710.5 \t\n2028\t554.3 \t\nThereafter\t1,892.3 \t\nTotal\t$\t3,361.7', '600.0\n\n(3.6)\n\n596.4\n\n\n6.05% notes payable, due 2036\n\n505.6\n\n(2.3)\n\n\n \n\n503.3\n\n\n4.625% notes payable, due 2042\n\n300.0\n\n(2.9)\n\n\n \n\n297.1\n\n\n4.35% notes payable, due 2043\n\n300.0\n\n(3.0)\n\n\n \n\n297.0\n\n\n4.3% notes payable, due 2046\n\n300.0\n\n(3.1)\n\n296.9\n\n\nFloating rate notes payable, due 2055\n\n400.0\n\n(4.5)\n\n\n \n\n395.5\n\n\nNon-recourse mortgages and notes payable\n\n\n \n\n67.1\n\n\n \n\n0.7\n\n\n \n\n67.8\n\n\nTotal long-term debt\n\n\n$\n\n4,022.7\n\n\n$\n\n(25.7)\n\n\n$\n\n3,997.0\n\nNet discount, premium and issuance costs associated with issuing these notes are amortized to expense over the respective terms using the interest method.', 'The following table summarizes long-term notes at December 31:\n2023\t2022\n0.15% Swiss franc denominated notes due 2024\n$\t714.6 \t\t$\t649.5 \t\n7.125% notes due 2025\n217.5 \t\t217.5 \t\n2.75% notes due 2025\n560.6 \t\t560.6 \t\n5.0% notes due 2026\n750.0 \t\t— \t\n1.625% euro denominated notes due 2026\n830.7 \t\t799.3 \t\n5.5% notes due 2027\n364.3 \t\t364.3 \t\n3.1% notes due 2027\n401.5 \t\t401.5 \t\n0.45% Swiss franc denominated notes due 2028\n476.4 \t\t433.0 \t\n3.375% notes due 2029\n930.6 \t\t930.6 \t\n0.42% Japanese yen denominated notes due 2029\n162.5 \t\t172.1 \t\n2.125% euro denominated notes due 2030\n830.7 \t\t799.3 \t\n0.625% euro denominated notes due 2031\n664.6 \t\t639.4 \t\n4.7% notes due 2033\n1,000.0 \t\t— \t\n0.50% euro denominated notes due 2033\n664.6 \t\t639.4 \t\n0.56% Japanese yen denominated notes due 2034\n65.8 \t\t69.7 \t\n6.77% notes due 2036\n158.6 \t\t158.6 \t\n5.55% notes due 2037\n444.7 \t\t444.7 \t\n5.95% notes due 2037\n266.8 \t\t266.8 \t\n3.875% notes due 2039\n240.3 \t\t240.3 \t\n1.625% British pound denominated notes due 2043\n318.5 \t\t301.2 \t\n4.65% notes due 2044\n38.3 \t\t38.3 \t\n3.7% notes due 2045\n386.8 \t\t386.8 \t\n3.95% notes due 2047\n347.0 \t\t347.0 \t\n3.95% notes due 2049\n958.2 \t\t958.2 \t\n1.70% euro denominated notes due 2049\n1,107.6 \t\t1,065.7 \t\n0.97% Japanese yen denominated notes due 2049\n54.2 \t\t57.4 \t\n2.25% notes due 2050\n1,250.0 \t\t1,250.0 \t\n1.125% euro denominated notes due 2051\n553.8 \t\t532.9 \t\n4.875% notes due 2053\n1,250.0 \t\t— \t\n4.15% notes due 2059\n591.3 \t\t591.3 \t\n2.50% notes due 2060\n850.0 \t\t850.0 \t\n1.375% euro denominated notes due 2061\n775.3 \t\t746.0 \t\n4.95% notes due 2063\n1,000.0 \t\t— \t\nUnamortized note discounts\t(121.2)\t\t(96.1)\t\nTotal long-term notes\t$\t19,104.6 \t\t$\t14,815.3 \t\n \nThe weighted-average effective borrowing rate for each issuance of the long term-notes approximates the stated interest rate.\nAt December 31, 2023, we had a total of $7.42 billion of unused committed bank credit facilities, which consisted primarily of a $3.00 billion credit facility that expires in December 2027 and a $4.00 billion 364-day facility that expires in September 2024, both of which are available to support our commercial paper program. We have not drawn against the $3.00 billion and $4.00 billion facilities as of December 31, 2023. Of the remaining committed bank credit facilities, the outstanding balances as of December 31, 2023 and 2022 were not material. Compensating balances and commitment fees are not material, and there are no conditions that are probable of occurring under which the lines may be withdrawn.']",1267.3462919192389,950000
16,16,f11f79ac,"Darden Restaurants FY24 new hire ratio & workforce trends, DRI.","Calculation: The percentage of current hourly employees who were new hires in fiscal 2024 is calculated as (137,038 new hires / 180,207 current hourly employees) × 100 ≈ 76%. This high percentage suggests that a large portion of the hourly workforce was brought on during fiscal 2024. Two potential inferences can be drawn from this ratio: (1) The company might be experiencing rapid workforce growth, indicating expansion and an increasing scale of operations; or (2) The high percentage of new hires could also be a result of significant turnover, where many positions were vacated and subsequently refilled. Without additional data on separation rates or details about whether the expansion is strategic (i.e., net growth) or compensatory (i.e., replacing departing employees), it is unclear which factor is most pronounced. However, the data clearly indicate noteworthy changes in the composition of the workforce during the period.","['Hire. We are committed to attracting, engaging, developing and retaining a workforce here at Dardens Restaurants that mirrors the diversity of our guests and the communities in which we operate. We track a variety of workforce statistics to help us understand the gender, racial and ethnic diversity of our team members. Key team member statistics as of the end of fiscal 2024 included the following:\n\nTotal team members (hourly and salaried)\n191,105\nTotal number of hourly team members\n180,207\nPercent of hourly team members – female\n58%\nPercent of hourly team members – members of racial or ethnic minority groups\n56%\nTotal number of new hires of hourly team members during fiscal 2024\n137,038\nPercent of hourly new hires – female\n57%\nPercent of hourly new hires – members of racial or ethnic minority groups\n56%\n \n\nIn addition to the gender, racial and ethnic diversity of our workforce, our team members are also very diverse in age; we employ members of five generations of the United States population: Traditionalists, Baby Boomers, Generation X, Millennials and Centennials. We provide our EEO-1 report and additional details about our inclusion and diversity programs on our website at www.darden.com.']",,Compositional,FinDER,Compositional,"['Hire. We are committed to attracting, engaging, developing and retaining a workforce here at Dardens Restaurants that mirrors the diversity of our guests and the communities in which we operate. We track a variety of workforce statistics to help us understand the gender, racial and ethnic diversity of our team members. Key team member statistics as of the end of fiscal 2024 included the following:\n\nTotal team members (hourly and salaried)\n191,105\nTotal number of hourly team members\n180,207\nPercent of hourly team members – female\n58%\nPercent of hourly team members – members of racial or ethnic minority groups\n56%\nTotal number of new hires of hourly team members during fiscal 2024\n137,038\nPercent of hourly new hires – female\n57%\nPercent of hourly new hires – members of racial or ethnic minority groups\n56%\n \n\nIn addition to the gender, racial and ethnic diversity of our workforce, our team members are also very diverse in age; we employ members of five generations of the United States population: Traditionalists, Baby Boomers, Generation X, Millennials and Centennials. We provide our EEO-1 report and additional details about our inclusion and diversity programs on our website at www.darden.com.']",f11f79ac,True,"['Hire. We are committed to attracting, engaging, developing and retaining a workforce that mirrors the diversity of our guests and the communities in which we operate. We track a variety of workforce statistics to help us understand the gender, racial and ethnic diversity of our team members. Key team member statistics as of the end of fiscal 2024 included the following:\n\nTotal team members (hourly and salaried)\n191,105\nTotal number of hourly team members\n180,207\nPercent of hourly team members – female\n58%\nPercent of hourly team members – members of racial or ethnic minority groups\n56%\nTotal number of new hires of hourly team members during fiscal 2024\n137,038\nPercent of hourly new hires – female\n57%\nPercent of hourly new hires – members of racial or ethnic minority groups\n56%\n \n\nIn addition to the gender, racial and ethnic diversity of our workforce, our team members are also very diverse in age; we employ members of five generations of the United States population: Traditionalists, Baby Boomers, Generation X, Millennials and Centennials. We provide our EEO-1 report and additional details about our inclusion and diversity programs on our website at www.darden.com.', 'DARDEN RESTAURANTS, INC.\nCONSOLIDATED STATEMENTS OF EARNINGS\n(In millions, except per share data)\nFiscal Year Ended\nMay 26, 2024\t\tMay 28, 2023\t\tMay 29, 2022\nSales\t$\t11,390.0 \t\t\t$\t10,487.8 \t\t\t$\t9,630.0 \t\nCosts and expenses:\t\t\t\t\t\nFood and beverage\n3,523.9 \t\t\t3,355.9 \t\t\t2,943.6 \t\nRestaurant labor\n3,619.3 \t\t\t3,346.3 \t\t\t3,108.8 \t\nRestaurant expenses\n1,836.6 \t\t\t1,702.2 \t\t\t1,582.6 \t\nMarketing expenses\n144.5 \t\t\t118.3 \t\t\t93.2 \t\nGeneral and administrative expenses\t479.2 \t\t\t386.1 \t\t\t373.2 \t\nDepreciation and amortization\t459.9 \t\t\t387.8 \t\t\t368.4 \t\nImpairments and disposal of assets, net\t12.4 \t\t\t(10.6)\t\t\t(2.0)\t\nTotal operating costs and expenses\n$\t10,075.8 \t\t\t$\t9,286.0 \t\t\t$\t8,467.8 \t\nOperating income\t$\t1,314.2 \t\t\t$\t1,201.8 \t\t\t$\t1,162.2 \t\nInterest, net\t138.7 \t\t\t81.3 \t\t\t68.7 \t\nEarnings before income taxes\t$\t1,175.5 \t\t\t$\t1,120.5 \t\t\t$\t1,093.5 \t\nIncome tax expense\t145.0 \t\t\t137.0 \t\t\t138.8 \t\nEarnings from continuing operations\t$\t1,030.5 \t\t\t$\t983.5 \t\t\t$\t954.7 \t\nLosses from discontinued operations, net of tax benefit of $1.7, $0.8 and $0.2, respectively\n(2.9)\t\t\t(1.6)\t\t\t(1.9)\t\nNet earnings\t$\t1,027.6 \t\t\t$\t981.9 \t\t\t$\t952.8 \t\nBasic net earnings per share:\t\t\t\t\t\nEarnings from continuing operations\t$\t8.59 \t\t\t$\t8.07 \t\t\t$\t7.47 \t\nLosses from discontinued operations\t(0.02)\t\t\t(0.01)\t\t\t(0.01)\t\nNet earnings\t$\t8.57 \t\t\t$\t8.06 \t\t\t$\t7.46 \t\nDiluted net earnings per share:\t\t\t\t\t\nEarnings from continuing operations\t$\t8.53 \t\t\t$\t8.00 \t\t\t$\t7.40 \t\nLosses from discontinued operations\t(0.02)\t\t\t(0.01)\t\t\t(0.01)\t\nNet earnings\t$\t8.51 \t\t\t$\t7.99 \t\t\t$\t7.39 \t\nAverage number of common shares outstanding:\t\t\t\t\t\nBasic\t119.9 \t\t\t121.9 \t\t\t127.8 \t\nDiluted\t120.8 \t\t\t122.9 \t\t\t129.0', 'Our human capital strategy focuses on attracting, developing and retaining the best talent in the industry. Some key elements of these strategies include: assessing current and future talent needs; a diverse and inclusive workforce; robust opportunities for employee growth and development; support for health and well-being; and an active listening strategy to make sure voices are heard and continuous improvement occurs. We review our human capital metrics and our diversity equity and inclusion (DEI) program with the Talent and Compensation Committee of our Board of Directors on a regular basis.\nAs of December 31, 2023, our three global cruise brands employed approximately 98,200 employees spanning across our shipboard fleet and shoreside locations. Our shoreside workforce, including private destinations, consisted of approximately 9,500 full time and 100 part-time employees. Our shipboard workforce consisted of approximately, 88,700 employees, and as of December 31, 2023, approximately 88% were covered by collective bargaining agreements.\nThe following table details the distribution of our workforce by employee type and region as of December 31, 2023:\nEmployee Type\tU.S. Based Employees\tInternational Employees\nShoreside Operations(1)\n4,050\t3,900\nShipboard Employees\n—\t88,700\nPrivate Destinations (2)\n—\t1,550\n \n(1)    Includes full time and part-time employees.\n(2)    Private Destinations includes Coco Cay, Labadee and Galapagos based employees.', 'Our culture is built on the foundation that our people and the way we treat one another promote creativity, innovation and performance, which spur our success. We are continually investing in our global workforce to further drive diversity and inclusion, provide fair and market-competitive pay and benefits to support our employees’ wellbeing, and foster their growth and development. As of December 1, 2023, we employed 29,945 people, of which 50% were in the United States and 50% were in our international locations. During fiscal 2023, our total attrition rate was 7.4%. We have not experienced work stoppages and believe our employee relations are good. Our employee listening program helps us understand employee sentiment on a wide range of topics throughout the employee lifecycle, providing insights that inform our decisions about employee programs, talent risks, management opportunities, employee networks and more. In fiscal 2023, 80% of our employees participated in our most recent engagement survey.\nDigital transformation and the COVID-19 pandemic have fundamentally changed how people work, and we are leaning into digital-first workflows, tools and resources to enable us to be productive, wherever we are. We also believe in the value of people being together—fostering trust, relationships and collaboration and innovation. We have evolved into a hybrid model, in which employees who are assigned to an office can divide their work between the office and home about half the time. We continue to pilot, test and iterate our approach to support new ways of working and evolving the employee experience.', 'Our people and culture are critical to achieving our operational, financial and strategic success.\nAs of December 31, 2023, we employed approximately 40,000 people in approximately 60 countries including over 15,000 outside of the United States. As of December 31, 2023, 25.9% of our global employees were women and 37.2% of our employees in the United States were racially and ethnically diverse. In 2023, 30.9% of our new hires globally were women and 53.0% of new hires in the United States were racially and ethnically diverse. Approximately 25.2% of leadership and management positions were held by women as of December 31, 2023. The diversity percentages included in this section exclude current year business acquisitions.\nAs a result of maintaining a consistent focus on an uplifting culture, our key talent (employees with the highest potential rating) retention rate excluding retirements in 2023 was 96.4%. Our company‑wide (all employees) voluntary retention rate excluding retirements was 90.4%.', 'Our employees share common goals: to put patients first and to help people around the world live better, healthier lives. Our global workforce is united by our values: Patient First, commitment to our People, Customer Dedication, Innovation, Integrity, and Excellence. Together, our values provide the foundation for our culture. We believe that an engaged, diverse workforce, empowered by inclusive leaders, will unlock our full potential as a company and as a leader in our sector. Our employees’ success is Catalent’s success.\n\nWe focus on employee development, engagement, and diversity and inclusion (“D&I”) to hire, develop, and retain the best talent. As of June 30, 2024, we had approximately 16,900 employees globally, with women representing 44% of our employees and holding 40% of roles at the manager level or higher. As of June 30, 2024, people of color represented 36% of our U.S. employees.\n\nOur turnover rate decreased to 19% as of June 30, 2024, including 11% voluntary turnover. Much of this turnover was driven by voluntary departures in the U.S. and by a few reorganizations at some of our larger sites and within our corporate functions.', 'Dominion Energy works to recruit, retain and develop the careers of talented individuals who reflect the communities it serves. To cultivate this diversified workforce, Dominion Energy focuses on workforce diversity, equity and inclusion while fostering an environment where employees can utilize their unique strengths, skills, personalities and life experiences. Dominion Energy is committed to increasing its diverse workforce representation to 40% by year-end 2026; to be adjusted as necessary based on position and market availability. During 2023, Dominion Energy increased diverse representation within its workforce from 37.0% to 37.7%, following an increase during 2022 from 35.5% to 37.0% and an increase during 2021 from 34.7% to 35.5%. For the purposes of measuring diversity, Dominion Energy includes employees who identify their gender as female and/or their race/ethnicity as', 'American Indian or Alaskan Native, Asian, Black or African American, Hispanic or Latino, Native Hawaiian or Other Pacific Islander or Two or More Races. In 2023, 2022 and 2021, the percentage of new hires that are diverse was 49.0%, 48.9% and 57.5%, respectively. Dominion Energy sponsors nine employee resource groups to support and reinforce its culture of inclusiveness by enabling employees with shared interests and backgrounds to work together to create community, provide networking opportunities and encourage professional development. The employee resource groups are aligned to support various forms of diversity, equity and inclusion, including gender, sexual orientation, gender identity and expression, race, veteran status, age, ability and cultural heritage. To further advance these initiatives, annual incentive plans for all employees, except as restricted by any collective bargaining agreements, include a performance measure for participation in diversity, equity and inclusion training.', 'As of February 1, 2024, we had 5,601 full-time employees located throughout the United States. Of this total, approximately 21 percent are women and 16 percent are ethnically diverse. During 2023, our voluntary turnover rate was 7.2 percent.\nWe encourage you to review our 2022 Sustainability Report available on our website for more information about our human capital programs and initiatives. Nothing on our website shall be deemed incorporated by reference into this Annual Report on Form 10-K.', 'As of December 31, 2023, we had 881 employees, 572 of whom were based in the U.S. and 309 of whom were based outside of the U.S., principally in the U.K. During fiscal year 2023, we increased our number of employees by 137 or 18.4% compared to an increase of 68 or 10.1%, in 2022. None of our employees is represented by a labor union. We consider our relationships with our employees to be good and have not experienced any interruptions of operations due to labor disagreements. \n\nDiversity, Equity and Inclusion']",1030.5175830144435,"In FY24 Darden brought on 137 038 hourly employees—about 76 % of its 180 207 hourly workforce (roughly 72 % of total headcount).  The company ended the year with 191 105 employees, and both its existing hourly staff (58 % women, 56 % minorities) and its new-hire class (57 % women, 56 % minorities) showed a similar diversity mix."
17,17,d15dde9e,"Impact of F5 litigation def on cap alloc & growth, ticker at end.","The litigation, though being vigorously defended and not triggering any loss contingencies on the balance sheet, still carries the risk of unforeseen future liabilities that could impact capital allocation decisions and long-term growth. First, the Company’s strategy of defending disputes aggressively may help preserve its reputation and intellectual property rights, but if an adverse outcome is eventually realized, it could force a reallocation of capital towards settlements or legal expenses rather than investments in growth initiatives. Without recording loss contingencies, there is a risk that sudden, significant cash outflows (if litigation results in unfavorable judgments or settlements) might strain liquidity. This uncertainty can lead to a more conservative stance from management in capital budgeting, potentially causing delays or cuts in research and development, acquisitions, or other strategic investments. Furthermore, the uncertainty around potential litigation costs can also affect its cost of capital if investors demand a higher return for perceived legal risk. In summary, while the current approach may reflect confidence in the legal defense, the unresolved disputes add a layer of unpredictability that could lead to re-prioritizing cash flows toward mitigating legal risks rather than fueling long-term operational and strategic growth.","[""Lynwood Investment CY Limited v. F5 Networks et al.\nOn June 8, 2020, Lynwood Investment CY Limited (“Lynwood”) filed a lawsuit in the United States District Court for the Northern District of California against the Company and certain affiliates, along with other defendants. In its complaint, Lynwood claims to be the assignee of all rights and interests of Rambler Internet Holding LLC (“Rambler”), and alleges that the intellectual property in the NGINX software originally released by the co-founder of NGINX in 2004 belongs to Rambler (and therefore Lynwood, by assignment) because the software was created and developed while the co-founder was employed by Rambler. Lynwood asserted 26 causes of action against the various defendants, including copyright infringement, violation of trademark law, tortious interference, conspiracy, and fraud. The complaint sought damages, disgorgement of profits, declarations of copyright and trademark ownership, trademark cancellations, and injunctive relief. Lynwood also initiated several trademark opposition and cancellation proceedings before the Trademark Trial and Appeal Board of the United States Patent and Trademark Office, which have all since been suspended.\nIn August and October 2020, the Company and the other defendants filed motions to dismiss Lynwood’s case. On March 25 and 30, 2021, the Court granted the Company’s and the other defendants’ motions to dismiss with leave to amend. Lynwood filed its amended complaint on April 29, 2021, seeking the same relief against the Company and other defendants. On May 27, 2021, the Company and other defendants filed a consolidated motion to dismiss.\nThe Court granted the consolidated motion to dismiss without leave to amend on August 16, 2022 and entered final judgment against Lynwood on September 9, 2022. On September 14, 2022, Lynwood filed a notice of appeal to the Ninth Circuit Court of Appeals to appeal the dismissal. Lynwood filed its opening brief on December 16, 2022. The Company filed its opening appellate brief on April 10, 2023, and Lynwood filed its reply on May 31, 2023. Following the Court’s order granting the consolidated motion to dismiss and final judgment in the Company’s favor, the Court subsequently granted the Company attorneys' fees of over $0.8 million, which Lynwood appealed to the Ninth Circuit Court of Appeals. The dismissal appeal and the fees appeal were heard by the Ninth Circuit Court of Appeals on December 7, 2023. On November 7, 2024, the Court of Appeals partially affirmed the dismissal by affirming dismissal of the state law claims and remanding a portion of the copyright claim to the District Court. The Court of Appeals also vacated the fees award because of the remand.\nIn addition to the above matters, the Company is subject to a variety of legal proceedings, claims, investigations, and litigation arising in the ordinary course of business, including intellectual property litigation. Management believes that the Company has meritorious defenses to the allegations made in its pending cases and intends to vigorously defend these lawsuits; however, the Company is unable to currently determine if an unfavorable outcome is probable or estimate any potential amount or range of possible loss of these or similar matters. There are many uncertainties associated with any litigation and these actions or other third-party claims against the Company may cause it to incur costly litigation and/or substantial settlement charges that could have a material adverse effect on the Company's business, financial condition, results of operations, and cash flows.\nThe Company records an accrual for loss contingencies for legal proceedings when it believes that an unfavorable outcome is both (a) probable and (b) the amount or range of any possible loss is reasonably estimable. The Company has not recorded any accrual for loss contingencies associated with such legal proceedings or the investigations discussed above.""]",,,FinDER,Non-numerical,"[""Lynwood Investment CY Limited v. F5 Networks et al.\nOn June 8, 2020, Lynwood Investment CY Limited (“Lynwood”) filed a lawsuit in the United States District Court for the Northern District of California against the Company and certain affiliates, along with other defendants. In its complaint, Lynwood claims to be the assignee of all rights and interests of Rambler Internet Holding LLC (“Rambler”), and alleges that the intellectual property in the NGINX software originally released by the co-founder of NGINX in 2004 belongs to Rambler (and therefore Lynwood, by assignment) because the software was created and developed while the co-founder was employed by Rambler. Lynwood asserted 26 causes of action against the various defendants, including copyright infringement, violation of trademark law, tortious interference, conspiracy, and fraud. The complaint sought damages, disgorgement of profits, declarations of copyright and trademark ownership, trademark cancellations, and injunctive relief. Lynwood also initiated several trademark opposition and cancellation proceedings before the Trademark Trial and Appeal Board of the United States Patent and Trademark Office, which have all since been suspended.\nIn August and October 2020, the Company and the other defendants filed motions to dismiss Lynwood’s case. On March 25 and 30, 2021, the Court granted the Company’s and the other defendants’ motions to dismiss with leave to amend. Lynwood filed its amended complaint on April 29, 2021, seeking the same relief against the Company and other defendants. On May 27, 2021, the Company and other defendants filed a consolidated motion to dismiss.\nThe Court granted the consolidated motion to dismiss without leave to amend on August 16, 2022 and entered final judgment against Lynwood on September 9, 2022. On September 14, 2022, Lynwood filed a notice of appeal to the Ninth Circuit Court of Appeals to appeal the dismissal. Lynwood filed its opening brief on December 16, 2022. The Company filed its opening appellate brief on April 10, 2023, and Lynwood filed its reply on May 31, 2023. Following the Court’s order granting the consolidated motion to dismiss and final judgment in the Company’s favor, the Court subsequently granted the Company attorneys' fees of over $0.8 million, which Lynwood appealed to the Ninth Circuit Court of Appeals. The dismissal appeal and the fees appeal were heard by the Ninth Circuit Court of Appeals on December 7, 2023. On November 7, 2024, the Court of Appeals partially affirmed the dismissal by affirming dismissal of the state law claims and remanding a portion of the copyright claim to the District Court. The Court of Appeals also vacated the fees award because of the remand.\nIn addition to the above matters, the Company is subject to a variety of legal proceedings, claims, investigations, and litigation arising in the ordinary course of business, including intellectual property litigation. Management believes that the Company has meritorious defenses to the allegations made in its pending cases and intends to vigorously defend these lawsuits; however, the Company is unable to currently determine if an unfavorable outcome is probable or estimate any potential amount or range of possible loss of these or similar matters. There are many uncertainties associated with any litigation and these actions or other third-party claims against the Company may cause it to incur costly litigation and/or substantial settlement charges that could have a material adverse effect on the Company's business, financial condition, results of operations, and cash flows.\nThe Company records an accrual for loss contingencies for legal proceedings when it believes that an unfavorable outcome is both (a) probable and (b) the amount or range of any possible loss is reasonably estimable. The Company has not recorded any accrual for loss contingencies associated with such legal proceedings or the investigations discussed above.""]",d15dde9e,True,"['F5\'s Environmental, Social and Governance (“ESG”) programs are guided by our fundamental principle to “do the right thing” for each other, our customers, our shareholders, and our communities.\nEnvironmental. In fiscal year 2024, F5 took a step forward in our environmental commitments by successfully obtaining the Science Based Target Initiative\'s verification for our 2030 target to reduce both absolute Scope 1 and 2 emissions by 50% and absolute Scope 3 emissions by 43% from the 2021 baseline. We plan to meet this target by optimizing our energy use, sourcing more renewable energy, and enhancing the sustainability of our products and supply chain processes.\nAs evidence of our progress towards our science-based target, F5’s most recent annual ESG report in April 2024 disclosed a 31% reduction in our total emissions during fiscal year 2023. This achievement was driven by a 40% reduction in Scope 1 and 2 emissions and a 30% reduction in Scope 3 emissions. To ensure the integrity of our emissions reporting, F5 also secured third-party verification for our Scope 1 and 2 emissions data from fiscal year 2023. The auditor’s verification letter is available on page 20 of F5’s 2023 ESG report at f5.com under the ‘‘Company — Investor Relations — ESG’’ section.\nSocial. In addition to the employee programs and benefits outlined in the Human Capital Management section above, we continue to prioritize F5 Global Good, the community development initiative that amplifies our employee engagement and diversity and inclusion programs. We are proud that employees direct the entirety of Global Good’s donations, through both the Company matching program and grant selection committees. In fiscal year 2024, two-thirds of all employees worldwide participated in Global Good programs, volunteering over 15,000 hours and directing the entirety of F5’s donations, through both the Company matching program and grant selection committees. F5 and our employees donated over $3.9 million to more than 3,200 non-profits worldwide in fiscal year 2024.\nGovernance. Our guiding principle to ""do the right thing"" is set forth in F5’s Code of Business Conduct and Ethics, with oversight led by our Board of Directors.\nIn fiscal year 2024, F5 added a Risk Committee to assist its Board of Directors’ oversight of the Company’s strategic, legal & regulatory, talent management, technology & cybersecurity, environmental (including climate), and other operational risks. The Risk Committee’s responsibilities include monitoring, reviewing, and providing guidance regarding applicable risk policies and processes, as well as providing feedback on related risk analysis and reporting. In conjunction, the Risk Committee reviews and assesses F5’s cybersecurity risk exposure and evaluates the adequacy and effectiveness of related risk management processes and policies, including data privacy and security, business continuity, and operational risks.', 'In June 2022, the Company and Fair Isaac Corporation (“FICO”) resolved a trademark dispute that was pending before the Trademark Trial and Appellate Board (“TTAB”) at the U.S. Patent and Trademark Office. The TTAB dismissed all proceedings between the parties in July 2022.\nIn March 2022, Webroot, Inc. and Open Text, Inc. (collectively, “Webroot”) filed a lawsuit against the Company and CrowdStrike, Inc. in federal court in the Western District of Texas alleging that certain of the Company’s products infringe six patents held by them. In the complaint, Webroot sought unspecified damages, attorneys’ fees, and a permanent injunction. In May 2022, CrowdStrike, Inc. asserted counterclaims alleging that certain of Webroot’s products infringe two of its patents. In the filing, CrowdStrike, Inc. sought unspecified damages, reasonable fees and costs, and a permanent injunction. In September 2022, Webroot amended its complaint to assert six additional patents. In November 2023, CrowdStrike, Inc. entered into an agreement that provided for, among other things, the settlement and dismissal of the parties’claims and filed for dismissal. The amount attributable to the settlement was not material.\nIn addition, the Company is involved in various other legal proceedings and subject to claims that arise in the ordinary course of business. For any claims for which the Company believes a liability is both probable and reasonably estimable, the Company records a liability in the period for which it makes this determination. There is no pending or threatened legal proceeding to which the Company is a party that, in the Company’s opinion, is reasonably possible to have a material effect on its consolidated financial statements; however, the results of litigation and claims are inherently unpredictable. Regardless of the outcome, litigation can have an adverse impact on the Company’s business because of defense and settlement costs, diversion of management resources, and other factors. In addition, the costs of litigation and the timing of these costs from\nperiod to period are difficult to estimate, subject to change and could adversely affect the Company’s consolidated financial statements.', 'In view of the uncertainty inherent in litigation and government and regulatory enforcement matters, we cannot predict the eventual outcome of such matters or the timing of their resolution, or in most cases reasonably estimate what the eventual judgments, damages, fines, penalties or impact of activity (if any) restrictions may be. As a result, we cannot provide assurance that such outcomes will not have a material adverse effect on our consolidated financial condition, cash flows, business or competitive position. As litigation or the process to resolve pending matters progresses, as the case may be, we will continue to review the latest information available and assess our ability to predict the outcome of such matters and the effects, if any, on our consolidated financial condition, cash flows, business or competitive position, which may require that we record liabilities in the consolidated financial statements in future periods.', 'Matters Fully Resolved Prior to 2023 Impacting the Consolidated Financial Statements\n\nSCANA Shareholder Litigation', 'Litigation Matters', 'In addition to the above, in the ordinary course of our operations, we are involved in a variety of claims, suits, investigations, and proceedings, including actions with respect to intellectual property claims, patent infringement claims, government investigations, labor and employment claims, breach of contract claims, tax, and other matters. Regardless of the outcome, these proceedings can have an adverse impact on us because of defense costs, diversion of management resources, and other factors. Although the results of complex legal proceedings are difficult to predict and our view of these matters may change in the future as litigation and events related thereto unfold; we currently do not believe that these matters, individually or in the aggregate, will materially affect our financial position, results of operations or cash flows.', ""We appealed the EC decision to the European Court of Justice in 2014, after the General Court (then called the Court of First Instance) rejected our appeal of the EC decision in its entirety. In September 2017, the Court of Justice sent the case back to the General Court to examine whether the rebates at issue were capable of restricting competition. In January 2022, the General Court annulled the EC’s 2009 findings against us regarding rebates, as well as the €1.1 billion fine imposed on Intel, which was returned to us in February 2022. The General Court’s January 2022 decision did not annul the EC’s 2009 finding that we made payments to prevent sales of specific rival products.\nIn April 2022, the EC appealed the General Court’s decision to the Court of Justice. In addition, in September 2023 the EC imposed a €376 million ($401 million) fine against us based on its finding that we made payments to prevent sales of specific rival products. We have appealed the EC’s decision. We have accrued a charge for the fine and are unable to make a reasonable estimate of the potential loss or range of losses in excess of this amount given the procedural posture and the nature of these proceedings.\nIn a related matter, in April 2022 we filed applications with the General Court seeking an order requiring the EC to pay us approximately €593 million in default interest on the original €1.1 billion fine that was held by the EC for 12 years, which applications have been stayed pending the EC’s appeal of the General Court’s January 2022 decision.\nLitigation Related to Security Vulnerabilities\nIn June 2017, a Google research team notified Intel and other companies\u202fthat it had identified security vulnerabilities, the first variants of which are now commonly referred to as “Spectre” and “Meltdown,” that affect many types of microprocessors, including our products. As is standard when findings like these are presented, we worked together with other companies in the industry to verify the research and develop and validate software and firmware updates for impacted technologies. In January 2018, information on the security vulnerabilities was publicly reported, before software and firmware updates to address the vulnerabilities were made widely available.\nAs of January 24, 2024, consumer class action lawsuits against us were pending in the US, Canada, and Argentina. The plaintiffs, who purport to represent various classes of purchasers of our products, generally claim to have been harmed by our actions and/or omissions in connection with Spectre, Meltdown, and other variants of this class of security vulnerabilities that have been identified since 2018, and assert a variety of common law and statutory claims seeking monetary damages and equitable relief. In the US, class action suits filed in various jurisdictions were consolidated for all pretrial proceedings in the US District Court for the District of Oregon, which entered final judgment in favor of Intel in July 2022 based on plaintiffs’ failure to plead a viable claim. Plaintiffs appealed, and in November 2023 the Ninth Circuit Court of Appeals affirmed the district court’s judgment. In Canada, an initial status conference has not yet been scheduled in one case relating to Spectre and Meltdown pending in the Superior Court of Justice of Ontario, and a stay of a second case pending in the Superior Court of Justice of Quebec is in effect. In Argentina, Intel Argentina was served with, and responded to, a class action complaint relating to Spectre and Meltdown in June 2022. The Argentinian court dismissed plaintiffs’ claims for lack of standing in May 2023, and plaintiffs have appealed. In November 2023, new plaintiffs filed a consumer class action complaint in the US District Court for the Northern District of California with respect to a further vulnerability variant disclosed in August 2023 and commonly referred to as “Downfall.” We moved to dismiss that complaint in January 2024. Additional lawsuits and claims may be asserted seeking monetary damages or other related relief. Given the procedural posture and the nature of these cases, including that the pending proceedings are in the early stages, that alleged damages have not been specified, that uncertainty exists as to the likelihood of a class or classes being certified or the ultimate size of any class or classes if certified, and that there are significant factual and legal issues to be resolved, we are unable to make a reasonable estimate of the potential loss or range of losses, if any, that might arise from these matters.\nLitigation Related to 7nm Product Delay Announcement\nMultiple securities class action lawsuits were filed in the US District Court for the Northern District of California against us and certain officers following our July 2020 announcement of 7nm product delays. The court consolidated the lawsuits and appointed lead plaintiffs in October 2020, and in January 2021 plaintiffs filed a consolidated complaint. Plaintiffs purport to represent all persons who purchased or otherwise acquired our common stock from October 25, 2019 through October 23, 2020, and they generally allege that defendants violated the federal securities laws by making false or misleading statements about the timeline for 7nm products. In March 2023, the court granted the defendants’ motion to dismiss the consolidated complaint, and in April 2023 entered judgment. Plaintiffs have appealed. Given the procedural posture and the nature of the case, including that it is in the early stages, that alleged damages have not been specified, that uncertainty exists as to the likelihood of a class being certified or the ultimate size of any class if certified, and that there are significant factual and legal issues to be resolved, we are unable to make a reasonable estimate of the potential loss or range of losses, if any, that might arise from the matter. In July 2021, we introduced a new process node naming structure, and the 7nm process is now called Intel 4.\nLitigation Related to Patent and IP Claims\nWe have had IP infringement lawsuits filed against us, including but not limited to those discussed below. Most involve claims that certain of our products, services, and technologies infringe others' IP rights. Adverse results in these lawsuits may include awards of substantial fines and penalties, costly royalty or licensing agreements, or orders preventing us from offering certain features, functionalities, products, or services. As a result, we may have to change our business practices, and develop non-infringing products or technologies, which could result in a loss of revenue for us and otherwise harm our business. In addition, certain agreements with our customers require us to indemnify them against certain IP infringement claims, which can increase our costs as a result of defending such claims, and may require that we pay significant damages, accept product returns, or supply our customers with non-infringing products if there were an adverse ruling in any such claims. In addition, our customers and partners may discontinue the use of our products, services, and technologies, as a result of injunctions or otherwise, which could result in loss of revenue and adversely affect our business.VLSI Technology LLC v. Intel\nIn October 2017, VLSI Technology LLC (VLSI) filed a complaint against us in the US District Court for the Northern District of California alleging that various Intel FPGA and processor products infringe eight patents VLSI acquired from NXP Semiconductors, N.V. (NXP). VLSI granted Intel a covenant not to sue on the two patents the court said can proceed to trial as it appeals losses it suffered earlier in the case on three other patents. VLSI has requested that the judge take the trial scheduled for March 2024 off calendar. In April 2019, VLSI filed three infringement suits against us in the US District Court for the Western District of Texas accusing various of our processors of infringement of eight additional patents it had acquired from NXP:"", 'Securities Litigation\n\nCity of Warren v. PFI, et al.', 'The Company and KFI believe that they have meritorious defenses to the claims in the MDL Proceedings and the other AFFF lawsuits. Given the numerous factual, scientific and legal issues to be resolved relating to these claims, the Company is unable to assess the probability of liability or to reasonably estimate a range of possible loss at this time. There can be no assurance that any such future exposure will not be material in any period.', 'To grow our business, we also invest in capital and other resources to expand our data centers and enable our workforce, and we acquire technology and businesses to supplement our technology portfolio. Our capital expenditures are typically under cancellable arrangements primarily used to support the installed base and growth of our hosted business. We have also issued long-term debt to finance our business. In August 2020, we issued 1.40% fixed rate ten-year notes with an aggregate principal amount of $1.5 billion due on September 1, 2030 (the “2030 Notes”).']",976.8354579573496,"F5 reports that no pending or threatened legal proceeding is reasonably possible to have a material effect on its consolidated financials; while defense costs and management distraction may arise, the company does not expect litigation liabilities to alter its capital-allocation priorities or impede growth initiatives. FFIV"
18,18,c808ac7f,$384M op lease cash flow flex from Applied Materials.,"The operating lease obligations of $384 million, with $96 million due in the next 12 months, suggest a fixed, recurring cash outflow that will affect short-term liquidity. Specifically, the $96 million payment required within one year means that the company must allocate a significant portion of its near-term cash flow to meet these lease commitments. This can constrain the availability of cash for discretionary spending, debt repayment, or strategic investment, particularly if operating cash flows were to weaken. On the other hand, since operating lease payments are generally fixed and predictable, they provide transparency in budgeting, even if they reduce overall financial flexibility. In assessing overall financial flexibility, it is important to compare these lease obligations with other current liabilities and the company’s ability to generate consistent operating cash flow. While the lease payments do require disciplined cash management, they are less flexible than debt obligations and can represent a potential risk if an adverse economic environment were to impair cash flow generation. Ultimately, the near-term $96 million outlay might impose a temporary strain on cash flow stability, but if managed within the context of strong operating cash flows, the company can maintain overall financial resilience.","['We at Applied Materials have certain on-balance sheet and off-balance sheet obligation arrangements to make future payments under various contracts. Certain contractual arrangements which are recorded on our balance sheet include borrowing facilities and debts and lease obligations.\nBorrowing Facilities and Debt Obligations\nAs of October 27, 2024, we had $6.2 billion in aggregate principal amount of senior unsecured notes with varying maturities, of which $700 million is due within 12 months and the remaining notes are due beyond 12 months. Future interest payments associated with these unsecured notes were $2.8 billion, of which $239 million is due within 12 months and the remaining interest payments are due beyond 12 months. See Note 9, Borrowing Facilities and Debt, of the Notes to the Consolidated Financial Statements for further discussion related to our borrowing facilities and debt obligations.\nLease Obligations\nAs of October 27, 2024, our operating lease obligation was $384 million related to various operating lease arrangements for certain facilities, of which $96 million is payable within 12 months and the remaining amount is payable beyond 12 months.\nPurchase Obligations\nAs of October 27, 2024, we had $8.1 billion of purchase obligations for goods and services, of which $4.2 billion is payable within 12 months and the remaining amount is payable beyond 12 months.\nDeemed Repatriation Tax Payable\nAs of October 27, 2024, we had $459 million of transition tax liability, of which $204 million is payable within 12 months and the remaining amount is payable beyond 12 months. This transition tax liability is associated with the deemed repatriation of accumulated foreign earnings as a result of the enactment of the Tax Act.\nOther Long-term Liabilities\nWe also have the obligation to fund our pension, postretirement and deferred compensation plans. We evaluate the need to make contributions to our pension and postretirement benefit plans after considering the funded status of the plans, movements in the discount rate, performance of the plan assets and related tax consequences. Payments to the plans would be dependent on these factors and could vary across a wide range of amounts and time periods. Payments for deferred compensation plans are dependent on activity by participants, making the timing of payments uncertain. As of October 27, 2024, the total of our future expected benefit payments for the pension plans and the postretirement plan over the next ten fiscal years were $214 million, of which $14 million is payable within 12 months and the remaining amount is payable beyond 12 months.\nAs of October 27, 2024, the gross liability for unrecognized tax benefits that was not expected to result in payment of cash within one year was $521 million. Interest and penalties related to uncertain tax positions that were not expected to result in payment of cash within one year of October 27, 2024 was $181 million. At this time, we are unable to reliably estimate the timing of payments due to uncertainties in the timing of tax audit outcomes.    \nOff-Balance Sheet Arrangements\nIn the ordinary course of business, we provide standby letters of credit or other guarantee instruments to third parties as required for certain transactions initiated by either us or our subsidiaries. These include agreements with various banks to facilitate subsidiary banking operations worldwide, including overdraft arrangements. We also have agreements with various banks to facilitate subsidiary banking operations worldwide, including overdraft arrangements, issuance of bank guarantees, and letters of credit. See Note 13, Guarantees, Commitments and Contingencies, of the Notes to the Consolidated Financial Statements for further discussion relating to these arrangements.']",,,FinDER,Non-numerical,"['We at Applied Materials have certain on-balance sheet and off-balance sheet obligation arrangements to make future payments under various contracts. Certain contractual arrangements which are recorded on our balance sheet include borrowing facilities and debts and lease obligations.\nBorrowing Facilities and Debt Obligations\nAs of October 27, 2024, we had $6.2 billion in aggregate principal amount of senior unsecured notes with varying maturities, of which $700 million is due within 12 months and the remaining notes are due beyond 12 months. Future interest payments associated with these unsecured notes were $2.8 billion, of which $239 million is due within 12 months and the remaining interest payments are due beyond 12 months. See Note 9, Borrowing Facilities and Debt, of the Notes to the Consolidated Financial Statements for further discussion related to our borrowing facilities and debt obligations.\nLease Obligations\nAs of October 27, 2024, our operating lease obligation was $384 million related to various operating lease arrangements for certain facilities, of which $96 million is payable within 12 months and the remaining amount is payable beyond 12 months.\nPurchase Obligations\nAs of October 27, 2024, we had $8.1 billion of purchase obligations for goods and services, of which $4.2 billion is payable within 12 months and the remaining amount is payable beyond 12 months.\nDeemed Repatriation Tax Payable\nAs of October 27, 2024, we had $459 million of transition tax liability, of which $204 million is payable within 12 months and the remaining amount is payable beyond 12 months. This transition tax liability is associated with the deemed repatriation of accumulated foreign earnings as a result of the enactment of the Tax Act.\nOther Long-term Liabilities\nWe also have the obligation to fund our pension, postretirement and deferred compensation plans. We evaluate the need to make contributions to our pension and postretirement benefit plans after considering the funded status of the plans, movements in the discount rate, performance of the plan assets and related tax consequences. Payments to the plans would be dependent on these factors and could vary across a wide range of amounts and time periods. Payments for deferred compensation plans are dependent on activity by participants, making the timing of payments uncertain. As of October 27, 2024, the total of our future expected benefit payments for the pension plans and the postretirement plan over the next ten fiscal years were $214 million, of which $14 million is payable within 12 months and the remaining amount is payable beyond 12 months.\nAs of October 27, 2024, the gross liability for unrecognized tax benefits that was not expected to result in payment of cash within one year was $521 million. Interest and penalties related to uncertain tax positions that were not expected to result in payment of cash within one year of October 27, 2024 was $181 million. At this time, we are unable to reliably estimate the timing of payments due to uncertainties in the timing of tax audit outcomes.    \nOff-Balance Sheet Arrangements\nIn the ordinary course of business, we provide standby letters of credit or other guarantee instruments to third parties as required for certain transactions initiated by either us or our subsidiaries. These include agreements with various banks to facilitate subsidiary banking operations worldwide, including overdraft arrangements. We also have agreements with various banks to facilitate subsidiary banking operations worldwide, including overdraft arrangements, issuance of bank guarantees, and letters of credit. See Note 13, Guarantees, Commitments and Contingencies, of the Notes to the Consolidated Financial Statements for further discussion relating to these arrangements.']",c808ac7f,True,"['APPLIED MATERIALS, INC.\nCONSOLIDATED STATEMENTS OF OPERATIONS\n(In millions, except per share amounts)\n  \nFiscal Year\t2024\t\t2023\t\t2022\n \t\t\t\t\t\nNet revenue\t$\t27,176 \t\t\t$\t26,517 \t\t\t$\t25,785 \t\nCost of products sold\t14,279 \t\t\t14,133 \t\t\t13,792 \t\nGross profit\t12,897 \t\t\t12,384 \t\t\t11,993 \t\nOperating expenses:\t\t\t\t\t\nResearch, development and engineering\t3,233 \t\t\t3,102 \t\t\t2,771 \t\nMarketing and selling\t836 \t\t\t776 \t\t\t703 \t\nGeneral and administrative\t961 \t\t\t852 \t\t\t735 \t\nSeverance and related charges\t— \t\t\t— \t\t\t(4)\t\nTotal operating expenses\t5,030 \t\t\t4,730 \t\t\t4,205 \t\nIncome from operations\t7,867 \t\t\t7,654 \t\t\t7,788 \t\nInterest expense\t247 \t\t\t238 \t\t\t228 \t\nInterest and other income (expense), net\t532 \t\t\t300 \t\t\t39 \t\nIncome before income taxes\t8,152 \t\t\t7,716 \t\t\t7,599 \t\nProvision for income taxes\t975 \t\t\t860 \t\t\t1,074 \t\nNet income\t$\t7,177 \t\t\t$\t6,856 \t\t\t$\t6,525 \t\nEarnings per share:\t\t\t\t\t\nBasic\t$\t8.68 \t\t\t$\t8.16 \t\t\t$\t7.49 \t\nDiluted\t$\t8.61 \t\t\t$\t8.11 \t\t\t$\t7.44 \t\nWeighted average number of shares:\t\t\t\t\t\nBasic\t827 \t\t\t840 \t\t\t871 \t\nDiluted\t834 \t\t\t845 \t\t\t877', ""Lease expense is recognized in Cost of sales or Operating overhead expense within the Consolidated Statements of Income, based on the underlying nature of the leased asset. For the fiscal years ended May 31, 2024, 2023 and 2022, lease expense primarily consisted of operating lease costs of $618 million, $585 million and $593 million, respectively, as well as $433 million, $403 million and $366 million, respectively, primarily related to variable lease costs. As of and for the fiscal years ended May 31, 2024 and 2023 and 2022, finance leases were not a material component of the Company's lease portfolio.\nThe undiscounted cash flows for future maturities of the Company's operating lease liabilities and the reconciliation to the Operating lease liabilities recognized in the Company's Consolidated Balance Sheets are as follows:\n(Dollars in millions)\nAS OF MAY 31, 2024(1)\nFiscal 2025\t$\t572 \t\nFiscal 2026\t554 \t\nFiscal 2027\t485 \t\nFiscal 2028\t403 \t\nFiscal 2029\t362 \t\nThereafter\t991 \t\nTotal undiscounted future cash flows related to lease payments\t$\t3,367 \t\nLess interest\t324 \t\nPresent value of lease liabilities\t$\t3,043 \t\n \n(1)Excludes $614 million as of May 31, 2024, of future operating lease payments for lease agreements signed but not yet commenced."", 'Cash Flow from Investing Activities\n\nNet cash used in investing activities totaled $1.4 billion, $108 million and $232 million in 2023, 2022 and 2021, respectively. Additions to fixed assets and capitalized software were $161 million, $176 million and $161 million\nin 2023, 2022 and 2021, respectively. The cash flows from investing activities in 2023, 2022 and 2021 include $16 million, $32 million and $49 million, respectively, of capital expenditures related to the major expansion of the Company’s precision chemistry consumable operations in the United States. The Company has incurred costs of $248 million on this new state-of-the-art facility, which is substantially complete as of December 31, 2023.\n\nDuring 2023, 2022 and 2021, the Company purchased $2 million, $11 million and $280 million of investments, respectively, while $2 million, $78 million and $218 million of investments matured, respectively, and were used for financing activities described below.\n\nIn 2023, the Company completed the acquisition of Wyatt for a total purchase price of $1.3 billion in cash. Wyatt is a pioneer in innovative light scattering and field-flow fractionation instruments, software, accessories, and services. The acquisition will expand Waters’ portfolio and increase exposure to large molecule applications.', 'Cash flows from investing activities in 2024 and 2023 were impacted by the following factors:\n•Payment for the Acquisition, net of cash acquired, of $7.1 billion in 2023.\n•Payments to settle the deal-contingent forward contracts of $1.4 billion in 2023.\n•Net proceeds from the sale of the aircraft wheel and brake business of approximately $443 million in 2023.\n•Cash collateral received of $250 million in 2023 per the credit support annex attached to the deal-contingent forward contracts.\n•Net maturities of marketable securities of $7 million in 2024 compared to $19 million in 2023.\n•Capital expenditures of $400 million in 2024 compared to $381 million in 2023.', 'CASH FLOW\t\t\t\t\t\n2022\t\t2023\t\t2024\nOperating Cash Flow\t$\t2,048 \t\t\t2,710 \t\t\t3,317 \t\n     Percent of sales\t14.8 \t%\t\t17.9 \t%\t\t19.0 \t%\nCapital Expenditures\t$\t299 \t\t\t363 \t\t\t419 \t\n     Percent of sales\t2.2 \t%\t\t2.4 \t%\t\t2.4 \t%\nFree Cash Flow (Operating Cash Flow less Capital Expenditures)\n$\t1,749 \t\t\t2,347 \t\t\t2,898 \t\n     Percent of sales\t12.7 \t%\t\t15.5 \t%\t\t16.6 \t%\nOperating Working Capital\t$\t990 \t\t\t1,283 \t\t\t1,394 \t\n     Percent of sales\t7.2 \t%\t\t8.5 \t%\t\t8.0 \t%\n \n\nOperating cash flow from continuing operations for 2024 was $3.3 billion, an increase of $607, or 22 percent compared with 2023, reflecting higher earnings (excluding the impact of non-cash items related to the NI acquisition and the loss on the Copeland note receivable). Acquisition-related costs and integration activities negatively impacted operating cash flow in the current year by approximately $235. AspenTech generated operating cash flow of approximately $320 compared to approximately $310 in the prior year. Operating cash flow from continuing operations for 2023 was $2.7 billion, an increase of 32 percent compared to $2.0 billion in 2022, reflecting higher earnings (excluding the impacts in both years from the Vertiv subordinated interest gains and higher Heritage AspenTech intangibles amortization in 2023).', 'CASH FLOW\t\t\t\t\t\n2022\t\t2023\t\t2024\nOperating Cash Flow\t$\t2,048 \t\t\t2,710 \t\t\t3,317 \t\n     Percent of sales\t14.8 \t%\t\t17.9 \t%\t\t19.0 \t%\nCapital Expenditures\t$\t299 \t\t\t363 \t\t\t419 \t\n     Percent of sales\t2.2 \t%\t\t2.4 \t%\t\t2.4 \t%\nFree Cash Flow (Operating Cash Flow less Capital Expenditures)\n$\t1,749 \t\t\t2,347 \t\t\t2,898 \t\n     Percent of sales\t12.7 \t%\t\t15.5 \t%\t\t16.6 \t%\nOperating Working Capital\t$\t990 \t\t\t1,283 \t\t\t1,394 \t\n     Percent of sales\t7.2 \t%\t\t8.5 \t%\t\t8.0 \t%\n \n\nOperating cash flow from continuing operations for 2024 was $3.3 billion, an increase of $607, or 22 percent compared with 2023, reflecting higher earnings (excluding the impact of non-cash items related to the NI acquisition and the loss on the Copeland note receivable). Acquisition-related costs and integration activities negatively impacted operating cash flow in the current year by approximately $235. AspenTech generated operating cash flow of approximately $320 compared to approximately $310 in the prior year. Operating cash flow from continuing operations for 2023 was $2.7 billion, an increase of 32 percent compared to $2.0 billion in 2022, reflecting higher earnings (excluding the impacts in both years from the Vertiv subordinated interest gains and higher Heritage AspenTech intangibles amortization in 2023).', 'We expect our cash flows from operating activities to remain sufficient to provide us with adequate levels of liquidity. In addition, we have access to $2.0 billion of debt capacity from our amended and restated revolving credit facility. We believe the Company has sufficient liquidity to operate in the current business environment for at least the next 12 months and the foreseeable future thereafter. Acquisitions, repurchases of our common stock and dividends remain strategic objectives, but they will be dependent on the economic outlook and liquidity of the Company.\n\nNet cash provided by operating activities was $2,079.8 million for fiscal 2024, which was an increase of $482.0 million, or 30.2%, compared to fiscal 2023. The increase was primarily the result of an increase in net income and favorable changes in working capital, specifically inventories, net and uniforms and other rental items in service and accounts receivable, net. These improvements were partially offset by unfavorable changes in working capital, primarily current liabilities and deferred income taxes.', 'Net cash used in investing activities in fiscal 2024 was $136.5 million, compared to $153.4 million in fiscal 2023. During fiscal 2024, we received proceeds of $49.5 million, primarily from the sale of our BAW manufacturing facility in Farmers Branch, Texas, and our capital expenditures decreased by $31.7 million as compared to fiscal 2023. Additionally, we acquired Anokiwave in fiscal 2024, resulting in net cash outflows of $83.0 million.', 'Cash flows used in investing activities were $1,053 million in 2023 primarily driven by $1.05 billion in capital expenditures. On February 16, 2024, the company completed the divestiture of the aerospace business. The proceeds from the sale will be recorded as a cash inflow from investing activities in 2024. See Note 4 for further details.', 'Applied Materials, Inc. is the leader in the materials engineering solutions used to produce virtually every semiconductor and advanced display in the world. We are experts in the design, development, production, and servicing of the critical wafer fabrication and display fabrication tools our customers need to manufacture semiconductors and displays. Our customers’ products are used in a wide variety of products such as personal computing devices, mobile phones, artificial intelligence (AI) and data center servers, automobiles, connected devices, industrial applications and consumer electronics. We have the semiconductor capital equipment industry’s most comprehensive portfolio of products. This breadth allows us the ability to connect and co-optimize technologies across our portfolio, enabling our customers to achieve superior results as manufacturing semiconductors and displays is becoming increasingly complex. Semiconductors provide the foundation for advances in technology that are reshaping the global economy, including artificial intelligence, internet of things, robotics, electric and autonomous vehicles, and clean energy.\nIncorporated in 1967, we are a Delaware corporation. Our fiscal year ends on the last Sunday in October. We operate in three reportable segments: Semiconductor Systems, Applied Global Services® (AGS), and Display. The Semiconductor Systems segment represents the largest contributor to our net revenue. A summary of financial information for each reportable segment is found in Note 14 of Notes to Consolidated Financial Statements. A discussion of factors that could affect operations is set forth under “Risk Factors” in Item 1A, which is incorporated herein by reference.']",681.3087499467656,384
19,19,7ec5e05d,2024 total opex: Nordson Corp (NDSN) cost-of-sales + S&A,"For 2024, the cost of sales is $1,203,792 and the selling and administrative expenses are $812,128. Adding these together, the total operating expense is calculated as follows:

1,203,792 + 812,128 = 2,015,920

Thus, the total operating expense for 2024 is $2,015,920 (in thousands).","['Consolidated Statements of Income Nordson Corp\nYears ended October 31, 2024, 2023 and 2022\n(In thousands except for per-share amounts)\t\t2024\t\t2023\t\t2022\nSales\t\t$\t2,689,921 \t\t\t$\t2,628,632 \t\t\t$\t2,590,278 \t\nOperating costs and expenses:\t\t\t\t\t\t\nCost of sales\t\t1,203,792 \t\t\t1,203,227 \t\t\t1,163,742 \t\nSelling and administrative expenses\t\t812,128 \t\t\t752,644 \t\t\t724,176 \t\n2,015,920 \t\t\t1,955,871 \t\t\t1,887,918 \t\nOperating profit\t\t674,001 \t\t\t672,761 \t\t\t702,360 \t\nOther income (expense):\t\t\t\t\t\t\nInterest expense\t\t(88,924)\t\t\t(59,505)\t\t\t(22,413)\t\nInterest and investment income\t\t4,913 \t\t\t2,680 \t\t\t2,026 \t\nPension settlement charge for U.S. Plans\t\t— \t\t\t— \t\t\t(41,221)\t\nOther - net\t\t(4,509)\t\t\t(597)\t\t\t8,527 \t\n(88,520)\t\t\t(57,422)\t\t\t(53,081)\t\nIncome before income taxes\t\t585,481 \t\t\t615,339 \t\t\t649,279 \t\nIncome tax expense\t\t118,197 \t\t\t127,846 \t\t\t136,176 \t\nNet income\t\t$\t467,284 \t\t\t$\t487,493 \t\t\t$\t513,103 \t\nAverage common shares\t\t57,176 \t\t\t57,090 \t\t\t57,629 \t\nIncremental common shares attributable to equity compensation\t\t440 \t\t\t541 \t\t\t620 \t\nAverage common shares and common share equivalents\t\t57,616 \t\t\t57,631 \t\t\t58,249 \t\nBasic earnings per share\t\t$\t8.17 \t\t\t$\t8.54 \t\t\t$\t8.90 \t\nDiluted earnings per share\t\t$\t8.11 \t\t\t$\t8.46 \t\t\t$\t8.81 \t\nDividends declared per common share\t\t$\t2.82 \t\t\t$\t2.63 \t\t\t$\t2.18']",,Addition,FinDER,Arithmetic,"['Consolidated Statements of Income Nordson Corp\nYears ended October 31, 2024, 2023 and 2022\n(In thousands except for per-share amounts)\t\t2024\t\t2023\t\t2022\nSales\t\t$\t2,689,921 \t\t\t$\t2,628,632 \t\t\t$\t2,590,278 \t\nOperating costs and expenses:\t\t\t\t\t\t\nCost of sales\t\t1,203,792 \t\t\t1,203,227 \t\t\t1,163,742 \t\nSelling and administrative expenses\t\t812,128 \t\t\t752,644 \t\t\t724,176 \t\n2,015,920 \t\t\t1,955,871 \t\t\t1,887,918 \t\nOperating profit\t\t674,001 \t\t\t672,761 \t\t\t702,360 \t\nOther income (expense):\t\t\t\t\t\t\nInterest expense\t\t(88,924)\t\t\t(59,505)\t\t\t(22,413)\t\nInterest and investment income\t\t4,913 \t\t\t2,680 \t\t\t2,026 \t\nPension settlement charge for U.S. Plans\t\t— \t\t\t— \t\t\t(41,221)\t\nOther - net\t\t(4,509)\t\t\t(597)\t\t\t8,527 \t\n(88,520)\t\t\t(57,422)\t\t\t(53,081)\t\nIncome before income taxes\t\t585,481 \t\t\t615,339 \t\t\t649,279 \t\nIncome tax expense\t\t118,197 \t\t\t127,846 \t\t\t136,176 \t\nNet income\t\t$\t467,284 \t\t\t$\t487,493 \t\t\t$\t513,103 \t\nAverage common shares\t\t57,176 \t\t\t57,090 \t\t\t57,629 \t\nIncremental common shares attributable to equity compensation\t\t440 \t\t\t541 \t\t\t620 \t\nAverage common shares and common share equivalents\t\t57,616 \t\t\t57,631 \t\t\t58,249 \t\nBasic earnings per share\t\t$\t8.17 \t\t\t$\t8.54 \t\t\t$\t8.90 \t\nDiluted earnings per share\t\t$\t8.11 \t\t\t$\t8.46 \t\t\t$\t8.81 \t\nDividends declared per common share\t\t$\t2.82 \t\t\t$\t2.63 \t\t\t$\t2.18']",7ec5e05d,True,"['Years ended September 30\n(Dollars and shares in millions, except per share amounts)\n2022 \t\t\t2023 \t\t\t2024 \t\nNet sales\t$\t13,804 \t\t\t15,165 \t\t\t17,492 \t\n   Cost of sales\t7,498 \t\t\t7,738 \t\t\t8,607 \t\n   Selling, general and administrative expenses\t3,614 \t\t\t4,186 \t\t\t5,142 \t\n   Gain on subordinated interest\t(453)\t\t\t(161)\t\t\t(79)\t\n   Loss on Copeland note receivable\t— \t\t\t— \t\t\t279 \t\n   Other deductions, net\t519 \t\t\t506 \t\t\t1,434 \t\n   Interest expense, net of interest income of: 2022, $34;\n   2023, $227; 2024, $148\n194 \t\t\t34 \t\t\t175 \t\n Interest income from related party\t— \t\t\t(41)\t\t\t(86)\t\nEarnings from continuing operations before income taxes\t2,432 \t\t\t2,903 \t\t\t2,020 \t\nIncome taxes\t549 \t\t\t642 \t\t\t415 \t\nEarnings from continuing operations\t1,883 \t\t\t2,261 \t\t\t1,605 \t\nDiscontinued operations, net of tax of $306, $2,969 and $85, respectively\n1,347 \t\t\t10,939 \t\t\t350 \t\nNet earnings\t3,230 \t\t\t13,200 \t\t\t1,955 \t\nLess: Noncontrolling interests in earnings of subsidiaries\t(1)\t\t\t(19)\t\t\t(13)\t\nNet earnings common stockholders\t$\t3,231 \t\t\t13,219 \t\t\t1,968 \t\nEarnings common stockholders:\t\t\t\t\t\n   Earnings from continuing operations\t$\t1,886 \t\t\t2,286 \t\t\t1,618 \t\n   Discontinued operations\t1,345 \t\t\t10,933 \t\t\t350 \t\nNet earnings common stockholders\t$\t3,231 \t\t\t13,219 \t\t\t1,968 \t\nBasic earnings per share common stockholders:\t\t\t\t\t\n   Earnings from continuing operations\t$\t3.17 \t\t\t3.98 \t\t\t2.83 \t\n   Discontinued operations\t2.27 \t\t\t19.02 \t\t\t0.61 \t\nBasic earnings per common share\t$\t5.44 \t\t\t23.00 \t\t\t3.44 \t\nDiluted earnings per share common stockholders:\t\t\t\t\t\n   Earnings from continuing operations\t$\t3.16 \t\t\t3.96 \t\t\t2.82 \t\n   Discontinued operations\t2.25 \t\t\t18.92 \t\t\t0.61 \t\nDiluted earnings per common share\t$\t5.41 \t\t\t22.88 \t\t\t3.43 \t\nWeighted average outstanding shares:\t\t\t\t\t\nBasic\t592.9 \t\t\t574.2 \t\t\t571.3 \t\nDiluted\t596.3 \t\t\t577.3 \t\t\t574.0', ""(Millions of U.S. Dollars, except for share and per share data)\t2024\t2023\t2022\nSales\t$12,100.6 \t\t$12,600.0 \t\t$12,698.6 \t\nCost of sales\t8,168.7 \t\t8,833.0 \t\t9,338.5 \t\nSelling and administrative expense\t942.4 \t\t957.0 \t\t900.6 \t\nResearch and development expense\t100.2 \t\t105.6 \t\t102.9 \t\nGain on sale of business\n1,575.6 \t\t— \t\t— \t\nBusiness and asset actions\t57.0 \t\t244.6 \t\t73.7 \t\nOther income (expense), net\t58.2 \t\t34.8 \t\t55.9 \t\nOperating Income\t4,466.1 \t\t2,494.6 \t\t2,338.8 \t\nEquity affiliates' income\t647.7 \t\t604.3 \t\t481.5 \t\nInterest expense\t218.8 \t\t177.5 \t\t128.0 \t\nOther non-operating income (expense), net\t(73.8)\t\t(39.0)\t\t62.4 \t\nIncome From Continuing Operations Before Taxes\t4,821.2 \t\t2,882.4 \t\t2,754.7 \t\nIncome tax provision\t944.9 \t\t551.2 \t\t500.8 \t\nIncome From Continuing Operations\t3,876.3 \t\t2,331.2 \t\t2,253.9 \t\n(Loss) Income from discontinued operations, net of tax\t(13.9)\t\t7.4 \t\t12.6 \t\nNet Income\t3,862.4 \t\t2,338.6 \t\t2,266.5 \t\nNet income attributable to noncontrolling interests of continuing operations\t34.2 \t\t38.4 \t\t10.4 \t\nNet Income Attributable to Air Products\t$3,828.2 \t\t$2,300.2 \t\t$2,256.1 \t\nNet Income Attributable to Air Products\t\t\t\nNet income from continuing operations\t$3,842.1 \t\t$2,292.8 \t\t$2,243.5 \t\nNet (loss) income from discontinued operations\t(13.9)\t\t7.4 \t\t12.6 \t\nNet Income Attributable to Air Products\t$3,828.2 \t\t$2,300.2 \t\t$2,256.1 \t\nPer Share Data(A) (U.S. Dollars per share)\nBasic EPS from continuing operations\t$17.27 \t\t$10.31 \t\t$10.11 \t\nBasic EPS from discontinued operations\t(0.06)\t\t0.03 \t\t0.06 \t\nBasic EPS Attributable to Air Products\n$17.21 \t\t$10.35 \t\t$10.16 \t\nDiluted EPS from continuing operations\t$17.24 \t\t$10.30 \t\t$10.08 \t\nDiluted EPS from discontinued operations\t(0.06)\t\t0.03 \t\t0.06 \t\nDiluted EPS Attributable to Air Products\t$17.18 \t\t$10.33 \t\t$10.14 \t\nWeighted Average Common Shares (in millions)\nBasic\n222.5 \t\t222.3 \t\t222.0 \t\nDiluted\n222.8 \t\t222.7 \t\t222.5"", 'Total\nFiscal 2024\t\t\t\t\t\t\t\t\t\nTotal net revenues\t$\t27,009.5 \t\t\t$\t7,338.9 \t\t\t$\t1,769.8 \t\t\t$\t58.0 \t\t\t$\t36,176.2 \t\nDepreciation and amortization expenses\t1,052.4 \t\t\t338.3 \t\t\t— \t\t\t121.9 \t\t\t1,512.6 \t\nIncome from equity investees\t— \t\t\t3.6 \t\t\t297.6 \t\t\t— \t\t\t301.2 \t\nOperating income/(loss)\t$\t5,355.3 \t\t\t$\t1,045.7 \t\t\t$\t925.9 \t\t\t$\t(1,918.1)\t\t\t$\t5,408.8 \t\nFiscal 2023\t\t\t\t\t\t\t\t\t\nTotal net revenues\t$\t26,569.6 \t\t\t$\t7,487.6 \t\t\t$\t1,893.8 \t\t\t$\t24.6 \t\t\t$\t35,975.6 \t\nDepreciation and amortization expenses\t910.1 \t\t\t335.1 \t\t\t0.1 \t\t\t117.3 \t\t\t1,362.6 \t\nIncome from equity investees\t— \t\t\t2.7 \t\t\t295.7 \t\t\t— \t\t\t298.4 \t\nOperating income/(loss)\t$\t5,495.7 \t\t\t$\t1,230.9 \t\t\t$\t967.6 \t\t\t$\t(1,823.4)\t\t\t$\t5,870.8 \t\nFiscal 2022\t\t\t\t\t\t\t\t\t\nTotal net revenues\t$\t23,370.8 \t\t\t$\t6,940.1 \t\t\t$\t1,843.6 \t\t\t$\t95.8 \t\t\t$\t32,250.3 \t\nDepreciation and amortization expenses\t808.4 \t\t\t513.0 \t\t\t0.1 \t\t\t126.4 \t\t\t1,447.9 \t\nIncome from equity investees\t— \t\t\t2.3 \t\t\t231.8 \t\t\t— \t\t\t234.1 \t\nOperating income/(loss)\t$\t4,486.5 \t\t\t$\t833.2 \t\t\t$\t817.3 \t\t\t$\t(1,519.2)\t\t\t$\t4,617.8 \t\n(in millions)\nNorth America\t\tInternational\t\t\nChannel\nDevelopment\nCorporate and Other\t\t\n\nTotal\nTotal assets at September 29, 2024\n$\t12,737.0 \t\t\t$\t8,464.5 \t\t\t$\t148.6 \t\t\t$\t9,989.2 \t\t\t$\t31,339.3 \t\nTotal assets at October 1, 2023\n10,869.1 \t\t\t8,045.3 \t\t\t188.8 \t\t\t10,342.3 \t\t\t29,445.5', 'Snap-on Incorporated – Consolidated Statements of Earnings \n \n(Amounts in millions, except per share data)\t\t2023\t\t2022\t\t2021\nNet sales\t\t$\t4,730.2 \t\t\t$\t4,492.8 \t\t\t$\t4,252.0 \t\nCost of goods sold\t\t(2,381.1)\t\t\t(2,311.7)\t\t\t(2,141.2)\t\nGross profit\t\t2,349.1 \t\t\t2,181.1 \t\t\t2,110.8 \t\nOperating expenses\t\t(1,309.2)\t\t\t(1,239.9)\t\t\t(1,259.3)\t\nOperating earnings before financial services\t\t1,039.9 \t\t\t941.2 \t\t\t851.5 \t\nFinancial services revenue\t\t378.1 \t\t\t349.7 \t\t\t349.7 \t\nFinancial services expenses\t\t(107.6)\t\t\t(83.7)\t\t\t(77.7)\t\nOperating earnings from financial services\t\t270.5 \t\t\t266.0 \t\t\t272.0 \t\nOperating earnings\t\t1,310.4 \t\t\t1,207.2 \t\t\t1,123.5 \t\nInterest expense\t\t(49.9)\t\t\t(47.1)\t\t\t(53.1)\t\nOther income (expense) – net\t\t67.5 \t\t\t42.5 \t\t\t16.5 \t\nEarnings before income taxes and equity earnings\t\t1,328.0 \t\t\t1,202.6 \t\t\t1,086.9 \t\nIncome tax expense\t\t(293.4)\t\t\t(268.7)\t\t\t(247.0)\t\nEarnings before equity earnings\t\t1,034.6 \t\t\t933.9 \t\t\t839.9 \t\nEquity earnings, net of tax\t\t— \t\t\t— \t\t\t1.5 \t\nNet earnings\t\t1,034.6 \t\t\t933.9 \t\t\t841.4 \t\nNet earnings attributable to noncontrolling interests\t\t(23.5)\t\t\t(22.2)\t\t\t(20.9)\t\nNet earnings attributable to Snap-on Incorporated\t\t$\t1,011.1 \t\t\t$\t911.7 \t\t\t$\t820.5 \t\nNet earnings per share attributable to Snap-on Incorporated:\t\t\t\t\t\t\nBasic\t\t$\t19.11 \t\t\t$\t17.14 \t\t\t$\t15.22 \t\nDiluted\t\t18.76 \t\t\t16.82 \t\t\t14.92 \t\nWeighted-average shares outstanding:\t\t\t\t\t\t\nBasic\t\t52.9 \t\t\t53.2 \t\t\t53.9 \t\nEffect of dilutive securities\t\t1.0 \t\t\t1.0 \t\t\t1.1 \t\nDiluted\t\t53.9 \t\t\t54.2 \t\t\t55.0', 'Sysco Corporation and its Consolidated Subsidiaries\nCONSOLIDATED RESULTS OF OPERATIONS\n(In millions, except for share and per share data) \n \tYear Ended\n \tJun. 29, 2024\t\tJul. 1, 2023\t\tJul. 2, 2022\n(In millions except for share and per share data)\nSales\t$\t78,844 \t\t\t$\t76,325 \t\t\t$\t68,636 \t\nCost of sales\t64,236 \t\t\t62,370 \t\t\t56,316 \t\nGross profit\t14,608 \t\t\t13,955 \t\t\t12,320 \t\nOperating expenses\t11,406 \t\t\t10,916 \t\t\t9,974 \t\nOperating income\t3,202 \t\t\t3,039 \t\t\t2,346 \t\nInterest expense\t607 \t\t\t527 \t\t\t624 \t\nOther expense (income), net (1)\n30 \t\t\t227 \t\t\t(25)\t\nEarnings before income taxes\t2,565 \t\t\t2,285 \t\t\t1,747 \t\nIncome taxes\t610 \t\t\t515 \t\t\t388 \t\nNet earnings\t$\t1,955 \t\t\t$\t1,770 \t\t\t$\t1,359 \t\nNet earnings:\t\t\t\t\t\nBasic earnings per share\t$\t3.90 \t\t\t$\t3.49 \t\t\t$\t2.66 \t\nDiluted earnings per share\t3.89 \t\t\t3.47 \t\t\t2.64 \t\nAverage shares outstanding\t501,238,422 \t\t\t507,362,913 \t\t\t510,630,645 \t\nDiluted shares outstanding\t503,096,086 \t\t\t509,719,756 \t\t\t514,005,827 \t\n \n(1)\nSysco’s second quarter of fiscal 2023 included a charge of $315 million in other expense related to pension settlement charges. See Note 14, “Company-Sponsored Employee Benefit Plans.” Sysco’s fourth quarter of fiscal 2023 included $122 million in other income related to a legacy litigation financing agreement. See Note 20, “Commitments and Contingencies.”', 'Net Sales\nNet sales for the Industrial precision solutions (IPS), Medical and Fluid Solutions (MFS) and Advanced technology solutions (ATS) segments were as follows:\nTwelve Months Ended\t\tVariance - Increase (Decrease)\t\nOct 31, 2024\t% of Total\tOct 31, 2023\t% of Total\t\tOrganic\t\tAcquisitions\t\tCurrency\t\tTotal\t\nIPS\t$\t1,484,249 \t\t55.2%\t$\t1,391,046 \t\t52.9%\t\t0.1 \t%\t\t6.6 \t%\t\t— \t%\t\t6.7 \t%\t\nMFS\t695,452 \t\t25.9%\t660,316 \t\t25.1%\t\t(0.2)\t%\t\t5.4 \t%\t\t0.1 \t%\t\t5.3 \t%\t\nATS\t510,220 \t\t19.0%\t577,270 \t\t22.0%\t\t(11.4)\t%\t\t— \t%\t\t(0.2)\t%\t\t(11.6)\t%\t\nTotal\t$\t2,689,921 \t\t\t$\t2,628,632 \t\t\t\t(2.5)\t%\t\t4.8 \t%\t\t— \t%\t\t2.3 \t%\t\n \nThe IPS organic sales increase of 0.1 percent was driven by increases in packaging, nonwovens, and industrial coatings product lines, principally offset by declines in measurements and controls and polymer processing. The MFS organic sales decrease of 0.2% was driven by a decrease in the medical fluid components product line, partially offset by an increase in the fluid solutions product line. The ATS organic sales decrease of 11.4 percent was driven by lower demand in electronics dispense product lines as well as test and inspection product lines.\nNet Sales by region were as follows:\nTwelve Months Ended\t\tVariance - Increase (Decrease)\nOct 31, 2024\t% of Total\tOct 31, 2023\t% of Total\t\tOrganic\t\tAcquisitions\t\tCurrency\t\tTotal\nAmericas\t$\t1,178,626 \t\t43.8%\t$\t1,149,760 \t\t43.7%\t\t(1.9)\t%\t\t4.3 \t%\t\t0.1 \t%\t\t2.5 \t%\nEurope\t726,100 \t\t27.0%\t682,676 \t\t26.0%\t\t(5.1)\t%\t\t10.2 \t%\t\t1.3 \t%\t\t6.4 \t%\nAsia Pacific\t785,195 \t\t29.2%\t796,196 \t\t30.3%\t\t(1.0)\t%\t\t1.0 \t%\t\t(1.4)\t%\t\t(1.4)\t%\nTotal\t$\t2,689,921 \t\t\t$\t2,628,632 \t\t\t\t(2.5)\t%\t\t4.8 \t%\t\t— \t%\t\t2.3 \t%\n \nSales outside the United States accounted for 66.6 percent of total sales in 2024, as compared to 66.2 percent in 2023.\nOperating Profit\nOperating profit for the IPS, MFS and ATS segments were as follows:\nTwelve Months Ended\t\t\t\t\t\t\t\nOct 31, 2024\t% of Sales\tOct 31, 2023\t% of Sales\t\t% of Sales Change\t\tIncrease (Decrease)\nIPS\t$\t470,559 \t\t31.7%\t$\t460,889 \t\t33.1%\t\t(1.4)%\t\t$\t9,670 \t\t\t2.1 \t%\t\nMFS\t187,731 \t\t27.0%\t189,367 \t\t28.7%\t\t(1.7)%\t\t(1,636)\t\t\t(0.9)\t%\t\nATS\t94,231 \t\t18.5%\t101,662 \t\t17.6%\t\t0.9%\t\t(7,431)\t\t\t(7.3)\t%\t\nCorporate\t(78,520)\t\t \t(79,157)\t\t\t\t \t\t637 \t\t\t(0.8)\t%\t\nTotal\t$\t674,001 \t\t25.1%\t$\t672,761 \t\t25.6%\t\t(0.5)%\t\t$\t1,240 \t\t\t0.2 \t%\t\n \nConsolidated operating margin decreased by 50 basis points primarily driven by costs related to the first-year effect of acquisitions, which more than offset favorable product mix. Gross margins improved 1.0 percentage point reflecting the impact of favorable product mix and lower incremental inventory step-up amortization related to acquisitions of $7,703 in 2024 versus $8,862 in 2023, while the increase in selling and administrative expenses was primarily driven by acquisitions. IPS operating profit declined 140 basis points due to an unfavorable acquisition impact and severance costs. MFS operating margin declined 170 basis points due to $10,761 in fees, severance, and non-cash inventory charges associated with the Atrion acquisition which offset improvements in operating efficiencies. ATS operating margin improved by 90 basis points on lower sales volumes due to cost reduction actions and favorable mix.', 'Other\n(Dollar amounts in millions)\t\t \tVariance\nYear Ended December 31,\t\t2023\t\t2022\t\t2023 vs. 2022\nSales\t\t$\t1,289 \t\t\t$\t1,805 \t\t\t(29)\t%\nOperating profit\t\t$\t43 \t\t\t$\t(66)\t\t\t165 \t%\nAs a percent of sales\t\t3.3 \t%\t\t(3.7)\t%\t\t\n \n2023 vs. 2022\n \t\t% Change\nFactors Contributing to Changes - Sales\t\t\nVolume/Price\t\t2 \t%\nCurrency\t\t— \t%\nAcquisitions/Divestitures\t\t(31)\t%\n(29)\t%\n \nOther consists of corporate costs and a few smaller businesses including: Linde Advanced Materials Technology and global helium wholesale; which individually do not meet the quantitative thresholds for separate presentation.\n\nSales\n\nSales for Other decreased $516 million, or 29%, in 2023 versus 2022. Divestitures decreased sales by 31% primarily due to sale of GIST business in third quarter of 2022. Volume/Price increased sales by 2% driven primarily by price in the coatings and global helium businesses, partially offset by lower coatings volumes.\n\nOperating profit\n\nOperating profit in Other increased $109 million, or 165%, in 2023 versus 2022 driven primarily by higher pricing in global helium and coatings and lower corporate costs which more than offset the impact of divestitures and lower volumes.', 'NXP Semiconductors N.V.\nConsolidated Statements of Operations\n($ in millions, unless otherwise stated)\tFor the years ended December 31,\n2023\t\t2022\t\t2021\nRevenue\t13,276 \t\t\t13,205 \t\t\t11,063 \t\nCost of revenue\t(5,723)\t\t\t(5,688)\t\t\t(4,996)\t\nGross profit\t7,553 \t\t\t7,517 \t\t\t6,067 \t\nResearch and development\t(2,418)\t\t\t(2,148)\t\t\t(1,936)\t\nSelling, general and administrative\t(1,159)\t\t\t(1,066)\t\t\t(956)\t\nAmortization of acquisition-related intangible assets\t(300)\t\t\t(509)\t\t\t(592)\t\nTotal operating expenses\t(3,877)\t\t\t(3,723)\t\t\t(3,484)\t\nOther income (expense)\t(15)\t\t\t3 \t\t\t— \t\nOperating income (loss)\t3,661 \t\t\t3,797 \t\t\t2,583 \t\nFinancial income (expense):\t\t\t\t\t\nExtinguishment of debt\t— \t\t\t(18)\t\t\t(22)\t\nOther financial income (expense)\t(309)\t\t\t(416)\t\t\t(381)\t\nIncome (loss) before income taxes\t3,352 \t\t\t3,363 \t\t\t2,180 \t\nBenefit (provision) for income taxes\t(523)\t\t\t(529)\t\t\t(272)\t\nResults relating to equity-accounted investees\t(7)\t\t\t(1)\t\t\t(2)\t\nNet income (loss)\t2,822 \t\t\t2,833 \t\t\t1,906 \t\nLess: Net income (loss) attributable to\n   non-controlling interests\n25 \t\t\t46 \t\t\t35 \t\nNet income (loss) attributable to stockholders\t2,797 \t\t\t2,787 \t\t\t1,871 \t\nEarnings per share data:\t\t\t\t\t\nNet income (loss) per common share attributable to stockholders\nin $:\n– Basic\t10.83 \t\t\t10.64 \t\t\t6.91 \t\n– Diluted\t10.70 \t\t\t10.55 \t\t\t6.79 \t\nWeighted average number of shares of common stock outstanding during the year (in thousands):\n– Basic\t258,381 \t\t\t261,879 \t\t\t270,687 \t\n– Diluted\t261,370 \t\t\t264,053 \t\t\t275,646', 'Segment operating income increased $127 million (48.7%), primarily due to higher net pricing, favorable volume/mix, lower manufacturing costs due to productivity, lower divestiture-related costs and lower costs incurred for the Simplify to Grow Program. These favorable items were partially offset by higher raw material costs, higher other selling, general and administrative expenses, higher advertising and consumer promotion costs, higher remeasurement loss on net monetary position, acquisition integration costs incurred in 2022, the impact of divestitures, inventory step-up charges incurred in 2022 and lapping a prior year favorable impact from the resolution of a tax matter.', 'Segment operating income increased $497 million (33.6%), primarily due to higher net pricing, lower impact from the European Commission legal matter, lapping the prior year incremental costs incurred due to the war in Ukraine, lower acquisition integration costs and favorable volume/mix. These favorable items were partially offset by higher raw material costs, higher advertising and consumer promotion costs, unfavorable currency, divestiture-related costs incurred in 2023, higher costs incurred for the Simplify to Grow Program, higher other selling, general and administrative expenses, higher remeasurement loss on net monetary position, higher manufacturing costs and an intangible asset impairment charge incurred in 2023.\n\n2022 compared with 2021']",1047.458166955039,I don’t know
20,20,3fae1303,"Share repurchase history of MLM, focusing on capital allocation strategy.","The data provided outlines a historical series of share repurchase authorizations and reveals how Martin Marietta Materials, Inc. has used share buybacks as a key tool in its capital allocation strategy. In particular:

1. **Consistent Return of Capital**: The fact that the company has periodically announced repurchase programs—as early as 1994 with 2.5 million shares and successive approvals in 2006, 2007, and 2015—demonstrates a long-term strategy to return excess cash to shareholders rather than investing all of it in operational growth. This reflects a deliberate capital allocation choice aimed at boosting shareholder value when internal projects or external acquisitions may not be as attractive.

2. **Increasing Magnitude of Repurchases**: The current authorization of up to 20 million shares indicates a significant scale-up compared to earlier programs. This change may signal that management has grown more confident in the company’s financial position and its future cash flows. It also suggests that they see the prevailing market conditions as favorable for repurchases, potentially believing that the shares are undervalued.

3. **Capital Structure Optimization**: Regular share repurchase programs can help improve metrics like earnings per share (EPS) by reducing the number of outstanding shares. The evolution and expansion of these programs over time imply that management is actively managing the capital structure to enhance shareholder return and maintain flexibility, especially when faced with variable business cycles.

4. **Market Signaling**: By updating the repurchase authorization periodically and disclosing details in press releases, the company sends a signal to the market about its confidence in future performance. The progressive increase in the allowable repurchase volume aligns with a strategy of seizing opportunities to offset dilution from capital raising or simply leveraging stock buyback benefits during periods of strong cash flow.

In summary, the historical and current details of share repurchase programs reflect a well-calibrated capital allocation strategy in which Martin Marietta Materials, Inc. balances reinvestment with returning capital to shareholders. The evolution in the size of the programs over time signals enhanced financial strength and a proactive approach to optimizing shareholder value.","['Issuer Purchases of Equity Securities\n\n \n\nPeriod\n\n \n\nTotal\nNumber of\nShares\nPurchased\n\n \n\n \n\nAverage\nPrice Paid\nper Share\n\n \n\n \n\nTotal\nNumber of\nShares\nPurchased\nas Part of\nPublicly\nAnnounced\nPlans or\nPrograms(1)\n\n \n\n \n\nMaximum\nNumber of\nShares that\nMay Yet be\nPurchased\nUnder the\nPlans or\nPrograms\n\n \n\nOctober 1, 2023 — October 31, 2023\n\n \n\n \n\n—\n\n \n\n \n\n$\n\n—\n\n \n\n \n\n \n\n—\n\n \n\n \n\n \n\n12,721,096\n\n \n\nNovember 1, 2023 — November 30, 2023\n\n \n\n \n\n—\n\n \n\n \n\n$\n\n—\n\n \n\n \n\n \n\n—\n\n \n\n \n\n \n\n12,721,096\n\n \n\nDecember 1, 2023 — December 31, 2023\n\n \n\n \n\n—\n\n \n\n \n\n$\n\n—\n\n \n\n \n\n \n\n—\n\n \n\n \n\n \n\n12,721,096\n\n \n\nTotal\n\n \n\n \n\n—\n\n \n\n \n\n$\n\n—\n\n \n\n \n\n \n\n—\n\n \n\n \n\n \n\n12,721,096\n\n \n\n1.\nThe Company’s stock repurchase program, which currently authorizes the repurchase of 20 million shares of common stock, is approved by the Board of Directors from time to time, and updated as appropriate by the Board of Directors, and announced to the public by press release. The latest announcement on this topic was the Company’s press release dated February 10, 2015 that its Board of Directors had authorized the repurchase of up to 20 million shares of its outstanding common stock, which included 5 million shares authorized under the Company’s previous share repurchase program. Previous press releases announcing prior share repurchase programs and the related amounts of common stock included under the share repurchase authorizations were as follows: (i) press release dated August 15, 2007 (5 million shares); (ii) press release dated February 22, 2006 (5 million shares); and (iii) May 6, 1994 (2.5 million shares).']",,,FinDER,Non-numerical,"['Issuer Purchases of Equity Securities\n\n \n\nPeriod\n\n \n\nTotal\nNumber of\nShares\nPurchased\n\n \n\n \n\nAverage\nPrice Paid\nper Share\n\n \n\n \n\nTotal\nNumber of\nShares\nPurchased\nas Part of\nPublicly\nAnnounced\nPlans or\nPrograms(1)\n\n \n\n \n\nMaximum\nNumber of\nShares that\nMay Yet be\nPurchased\nUnder the\nPlans or\nPrograms\n\n \n\nOctober 1, 2023 — October 31, 2023\n\n \n\n \n\n—\n\n \n\n \n\n$\n\n—\n\n \n\n \n\n \n\n—\n\n \n\n \n\n \n\n12,721,096\n\n \n\nNovember 1, 2023 — November 30, 2023\n\n \n\n \n\n—\n\n \n\n \n\n$\n\n—\n\n \n\n \n\n \n\n—\n\n \n\n \n\n \n\n12,721,096\n\n \n\nDecember 1, 2023 — December 31, 2023\n\n \n\n \n\n—\n\n \n\n \n\n$\n\n—\n\n \n\n \n\n \n\n—\n\n \n\n \n\n \n\n12,721,096\n\n \n\nTotal\n\n \n\n \n\n—\n\n \n\n \n\n$\n\n—\n\n \n\n \n\n \n\n—\n\n \n\n \n\n \n\n12,721,096\n\n \n\n1.\nThe Company’s stock repurchase program, which currently authorizes the repurchase of 20 million shares of common stock, is approved by the Board of Directors from time to time, and updated as appropriate by the Board of Directors, and announced to the public by press release. The latest announcement on this topic was the Company’s press release dated February 10, 2015 that its Board of Directors had authorized the repurchase of up to 20 million shares of its outstanding common stock, which included 5 million shares authorized under the Company’s previous share repurchase program. Previous press releases announcing prior share repurchase programs and the related amounts of common stock included under the share repurchase authorizations were as follows: (i) press release dated August 15, 2007 (5 million shares); (ii) press release dated February 22, 2006 (5 million shares); and (iii) May 6, 1994 (2.5 million shares).']",3fae1303,True,"['Our primary ongoing cash requirements are to fund our existing operations, store expansion and improvement, CAF and strategic growth initiatives. Since fiscal 2013, we have also elected to use cash for our share repurchase program.  Our primary ongoing sources of liquidity include funds provided by operations, proceeds from non-recourse funding vehicles and borrowings under our revolving credit facility or through other financing sources.\nOur current capital allocation strategy is to focus on our core business. Given our recent performance and continued market uncertainties, we are taking a conservative approach to our capital structure in order to maintain the flexibility that allows us to efficiently access the capital markets for both CAF and CarMax as a whole. We have taken steps to better align our expenses to sales as well as slowed the rate of our store growth. We resumed our share repurchases during the third quarter of fiscal 2024 after a pause initiated during the third quarter of the prior fiscal year. For fiscal 2025, we intend to modestly accelerate the pace of our share repurchases above the pace that we implemented in the third quarter of fiscal 2024. We believe we have the appropriate liquidity, access to capital and financial strength to support our operations and continue investing in our strategic initiatives for the next twelve months and thereafter for the foreseeable future.We are party to contractual obligations involving commitments to make payments to third parties. These obligations impact our liquidity and capital resource needs. Our contractual obligations primarily consist of long-term debt and related interest payments, leases, purchase obligations and commitments, income taxes and defined benefit retirement plans. See Notes 12 and 16 for amounts outstanding as of February 29, 2024 related to debt and leases, respectively.\nOur contractual obligations related to income taxes represent the net unrecognized tax benefits related to uncertain tax positions. See Note 10 for information related to income taxes. Our contractual obligations related to defined benefit retirement plans represent the funded status recognized as of February 29, 2024. See Note 11 for information related to these plans.\nPurchase obligations and commitments consist of certain enforceable and legally binding obligations related to real estate purchases, third-party outsourcing services and advertising. As of February 29, 2024, our purchase obligations and commitments were approximately $428.2 million, of which $213.3 million are due in fiscal 2025. The majority of the remaining purchase obligations and commitments are due within the next three years.\nWe have historically managed leverage based on a number of factors, including internal financial forecasts, consideration of CAF’s operational and capital needs, external peer benchmarking, requirements of our debt agreements and macroeconomic conditions. Generally, we expect to use our revolving credit facility and other financing sources, together with stock repurchases, to maintain a leverage profile that ensures operating flexibility while supporting continued investment in the business.', 'Overview of Capital Structure\nHistorically, we have largely funded our growth through cash provided by our operations, the issuance of notes in the financial markets, bank borrowings and, to a lesser extent, the issuance of our common stock, including issuances for certain mergers and acquisitions. Maintaining high levels of liquidity and focusing on cash generation are among our financial strategies. Our capital allocation strategy includes reinvesting in our business, maintaining an investment grade credit rating, maintaining a relevant dividend and deploying excess free cash flow to share repurchases or acquisitions.\nWe had cash and cash investments of approximately $634 million and $452 million at December 31, 2023 and 2022, respectively. Our cash and cash investments consist of overnight interest bearing money market demand accounts, time deposit accounts, and money market mutual funds containing government securities and treasury obligations. While we attempt to diversify these investments in a prudent manner to minimize risk, it is possible that future changes in the financial markets could affect the security or availability of these investments. Of the cash and cash investments we held at December 31, 2023 and 2022, $323 million and $321 million, respectively, was held in our foreign subsidiaries. If these funds were needed for our operations in the U.S., their repatriation into the U.S. would not result in significant additional U.S. income tax or foreign withholding tax, as we have recorded such taxes on substantially all undistributed foreign earnings, except for those that are legally restricted.\nOur current ratio was 1.7 to 1 and 1.6 to 1 at December 31, 2023 and 2022, respectively. The increase in our current ratio is primarily due to the repayment of the 364-day term loan during 2023.\nOur total debt as a percent of total capitalization was 97 percent and 109 percent at December 31, 2023 and 2022, respectively. Refer to Note K to the consolidated financial statements for additional information.\nWe believe that our present cash balance and cash flows from operations, and borrowing availability under our revolving credit agreement, are sufficient to fund our near-term working capital and other investment needs. We believe that our longer-term working capital and other general corporate requirements will be satisfied through cash flows from operations and, to the extent necessary, from bank borrowings and future financial market activities. However, due to the changing market conditions and its impact on our customers and suppliers, we are unable to fully estimate the extent of the impact that the changing market conditions may have on our future financial condition.', ""The Company believes it has a strong track record of deploying capital to investments that enhance the Company's business and return capital to shareholders.\nDuring 2023, the Company invested $671.5 million in strategic business acquisitions. The acquisitions have enhanced the Company’s service offerings, expanded its customer and revenue mix, and strengthened and broadened the scope of its geographic presence. The Company continues to evaluate acquisition opportunities that leverage the Company’s core competencies, complement existing scientific and technological capabilities, increase the Company’s presence in key geographic, therapeutic and strategic areas, and meet or exceed the Company’s financial criteria.\nDuring 2023, the Company repurchased 4.8 million shares of Common Stock at an average price of $206.85 per share for a total cost of $1,000.0 million. The Company has accrued $9.0 million of excise tax related to this accelerated share repurchase, which will be paid in April 2024. At the end of 2023, the Company had outstanding authorization from the Board to purchase $530.4 million of Common Stock.\nDuring 2023, capital expenditures were $453.6 million. The Company expects capital expenditures in 2024 to be approximately 3.5% of revenues, primarily in connection with projects to support growth in the Company's core businesses, facility expansion and updates, projects related to its LaunchPad initiative, and further acquisition integration initiatives."", 'Our Board of Directors has approved the following authorization to repurchase common stock: March 2014 authorization program for 300 million shares, with 144 million outstanding at December 31, 2023. To implement this authorization, we have used open market repurchases, relying on Rule 10b5-1 of the Securities Exchange Act of 1934, where feasible. We have also used accelerated share repurchase agreements with large financial institutions to repurchase our stock. We will continue to fund any share repurchases through a combination of cash from operations, borrowings dependent on market conditions, or cash from the disposition of certain non-strategic investments.\n\nOur 2024 financing activities will focus on managing our debt level and paying dividends, subject to approval by our Board of Directors. We plan to fund our financing uses of cash through a combination of cash from operations, issuance of debt and asset sales. The timing and mix of any debt issuance and/or refinancing will be guided by credit market conditions and interest rate trends.\n\nA summary of our repurchases of common stock during the fourth quarter of 2023 is as follows:\n\nISSUER PURCHASES OF EQUITY SECURITIES\n(a)\t(b)\t(c)\t(d)\nPeriod\t\nTotal Number of\nShares (or Units) Purchased1,2', 'Share repurchases of $622 million in 2023, $3.1 billion in 2022, and $3.4 billion in 2021 resulted in the retirement of 2.8 million, 12.6 million, and 12.7 million shares, respectively. As of December 31, 2023, $6.9 billion remains authorized by our Board of Directors for repurchase. The timing and volume of future share repurchases will be guided by our assessment of market conditions and other pertinent factors. Repurchases may be executed in the open market, through derivatives, accelerated repurchase and other negotiated transactions and through plans designed to comply with Rule 10b5-1(c) and Rule 10b-18 under the Securities and Exchange Act of 1934. Any near-term purchases under the program are expected to be made with internally-generated cash, cash on hand, or proceeds from borrowings.', 'Our Board has authorized the investment in Arch Capital’s common shares through a share repurchase program. Since the inception of the share repurchase program through December 31, 2023, Arch Capital has repurchased approximately 433.6 million common shares for an aggregate purchase price of $5.9 billion. At December 31, 2023, $1.0 billion of share repurchases were available under the program. Repurchases under the program may be effected from time to time in open market or privately negotiated transactions through December 31, 2024. The timing and amount of the repurchase transactions under this program will depend on a variety of factors, including market conditions, the development of the economy, corporate and regulatory considerations. We will continue to monitor our share price and, depending upon results of operations, market conditions and the development of the economy, as well as other factors, we will consider share repurchases on an opportunistic basis.', 'The company repurchased $14.9 billion of its common stock in 2023 under its stock repurchase program.', 'Globe Life has an ongoing share repurchase program that began in 1986. The share repurchase program is reviewed with the Board of Directors by management quarterly, and continues indefinitely unless and until the Board of Directors decides to suspend, terminate or modify the program. With no specified authorization amount, management determines the amount of repurchases based on the amount of the excess cash flows after the payment of dividends to the Parent Company shareholders, general market conditions, and other alternative uses. Since implementing our share repurchase program in 1986, we have used $9.4 billion of excess cash flow at the Parent Company to repurchase Globe Life Inc. common shares after determining that the repurchases provide a greater risk-adjusted after-tax return than other investment alternatives.', 'Under the 2023-2024 Stockholder Return Program, share repurchases can be made from time to time using a variety of methods, which may include open market purchases, Rule 10b5-1 plans, accelerated share repurchases, privately negotiated transactions or otherwise, all in accordance with the rules of the Securities and Exchange Commission and other applicable legal requirements. The specific timing and amount of any share repurchases, and the specific timing and amount of any dividend payments, under the 2023-2024 Stockholder Return Program will depend on prevailing share prices, general economic and market conditions, Company performance, and other considerations. In addition, the specific timing and amount of any dividend payments are subject to being declared on future dates by our Board of Directors in its sole discretion. The 2023-2024 Stockholder Return Program does not obligate us to acquire any particular amount of common stock or to declare and pay any particular amount of dividends, and the 2023-2024 Stockholder Return Program may be suspended or discontinued at any time at our discretion.', 'Our goal is to be the preeminent owner of high-quality lodging real estate in growing markets in the U.S. and to generate superior long-term risk adjusted returns for our stockholders throughout all phases of the lodging cycle through a combination of appreciation in asset values, growth in earnings and the payment of dividends. The pillars of our strategy to achieve this objective and elevate our growth profile include:\n•Geographically diverse portfolio of hotels in the U.S. - Own a diversified portfolio of hotels in the U.S. in major urban and resort destinations. Target markets with diverse demand generators, high barriers to entry, favorable supply and demand dynamics and attractive long-term projected RevPAR growth;•Strong scale and integrated platform - Utilize our scale to create value through enterprise analytics, asset management and capital investment initiatives, while aiding external growth by leveraging scale as a competitive advantage to acquire assets befitting our strategy. Allocate and recycle capital to seek returns that exceed our cost of capital and actively return capital to stockholders;\n•Investment grade balance sheet - Maintain a strong and flexible capital structure that allows us to execute our strategy throughout all phases of the lodging cycle; and\n•Employer of choice and responsible corporate citizen - Align our organizational structure with our business objectives to be an employer of choice and a responsible corporate citizen.\nGeographically Diverse Portfolio\nWe seek to have a geographically diversified portfolio in major markets and premier resort destinations in the U.S. We primarily focus on acquisitions and, occasionally, new development opportunities to enhance our portfolio. While we have historically targeted acquisitions in the top 25 U.S. markets, we also consider hotels in other markets, which we believe have high growth potential and diverse demand generators. We focus generally on the following types of assets:\n•Resorts in destination locations with limited supply growth. These assets feature superior amenities and unique experiential offerings;\n•Convention destination hotels that are group oriented in urban and resort markets. These assets feature extensive and high-quality meeting facilities and often are connected to prominent convention centers; and\n•High-end urban hotels that are positioned in prime locations and possess multiple demand drivers for both business and leisure travelers.\nAs one of the largest owners of Marriott and Hyatt hotels, our hotels primarily are operated under brand names that are among the most respected and widely recognized in the lodging industry. Within these brands, we have focused predominantly on the upper-upscale and luxury chain scales, as we believe these have a broad appeal for both individual and group leisure and business customers. In addition, we own several unbranded or soft-branded hotels that appeal to distinctive customer profiles in certain submarkets.Strong Scale and Integrated Platform\nEnterprise Analytics Platform. Due to the scale of our asset management and business intelligence platform, we believe we are in a unique position to implement value-added real estate decisions and to assist our managers in improving operating performance and profitability. The size and composition of our portfolio and our affiliation with most of the leading brands and operators in the industry allow our enterprise analytics team to benchmark similar hotels and identify revenue-enhancement opportunities and cost efficiencies that can maximize the operating performance, long-term profitability and value of our real estate. We perform independent underwriting of return on investment (“ROI”) projects and potential acquisitions, as well as revenue management analysis of ancillary revenue opportunities. Our goal is to continue to differentiate our hotels within their competitive markets, drive operating performance and enhance the overall value of our real estate through the following:\n•Enhance operating performance and profitability by using our business intelligence system to benchmark and monitor hotel performance and cost controls.\n•Drive revenue growth by conducting detailed strategic reviews with our managers on markets and business mix to assist them in developing the appropriate group/transient mix, online presence to address a broad customer base, and market share targets for each hotel.\n•Work with leading brands, such as Marriott and Hyatt, to take advantage of their worldwide presence and lodging infrastructure. We also have a selection of hotels managed by independent operators where we believe these operators have more flexibility to drive revenues and control costs to maximize profits.•Improve asset value through the extension or purchase of ground leases or the restructuring of management agreements to increase contract flexibility.\nDisciplined Capital Allocation. Guided by a disciplined approach to capital allocation, we are equipped to make investment decisions that seek to deliver the greatest value and returns to stockholders. Our goal is to allocate capital to enhance and improve our portfolio, while balancing the importance of prudently returning capital to stockholders.\nFor 2024, we will continue our disciplined approach to capital allocation and intend to take advantage of our strong balance sheet and overall scale. We are constantly evaluating potential acquisitions of iconic upper-upscale and luxury properties that we believe have sustainable competitive advantages. Similarly, we intend to continue our capital recycling program with strategic and opportunistic dispositions. This may include the sale of assets where we believe the potential for growth is constrained or hotels with significant capital expenditure requirements that we do not believe would generate an adequate return.\nWe may acquire additional properties or dispose of properties through various structures, including transactions involving single assets, portfolios, joint ventures, mergers and acquisitions of the securities or assets of other REITs or distributions of hotels to our stockholders. We anticipate that any acquisitions may be funded by, or through a combination of, proceeds from the sales of hotels, equity offerings of Host Inc., issuances of OP units by Host L.P., incurrence of debt, available cash or advances under our credit facility. We note, however, that the nature and supply of these assets make acquisitions inherently difficult to predict. For these reasons, we can make no assurances that we will be successful in purchasing any one or more hotels that we are reviewing currently, or may in the future review, bid on or negotiate to buy.\nWe also seek to create and mine value from our existing portfolio through value enhancement initiatives and ROI projects. We believe these investments provide a significant opportunity to achieve returns well in excess of our cost of capital. We work closely with our managers to attempt to schedule these projects to minimize operational disruption and environmental impact. Value enhancement initiatives seek to maximize the value of real estate within our existing portfolio through its highest and best use. These projects may include hotel expansion, timeshare, office space or condominium units on excess land, redevelopment or expansion of existing retail space, and the acquisition of development entitlements. ROI projects are designed to improve the positioning of our hotels within their markets and competitive set. These projects include extensive renovations, including guest rooms, lobbies, food and beverage outlets; expansions and/or extensive renovation of ballroom and meeting rooms; major mechanical system upgrades; and green building initiatives and certifications. Also included are projects focused on increasing space profitability or lowering net operating costs, such as converting unprofitable or underutilized space into meeting space, adding guestrooms, and implementing energy and water conservation measures such as LED lighting, high-efficiency mechanical, electrical and plumbing equipment and fixtures, solar power, energy management systems, guestroom water efficient fixtures, and building automation systems.\nRenewal and replacement capital expenditures are designed to maintain the quality and competitiveness of our hotels. Typically, renovations occur at intervals of approximately seven to ten years, but the timing may vary based on the type of property, function of area being renovated, hotel occupancy and other factors. These renovations generally are divided into the following types: soft goods, case goods, bathroom and architectural and engineering systems. Soft goods include items such as carpeting, textiles and wall finishes, which may require more frequent updates to maintain brand quality standards. Case goods include dressers, desks, couches, restaurant and meeting room tables and chairs, which generally are not replaced as frequently. Bathroom renovations include the refurbishment or replacement of tile, vanity, lighting and plumbing fixtures. Architectural and engineering systems include the physical plant of the hotel, including the roof, elevators/escalators, façade, heating, ventilation, and air conditioning and fire systems.\nThroughout the lodging cycle, to the extent that we are unable to find appropriate investment opportunities that meet our return requirements, we will focus on returning capital to stockholders through dividends or common stock repurchases. Significant factors we review to determine the level and timing of the returns to stockholders include our current stock price compared to our determination of the underlying value of our assets, current and forecast operating results and the completion of hotel sales.']",1470.6981669878587,"MLM has treated buybacks as a flexible use of excess cash: after pausing in FY-2023, it restarted repurchases in 3Q-FY2024 under its March-2014, 300 million-share program (144 million shares/$6.9 billion still available at 12-31-23). It retired 12.7 million shares for $3.4 billion in 2021, 12.6 million shares for $3.1 billion in 2022, and 2.8 million shares for $622 million in 2023, and plans a modestly faster pace in FY-2025 while funding buybacks with operating cash and opportunistic borrowing, consistent with its strategy of reinvesting in the core business, preserving an investment-grade balance sheet, and returning surplus cash to shareholders."
21,21,HII/2018/page_103.pdf,"For HII, what is the liability for interest and penalties as of december 31 , 2017?",0,"['[\'and penalties , resulting in a liability of $ 1 million for interest and penalties as of december 31 , 2018 .\', \'in 2017 , there was a net decrease in income tax expense of $ 1 million for interest and penalties , resulting in no material liability for interest and penalties as of december 31 , 2017 .\', \'the 2017 changes in interest and penalties related to statute of limitation expirations .\', \'in 2016 , there was a net decrease in income tax expense of $ 2 million for interest and penalties , resulting in a total liability of $ 1 million for interest and penalties as of december 31 , 2016 .\', \'the 2016 changes in interest and penalties related to reductions in prior year tax positions and settlement with a taxing authority .\', \'the following table summarizes the tax years that are either currently under examination or remain open under the applicable statute of limitations and subject to examination by the major tax jurisdictions in which the company operates: .\']\njurisdiction united states ( 1 )\tjurisdiction 2011\tjurisdiction -\t2017\nconnecticut\t2016\t-\t2017\nmississippi\t2012\t-\t2017\nvirginia ( 1 )\t2011\t-\t2017\n[\'virginia ( 1 ) 2011 - 2017 ( 1 ) the 2014 tax year has been closed in these jurisdictions .\', ""although the company believes it has adequately provided for all uncertain tax positions , amounts asserted by taxing authorities could be greater than the company\'s accrued position ."", \'accordingly , additional provisions for federal and state income tax related matters could be recorded in the future as revised estimates are made or the underlying matters are effectively settled or otherwise resolved .\', \'conversely , the company could settle positions with the tax authorities for amounts lower than have been accrued .\', ""the company believes that it is reasonably possible that during the next 12 months the company\'s liability for uncertain tax positions may decrease by $ 14 million due to resolution of a federal uncertain tax position ."", \'during 2013 the company entered into the pre-compliance assurance process with the irs for years 2011 and 2012 .\', \'the company is part of the irs compliance assurance process program for the 2014 through 2018 tax years .\', \'open tax years related to state jurisdictions remain subject to examination .\', \'deferred income taxes - deferred income taxes reflect the net tax effects of temporary differences between the carrying amounts of assets and liabilities for financial reporting purposes and for income tax purposes .\', \'as described above , deferred tax assets and liabilities are calculated as of the balance sheet date using current tax laws and rates expected to be in effect when the deferred tax items reverse in future periods .\', \'as a result of the reduction in the corporate income tax rate from 35% ( 35 % ) to 21% ( 21 % ) under the tax act , the company revalued its net deferred tax assets as of december 31 , 2017 .\', \'net deferred tax assets are classified as long-term deferred tax assets in the consolidated statements of financial position. .\']']","{'text_1': 'in 2017 , there was a net decrease in income tax expense of $ 1 million for interest and penalties , resulting in no material liability for interest and penalties as of december 31 , 2017 .', 'text_3': 'in 2016 , there was a net decrease in income tax expense of $ 2 million for interest and penalties , resulting in a total liability of $ 1 million for interest and penalties as of december 31 , 2016 .'}","subtract(1, 1)",FinQA,Arithmetic,"['in 2017 , there was a net decrease in income tax expense of $ 1 million for interest and penalties , resulting in no material liability for interest and penalties as of december 31 , 2017 .', 'in 2016 , there was a net decrease in income tax expense of $ 2 million for interest and penalties , resulting in a total liability of $ 1 million for interest and penalties as of december 31 , 2016 .']",HII/2018/page_103.pdf,True,"['[\'and penalties , resulting in a liability of $ 1 million for interest and penalties as of december 31 , 2018 .\', \'in 2017 , there was a net decrease in income tax expense of $ 1 million for interest and penalties , resulting in no material liability for interest and penalties as of december 31 , 2017 .\', \'the 2017 changes in interest and penalties related to statute of limitation expirations .\', \'in 2016 , there was a net decrease in income tax expense of $ 2 million for interest and penalties , resulting in a total liability of $ 1 million for interest and penalties as of december 31 , 2016 .\', \'the 2016 changes in interest and penalties related to reductions in prior year tax positions and settlement with a taxing authority .\', \'the following table summarizes the tax years that are either currently under examination or remain open under the applicable statute of limitations and subject to examination by the major tax jurisdictions in which the company operates: .\'] jurisdiction united states ( 1 ) jurisdiction 2011 jurisdiction - 2017 connecticut 2016 - 2017 mississippi 2012 - 2017 virginia ( 1 ) 2011 - 2017 [\'virginia ( 1 ) 2011 - 2017 ( 1 ) the 2014 tax year has been closed in these jurisdictions .\', ""although the company believes it has adequately provided for all uncertain tax positions , amounts asserted by taxing authorities could be greater than the company\'s accrued position ."", \'accordingly , additional provisions for federal and state income tax related matters could be recorded in the future as revised estimates are made or the underlying matters are effectively settled or otherwise resolved .\', \'conversely , the company could settle positions with the tax authorities for amounts lower than have been accrued .\', ""the company believes that it is reasonably possible that during the next 12 months the company\'s liability for uncertain tax positions may decrease by $ 14 million due to resolution of a federal uncertain tax position ."", \'during 2013 the company entered into the pre-compliance assurance process with the irs for years 2011 and 2012 .\', \'the company is part of the irs compliance assurance process program for the 2014 through 2018 tax years .\', \'open tax years related to state jurisdictions remain subject to examination .\', \'deferred income taxes - deferred income taxes reflect the net tax effects of temporary differences between the carrying amounts of assets and liabilities for financial reporting purposes and for income tax purposes .\', \'as described above , deferred tax assets and liabilities are calculated as of the balance sheet date using current tax laws and rates expected to be in effect when the deferred tax items reverse in future periods .\', \'as a result of the reduction in the corporate income tax rate from 35% ( 35 % ) to 21% ( 21 % ) under the tax act , the company revalued its net deferred tax assets as of december 31 , 2017 .\', \'net deferred tax assets are classified as long-term deferred tax assets in the consolidated statements of financial position. .\']', ""Asbestos Related Claims - HII and its predecessors-in-interest are defendants in a longstanding series of cases that have been and continue to be filed in various jurisdictions around the country, wherein former and current employees and various third parties allege exposure to asbestos containing materials while on or associated with HII premises or while working on vessels constructed or repaired by HII. In some instances, partial or full insurance coverage is available for the Company's liabilities. The costs to resolve cases during the years ended December 31, 2023, 2022, and 2021 were not material individually or in the aggregate. The Company’s estimate of asbestos-related liabilities is subject to uncertainty because liabilities are influenced by many variables that are inherently difficult to predict. Although the Company believes the ultimate resolution of current cases will not have a material effect on its consolidated financial position, results of operations, or cash flows, it cannot predict what new or revised claims or litigation might be asserted or what information might come to light and can, therefore, give no assurances regarding the ultimate outcome of asbestos related litigation."", 'We expect to continue to have sufficient cash and borrowing capacity to support working capital needs and capital expenditures, to pay interest and service debt and to pay dividends to shareholders quarterly. We believe we have the ability to meet our short-term and long-term cash requirements by using available cash and internally generated funds and to borrow under our committed and uncommitted credit facilities. The following summarizes our material cash requirements from significant contractual obligations and purchase commitments that impact our liquidity as of December 31, 2023:\nIn millions\tNext\nTwelve Months\tGreater Than Twelve Months\tTotal\nDebt obligations (Note 8)\t$\t237.5 \t\t$\t1,769.3 \t\t$\t2,006.8 \t\nInterest obligations on fixed-rate debt\n42.5 \t\t279.7 \t\t322.2 \t\nOperating lease obligations, net of sublease rentals (Note 15)\t31.4 \t\t97.8 \t\t129.2 \t\nPension and other post-retirement plan contributions (Note 11)\t9.5 \t\t79.9 \t\t89.4 \t\nOther purchase obligations\n42.4 \t\t24.2 \t\t66.6 \t\nTotal contractual obligations, net\t$\t363.3 \t\t$\t2,250.9 \t\t$\t2,614.2 \t\n \nOther purchase obligations primarily include service and marketing contracts as well as commitments for raw materials to be utilized in the normal course of business. For purposes of the above table, arrangements are considered purchase obligations if a contract specifies all significant terms, including fixed or minimum quantities to be purchased, a pricing structure and approximate timing of the transaction.\nIn addition to the significant contractual obligations described above, we will incur annual interest expense on outstanding variable rate debt. As of December 31, 2023, variable interest rate debt was $1,187.5 million at a weighted average interest rate of 6.84%. Inclusive of our interest rate swaps and collars, our weighted average interest rate on our variable rate debt was 6.29% as of December 31, 2023. Refer to ITEM 8, Note 9 of the Notes to Consolidated Financial Statements for additional information regarding our interest rate swaps and collars.\nThe total gross liability for uncertain tax positions at December 31, 2023 was estimated to be $38.6 million. We record penalties and interest related to unrecognized tax benefits in (Benefit) provision for income taxes and Net interest expense, respectively, which is consistent with our past practices. As of December 31, 2023, we had recorded $0.3 million for the possible payment of penalties and $6.4 million related to the possible payment of interest.', 'The following table summarizes our expected payments for significant contractual obligations as of December 31, 2023, using the interest rates in effect as of that date:\n\n \n\n(U.S. Dollars in thousands)\n\n \t\nTotal\n\n \t \t\n2024\n\n \t \t\n2025\n\n \t \t\n2026\n\n \t \t\n2027\n\n \t \t\n2028\n\n \t \t\nAfter 2028\n\n \nLong-term debt, including current portion (1)\n\n \t$\t1,434,825\t \t \t$\t42,162\t \t \t$\t46,958\t \t \t$\t595,651\t \t \t$\t750,026\t \t \t$\t28\t \t \t$\t-\t \nFinance lease obligations, including current portion (2)\n\n \t \t71,308\t \t \t \t3,614\t \t \t \t44,069\t \t \t \t2,517\t \t \t \t2,337\t \t \t \t2,064\t \t \t \t16,707\t \nInterest on long-term debt and finance lease obligations\n\n \t \t329,157\t \t \t \t104,116\t \t \t \t101,204\t \t \t \t92,837\t \t \t \t23,684\t \t \t \t1,408\t \t \t \t5,908\t \nOperating leases\n\n \t \t85,148\t \t \t \t32,145\t \t \t \t18,887\t \t \t \t8,278\t \t \t \t7,667\t \t \t \t6,157\t \t \t \t12,014\t \nShort-term borrowings (3)\n\n \t \t81,769\t \t \t \t81,769\t \t \t \t-\t \t \t \t-\t \t \t \t-\t \t \t \t-\t \t \t \t-\t \nTotal contractual cash obligations\n\n \t$\t2,002,207\t \t \t$\t263,806\t \t \t$\t211,118\t \t \t$\t699,283\t \t \t$\t783,714\t \t \t$\t9,657\t \t \t$\t34,629\t \n \n\n(1) The Tranche B Term Loan matures on December 13, 2026. The Tranche A Term Loan and the Revolving Facility mature on June 29, 2027. As of December 31, 2023, there was $150 million outstanding under the Revolving Facility classified as long-term debt. \n\n \n\n(2) Finance lease obligations, including current portion includes a payment for a purchase option reasonably certain to be exercised in 2025.', 'On January 29, 2020, the Special Director issued an order imposing a penalty on YRIPL and certain former directors of approximately Indian Rupee 11 billion, or approximately $135 million. Of this amount, $130 million relates to the alleged failure to invest a total of $80 million in India within an initial seven-year period. We have been advised by external counsel that the order is flawed and have filed a writ petition with the Delhi High Court, which granted an interim stay of the penalty order on March 5, 2020. In November 2022, YRIPL was notified that an administrative tribunal bench had been constituted to hear an appeal by DOE of certain findings of the January 2020 order, including claims that certain charges had been wrongly dropped and that an insufficient amount of penalty had been imposed. A hearing with the administrative tribunal that had been scheduled for December 4, 2023 has been rescheduled to March 4, 2024. The stay order remains in effect and the next hearing in the Delhi High Court that had been scheduled for December 14, 2023 has been rescheduled to March 21, 2024. We deny liability and intend to continue vigorously defending this matter. We do not consider the risk of any significant loss arising from this order to be probable.', 'The following table summarizes the Company’s contractual obligations, commercial commitments and expected cash requirements for interest at December 31, 2023. Additional information related to these obligations can be found in Notes 13, 14, 15 and 18 to the Consolidated Financial Statements.', 'As discussed and defined in Note 13 of the Notes to Consolidated Financial Statements, on July 21, 2021, it was announced that we and the two other national pharmaceutical distributors had negotiated a Distributor Settlement Agreement. The Distributor Settlement Agreement became effective on April 2, 2022, and as of September 30, 2024, it included 48 of 49 eligible states (the ""Settling States"") as well as 99% by population of the eligible political subdivisions in the Settling States. Our accrued litigation liability related to the Distributor Settlement Agreement, including the State of Alabama and an estimate for non-participating government subsidiaries (with whom we have not reached a settlement agreement), as well as other opioid-related litigation for which we have reached settlement agreements on our Consolidated Balance Sheet as of September 30, 2024 is $4.9 billion and is expected to be paid over the next 14 years. We currently estimate that $630.2 million will be paid prior to September 30, 2025. The payment of the aforementioned litigation liability has not and is not expected to have an impact on our ability to pay dividends.\nThe following is a summary of our contractual obligations for future principal and interest payments on our debt, minimum rental payments on our noncancellable operating leases, and minimum payments on our other commitments as of September 30, 2024:\nPayments Due by Period (in thousands)\t\tDebt, Including Interest Payments\t\tOperating\nLeases\t\tOther Commitments\t\tTotal\nWithin 1 year\t\t$\t726,675 \t\t\t$\t248,556 \t\t\t$\t116,250 \t\t\t$\t1,091,481 \t\n1-3 years\t\t344,184 \t\t\t437,502 \t\t\t166,544 \t\t\t948,230 \t\n4-5 years\t\t1,009,527 \t\t\t333,414 \t\t\t48,550 \t\t\t1,391,491 \t\nAfter 5 years\t\t3,905,571 \t\t\t460,097 \t\t\t1,069 \t\t\t4,366,737 \t\nTotal\t\t$\t5,985,957 \t\t\t$\t1,479,569 \t\t\t$\t332,413 \t\t\t$\t7,797,939 \t\n \n    The 2017 Tax Act requires a one-time transition tax to be recognized on historical foreign earnings and profits. As of September 30, 2024, we expect to pay a remaining $104.2 million, net of overpayments and tax credits, related to this transition tax over the next two years. The transition tax commitment is included in ""Other Commitments"" in the above table.\nOur liability for uncertain tax positions was $545.0 million (including interest and penalties) as of September 30, 2024. This liability represents an estimate of tax positions that we have taken in our tax returns which may ultimately not be sustained upon examination by taxing authorities. Since the amount and timing of any future cash settlements cannot be predicted with reasonable certainty, the estimated liability has been excluded from the above contractual obligations table. Our liability for uncertain tax positions as of September 30, 2024 primarily includes an uncertain tax benefit related to the legal accrual for litigation related to the distribution of prescription opioid pain medications, as disclosed in Note 13 of the Notes to Consolidated Financial Statements.', 'As of October 31, 2024, our material cash requirements consisted of future payments for debt and related interests, income tax liabilities related to one-time transition tax, purchase obligations, operating lease and Retirement Income Plan.\n\nWe incur interest on a revolving loan and a term loan. Using the same interest rate of October 31, 2024, and assuming borrowings as of October 31, 2024, remain constant throughout all periods, these loans would result in interest payments of $109.5 million in the twelve months ending October 31, 2025, and $272.1 million in the years thereafter. See Note 5. Financing Arrangements for additional information related to debt and interests.', ""The 2022 Credit Agreement contains customary representations and warranties, affirmative and negative covenants and events of default. The negative covenants include restrictions on subsidiary indebtedness, liens and fundamental changes. These covenants are subject to a number of important exceptions and qualifications. The principal financial covenant requires a maximum consolidated leverage ratio. There were no outstanding borrowings under the 2022 Credit Agreement as of December 31, 2023. \n\nInterest Expense\n\nThe Notes bear interest at fixed rates that are payable semi-annually in arrears on their respective interest payment dates each year. Interest expense, together with ongoing commitment fees under the terms of the Company's credit agreements, included in the consolidated statements of income for the years ended December 31, 2023, 2022 and 2021 was as follows (in thousands):\n\n2023\t\t2022\t\t2021\nAmortization of debt discount and issuance costs\t$\t5,803 \t\t\t$\t4,688 \t\t\t$\t69,697 \t\nCoupon interest payable on 2029 Notes\t5,218 \t\t\t— \t\t\t— \t\nCoupon interest payable on 2027 Notes\t4,312 \t\t\t4,312 \t\t\t4,313 \t\nCoupon interest payable on 2025 Notes\t1,436 \t\t\t1,437 \t\t\t1,437 \t\nInterest payable and commitment fees under the credit agreements\t1,402 \t\t\t952 \t\t\t557 \t\nCapitalization of interest expense\t(462)\t\t\t(293)\t\t\t(3,672)\t\nTotal interest expense\t$\t17,709 \t\t\t$\t11,096 \t\t\t$\t72,332"", 'In June 2023, the outstanding floating-rate capital securities issued by First Charter Capital Trust I and II that used three-month U.S. dollar LIBOR as its reference rate transitioned to a replacement reference rate after June 30, 2023. The replacement reference rate is three-month CME Term SOFR plus a tenor spread adjustment of 0.26161%. Dividends and interest began accruing based on the replacement reference rate on September 15, 2023 with the first payment date of SOFR-based interest occurring on December 15, 2023. Likewise, the aforementioned subordinated floating-rate debentures have undergone the same transition as the floating-rate capital securities. Refer to Note 1 for additional information regarding this transition.\n\nFHLB advances\nAt December 31, 2023, FHLB advances have a weighted-average rate of 5.62%, with interest payable monthly. The Bancorp has pledged $30.3 billion of loans and securities to secure its borrowing capacity at the FHLB which is partially utilized to fund $1.5 billion in FHLB advances that are outstanding. The FHLB advances mature as follows: $1.5 billion in 2024, $4 million in 2025 and $6 million after 2028.']",1500.0509589444846,0
22,22,BLL/2010/page_39.pdf,"for the receivables sales agreement of Ball Corporation , what is the increase in the size of the new program in the last 8 months of the year compared to the first 4 months ( in millions ) ?",50,"[""['page 26 of 100 our calculation of adjusted net earnings is summarized below: .']\n( $ in millions except per share amounts )\t2010\t2009\t2008\nnet earnings attributable to ball corporation as reported\t$ 468.0\t$ 387.9\t$ 319.5\ndiscontinued operations net of tax\t74.9\t2.2\t-4.6 ( 4.6 )\nbusiness consolidation activities net of tax\t-9.3 ( 9.3 )\t13.0\t27.1\ngains and equity earnings related to acquisitions net of tax\t-105.9 ( 105.9 )\t2212\t2212\ngain on dispositions net of tax\t2212\t-30.7 ( 30.7 )\t-4.4 ( 4.4 )\ndebt refinancing costs net of tax\t5.3\t2212\t2212\nadjusted net earnings\t$ 433.0\t$ 372.4\t$ 337.6\nper diluted share from continuing operations as reported\t$ 2.96\t$ 2.05\t$ 1.62\nper diluted share as adjusted\t2.36\t1.96\t1.74\n['debt facilities and refinancing interest-bearing debt at december 31 , 2010 , increased $ 216.1 million to $ 2.8 billion from $ 2.6 billion at december 31 , 2009 .', 'in december 2010 , ball replaced its senior credit facilities due october 2011 with new senior credit facilities due december 2015 .', 'the senior credit facilities bear interest at variable rates and include a $ 200 million term a loan denominated in u.s .', 'dollars , a a351 million term b loan denominated in british sterling and a 20ac100 million term c loan denominated in euros .', 'the facilities also include ( 1 ) a multi-currency , long-term revolving credit facility that provides the company with up to approximately $ 850 million and ( 2 ) a french multi-currency revolving facility that provides the company with up to $ 150 million .', 'the revolving credit facilities expire in december 2015 .', 'in november 2010 , ball issued $ 500 million of new 5.75 percent senior notes due in may 2021 .', 'the net proceeds from this offering were used to repay the borrowings under our term d loan facility and for general corporate purposes .', 'in march 2010 , ball issued $ 500 million of new 6.75 percent senior notes due in september 2020 .', 'on that same date , the company issued a notice of redemption to call $ 509 million in 6.875 percent senior notes due december 2012 at a redemption price of 101.146 percent of the outstanding principal amount plus accrued interest .', 'the redemption of the bonds occurred on april 21 , 2010 , and resulted in a charge of $ 8.1 million for the call premium and the write off of unamortized financing costs and unamortized premiums .', 'the charge is included in the 2010 statement of earnings as a component of interest expense .', 'at december 31 , 2010 , approximately $ 976 million was available under the company 2019s committed multi-currency revolving credit facilities .', 'the company 2019s prc operations also had approximately $ 20 million available under a committed credit facility of approximately $ 52 million .', 'in addition to the long-term committed credit facilities , the company had $ 372 million of short-term uncommitted credit facilities available at the end of 2010 , of which $ 76.2 million was outstanding and due on demand , as well as approximately $ 175 million of available borrowings under its accounts receivable securitization program .', 'in october 2010 , the company renewed its receivables sales agreement for a period of one year .', 'the size of the new program will vary between a maximum of $ 125 million for settlement dates in january through april and a maximum of $ 175 million for settlement dates in the remaining months .', 'given our free cash flow projections and unused credit facilities that are available until december 2015 , our liquidity is strong and is expected to meet our ongoing operating cash flow and debt service requirements .', 'while the recent financial and economic conditions have raised concerns about credit risk with counterparties to derivative transactions , the company mitigates its exposure by spreading the risk among various counterparties and limiting exposure to any one party .', 'we also monitor the credit ratings of our suppliers , customers , lenders and counterparties on a regular basis .', 'we were in compliance with all loan agreements at december 31 , 2010 , and all prior years presented , and have met all debt payment obligations .', 'the u.s .', 'note agreements , bank credit agreement and industrial development revenue bond agreements contain certain restrictions relating to dividends , investments , financial ratios , guarantees and the incurrence of additional indebtedness .', 'additional details about our debt and receivables sales agreements are available in notes 12 and 6 , respectively , accompanying the consolidated financial statements within item 8 of this report. .']""]",{'text_17': 'the size of the new program will vary between a maximum of $ 125 million for settlement dates in january through april and a maximum of $ 175 million for settlement dates in the remaining months .'},"subtract(175, 125)",FinQA,Arithmetic,['the size of the new program will vary between a maximum of $ 125 million for settlement dates in january through april and a maximum of $ 175 million for settlement dates in the remaining months .'],BLL/2010/page_39.pdf,True,"[""['page 59 of 94 notes to consolidated financial statements ball corporation and subsidiaries 13 .', 'debt and interest costs ( continued ) long-term debt obligations outstanding at december 31 , 2007 , have maturities of $ 127.1 million , $ 160 million , $ 388.4 million , $ 625.1 million and $ 550.3 million for the years ending december 31 , 2008 through 2012 , respectively , and $ 456.1 million thereafter .', 'ball provides letters of credit in the ordinary course of business to secure liabilities recorded in connection with industrial development revenue bonds and certain self-insurance arrangements .', 'letters of credit outstanding at december 31 , 2007 and 2006 , were $ 41 million and $ 52.4 million , respectively .', 'the notes payable and senior credit facilities are guaranteed on a full , unconditional and joint and several basis by certain of the company 2019s domestic wholly owned subsidiaries .', 'certain foreign denominated tranches of the senior credit facilities are similarly guaranteed by certain of the company 2019s wholly owned foreign subsidiaries .', 'note 22 contains further details as well as condensed , consolidating financial information for the company , segregating the guarantor subsidiaries and non-guarantor subsidiaries .', 'the company was not in default of any loan agreement at december 31 , 2007 , and has met all debt payment obligations .', 'the u.s .', 'note agreements , bank credit agreement and industrial development revenue bond agreements contain certain restrictions relating to dividend payments , share repurchases , investments , financial ratios , guarantees and the incurrence of additional indebtedness .', 'on march 27 , 2006 , ball expanded its senior secured credit facilities with the addition of a $ 500 million term d loan facility due in installments through october 2011 .', 'also on march 27 , 2006 , ball issued at a price of 99.799 percent $ 450 million of 6.625% ( 6.625 % ) senior notes ( effective yield to maturity of 6.65 percent ) due in march 2018 .', 'the proceeds from these financings were used to refinance existing u.s .', 'can debt with ball corporation debt at lower interest rates , acquire certain north american plastic container net assets from alcan and reduce seasonal working capital debt .', '( see note 3 for further details of the acquisitions. ) on october 13 , 2005 , ball refinanced its senior secured credit facilities to extend debt maturities at lower interest rate spreads and provide the company with additional borrowing capacity for future growth .', 'during the third and fourth quarters of 2005 , ball redeemed its 7.75% ( 7.75 % ) senior notes due in august 2006 .', 'the refinancing and senior note redemptions resulted in a debt refinancing charge of $ 19.3 million ( $ 12.3 million after tax ) for the related call premium and unamortized debt issuance costs .', 'a summary of total interest cost paid and accrued follows: .'] ( $ in millions ) 2007 2006 2005 interest costs before refinancing costs $ 155.8 $ 142.5 $ 102.4 debt refinancing costs 2013 2013 19.3 total interest costs 155.8 142.5 121.7 amounts capitalized -6.4 ( 6.4 ) -8.1 ( 8.1 ) -5.3 ( 5.3 ) interest expense $ 149.4 $ 134.4 $ 116.4 interest paid during the year ( a ) $ 153.9 $ 125.4 $ 138.5 ['( a ) includes $ 6.6 million paid in 2005 in connection with the redemption of the company 2019s senior and senior subordinated notes. .']"", ""Consolidated Balance Sheets\n\nBall Corporation\n\nDecember 31,\n\n($ in millions)\n\n    \n\n2023\n\n    \n\n2022\n\n\nAssets\n\nCurrent assets\n\nCash and cash equivalents\n\n\n$\n\n695\n\n\n$\n\n548\n\nReceivables, net\n\n2,334\n\n2,594\n\nInventories, net\n\n1,559\n\n2,179\n\nOther current assets\n\n295\n\n168\n\nTotal current assets\n\n4,883\n\n5,489\n\nNoncurrent assets\n\nProperty, plant and equipment, net\n\n7,380\n\n7,053\n\nGoodwill\n\n4,290\n\n4,235\n\nIntangible assets, net\n\n1,309\n\n1,417\n\nOther assets\n\n1,441\n\n1,715\n\nTotal assets\n\n\n$\n\n19,303\n\n\n$\n\n19,909\n\n\nLiabilities and Equity\n\nCurrent liabilities\n\nShort-term debt and current portion of long-term debt\n\n\n$\n\n1,065\n\n\n$\n\n1,408\n\nAccounts payable\n\n3,753\n\n4,383\n\nAccrued employee costs\n\n333\n\n236\n\nOther current liabilities\n\n1,034\n\n981\n\nTotal current liabilities\n\n6,185\n\n7,008\n\nNoncurrent liabilities\n\nLong-term debt\n\n7,504\n\n7,540\n\nEmployee benefit obligations\n\n898\n\n847\n\nDeferred taxes\n\n421\n\n540\n\nOther liabilities\n\n458\n\n447\n\nTotal liabilities\n\n15,466\n\n16,382\n\n\nEquity\n\nCommon stock (683,241,401 shares issued - 2023; 682,144,408 shares issued - 2022)\n\n1,312\n\n1,260\n\nRetained earnings\n\n7,763\n\n7,309\n\nAccumulated other comprehensive earnings (loss)\n\n(916)\n\n(679)\n\nTreasury stock, at cost (367,551,366 shares - 2023; 368,036,369 shares - 2022)\n\n(4,390)\n\n(4,429)\n\nTotal Ball Corporation shareholders' equity\n\n3,769\n\n3,461\n\nNoncontrolling interests\n\n68\n\n66\n\nTotal equity\n\n3,837\n\n3,527\n\nTotal liabilities and equity\n\n\n$\n\n19,303\n\n\n$\n\n19,909"", ""['page 26 of 100 our calculation of adjusted net earnings is summarized below: .'] ( $ in millions except per share amounts ) 2010 2009 2008 net earnings attributable to ball corporation as reported $ 468.0 $ 387.9 $ 319.5 discontinued operations net of tax 74.9 2.2 -4.6 ( 4.6 ) business consolidation activities net of tax -9.3 ( 9.3 ) 13.0 27.1 gains and equity earnings related to acquisitions net of tax -105.9 ( 105.9 ) 2212 2212 gain on dispositions net of tax 2212 -30.7 ( 30.7 ) -4.4 ( 4.4 ) debt refinancing costs net of tax 5.3 2212 2212 adjusted net earnings $ 433.0 $ 372.4 $ 337.6 per diluted share from continuing operations as reported $ 2.96 $ 2.05 $ 1.62 per diluted share as adjusted 2.36 1.96 1.74 ['debt facilities and refinancing interest-bearing debt at december 31 , 2010 , increased $ 216.1 million to $ 2.8 billion from $ 2.6 billion at december 31 , 2009 .', 'in december 2010 , ball replaced its senior credit facilities due october 2011 with new senior credit facilities due december 2015 .', 'the senior credit facilities bear interest at variable rates and include a $ 200 million term a loan denominated in u.s .', 'dollars , a a351 million term b loan denominated in british sterling and a 20ac100 million term c loan denominated in euros .', 'the facilities also include ( 1 ) a multi-currency , long-term revolving credit facility that provides the company with up to approximately $ 850 million and ( 2 ) a french multi-currency revolving facility that provides the company with up to $ 150 million .', 'the revolving credit facilities expire in december 2015 .', 'in november 2010 , ball issued $ 500 million of new 5.75 percent senior notes due in may 2021 .', 'the net proceeds from this offering were used to repay the borrowings under our term d loan facility and for general corporate purposes .', 'in march 2010 , ball issued $ 500 million of new 6.75 percent senior notes due in september 2020 .', 'on that same date , the company issued a notice of redemption to call $ 509 million in 6.875 percent senior notes due december 2012 at a redemption price of 101.146 percent of the outstanding principal amount plus accrued interest .', 'the redemption of the bonds occurred on april 21 , 2010 , and resulted in a charge of $ 8.1 million for the call premium and the write off of unamortized financing costs and unamortized premiums .', 'the charge is included in the 2010 statement of earnings as a component of interest expense .', 'at december 31 , 2010 , approximately $ 976 million was available under the company 2019s committed multi-currency revolving credit facilities .', 'the company 2019s prc operations also had approximately $ 20 million available under a committed credit facility of approximately $ 52 million .', 'in addition to the long-term committed credit facilities , the company had $ 372 million of short-term uncommitted credit facilities available at the end of 2010 , of which $ 76.2 million was outstanding and due on demand , as well as approximately $ 175 million of available borrowings under its accounts receivable securitization program .', 'in october 2010 , the company renewed its receivables sales agreement for a period of one year .', 'the size of the new program will vary between a maximum of $ 125 million for settlement dates in january through april and a maximum of $ 175 million for settlement dates in the remaining months .', 'given our free cash flow projections and unused credit facilities that are available until december 2015 , our liquidity is strong and is expected to meet our ongoing operating cash flow and debt service requirements .', 'while the recent financial and economic conditions have raised concerns about credit risk with counterparties to derivative transactions , the company mitigates its exposure by spreading the risk among various counterparties and limiting exposure to any one party .', 'we also monitor the credit ratings of our suppliers , customers , lenders and counterparties on a regular basis .', 'we were in compliance with all loan agreements at december 31 , 2010 , and all prior years presented , and have met all debt payment obligations .', 'the u.s .', 'note agreements , bank credit agreement and industrial development revenue bond agreements contain certain restrictions relating to dividends , investments , financial ratios , guarantees and the incurrence of additional indebtedness .', 'additional details about our debt and receivables sales agreements are available in notes 12 and 6 , respectively , accompanying the consolidated financial statements within item 8 of this report. .']"", 'Consolidated Statements of Earnings\n\nBall Corporation\n\n\nYears Ended December 31,\n\n($ in millions, except per share amounts)\n\n\n2023\n\n\n2022\n\n\n2021\n\nNet sales\n\n\n$\n\n14,029\n\n\n$\n\n15,349\n\n\n$\n\n13,811\n\nCosts and expenses\n\n\nCost of sales (excluding depreciation and amortization)\n\n(11,359)\n\n(12,766)\n\n(11,085)\n\nDepreciation and amortization\n\n(686)\n\n(672)\n\n(700)\n\nSelling, general and administrative\n\n(558)\n\n(626)\n\n(593)\n\nBusiness consolidation and other activities\n\n(153)\n\n(71)\n\n(142)\n\n\n(12,756)\n\n(14,135)\n\n(12,520)\n\nEarnings before interest and taxes\n\n1,273\n\n1,214\n\n1,291\n\nInterest expense\n\n(459)\n\n(312)\n\n(270)\n\nDebt refinancing and other costs\n\n—\n\n(18)\n\n(13)\n\nTotal interest expense\n\n(459)\n\n(330)\n\n(283)\n\nEarnings before taxes\n\n814\n\n884\n\n1,008\n\nTax (provision) benefit\n\n(123)\n\n(159)\n\n(156)\n\nEquity in results of affiliates, net of tax\n\n20\n\n7\n\n26\n\nNet earnings\n\n711\n\n732\n\n878\n\nNet earnings attributable to noncontrolling interests\n\n4\n\n13\n\n—\n\nNet earnings attributable to Ball Corporation\n\n\n$\n\n707\n\n\n$\n\n719\n\n\n$\n\n878\n\nEarnings per share:\n\n\nBasic\n\n\n$\n\n2.25\n\n\n$\n\n2.27\n\n\n$\n\n2.69\n\nDiluted\n\n\n$\n\n2.23\n\n\n$\n\n2.25\n\n\n$\n\n2.65\n\nWeighted average shares outstanding: (000s)\n\n\nBasic\n\n314,775\n\n316,433\n\n325,989\n\nDiluted\n\n317,022\n\n320,008\n\n331,615', 'The company’s growth and asset maintenance plans require capital expenditures over the coming years, which will be funded by operating cash flows and external borrowings. Approximately $258 million of capital expenditures were contractually committed as of December 31, 2023. Maturities for Ball’s long-term debt are disclosed in Note 15 to the consolidated financial statements within Item 8 of this annual report. Repayments of debt and other operational cash requirements will also be funded by operating cash flows and external borrowings. The company has no material off-balance sheet arrangements.', 'Remaining performance obligations represent contracted revenues that had not yet been recognized, and include deferred revenues; invoices that have been issued to customers but were uncollected and have not been recognized as revenues; and amounts that will be invoiced and recognized as revenues in future periods. The volumes and amounts of customer contracts that we book and total revenues that we recognize are impacted by a variety of seasonal factors. In each fiscal year, the amounts and volumes of contracting activity and our total revenues are typically highest in our fourth fiscal quarter and lowest in our first fiscal quarter. These seasonal impacts influence how our remaining performance obligations change over time and, combined with foreign exchange rate fluctuations and other factors, influence the amount of remaining performance obligations that we report at a point in time. As of May 31, 2024, our remaining performance obligations were $97.9 billion, of which we expect to recognize approximately 39% as revenues over the next twelve months, 36% over the subsequent month 13 to month 36, 19% over the subsequent month 37 to month 60 and the remainder thereafter.\n\nSales of Financing Receivables', 'Balance at December 31, 2021\n\n\n$\n\n272\n\n\n$\n\n38\n\nIncrease (decrease)\n\n44\n\n(26)\n\nBalance at December 31, 2022\n\n316\n\n12\n\nIncrease (decrease)\n\n21\n\n(2)\n\nBalance at December 31, 2023\n\n\n$\n\n337\n\n\n$\n\n10\n\n\nDuring the year ended December 31, 2023, contract liabilities increased by $19 million, which is net of cash received of $984 million and amounts recognized as sales of $965 million, the majority of which related to current contract liabilities. The amount of sales recognized during the year ended December 31, 2023, that was included in the company’s opening contract liabilities balance was $316 million, all of which related to current contract liabilities. The difference between the opening and closing balances of the company’s contract liabilities primarily results from timing differences between the company’s performance and the customer’s payments. Current contract liabilities are classified within other current liabilities on the consolidated balance sheets and noncurrent contract liabilities are classified within other liabilities.\n\n\nThe company also recognized additional sales of $20 million and $8 million during the years ended December 31, 2023 and 2022, respectively, from performance obligations satisfied (or partially satisfied) in prior periods. These sales amounts are the result of changes in the transaction price of the company’s contracts with customers.\n\n\nTransaction Price Allocated to Remaining Performance Obligations', 'The Company’s revenue is measured at the determinable transaction price, net of any variable considerations granted to customers and any taxes collected from customers and subsequently remitted to governmental authorities. Variable considerations include rights to return products and sales incentives, which primarily consist of volume rebates. These variable considerations are estimated throughout the year based on various factors, including contract terms, historical experience and performance levels. Total accrued sales returns were approximately $52 million and $38 million as of December 31, 2023 and 2022, respectively, and are reported as a reduction of Accounts receivable – net. Total accrued sales incentives were approximately $114 million and $102\nmillion as of December 31, 2023 and 2022, respectively, and are reported as part of Accrued expenses.\n\nThe Company records a contract asset when it has a right to payment from a customer that is conditioned on events other than the passage of time. The Company also records a contract liability when customers prepay but the Company has not yet satisfied its performance obligation. The Company did not have any material unsatisfied performance obligations, contract assets or liabilities as of December 31, 2023 and 2022.', '2023\t\t2022\nSales return, rebate, and discount liabilities, beginning of year\t$\t8,214.1 \t\t\t$\t6,161.6 \t\nReduction of net sales(1)\n37,866.8 \t\t\t28,398.4 \t\nCash payments\t(35,413.4)\t\t\t(26,345.9)\t\nSales return, rebate, and discount liabilities, end of year\t$\t10,667.5 \t\t\t$\t8,214.1 \t\n \n(1) Adjustments of the estimates for these returns, rebates, and discounts to actual results were less than 1 percent of consolidated revenue for each of the years presented.\nThe increase in reduction of net sales in 2023 was primarily driven by our incretin products due to the increase in volume of rebates for managed care, Medicare, chargebacks, and Medicaid programs.', 'Year\n\n\nNet Sales and Revenues\n\n\n2025\n\n\n$\n\n512\n\n\n2026\n\n429\n\n\n2027\n\n328\n\n\n2028\n\n208\n\n\n2029\n\n151\n\n\nLater years\n\n119\n\n\nTotal\n\n\n$\n\n1,747\n\nAs permitted, we elected only to disclose remaining performance obligations with an original contract duration greater than one year. The contracts with an expected duration of one year or less are for sales to dealers and retail customers for equipment, service parts, repair services, and certain telematics services.']",1027.8243330540136,50
23,23,ce3dbb01,Brown & Brown's structured IR protocols affect liability cost impact.,"The company’s proactive incident response and prevention protocols, such as the structured use of internal and external scans along with third-party penetration tests, play a critical role in reducing potential liability and associated costs in several ways:

1. Early Detection & Mitigation: Regular internal persistent scans, monthly external scans, and periodic third-party penetration tests enable the company to identify vulnerabilities before they can be exploited. Early detection minimizes the likelihood of a successful breach, reducing the severity of any potential incident and the costs associated with remediation.

2. Reduced Remediation Costs: By identifying security weaknesses early, the company can address issues promptly. This proactive approach can lower the expenses required for incident response, forensic analysis, and remediation compared to the higher costs incurred after a major breach.

3. Demonstration of Due Diligence: These robust protocols reflect the company’s commitment to cybersecurity best practices. In the event of an incident, documented evidence of proactive risk management and compliance (including adherence to standards such as SOC 2 Type II) can help mitigate regulatory penalties and legal liabilities by showing that the company took reasonable measures to protect sensitive information.

4. Enhanced Insurance Coverage Benefits: The company’s use of these protocols supports its cyber liability insurance by potentially lowering risk exposure. In the event of a breach, having well-documented security practices can facilitate more favorable terms from insurers or help in reducing claim amounts.

5. Minimization of Operational Disruption: A well-structured incident response process — integrating immediate action from specialized teams and clear communication protocols — helps minimize downtime. Reduced operational disruption directly translates into lower indirect costs and helps maintain customer confidence and revenue integrity.

